artikel,judul,keyword,link,tanggal
"berhasil mengalahkan Sutikno Si Mega Dragon dalam duel   Championship (KX-1). Rizki menang KO di ronde pertama. Laga tersebut berlangsung di Markas Komando (Mako) Brimob Polda Metro Jaya, Jl Kwitang, Jakarta Pusat, Sabtu (26/3/2022) malam. Rizki, yang punya julukan Badai, bertarung dalam duel kelas 50 kg. Dengan kemenangan itu, Rizki Nurohman menyabet Sabuk Kapolda Metro Jaya, yang disaksikan Inspektur Pengawas Daerah (Irwasda) Polda Metro Jaya, Kombes Pol Dwi Gunawan, Komandan Satuan Brimbob Polda Metro Jaya, Kombes Pol Gatot Mangkurat Putra Perkasa Jumantara SIK dan Anggota Komsi VII Dewan Perwakilan Rakyat Republik Indonesia (DPR-RI), Paramitha Widya Kusuma. Badai tidak perlu lama-lama menghentikan perlawanan agresif Sutikno. Dengan memblok tendangan keras lawannya, Rizki langsung melepaskan low-kick yang menyebabkan Sutikno terjatuh dan tidak dapat melanjutkan pertarungan. ""Saya tidak menduga tendangan keras saya berhasil dibloknya dengan dengkul. Kaki kanan saya sobek dan tidak bisa melanjutkan pertarungan. Kali ini, memang bukan rezeki saya untuk meraih kemenangan pada penampilan perdana di KX-1,"" kata Sutikno yang bisa bertarung di Mix Martial Arts saat ditemui di ruang Medis. ""Ya, saya memang sengaja memblok tendangan kerasnya dan langsung melepaskan low-kick untuk melumpuhkannya. Tulang kering saya memang terasa sakit juga sih akibat tendangannya yang cukup keras,"" kata Badai usai menerima Sabuk Kapolda Metro Jaya yang disematkan Kombes Pol Dwi Gunawan. Dengan kemenangan ini, Rizki Nurohman tampil tak terkalahkan dalam dua penampilan di KX-1. Putra promotor Abdul Rahman yang pernah merah perunggu pada pertandingan eskebisi kickboxing Pekan Olahraga Nasional (PON) Papua 2021 ini telah mencatat rekor 20 kali penampilan dengan 18 kali menang KO dan dua kali kalah.    ""Penampilan Rizki Nurohman memang luar biasa. Dia hanya butuh satu ronde saja untuk bisa menghentikan lawan yang begitu agresif melakukan serangan. Dan, saya berharap Rizki terus berlatih untuk menghadapi pertarungan selanjutnya,"" kata Paramitha Widya Kusuma yang juga ibu angkat Rizki Nurohman. Lebih jauh Paramitha Widya Kusuma memberikan apresiasi terhadap Kapolda Metro Jaya, Irjen Pol Fadil Imran yang mendukung pelaksanaan KX-1. ""Saya mengapresiasi Kapolda Metro Jaya yang telah mendukung kesuksesan KX-1. Dan, saya berharap Kapolda-kapolda lainnya bisa menggelar KX-1,"" imbuhnya. ""Saya berterima kasih kepada pak Kapolda Metro Jaya, Irjen Pol Fadil Imran dan juga pak Kombes Pol Dwi Gunawan selaku Dansat Brimob Polda Metro Jaya yang telah mendukung pelaksanaan KX-1 dan Pencak Dor memperebutkan Sabuk Kapolda Metro Jaya. Dan, saya akan kembali menggelar KX-1 kalau tidak di Bali ya di Batam,"" kata Promotor KX-1, Abdul Rahman. Kickboxing Championship (KX-1) yang mengambil tema Jakarta Tanpa Tawuran kali ini mempertandingkan 11 partai kickboxing dan 12 partai Pencak Dor.  Sementara itu, Kapolda Metro Jaya Irjen Pol Fadil Imran dalam sambutan tertulis yang dibacakan Irwasda Konbes Pol Dwi Gunawan mengatakan kegiatan ini dalam rangka menjalin silaturahmi antar atlet dan juga sasana kickboxing maupun Pencak Dor yang merupakan budaya bangsa Indonesia. ""Saya berharap dengan adanya kegiatan ini bisa mencegah terjadinya tawuran. Dan, saya berharap dari pertandingan ini bisa lahir atlet-atlet petarung beladiri profesional yang mampu mengharumkan nama bangsa dan negara di kancah internasional,"" kata Irjen Pol Fadil Imran.",Rizki Nurohman Menang KO atas 'Mega Dragon',konbes,https://sport.detik.com/sport-lain/d-6002690/rizki-nurohman-menang-ko-atas-mega-dragon?single=1,"Sabtu, 26 Mar 2022 23:37 WIB"
"""Insya Allah regenerasi tidak bisa dibendung. Muktamarnya kondusif tapi regenerasi tidak bisa dibendung. Dukungan kepada Gus Yahya terus menguat,"" kata Gus Ipul kepada detikcom, Rabu (8/12/2021). Pengurus PBNU mengumumkan Muktamar ke-34 akan digelar pada 23-25 Desember 2021. Hal ini disepakati setelah Konferensi Besar (Konbes NU) digelar, Selasa (7/12/2021). Gus Ipul bersyukur karena jadwal muktamar sudah diputuskan. ""Ini keputusan dibuat bersama. Sesuai perintah Rais Aam. Kita bersyukur. Nggak ada masalah,"" jelasnya. Keputusan ini dibuat tidak terlepas dari kebijakan pemerintah yang membatalkan penerapan PPKM level 3 di seluruh daerah di masa libur Natal dan Tahun Baru (Nataru). Dalam acara ini, turut hadir Ketum PBNU KH Said Aqil Siroj, Rais Aam PBNU KH Miftachul Akhyar, hingga Katib Aam PBNU Yahya Cholil Staquf. Diketahui, Said Aqil dan  adalah dua kandidat calon ketua umum PBNU yang bersaing dalam Muktamar NU ke-34.","Muktamar ke-34 di Depan Mata, Gus Ipul: Dukungan ke Gus Yahya Menguat",konbes,https://news.detik.com/berita-jawa-timur/d-5846722/muktamar-ke-34-di-depan-mata-gus-ipul-dukungan-ke-gus-yahya-menguat?single=1,"Rabu, 08 Des 2021 19:35 WIB"
"""Ini keputusan dibuat bersama. Sesuai perintah Rais Aam. Kita bersyukur. Nggak ada masalah,"" kata Gus Ipul kepada detikcom, Rabu (8/12/2021). Persoalan waktu digelarnya Muktamar NU ini bermula dari rencana penerapan PPKM level 3 se-Indonesia di masa libur Nataru untuk mencegah melonjaknya COVID-19, yakni pada 24 Desember 202 -2 Januari 2022. Rencana tersebut berbenturan dengan jadwal awal Muktamar NU yang rencananya digelar pada 23-25 Desember 2021. Rencana penerapan PPKM level 3 secara nasional itu dipertimbangkan karena Muktamar NU akan dihadiri banyak orang. Sebagian menginginkan jadwal Muktamar diundur hingga akhir Januari 2022, sebagian mengusulkan dimajukan pada 17-19 Desember 2021. ""Kemarin itu karena dilarang di tanggal 23-25 Desember, Rois Aam minta dimajukan sementara Ketua Umum minta dimundurkan. Tapi setelah boleh ya kita kembali ke kesepakatan awal. Nggak ada masalah,"" kata Gus Ipul. Pengurus Besar Nahdlatul Ulama ( ) mengumumkan Muktamar ke-34 akan digelar pada 23-25 Desember 2021. Hal ini disepakati setelah digelarnya Konferensi Besar (Konbes NU), Selasa (7/12/2021).",Respons Gus Ipul Soal Muktamar NU Diputuskan 23-25 Desember 2021,konbes,https://news.detik.com/berita-jawa-timur/d-5846660/respons-gus-ipul-soal-muktamar-nu-diputuskan-23-25-desember-2021?single=1,"Rabu, 08 Des 2021 18:52 WIB"
"Ketua Pengurus Besar Nahdlatul Ulama (PBNU) Marsudi Syuhud menanggapi rekannya sesama Ketua  Saifullah Yusuf atau Gus Ipul, soal kritiknya yang menyebut bahwa kondisi NU sedang tidak baik-baik saja. Marsudi menyindir Gus Ipul yang tak pernah ke  . ""Ya pantas saja Gus Ipul menyampaikan begitu, karena Gus Ipul sendiri tidak pernah ke  ,"" kata Marsudi  dalam diskusi Total Politik bertajuk 'Panas Muktamar NU Dalam Persimpangan Jalan Menuju 2024' di Cikini, Jakarta Pusat (Jakpus), Minggu (12/12/2021). Marsudi mengklaim bahwa saat ini NU masih berada di posisi seharusnya. Lantas, dia membalas kritikan Gus Ipul yang dinilai tak banyak bergulat dalam program-program PBNU. ""Nah, kalau beliau berkecimpung di PBNU setiap harinya, melihat, akan bisa meyakini bahwa PBNU on the position,"" kata dia. Marsudi memahami bahwa pernyataan Gus Ipul tersebut menyinggung 'gegeran' di dalam internal PBNU saat menjelang pelaksanaan Muktamar ke-34 NU pada akhir Desember 2021 mendatang. Saat ini, dia menegaskan kembali, internal PBNU sudah baik-baik saja. ""Ini kan dinamika 26 November. Nah, kalau kemarin (masalah) sudah selesai. PBNU sudah baik-baik saja kalau sekarang,"" kata dia. Lebih lanjut, Marsudi memastikan bahwa nama-nama yang muncul sebagai calon ketua umum NU sudah dipersiapkan secara ketat. Dia menyebut, hal itu mencakup, sertifikasi madrasah kader, keilmuan, dan kemampuan manajemen organisasi. ""Figur di NU semuanya sudah dipersiapkan. Itu ketat juga persiapannya selain mempunyai sertifikasi untuk madrasah kader, itu juga secara keilmuan yang mapan manajemen organisasi yang baik dan punya progam ke depan. Itu semua sudah didoktrinkan warga-warga NU, sehingga nanti dari bawah menginginkan siapa calon-calonnya,"" katanya. Dia menambahkan, PBNU merupakan organisasi sosial keagamaan yang sudah menjadi sorotan publik. Lantas, kata dia, banyak pihak yang melirik PBNU untuk bekerja sama di berbagai bidang, termasuk politik maupun sosial. ""NU organisasi sosial keagamaan yang anggotanya adalah individu-individu yang inshaallah terbesar di dunia. Siapa saja akan melirik itu, siapa saja akan mengajak kerja sama untuk arah apa saja, tidak hanya politik, termasuk sosial,"" ujarnya. Kritik Gus Ipul itu sebelumnya disampaikan sebelum ada penetapan Muktamar NU pada 23-25 Desember 2021. Seperti diketahui, saat itu sejumlah pihak mendorong muktamar dipercepat dan ada juga yang meminta ditunda. Menurut Gus Ipul, Muktamar NU dipercepat juga sangat mungkin dilakukan. Jumlah peserta juga bisa dikurangi, misalnya dengan mengurangi peserta yang luring. Sementara yang daring diperbanyak. ""Dipercepat dengan prokes ketat, jumlah peserta dikurang, online diperbanyak. Panitia pada dasarnya sudah siap. Menunda bisa jadi menyebabkan komplikasi yang luar biasa. Menambah banyak masalah. Karena suasana PBNU saat ini sudah tidak kondusif,"" Gus Ipul kepada detikcom, Kamis (18/11). Sebelumnya, PBNU mengumumkan Muktamar ke-34 akan digelar pada 23-25 Desember 2021. Hal ini disepakati setelah digelarnya Konferensi Besar (Konbes NU). ""Sebagaimana hasil munas konbes NU tanggal 26 September yang lalu, maka pelaksanaan Muktamar NU ke-34 di Lampung tanggal 23-25 Desember insyaallah akan dapat berjalan Muktamar NU bersama kita semua,"" kata Sekjen PBNU Helmy Faishal Zaini di kantor PBNU, Jl Salemba Raya, Jakarta, Selasa (7/12). Dia mengatakan keputusan ini dibuat tak terlepas dari kebijakan pemerintah yang membatalkan penerapan PPKM level 3 di seluruh daerah di masa libur Natal dan tahun baru. ""Wabah virus COVID-19 perkembangannya semakin membaik sehingga pemerintah menarik kembali kebijakan PPKM level 3,"" katanya. Dalam acara ini, turut hadir Ketum PBNU KH Said Aqil Siroj, Rais Aam PBNU KH Miftachul Akhyar, hingga Katib Aam PBNU Yahya Cholil",Marsudi Syuhud Sindir Gus Ipul Tak Pernah ke PBNU,konbes,https://news.detik.com/berita/d-5851726/marsudi-syuhud-sindir-gus-ipul-tak-pernah-ke-pbnu?single=1,"Minggu, 12 Des 2021 17:16 WIB"
"PBNU mengeluarkan surat terkait perubahan waktu pelaksanaan  .   dipercepat ke tanggal 22-23 Desember 2021. Hal itu tertuang dalam surat PBNU bernomor 4288/aI01/12/2021 pada 15 Desember 2021 sebagaimana salinannya dilihat, Kamis (16/12/2021). Surat itu ditujukan kepada PWNU, PCNU dan PCINU. Surat ditandatangani oleh Rais Aam Miftachul Akhyar, Katib Aam Yahya Cholil Staquf, Ketum PBNU Said Aqil Siroj, dan Sekjen Helmy Faishal Zaini. Berikut isi dari surat tersebut: Sebelum keluar surat tersebut, PBNU mengumumkan  akan digelar pada 23-25 Desember 2021. Hal ini disepakati setelah digelarnya Konferensi Besar (Konbes NU). ""Sebagaimana hasil munas konbes NU tanggal 26 September yang lalu, maka pelaksanaan Muktamar NU ke-34 di Lampung tanggal 23-25 Desember insyaallah akan dapat berjalan Muktamar NU bersama kita semua,"" kata Sekjen PBNU Helmy Faishal Zaini di kantor PBNU, Jl Salemba Raya, Jakarta, Selasa (7/12). Dia mengatakan keputusan ini dibuat tak terlepas dari kebijakan pemerintah yang membatalkan penerapan PPKM level 3 di seluruh daerah di masa libur Natal dan tahun baru. ""Wabah virus COVID-19 perkembangannya semakin membaik sehingga pemerintah menarik kembali kebijakan PPKM level 3,"" katanya. Dalam acara ini, turut hadir Ketum PBNU KH Said Aqil Siroj, Rais Aam PBNU KH Miftachul Akhyar, hingga Katib Aam PBNU Yahya Cholil Staquf. Diketahui, Said Aqil dan Yahya Staquf adalah dua kandidat calon ketua umum PBNU yang bersaing dalam Muktamar NU ke-34.",Muktamar NU Dipercepat Jadi 22-23 Desember!,konbes,https://news.detik.com/berita/d-5858039/muktamar-nu-dipercepat-jadi-22-23-desember?single=1,"Kamis, 16 Des 2021 16:20 WIB"
"mengatakan Arab Saudi juga mengatur masalah toa masjid. Dia menilai orang yang meributkan urusan toa berarti kurang piknik. Hal itu disampaikan Yaqut saat memberikan sambutan di Konbes XXV GP Ansor di Kalimantan Selatan. Yaqut awalnya menyampaikan bahwa dia harus segera kembali ke Jakarta karena Menteri Urusan Islam, Dakwah, dan Penyuluhan Arab Saudi, Syekh Abdullatif bin Abdulaziz, akan kembali ke negaranya. ""Mohon maaf, sahabat-sahabat sekalian, mohon maaf setelah ini saya harus pulang dulu, kembali dulu ke Jakarta, karena tamu saya Menteri Urusan Agama Islam Saudi nanti malam akan kembali ke negaranya, saya harus mengantarkan beliau di bandara,"" kata Yaqut dalam siaran YouTube GP Ansor, Rabu (30/3/2022). Yaqut kemudian menyinggung kesamaan Saudi dengan Indonesia. Salah satu kesamaan itu adalah masalah toa masjid. ""Tapi alhamdulillah seperti berita yang kita baca, kita dengar, kita saksikan, ternyata di Saudi itu sama dengan di Indonesia, urusan toa pun diatur. Jadi kalau orang ribut urusan toa, berarti kurang piknik,"" katanya. Lebih lanjut, Yaqut mendoakan orang yang meributkan masalah toa itu bisa piknik. Setidaknya, kata dia, piknik ke Arab Saudi untuk umrah. ""Jadi yang ribut-ribut itu kita doakan bisa piknik, setidaknya umrahlah, nanti di Saudi supaya tahu bahwa toa itu juga diatur di Saudi sana, bukan hanya di Indonesia,"" sebutnya. Kepada hadirin, Yaqut bertanya apakah masalah toa masih akan diributkan. Hadirin pun menjawab dengan gelak tawa. ""Ini mau ribut lagi nggak soal toa kira-kira?"" tanya Yaqut ke hadirin yang disambut dengan gelak tawa. ""Kalau saya teruskan ribut lagi ini pasti, he-he,"" kata Yaqut.","Menag Yaqut: Arab Saudi Urusan Toa Pun Diatur, Kalau Ribut Kurang Piknik",konbes,https://news.detik.com/berita/d-6008383/menag-yaqut-arab-saudi-urusan-toa-pun-diatur-kalau-ribut-kurang-piknik?single=1,"Rabu, 30 Mar 2022 17:14 WIB"
"Ketua Umum GP Ansor yang juga Menteri Agama, Yaqut Cholil Qoumas, membuka Konferensi Besar (Konbes) XXV GP   di Kalimantan Selatan. Yaqut meminta GP Ansor menghadapi tantangan kebinekaan, salah satunya aktivitas aktivis eks Hizbut Tahrir Indonesia (HTI) dan eks Front Pembela Islam (FPI). ""Jadi konsep kongres ke depan itu benar-benar mengantisipasi situasi kebangsaan yang semakin menurut saya tidak mudah. Tantangan kebinekaan masih saja muncul, tantangan itu masih saja muncul, kemudian kelompok-kelompok agama yang menggunakan sebagai   atau alat untuk memperjuangkan kepentingannya juga masih masif gerakannya,"" kata Yaqut dalam siaran YouTube GP  , Rabu (30/3/2022). Yaqut mengatakan pemerintah telah mampu membubarkan HTI dan FPI. Akan tetapi, menurutnya eks anggota organisasi itu masih terus bergerak. ""Meskipun kita mampu membubarkan HTI dan FPI bersama pemerintah, tetapi mereka masih berkelindan di bawah tanah, masih bergerak dengan cara mereka, ini pekerjaan-pekerjaan semua  , ini tolong dipikirkan,"" sebutnya. Yaqut mengatakan GP Ansor tak boleh membiarkan pemerintah sendiri untuk menghadapi eks anggota HTI dan FPI itu. Terlebih, kata dia, GP Ansor adalah terdepan dalam mempertahankan NKRI. ""Tentu kita tidak bisa membiarkan aparatur negara untuk menghadapi mereka sendiri, eks HTI, eks FPI yang sejenis, gitu ya. Kita tidak bisa serahkan kepada aparatur negara untuk menghadapinya sendiri,"" jelasnya. ""Kita sebagai warga masyarakat, sebagai warga bangsa, sebagai masyarakat sipil kita memiliki kewajiban yang sama, apalagi   dan Banser yang mendeklarasikan dirinya sebagai garda terdepan atas pertahanan NKRI,"" imbuhnya. Lebih lanjut, Yaqut meminta GP Ansor merumuskan cara-cara untuk menghadapi eks anggota HTI dan FPI itu. Dia berharap cara itu bisa dirumuskan di kongres GP Ansor. ""Ini juga tolong dipikirkan, tolong dianalisa, dilihat apa kebutuhan, apa keperluan organisasi dengan melihat situasi yang berkembang seperti sekarang ini. Jangan asal membuat kongres, mempersiapkan kongres itu acaranya itu tok jangan, tapi substansinya itu harus dipikirkan,"" sebutnya. ""Saya yakin dengan semangat yang dimiliki oleh sahabat-sahabat sekalian ini apa yang kita harapkan bisa di Konbes ini dirumuskan dengan baik,"" lanjutnya.","Buka Konbes, Yaqut Minta GP Ansor Hadapi Eks HTI dan FPI",konbes,https://news.detik.com/berita/d-6008562/buka-konbes-yaqut-minta-gp-ansor-hadapi-eks-hti-dan-fpi?single=1,"Rabu, 30 Mar 2022 18:17 WIB"
"Kita semua bahagia tidak terkira. Akhirnya ada titik temu. Hingga Senin malam, 7 Desember 2021, saya ngeri membayangkan kemungkinan terburuk: perahu Muktamar terbelah dua. Saya rapal doa dalam hati: semoga ada keajaiban. Ini bermula dari rencana PPKM Nataru. Dari 24 Desember 2021 hingga 2 Januari 2022, Pemerintah berencana membatasi pergerakan orang: tidak ada liburan, tidak perayaan, tidak ada perhelatan akbar. Ini berdampak pada jadwal Muktamar. Pengurus terbelah dua arus: maju atau mundur. Pj Rais Aam memerintahkan maju. Alasannya, tidak ada jaminan jika pun mundur, Muktamar bakal terlaksana. Tidak ada yang tahu, kapan pandemi ini sirna. Alasan lainnya, krisis legitimasi. Kepengurusan PBNU mestinya berakhir Agustus 2020. Tanpa kepastian jadwal Muktamar, legitimasi pengurus bermasalah. Arus mundur punya dua jawaban: teknis dan normatif. Secara teknis, lokasi belum siap. Sarpras pesantren, venue utama Muktamar, sedang pengerjaan. Pengunduran waktu dapat memperbaiki teknis penyelenggaraan. Tanggalnya pun cantik: 31 Januari, pas harlah NU kalender masehi. Secara normatif, krisis legitimasi tidak akan terjadi. Ini karena ada keputusan Munas dan Konbes, yang statusnya setingkat di bawah Muktamar. Munas dan Konbes Jakarta, 25-26 September 2021, memutuskan Muktamar akan diselenggarakan di Lampung pada 23-25 Desember 2021, dengan persetujuan Satgas Covid-19. Jika diktum pertama tidak tercapai, keputusan penyelenggaraan Muktamar ke-34 diserahkan ke PBNU. Masa Khidmat PBNU hasil Muktamar ke-33 adalah sampai dilaksanakannya Muktamar ke-34. Di titik ini gamblang, tetapi buntu. Pj Rais Aam, pada 25 November, menerbitkan surat perintah kepada SC dan OC untuk menyelenggarakan Muktamar pada 17 Desember. Pendukung arus maju menganggap perintah Pj Rais Aam harus dilaksanakan. Dasarnya: Pasal 14 ayat (3) AD NU yang menyatakan: Syuriyah adalah Pimpinan Tertinggi NU. Kubu kontra menganggap surat perintah berkop PBNU, tetapi ditandatangani sendiri oleh Pj Rais Aam, tidak punya pijakan hukum. Pertama, Syuriyah itu status kelembagaan, bukan perseorangan. Kedua, Pasal 58 ART NU menyebutkan kewenangan Rais Aam, antara lain, adalah bersama Ketua Umum menandatangani keputusan-keputusan strategis PBNU. Tugas Rais Aam, antara lain, adalah bersama Ketua Umum memimpin pelaksanaan Muktamar. Artinya, tidak bisa jalan sendiri-sendiri. Ketiga, diktum ketiga keputusan Munas-Konbes Jakarta 2021 menyebutkan, dalam hal jadwal Muktamar tidak dapat terlaksana, keputusan penyelenggaraan Muktamar diserahkan ke PBNU. Upaya mempertemukan dua arus pandangan ini terus dilakukan. Di forum terbatas, setelah Majma Buhuts yang dihadiri para Masyayikh di Pesantren Asshodiqiyah Semarang, 5 Desember 2021, Pj Rais Aam dan Ketua Umum PBNU bertemu. Sesuai keputusan Munas dan Konbes Jakarta, Ketua Umum mengusulkan agar jadwal Muktamar ditetapkan oleh Rapat PBNU, yang dihadiri oleh seluruh unsur harian Syuriyah dan Tanfidziyah. Ini solusi dari kebuntuan rapat oleh empat orang: Pj Rais Aam, Katib Aam, Ketua Umum dan Sekjen. Tetapi Pj Rais Aam bergeming: Muktamar tetap harus dilaksanakan tanggal 17 Desember. Beliau telah mengeluarkan surat penunjukan, tertanggal 5 Desember 2021, kepada dua orang pengurus Tanfidziyah untuk menyelenggarakan Konbes di Jakarta pada 7 Desember 2021. Di sisi lain, PBNU menerbitkan surat undangan, ditandatangani Rais Syuriyah, Katib Syuriyah, Ketum, dan Sekjen, tertanggal 6 Desember 2021, untuk menggelar Rapat Harian Syuriyah dan Tanfidziyah pada 7 Desember 2021. Di titik ini, saya sudah membayangkan kemungkinan terburuk. Arus maju ingin mendapatkan legitimasi memajukan Muktamar melalui Konbes di Hotel Bidakara. Pesertanya PW pendukung arus maju. Arus mundur ingin mendapat legitimasi memundurkan Muktamar melalui Rapat Harian Syuriyah dan Tanfidziyah di kantor PBNU. Ini berarti akan ada dua Muktamar: Muktamar tanggal 17 Desember dan Muktamar tanggal 31 Januari. Saya cemas, apakah NU akan terbelah? Saya sangat mencintai NU dan berdoa agar itu tidak terjadi. Keajaiban datang. Selasa siang, 7 Desember 2021, Pemerintah mengumumkan pembatalan PPKM level 3 serentak. Artinya, jadwal Muktamar bisa kembali semula. Pj Rais Aam dan Katib Aam, di sela-sela 'Konbes' Bidakara, datang ke kantor PBNU. Keempatnya mufakat menerbitkan surat, ditandatangani lengkap. Isinya: Muktamar diselenggarakan di Lampung, 23-25 Desember, sesuai keputusan Munas dan Konbes Jakarta. Semua orang bersuka cita. NU lolos dari lobang jarum pertama. Selebihnya soal persaingan biasa. Sekeras apa pun kontestasi kandidat, yang penting arenanya sama. Kalah-menang soal biasa. Gara-gara polarisasi maju-mundur, orang tidak ada yang fokus bicara program dan agenda. Semuanya sibuk dengan pemenangan kandidat dan isu penyertanya. Ada dua agenda internal yang harus dibicarakan dengan kepala dingin. Waktunya bukan sekarang. Mungkin nanti di Munas dan Konbes setelah Muktamar. Soalnya ini isu sensitif. Dua-duanya sudah kadung jadi bahasa 'marketing' masing-masing kubu. Isu pertama adalah mekanisme pemilihan Rais Aam dan Ketua Umum PBNU. Ini sudah bergulir lama. Sejak Muktamar Jombang 2015, Rais Aam dipilih oleh Ahlul Halli wal Aqdi (AHWA), tetapi Ketua Umum dipilih secara langsung. Di Munas dan Konbes Banjar 2019, Ketua Umum diusulkan dipilih juga oleh AHWA dan disetujui. Tetapi, Munas dan Konbes Jakarta 2021 menganulir keputusan itu. Ketua Umum tetap dipilih secara langsung oleh PW dan PC. Alasannya, memberi hak kepada mereka dalam perhelatan akbar lima tahun sekali. Keputusan ini harus dibayar mahal. Memang, NU sejak lama memilih Ketua Umum Tanfidziyah secara langsung. Di bursa kontestasi Ketua Umum, terutama sejak era KH Idham Chalid dan transisi ke Gus Dur, Muktamar diwarnai dinamika dan ketegangan. Itu biasa. Tapi sekarang Indonesia masuk era demokrasi liberal. Pasangannya mekanisme pasar. Ini demokrasi biaya tinggi. Partai-partai politik mempraktekkan ini. Ketua-ketua DPW/DPD/DPC dipilih secara langsung. Dampaknya dua: politik uang dan perpecahan. Pemberi mahar paling banyak yang menang. Yang kalah boikot atau loncat partai. Sejumlah Parpol lalu melakukan resentralisasi. Ketua DPW/DPD/DPC ditunjuk oleh DPP. Daerah atau Cabang mengusulkan. Penentunya DPP. Ini mengurangi friksi dan politik biaya tinggi. Di Munas dan Konbes Cirebon tahun 2012, NU merekomendasikan agar Pilkada langsung ditinjau ulang. Alasannya menimbulkan mudharat: politik uang dan konflik horizontal. Sekarang NU mempertahankan ini. Alasannya, mekanisme AHWA mengamputasi kedaulatan Wilayah dan Cabang. Sekarang lihat fenomenanya: mobilisasi suara akar rumput. Ini mirip Pilpres atau Pilkada. Ada pembelahan dan politik uang. Muktamar sibuk dengan urusan pencalonan, bukan agenda dan program. Setelah riuh rendah Muktamar usai, isu ini harus dibicarakan dengan kepala dingin. Sebaiknya AHWA diberlakukan untuk memilih Rais Aam dan Ketua Umum Tanfidziyah. PW dan PC datang ke Muktamar, dengan membawa program dan agenda. Kapan ini dilakukan? Periode mendatang, di Muktamar ke-35. Isu kedua adalah pembatasan masa jabatan Ketua Umum Tanfidziyah. Ini bukan soal membatasi orang mau berkhidmah. Ini mekanisme alamiah organisasi. Di organisasi bisnis, CEO terbaik pun biasanya menjabat paling lama lima tahun. Setelah itu, tidak ada inovasi. Dia terperangkap dalam rutinitas. Di situlah perlunya penyegaran. Orang baru biasanya datang dengan gaya dan semangat baru. Ini penting untuk kelangsungan organisasi. NU adalah jam'iyah diniyah, tentu saja tidak bisa disamakan dengan organisasi bisnis. Ada kekhasan ormas keagamaan seperti NU. Tetapi, tetap saja perlu ada pembatasan, entah dua atau tiga periode. Kaderisasi dan regenerasi mutlak bagi kelangsungan organisasi. Ini juga harus dibicarakan dengan kepala dingin. Kapan berlakunya? Periode mendatang, mulai Muktamar ke-35. ,",Dua Agenda Muktamar NU,konbes,https://news.detik.com/kolom/d-5846617/dua-agenda-muktamar-nu?single=1,"Rabu, 08 Des 2021 18:36 WIB"
