artikel,judul,keyword,link,tanggal
"Kepala Satgas Penanganan COVID-19/Kepala BNPB melalui Juru Bicara/Koordinator Tim Pakar, Prof. Wiku Adisasmito membeberkan cara satgas menangani COVID-19. Menurutnya, dalam melakukan tugas di tahun 2021, Satgas berpegang pada prinsip kolaborasi lintas sektor. Satgas juga telah mengeluarkan berbagai kebijakan yang mengatur pelaku perjalanan, baik internasional dan dalam negeri, hingga melakukan penanganan hingga ke tingkat terkecil demi memutus mata rantai penularan. Dalam penanganannya Satgas memiliki 6 bidang diantaranya Bidang Data/IT, Komunikasi Publik, Perubahan Perilaku, Penanganan Kesehatan, Koordinasi Relawan dan Perlindungan Tenaga Kesehatan. ""Penanganannya dilakukan mulai dari hulu ke hilir yang dibagi dalam 3 pilar. Yakni pilar promotif/preventif, pilar surveilans dan pilar kuratif dengan 3 strategi yaitu sosialisasi dan edukasi, penegakan kedisilinan dan kolaborasi lintas unsur,"" jelas Wiku dilansir dari covid19.go.id, Kamis (28/10/2021). Sepanjang tahun 2021 Satgas menerapkan berbagai kebijakan. Dapat terlihat pada awal tahun 2021, terjadi lonjakan kasus diakibatkan libur Natal dan Tahun Baru 2021. Kebijakan saat itu menerapkan Pemberlakuan Pembatasan Kegiatan Masyarakat (PPKM) sekaligus menjadi mitigasi kasus pada lonjakan pertama. Setelah kasus turun, kebijakan PPKM dilanjutkan dengan PPKM Mikro yang diterapkan di seluruh Indonesia. Satgas juga membentuk posko hingga ke tingkat desa/kelurahan di seluruh Indonesia dalam mengawasi protokol kesehatan di tingkat terkecil sehingga dapat memutus mata rantai penularan dan masyarakat tetap aman dan produktif. Pada saat terjadinya lonjakan kedua di bulan Juli 2021, PPKM Mikro dilanjutkan dengan kebijakan PPKM Darurat, karena terjadi lonjakan dampak dari Idul Fitri. ""Kebijakan ini (PPKM Darurat) berhasil menekan kasus sehingga dilanjutkan dengan penerapan PPKM Level 1- 4 yang masih berlaku hingga saat ini,"" tutur Wiku. Selain berbasis PPKM, Satgas juga mengatur pelaku perjalanan internasional dan perjalanan dalam negeri. Untuk perjalanan internasional, Satgas telah mengeluarkan 6 surat edaran dan 11 surat edaran perjalanan dalam negeri sepanjang tahun 2021. Termasuk juga mengeluarkan kebijakan peniadaan mudik lebaran tahun 2021. Upaya lainnya seperti pemantauan perubahan perilaku masyarakat yaitu menjaga jarak, memakai masker, pembentukan posko di seluruh Indonesia, penyediaan fasilitas isolasi terpusat dan distribusi masker sebagai upaya pencegahan. Sementara dari 6 bidang dalam Satgas yaitu bidang Data/IT penyediaan sistem data Bersatu Lawan COVID-19, zonasi risiko, monitoring perubahan perilaku, pelaksanaan PPKM Mikro dikumpulkan data yang ada dan digunakan oleh kementerian/Lembaga tingkat pusat dan daerah sebagai dasar analisis situasi dan dasar pengambilan keputusan. Lalu, Bidang Perubahan Perilaku, membantu mempercepat perubahan perilaku masyarakat dan menerapkan protokol kesehatan seperti sosialisasi dan edukasi dengan berbagai macam metode. Bidang ini bekerja sama dengan berbagai institusi dan menghasilkan materi edukasi seperti pedoman, video, lagu, pagelaran seni. Bidang ini telah mendidik lebih dari 60 juta orang dan menghasilkan 123 ribu Duta Perubahan Perilaku yang tersebar di Indonesia. Selanjutnya, Bidang Komunikasi Publik bertugas menyebar informasi dari setiap elemen Satgas kepada masyarakat. Saat ini ada 13 stasiun televisi swasta yang bekerjasama, 18 media cetak, 24 media online, hingga radio dan media luar ruangan serta 3.030 jurnalis yang telah berkolaborasi. ""Kolaborasi ini total telah menghasilkan total 38.643 berita yang ditayangkan media siber, media cetak, televisi dan radio serta lainnya,"" ucap Wiku. Pada bidang Koordinasi Relawan bertugas menghimpun dan mengkoordinasi serta mendistribusikan relawan COVID-19 dalam kegiatan edukasi, asistensi yang dilakukan kementerian/Lembaga sesuai yang dibutuhkan. Lalu, Bidang Kesehatan, Perlindungan Tenaga Kesehatan mendukung Kementerian Kesehatan dalam melakukan upaya surveilans, yaitu testing, tracing dan treatment serta perlindungan terhadap tenaga kesehatan. ""Satgas terus berkoordinasi dengan kementerian/Lembaga tingkat pusat dan daerah untuk memastikan pengendalian terstruktur. Meskipun saat ini kondisi terkendali, masih ada tugas meningkatkan cakupan vaksinasi dan untuk itu kita semuanya harus bisa menanganinya dengan baik. Dengan begitu, kondisi pandemi yang mengalami perbaikan saat ini harus dijaga jangan sampai terjadi lonjakan seperti negara lainnya,"" jelasnya. Indonesia juga telah berhasil menyelenggarakan kegiatan besar yang dibuktikan dengan penyelenggaraan PON XX Papua 2021. Dari PON XX di Papua, penularan dapat terkendali terbukti dengan hanya ditemukan 176 kasus dari 10 ribu peserta. Positivity rate juga terbilang rendah yakni 1,13%. Keberhasilan penyelenggaraan PON XX menjadi modal Indonesia dalam menyelenggarakan kegiatan besar mendatang seperti Superbike Mandalika di Nusa Tenggara Barat (NTB) yang saat ini sedang dilakukan persiapan dalam pelaksanaannya. Ditambah kondisi kasus di NTT yang cukup terkendali dengan level PPKM yang juga rendah. Dari 5 kabupaten/kota, 4 berada di level 1 dan 1 kabupaten/kota berada di level 2. Lalu, cakupan vaksinasi yang cukup tinggi yakni di Mataram 92,74%, Lombok Barat 56,37%, Lombok Tengah 68,69%, Lombok Timur 48,29% dan Lombok Utara 69,59%. ""Dan penting diingat dalam beberapa bulan kedepan libur Natal dan Tahun Baru 2022 berpotensi menimbulkan lonjakan kasus. Oleh karena itu keberhasilan Indonesia dalam penanganan menjadi indikator penting, sehingga cita-cita produktif dan aman COVID-19 dapat tercapai, dan kita dapat dikatakan berhasil jika memasuki tahun 2022 tanpa ada lonjakan kasus,"" tegas Wiku.",Satgas Beberkan Upaya Pengendalian COVID-19 Selama 2021,idulfitri,https://news.detik.com/berita/d-5787099/satgas-beberkan-upaya-pengendalian-covid-19-selama-2021?single=1,"Kamis, 28 Okt 2021 19:24 WIB"
"pemerintah demi mencegah meningkatnya mobilitas masyarakat pada akhir tahun. Dengan demikian, risiko penyebaran COVID-19 dapat dicegah agar tak sampai menimbulkan gelombang ketiga Corona. Cuti bersama 24 Desember 2021 dihapus sesuai dengan Surat Keputusan Bersama (SKB) Menteri Agama, Menteri Ketenagakerjaan, Menteri Pendayagunaan Aparatur Negara dan Reformasi Birokrasi SKB Tiga Menteri Nomor 712 Tahun 2021, Nomor 1 Tahun 2021, serta Nomor 3 Tahun 2021 tentang Hari libur Nasional dan Cuti Bersama 2021. Lalu kenapa cuti bersama dihapus? Berikut penjelasannya. Informasi soal cuti bersama dihapus sudah disampaikan Menko PKM Muhadjir Effendy pada 18 Juni 2021. Ada pula dua libur nasional lainnya yang mengalami pergeseran lantaran 'kejepit' pada akhir pekan. ""Pemerintah memutuskan mengubah dua hari libur nasional dan meniadakan satu hari libur cuti bersama,"" ucap Menteri Koordinator Bidang Pembangunan Manusia dan Kebudayaan (PMK) Muhadjir Effendy dalam konferensi pers kala itu. Untuk diketahui, tanggal 25 Desember dan 1 Januari 2022 sama-sama berada di hari Sabtu. Dengan dihapusnya cuti bersama 24 Desember, pemerintah hendak mencegah peningkatan mobilitas masyarakat, di mana dikhawatirkan banyak orang yang mengambil libur panjang hingga perayaan tahun baru 2022. Dalam SKB 3 Menteri, tercantum bahwa kini cuti bersama Natal 2021 ditiadakan. Ini daftar hari libur dan cuti bersama 2021 yang terbaru sesuai SKB 3 Menteri: 1. Jumat, 1 Januari: Tahun Baru 2021 Masehi 2. Jumat, 12 Februari: Tahun Baru Imlek 2572 Kongzili 3. Kamis, 11 Maret: Isra Mikraj Nabi Muhammad SAW 4. Minggu, 14 Maret: Hari Suci Nyepi Tahun Baru Saka 1943 5. Jumat, 2 April: Wafat Isa Al Masih 6. Sabtu, 1 Mei: Hari Buruh Internasional 7. Kamis, 13 Mei: Kenaikan Isa Al Masih sekaligus Hari Raya Idul Fitri 1442 Hijriah 8. Jumat, 14 Mei: Hari Raya Idul Fitri 1442 Hijriah 9. Rabu, 26 Mei: Hari Raya Waisak 2565 10. Selasa, 1 Juni: Hari Lahir Pancasila 11. Selasa, 20 Juli: Hari Raya Idul Adha 1442 Hijriah 12. Rabu, 11 Agustus: Tahun Baru Islam 1443 Hijriah (diubah) 13. Selasa, 17 Agustus: Hari Kemerdekaan Republik Indonesia 14. Rabu, 19 Oktober: Maulid Nabi Muhammad SAW (diubah) 15. Sabtu, 25 Desember: Hari Raya Natal Cuti bersama 1. Rabu, 12 Mei: Hari Raya Idul Fitri 1442 Hijriah Sementara itu, SKB 3 Menteri soal libur 2022 sudah diterbitkan. Berikut daftar hari libur nasional 2022 sesuai SKB 3 Menteri Nomor 963 Tahun 2021, Nomor 3 Tahun 2021 dan Nomor 4 Tahun 2021 tentang Hari Libur Nasional dan Cuti Bersama 2022. Berikut 16 hari yang ditetapkan sebagai tanggal merah dalam kalender 2022: Cuti bersama dihapus dan kini pemerintah juga akan mengetatkan aturan di masa Natal dan tahun baru (nataru). Menko Muhadjir juga meminta masyarakat tidak membuat rencana bepergian jauh di masa tersebut. ""Kita matangkan aturannya dulu. Pokoknya sementara sekarang jangan ada yang punya rencana mudik. Jadi nggak usah beli tiket dulu, nggak usah merancang dulu untuk bepergian jarak jauh,"" kata Muhadjir di Balai Kota Solo, Rabu (27/10/2021). Muhadjir menyebut pemerintah tidak ingin terjadi gelombang ketiga virus Corona atau COVID-19 setelah libur panjang akhir tahun. Dia mengambil contoh beberapa negara yang saat ini dilanda lonjakan jumlah kasus COVID-19. ""Sekarang kan Eropa hampir semua negara mengalami kenaikan yang drastis, Amerika Selatan, tetangga kita Singapura yang kemarin katanya paling hebat menangani COVID tapi sekarang justru mengalami keparahan, Jepang juga, Korsel juga. Karena itu, kita tidak boleh main-main ini dengan kondisi kita ini, kemudian menganggap remeh,"" tuturnya. Meski aturan masih dimatangkan, Muhadjir mengatakan ada kemungkinan pemerintah akan membuat aturan seperti tahun lalu demi masyarakat. ""Kemungkinan akan kita atur ketat seperti tahun lalu, terutama jangan dicurigai macam-macam. Ini demi keselamatan dan kemaslahatan rakyat Indonesia semua,"" ujarnya.","Cuti Bersama Dihapus, Tanggal Merah Natal-Tahun Baru Jatuh di Hari Sabtu",idulfitri,https://news.detik.com/berita/d-5784819/cuti-bersama-dihapus-tanggal-merah-natal-tahun-baru-jatuh-di-hari-sabtu?single=1,"Rabu, 27 Okt 2021 14:04 WIB"
"Anggota DPRD Kabupaten Mojokerto dilaporkan ke polisi. Ia diduga   seorang pengusaha rental mobil hingga rugi Rp 75 juta. Kasus dugaan penipuan tersebut dialami seorang pria berinisial NYB (69), warga Desa Gebangmalang, Kecamatan Mojoanyar, Mojokerto. Pengusaha rental mobil ini mengaku ditipu oleh Mustakim, anggota DPRD Kabupaten Mojokerto dari PPP. ""Kasus penipuan, korbannya saya, kerugian Rp 75 juta. (Mustakim) masih aktif anggota DPRD Mojokerto dari PPP. Dia rumahnya di Pacing (Kecamatan Bangsal, Mojokerto),"" kata NYB kepada detikcom, Selasa (12/10/2021). Dugaan   tersebut, lanjut NYB, dia alami sebelum Lebaran Idul Fitri pada Mei 2021. Menurut dia, saat itu Mustakim menjual mobil Toyota Kijang Innova Reborn kepada dirinya seharga Rp 175 juta. ""Dia teman baik, dia anggota dewan, saya dulu kepala desa,"" ujarnya. Kala itu, kata NYB, ia menyerahkan uang Rp 75 juta kepada Mustakim sebagai uang muka mobil tersebut. Sebagai bukti pembayaran uang muka, ia mendapatkan kuitansi dari anggota DPRD Kabupaten Mojokerto periode 2019-2024 tersebut. ""Uangnya diambil di rumah saya menjelang Lebaran Idul Fitri. Ada kuitansi, malah dia yang membuatkan kuitansi, masih saya simpan,"" terangnya. Namun hingga beberapa bulan berlalu, Mustakim tak kunjung menyerahkan mobil yang dia jual ke NYB. Mustakim diduga mengemplang uang Rp 75 juta milik NYB. ""Sudah saya cari, saya telepon tidak bisa, sampai saya cegat di rumahnya, saya telepon tidak diangkat, saya SMS tidak dibalas,"" ungkap NYB. Oleh sebab itu, NYB terpaksa melaporkan Mustakim ke Polres Mojokerto pada Jumat (1/10). Ia juga menyertakan foto kopi kuitansi pembayaran uang muka mobil, sebagai salah satu bukti dalam laporannya. Meski begitu, ia berharap Mustakim bersedia mengembalikan uang miliknya. Sehingga kasus ini bisa diselesaikan secara damai. ""Uang itu sangat berharga bagi saya, kerja saya hanya rental mobil, rencana untuk menambah armada saya,"" terangnya. Kasat Reskrim Polres Mojokerto AKP Tiksnarto Andaru Rahutomo menjelaskan, pihaknya telah menerima laporan   yang diduga dilakukan Mustakim. ""Laporan sudah kami terima, terhadap terlapornya atas nama Mustakim. Sesuai prosedur, kami akan memeriksa saksi-saksi yang menurut pelapor mengetahui kejadian tersebut, serta bukti yang dimiliki,"" ujarnya. Sayangnya, sampai saat ini Mustakim belum bisa dikonfirmasi terkait kasus tersebut. Detikcom beberapa kali menelepon nomor ponselnya, tapi tidak ada respons. Sementara WhatsApp anggota DPRD Kabupaten Mojokerto ini tidak aktif.",Anggota DPRD Mojokerto Dilaporkan Tipu Teman Rp 75 Juta,idulfitri,https://news.detik.com/berita-jawa-timur/d-5764136/anggota-dprd-mojokerto-dilaporkan-tipu-teman-rp-75-juta?single=1,"Selasa, 12 Okt 2021 18:53 WIB"
"Ramai kabar soal   menelantarkan orang tuanya mencuat baru-baru ini. Tuduhan itu datang dari adiknya, Miftakhul Khoeron, atau yang akrab disapa Tajib.  dengan tegas membantah tuduhan itu. Menurutnya, tudingan itu di luar logika. Lantaran hingga kini dia masih bisa mengurusi 500 orang santri sehingga tidak mungkin menurutnya, dia menelantarkan orang tua. ""Ya logis saja bro, santri 500 (orang) saya sekolahi, masak orang tua saya nggak. Ya kan begitu,"" kata Gus Miftah kala ditemui di kawasan gedung Transmedia, Mampang Prapatan, Jakarta Selatan. Gus Miftah merasa tudingan tersebut tidak tepat ditujukan kepadanya. Berkaca kepada dirinya yang sangat memperhatikan orang lain yang bukan keluarganya. ""Ya gini, kok prostitusi, WTS saya jabanin (diurusin). Masak orang tua nggak. Kalau itu dijadikan celah bagi saya, oh saya nggak pernah ngopenin, nggak akan saya jawab. Nanya saja ke lurah di sana, Pak Kapolsek, jangan tanya ke orang tua saya, kasihan. Kalau itu bisa dilihatlah. Sekali lagi ya, santri yang orang luar (keluarga) saya urusin, WTS, anak kelab malam yang saya nggak kenal, saya urusin. Masak orang tua saya nggak diurusin,"" lanjutnya. Gus Miftah juga memberi komentar soal orang yang memberi tuduhan tersebut yakni adiknya sendiri. Dia menjadikan kisah Nabi Nuh sebagai pengibaratan untuk permasalahannya ini. Seperti diketahui, putra sulung Nabi Nuh yaitu Kan'an adalah orang yang durhaka kepada perintah Allah. Ketika banjir bandang datang, Nabi Nuh sempat mengajak Kan'an naik ke atas kapal, namun ditolak lantaran dia yakin dapat menyelamatkan diri dari banjir besar itu. Pada momen itu, Nabi Nuh menyadari bahwa cinta pada anaknya membuatnya lupa pada Allah. Dia pun lalu memohon ampun dan mengikhlaskan anaknya yang meninggal dan masuk golongan orang kafir. ""Katanya yang ngomong adiknya sendiri. Lah sekarang begini, Nabi Nuh saja kan seperti itu. Kewajiban orang tua kepada anak ada batasnya. Apalagi kakak kepada adiknya,"" katanya. Di sisi lain, Gus Miftah merasa telah gagal mengedukasi keluarganya. Namun dia berusaha bijak dan mengambil hikmah atas kejadian ini untuk lebih memperhatikan orang tuanya. ""Artinya saya pengin mengedukasi keluarga saya. Bisa jadi saya mengedukasi para santri, tapi mungkin Allah mentakdirkan gagal mengedukasi keluarga saya. Ya itu saya terima. Mungkin itu bagian dari kelemahan saya. Akhirnya ketika itu viral, barangkali ya saya harus lebih perhatian kepada orang tua, saya nggak akan membantah karena bagaimanapun itu urusan internal keluarga saya,"" tuturnya. Soal dirinya tidak pernah mendatangi orang tua, Gus Miftah mengurai alasan. Pandemi disebutnya sebagai salah satu hal yang menyebabkan dirinya mengunjungi orang tuanya. ""Kemudian yang kedua, katanya jarang mengunjungi, bro ini pandemi. Saya kalau kena COVID-19, saya nggak ada gejala apa pun. Ketika saya pulang ketemu orang tua saya di musim pandemi ini pasti akan menimbulkan masalah. Mereka ini rentan, usia-usia sepuh. Di pandemi saja saya sudah tiga kali ke sana dan di keluarga kami nggak ada keharusan ketemunya di Idul Fitri, nggak, tapi komunikasi tiap hari dan komunikasi luar biasa,"" bebernya. Gus Miftah juga akui belum lama ini sudah bertemu dengan orang tuanya. ""Ini saya baru dari sana. Saya kan ada undangan di Lampung banyak, ada undangan Pak Kapolda jadi sekaligus mampir. Seperti kemarin saya vaksin sekaligus mampir. Jadi saya usahakan waktu itu seefektif mungkin,"" imbuhnya. Sementara itu, dia juga heran mengapa isu ini berembus kencang. Dia menduga ada pesanan tertentu. ""Tapi saya nggak tahu kemudian di belakang itu ada yang order. Kenapa jadi seramai itu,"" katanya.","Adik Tuding Telantarkan Orang Tua, Gus Miftah Singgung Kisah Nabi Nuh",idulfitri,https://hot.detik.com/celeb/d-5759480/adik-tuding-telantarkan-orang-tua-gus-miftah-singgung-kisah-nabi-nuh?single=1,"Sabtu, 09 Okt 2021 11:45 WIB"
"Polisi masih mengulik jejak pembunuh Tuti Suhartini dan anaknya Amalia Mustika Ratu. Makam kedua warga tersebut pun dibongkar untuk menelisik lebih lanjut misteri kematian ibu dan anak tersebut. Lalu apa hasil autopsi ulang polisi ? Sementara itu puluhan sopir angkot elf di Cianjur mogok karena merasa dirugikan oleh travel gelap. Bagaimana ceritanya? Sejumlah peristiwa menarik lainnya terjadi di Jabar hari ini, berikut ulasannya: Sebulan lebih kasus belum terungkap, polisi membongkar makam Tuti Suhartini (55) dan anak Amalia Mustika Ratu alias Amel (23) di Subang, Jawa Barat, Sabtu (2/10). Kedua jenazah diangkat dari liang lahat dan dilakukan autopsi ulang di tempat oleh tim penyidik gabungan. Polisi enggan mengungkap hasil autopsi ulang jenazah ibu-anak korban pembunuhan sadis itu. Autopsi dilakukan untuk mengecek korban dibunuh dengan senjata tajam atau bukan. Selain itu, polisi menelusuri kembali jejak waktu pelaku menghabisi korban. ""Hasil autopsi itu langsung dikirimkan kepada penyidik, jadi kita tidak sembarangan, karena kita minta itu penyidik dari Polres Subang, dari hasil autopsi itu nanti dilaporkan ke penyidik untuk dievaluasi kembali,"" ucap Kabid Humas Polda Jabar Kombes Erdi A Chaniago di Mapolda Jabar, Jalan Soekarno Hatta, Kota Bandung, Rabu (6/10/2021). Erdi menuturkan autopsi ulang dilakukan oleh penyidik untuk mencari kesesuaian dengan bukti dan petunjuk baru yang dimiliki penyidik. Polisi juga ingin mencari tahu penyebab kematian dari ibu-anak tersebut. ""Kita melihat lagi kesesuaian. Apakah penyebab kematiannya kedua korban tersebut dibunuh, apakah melakukan perlawanan, apakah kemudian untuk menentukan waktu kematiannya? Kita cari kesesuaian kembali,"" ujarnya. ""Sehingga setelah melihat hasil autopsi tersebut, di antaranya juga mengenai alat yang digunakan. Apakah tumpul atau tajam?"" kataErdi menambahkan. Puluhan angkutan umum elf di Cianjur menggelar aksi mogok memprotes keberadaan travel gelap yang makin marak. Pasalnya keberadaan travel gelap membuat angkutan elf sepi penumpang. Bahkan travel gelap semakin aktif beroperasi usai memiliki legalitas atau berbadan hukum. Ade Ruslan, sopir elf, mengatakan para sopir sudah geram dengan maraknya travel gelap. Sebelumnya travel gelap hanya beroperasi saat momen mudik lebaran, namun kini di hari biasa pun juga beroperasi. ""Jadi sekarang juga terus beroperasi, tidak hanya di momen mudik lebaran Idul Fitri atau Idul Adha. Setiap hari mereka naik-turunkan penumpang,"" ujar dia saat ditemui di Terminal Pasirhayam, Rabu (6/10/2021). Menurutnya para sopir sudah beberapa kali melakukan protes, namun tidak ada tindakan dari Dinas Perhubungan atau pihak terkait. ""Sudah bosan protes, mulai dari audiensi hingga mogok beroperasi. Janjinya mau ditindak atau ditertibkan, tapi nyatanya sekarang tetap beroperasi. Bahkan informasinya mereka ada yang berbadan hukum, jadi merasa bebas untuk mengangkut penumpang,"" kata dia. Ade menegaskan para sopir akan terus mogok jika masalah tersebut tak kunjung selesai.""Kalau tidak kunjung ada solusi, kami akan terus mogok,"" tegasnya. ""Percuma mau beroperasi juga, penumpang tidak ada. Semuanya diambil oleh travel gelap. Percuma ada trayek, karena travel gelap bebas kemana saja,"" tambahnya. Senada, Pian, sopir trayek Cianjur-Agrabinta, mengatakan sejak maraknya travel gelap, setiap beroperasi angkutan elf hanya mendapat satu atau dua penumpang. ""Paling banyak empat penumpang. Sering nya paling hanya dua penumpang. Mau dapat penghasilan dari mana dengan penumpang yang hanya segitu. Jangankan untuk keluarga, untuk bensin saja kurang,"" ucapnya. Dia berharapDishub bisa bertindak tegas terkait maraknya travel gelap. ""Kalau dibiarkan terus, angkutan elf bisa mati,""pungkasnya. Polisi menetapkan tujuh tersangka terkait peristiwa bentrokan maut di lahan tebu perbatasan antara Kabupaten Indramayu dan Majalengka yang menewaskan dua petani. Para tersangka itu merupakan pentolan dan anggota Forum Komunikasi Masyarakat Indramayu Selatan (F-Kamis). ""Di waktu sesaat setelah kejadian kita langsung mengamankan anggota F-Kamis dan pemeriksaan terhadap 26 orang. Kita tetapkan tujuh tersangka, salah satunya ketua F-Kamis,"" kata Kapolres Indramayu AKBP M Lukman Syarif kepada awak media saat jumpa pers di Mapolres Indramayu, Jawa Barat, Rabu (6/10/2021). Lukman mengatakan konflik lahan garapan tebu di wilayah PG Jatitujuh terjadi selama bertahun-tahun. Menurutnya, F-Kamis selama ini terus memprovokasi masyarakat dan petani untuk mempertahankan lahan garapan secara sepihak, dalam artian enggan bermitra dengan PG Jatitujuh. ""Kita laksanakan tindakan tegas. Tidak ada premanisme, intimidasi dan pemerasan terhadap masyarakat kecil. Sebetulnya petani ingin bermitra,"" ucap Lukman. Sekadar diketahui, ketua F-Kamis merupakan salah seorang anggota DPRD Kabupaten Indramayu dari Partai Demokrat yang berinisial T. Dari hasil pemeriksaan polisi, T diduga terlibat dalam memprovokasi petani. ""Ketua F-Kamis ini perannya menggerakkan, menghasut dan melawan petani yang menggarap atau menjadi mitra (PG Jatitujuh),"" kata Lukman. Selain memprovokasi petani yang bentrok. Lukman menambahkan F-Kamis juga berperan dalam provokasi terhadap kepolisian. ""Beberapa hari lalu kita lakukan penindakan dan dihadang orang-orang yang bawa senjata tajam (sajam),"" kata Lukman. Sebelumnya, ketua F-Kamis yang diamankan kepolisian merupakan anggota DPRD Kabupaten Indramayu dari Partai Demokrat. DPC Partai Demokrat Indramayu mengaku telah menyiapkan langkah-langkah terkait kadernya yang diduga terlibat dalam konflik petani tebu itu. Ketua Badan Penelitian dan Pengembangan (Balitbang) DPC Partai Demokrat Harris Solihin partainya masih menyelidiki keterlibatan T selaku Ketua F-Kamis dalam peristiwa bentrok yang menewaskan dua petani itu. ""Menurut penjelasannya, dia sebagai ketua F-Kamis. Tetapi itu di luar dari organisasi kami (partai),"" kata Harris saat jumpa pers di kantorDPRD KabupatenIndramayu, Jawa Barat, Selasa (5/10/2021). Pertokoan di Kawasan Kanis, Jalan RE Martadinata, Kabupaten Ciamis, Jawa Barat, hangus terbakar, Rabu (6/10/2021). Dalam peristiwa tersebut 2 orang meninggal dunia dan 1 orang mengalami luka-luka. Ada 3 toko yang sudah terbakar, yakni toko tembakau (bako), toko donat dan kios makanan. Sampai pukul 18.30 WIB, petugas pemadam kebakaran dari Ciamis dibantu dari Tasikmalaya masih melakukan pendinginan karena api di bagian dalam pertokoan masih menyala. Wakil Bupati Ciamis Yana D Putra meninjau langsung ke lokasi kebakaran. Yana menjelaskan semua armada Damkar Ciamis dan tangki pengisi air dikerahkan. Dibantu dari PDAM, kepolisian dan pihak lainnya termasuk bantuan dari Damkar Kota Tasikmalaya. ""Api masih menyala di bagian dalam, sekarang masih melakukan pemadaman. Semua damkar kita kerahkan. Dari kejadian ini sementara ada 2 korban meninggal dunia dan 1 orang luka-luka. Sudah dievakuasi,"" ujar Yana. Yana menyatakan belum mengetahui pasti penyebab kebakaran tersebut. Pihaknya akan melakukan identifikasi terkait asal api yang membakar sejumlah pertokoan di Ciamis. ""Kita akan cari tahu penyebab kebakaran,"" katanya. Diketahu di belakang pertokoan tersebut adalah rumah. Korban meninggal diduga terjebak api dan yang sedang sakit sehingga tidak bisa menyelamatkan diri. Sementara itu Soni, seorang anggota keluarga pemilik toko mengatakan berdasarkan keterangan dari adik iparnya api diduga dari kompor minyak yang lupa dimatikan oleh pegawai. ""Saya tanya ke adik ipar, katanya kompor lupa dimatikan. Pegawai pulang sore. Yang ada di rumah tidak mengetahui, saat tau api sudah membesar. Maunolong tidak sempat. Tadi tiga orang di dalam,"" ujarnya. Ustaz Solmed mengadukan ke polisi terkait pencemaran nama baik oleh panitia pengajian di Garut ke Polda Jabar. Polisi akan menindaklanjuti pengaduan itu. ""Ya jadi memang yang bersangkutan 5 Oktober kemarin dia datang dan melapor dalam bentuk surat pengaduan,"" ucap Kabid Humas Polda Jabar Kombes Erdi A Chaniago saat dikonfirmasi, Rabu (6/10/2021). Aduan tersebut berkaitan dengan pencemaran nama baik yang dilakukan Tisna dan Suwarna. Menurut Erdi, pengaduan itu akan ditindaklanjuti oleh tim Direktorat Reserse Kriminal Khusus Polda Jabar. ""Nanti pengaduan tersebut, ini kan bahan dalam rangka penyelidikan. Tentunya surat pengaduan tersebut akan dipelajari oleh Direktorat Kriminal Khusus terkait permasalahan yang dilaporkan oleh ustaz Solmed,"" tutur Erdi. ""Setelah dipelajari, kemudian ada beberapa hal yang akan dilakukan, yaitu dengan memanggil saksinya dalam rangka penyelidikan ya,"" kata Erdi menambahkan. Sebelumnya, ustaz Solmed dituduh oleh Suwarna telah melanggar perjanjian dalam ceramah. Ia membatalkan sepihak, padahal sudah menerima uang Rp 8 juta. Ustaz Solmed pun membantahnya Ustaz Solmed tidak datang ke acara pengajian di Kampung Cisamak, Desa Cisewu, Kecamatan Cisewu, Kabupaten Garut, Jawa Barat karena mendapatkan halangan di jalan. Akses menuju kampung tersebut tertutup imbas longsor. Semula acara pengajian itu di Pangalengan, Bandung, Jawa Barat.",Jabar Hari Ini: Anggota DPRD Tersangka Bentrokan Maut-Sopir Elf Mogok,idulfitri,https://news.detik.com/berita-jawa-barat/d-5756042/jabar-hari-ini-anggota-dprd-tersangka-bentrokan-maut-sopir-elf-mogok?single=1,"Rabu, 06 Okt 2021 21:15 WIB"
