artikel,judul,keyword,link,tanggal
"Bidang Koordinasi Relawan Satuan Tugas COVID-19 (BKR Satgas COVID-19) menggelar kegiatan Peningkatan Kapasitas Relawan Layanan Dukungan Psikososial (LDP). Kegiatan ini berlangsung secara serentak di tiga provinsi di Indonesia, yaitu Kalimantan Timur, Kalimantan Selatan dan Sumatera Utara. Ketua BKR Satgas COVID-19 Andre Rahadian mengatakan kegiatan yang berlangsung selama mulai 18 hingga Oktober 2021 ini akan melibatkan 30 relawan dari berbagai perwakilan organisasi kemasyarakatan, dinas kesehatan, dinas sosial, lembaga sosial yang berada di tiap Provinsi. Menurutnya, kondisi kesehatan jiwa masyarakat yang terganggu selama masa pandemi adalah fenomena nyata yang harus segera disikapi. ""Aspek psikososial perlu mendapat perhatian, karena dampak jangka panjangnya dapat berpengaruh terhadap berbagai persoalan, khususnya tingkat produktivitas. Untuk itulah kehadiran relawan layanan dukungan psikososial di tengah-tengah masyarakat sangat dibutuhkan dan menjadi dasar pelaksanaan kegiatan Peningkatan Kapasitas Relawan Layanan Dukungan Psikososial (LDP),"" ungkap Andre dalam keterangan tertulis, Jumat (22/10/2021). Andre berharap kegiatan ini mampu membentuk Relawan Layanan Dukungan Psikososial (LDP) yang siap terjun mendampingi masyarakat, baik itu kelompok rentan (lansia, anak, disabilitas, dan lain-lain). ""Dan tenaga kesehatan yang membutuhkan terkait adaptasi kebiasaan baru, cara atau respons dalam menghadapi situasi pandemi, memberdayakan masyarakat terdampak pandemi, mengkampanyekan perubahan perilaku masyarakat, mengkampanyekan vaksinasi serta donor plasma konvalesen,"" tambahnya. Lebih lanjut, ia memaparkan pelaksanaan kegiatan dilakukan secara offline selama enam hari dengan menerapkan protokol kesehatan yang ketat. Di tiga hari pertama , seluruh relawan akan mendapatkan pelatihan peningkatan kapasitas dengan jumlah tujuh sesi materi yang disampaikan oleh narasumber yang mumpuni di bidangnya. Adapun ketujuh materi tersebut antara lain, 1. Pengantar kerelawanan 2. Protokol kesehatan dan seputar COVID-19 3. Psikoedukasi 4. Dukungan psikologi awal 5. Layanan dukungan psikososial 6. Pendampingan sosial 7. Fungsi koordinasi (pelaporan) Sementara itu, di hari keempat dan kelima, relawan yang telah dibekali materi akan turun ke lapangan untuk melakukan praktik pendampingan kepada lembaga sosial sasaran program. Andre menyebutkan lokasi lembaga yang tersebar di tiga provinsi tersebut antara lain, UPTD Panti Sosial Tresna Werdha Nirwana Puri, SLB Yayasan Untung Tuah, Panti Asuhan Anak Harapan, RS Abdul Muis, Panti Asuhan Al Ikhlas Dinsos Provinsi Kalsel, RS Bhayangkara Tk. III Banjarmasin Tembusan Dinkes Prov Kalsel, Panti Lansia Binjai, Panti Anak Ora El Labora, RSUD GL Tobing, dan Panti Lansia Provsu. Di hari terakhir, seluruh relawan yang menjadi peserta kegiatan akan melakukan monitoring dan evaluasi program secara keseluruhan. ""Selama ini hal-hal yang berkaitan dengan kondisi psikososial masih belum banyak kita sentuh. Memang, telah banyak layanan dukungan psikososial yang diadakan oleh berbagai instansi, lembaga dan organisasi, seperti layanan bantuan psikologi 'Sejiwa' dan #SahabatRelawan, yang dilakukan secara daring. Namun, dukungan psikososial yang diberikan secara langsung di masyarakat, belum banyak dilakukan,"" kata Kepala Sub-Bidang Relawan Kesehatan BKR Satgas COVID-19 dr. Joseph Frederick William. dr Joseph menilai dukungan psikososial penting diberikan kepada mereka yang terpapar, supaya mereka bisa menjalani masa penyembuhan dan juga melawan penyakit yang diderita. Sehingga, nantinya masyarakat tak kehilangan harapan saat dirawat. Mengingat para pasien COVID umumnya tidak dapat didampingi oleh keluarga. Selain itu, dr Joseph pun mengatakan pelatihan ini bertujuan agar dampak negatif dari pandemi, yang mungkin dapat memunculkan berbagai gejolak sosial, dapat diredam. Sehingga tidak berkembang menjadi keresahan yang mengganggu atau malah menjadi gerakan yang tidak kondusif dalam upaya menangani dan mengendalikan penyebaran serta penularan virus penyebab COVID-19 ""Kegiatan yang berlangsung di tiga Provinsi ini adalah rangkaian awal, Satgas Relawan akan terus melanjutkan Peningkatan Kapasitas Relawan di berbagai Provinsi di Indonesia kedepannya,"" tuturnya. ""Secara berkelanjutan Satgas Relawan juga akan terus bersinergi melalui relawan binaan bersama berbagai Kementerian, Dinas Kesehatan, Dinas Sosial, dan berbagai organisasi profesi dan kemasyarakatan di Indonesia untuk terus mewujudkan kesehatan mental bagi masyarakat dan terutama kelompok rentan yang terdampak pandemi,"" pungkasnya.",Satgas Tingkatkan Kapasitas Relawan dalam Layanan Dukungan Psikososial,bantuanpanti,https://news.detik.com/berita/d-5778803/satgas-tingkatkan-kapasitas-relawan-dalam-layanan-dukungan-psikososial?single=1,"Jumat, 22 Okt 2021 23:05 WIB"
"Pesantren Al Yaqin yang berlokasi di Desa Gunung Manik, Kecamatan Tanjungsari, Kabupaten Sumedang merupakan pesantren yang dibangun oleh komunitas mualaf asal Indonesia Timur. Mereka mengatasnamakan Komunitas Lemorai atau Para Perantau. Pesantren Al Yaqin lahir tidak terlepas dari konflik politik yang terjadi di Timor Timur kala itu sekitar tahun 1994-2002. Hingga pada akhirnya Timor Timur ditetapkan sebagai negara berdaulat berdasarkan hasil referendum untuk kemudian secara resmi menjadi Timor Leste pada 2002. ""Jadi, kami tidak ada pilihan waktu itu, mau tetap di Timor Timur atau kami keluar dari sana,"" ungkap Pimpinan Pesantren Al Yaqin, Roberto Freitas atau setelah mualaf menjadi Hasan Basri belum lama ini. Hasan mengenang kejadian pada tahun 1996 di sana. Dimana saat konflik terjadi, dari yang semula konflik politik hingga merembet menjadi konflik persaudaraan hanya karena berbeda agama. ""Semua Timor Timur itu goncang, konflik, padahal masih bersaudara tapi karena dipicu oleh kancah politik, akhirnya goyang pecah,"" terang Hasan. Hingga pada tahun 1999, ia bersama keluarga, saudara dan tetangga lainnya memutuskan untuk hijrah ke pulau Jawa. Keyakinannya pada Islam dan kecintaannya pada Negara Kesatuan Republik Indonesia (NKRI) menjadi kekuatannya saat itu. ""Tahun 1999 itulah kami meninggalkan Timor Timur dan dalam hati kami bilang 'ya sudah memang Timor Timur harus merdeka' maka kami pun lebih memilih integrasi dengan Indonesia karena kecintaan kami pada agama Islam dan Indonesia,"" ungkapnya. Singkat cerita, tidak kurang dari 20 orang termasuk Hasan bersama istri dan kedua anaknya yang sama-sama memeluk Islam akhirnya tiba di Pulau Jawa. Tempat pertama yang disinggahinya adalah sebuah rumah kontrakan mungil di Jalan Kebon Kopi, Kota Cimahi. ""Awal-awal datang kami semua tinggal di daerah Kebon Kopi, saya bersama istri dan juga anak tinggal di sebuah kontrakan, ada juga yang tidur di masjid-masjid karena kebayangkan 20 orang,"" terangnya. Saat tiba pertama kali di pulau Jawa, profesi yang ditekuni Hasan adalah menjadi seorang penjual koran. Bisa dibayangkan berapa penghasilannya kala itu. ""Untuk makan kami orang sangat- sangat sederhana, bahkan pernah diantara kami tidak makan satu hari penuh,"" ungkapnya. Pernah suatu waktu, Hasan pun jatuh sakit maka untuk memenuhi kebutuhan sehari-hari di pegang kendali oleh istrinya. Berkat keahliannya membuat tas dari anyaman tali padang, semua kebutuhan keluarganya pun dapat dipenuhi secara alakadarnya. ""Yang penting bagi kami itu bisa makan tidak lebih, dari menjual tas itu, kalau bisa dapat bikin dua, itu saya ingat harganya 8 ribu rupiah,"" katanya Setelah perjuangannya hidup di rumah kontrakan kecil selama hampir satu tahun, akhirnya pertolongan pun datang. Saat itu, rombongannya yang berniat ingin mendirikan sebuah pesantren mendapatkan bantuan dari Bank Negara Indonesia (BNI) dan Perusahaan Listrik Negara (PLN). ""Saya masih ingat bantuan yang kami dapat itu, dari BNI Rp 2,5 Juta dan dari PLN sebesar Rp 1,5 juta,"" katanya. Seperti gayung bersambut, kata Hasan, ia pun ditawari sebuah tanah di desa Gunung Manik, Kecamatan Tanjungsari, Sumedang. Hingga akhirnya berdirilah sebuah bangunan diatas tanah seluas tujuh tumbak kala itu. ""Saya masih ingat awal mula saya beli di sini itu tujuh tumbak saja,"" terangnya. Dari tanah seluas 7 tumbak itulah, ia bersama istrinya kala itu mendirikan sebuah pesantren dan rumah panti asuhan. Disela rencananya itu, orang timur yang telah ada di pulau Jawa sebelumnya, turut ikut berkumpul di tempat itu dan memberikan ide agar mendirikan sebuah yayasan pendidikan. ""Mahasiswa-mahasiswa yang sebelumnya sudah ada di pulau Jawa ngasih ide, kenapa tidak bikin yayasan pendidikan saja agar menjadi wadah bagi orang Timor timur kala itu yang memilih masuk Indonesia,"" ungkapnya. Akhirnya, yayasan yang diberinya nama Lemorai atau Para Perantau pun terbentuk. Yayasan itu saat ini menaungi pesantren Al Yaqin dan rumah panti asuhan Latiful Muhtadin. ""Jadi pesantren Al Yaqin dan rumah panti asuhan, sekaramg semuanya ada dibawah naungan Yayasan Lemorai,"" kata Hasan. Sejak berdiri tahun 1999, Yayasan Lemorai telah membantu pendidikan agama Islam dan memberi tempat tinggal khususnya bagi ratusan anak-anak kurang mampu yang berasal dari Timor Timur dulu. ""Awal-awal jumlah anak yang belajar agama disini ada 123 orang, mereka semua anak-anak dari Timor timur setelah pecah orang tuanya menitipkannya kepada kami,"" terang Hasan. Hasan mengatakan, sistem pendidikan di tempatnya, yakni khusus belajar agama seperti Tahfiz, Hadits, Fiqih ,Bahasa Arab, Bahasa Inggris dan Tafsir Al-Qur'an. Sementara untuk pendidikam formal, para santri bersekolah di sekolah formal pada umumnya di sekitar yayasan. ""Jadi disini mereka khusus tinggal dan belajar ngaji, sementara untuk sekolah formal mereka keluar,"" katanya. Hasan melanjutkan, sistem kekeluargaan sangat diterapkan di Yayasan Lemorai, dimana bagi mereka yang telah lulus di perguruan tinggi diharuskan menyumbangkan sedikit ilmunya di yayasan tersebut. ""Jadi mereka yang pernah tinggal disini dan lulus menjadi sarjana, nantinya ikut menyumbangkan ilmunya untuk mengajar disini,begitu seterusnya,"" kata dia. Tahun 2021 ini, santri di rumah tahfiz dan panti asuhannya berjumlah 84 orang. Santri yang ada pun kini bukan hanya dari orang-orang Indonesia bagian timur saja tapi juga ada anak-anak dari daerah lainnya. Seperti Femi Alfiah Firdaus yang berasal dari Rancaekek, Kabupaten Sumedang. Ia tinggal di Ponpes Al Yakin, selain belajar agama juga diberikan kesempatan untuk kuliah gratis. ""Alhamdulillah, selain bisa belajar agama juga saya bisa kuliah gratis,"" ungkapnya yang kini menjadi mahasiswa dari Universitas Al Ghifari Bandung. Selain Femi, ada juga Sudirman yang merupakan keturunan dari Timor Leste. Ia sengaja tinggal di Panti asuhan untuk mendapatkan kesempatan pendidikan. ""Saya ingin belajar disini,"" ucapnya. Salah satu pengajar, Dian Sofia Angle Freitas mengatakan, pondok Al Yaqin baginya sebagai miniatur Indonesia dengan latar belakang berbeda-beda mulai dari suku, budaya, bahasa dan adat. ""Di sini kita bisa belajar saling mengenal satu sama lain dan saling belajar satu sama lain,"" pungkasnya.",Mengenal Pesantren Al Yaqin Sumedang yang Lahir dari Konflik Timor Timur 99,bantuanpanti,https://news.detik.com/berita-jawa-barat/d-5779867/mengenal-pesantren-al-yaqin-sumedang-yang-lahir-dari-konflik-timor-timur-99?single=1,"Minggu, 24 Okt 2021 08:35 WIB"
"Menteri Badan Usaha Milik Negara (BUMN), Erick Thohir mengunjungi komunitas binaan IndiHome di Papua, baik yang bergerak di bidang seni, budaya, dan pendidikan. Ia didampingi Direktur Consumer Service PT Telkom Indonesia (Persero), Venusiana yang sempat berbincang dengan beberapa komunitas tersebut. ""Sebagai #InternetnyaIndonesia, IndiHome berkomitmen bukan hanya mewujudkan pemerataan konektivitas digital dari Aceh sampai Papua, tetapi kami juga bertekad menyambung kebahagiaan dan menghadirkan solusi nyata bagi masyarakat Papua melalui platform dan layanan digital terbaik,"" ungkap Venusiana dalam keterangan tertulis, Selasa (5/10/2021). Hal itu diungkapkanya saat menyambut kedatangan Erick di Jayapura, Papua belum lama ini. Erick dan Venusiana berbincang santai dengan Mama Ibo, pendiri Batik Papua 'Pondok Putri Dobonsolo' yang menceritakan proses seni ukir batik Papua yang terinspirasi dari batik di Pulau Jawa. Menurut Mama Ibo, keunikan dari Batik Papua ada pada ukiran yang khas dengan ikon Papua, seperti Burung Cenderawasih. Mama Ibo juga menjelaskan bahwa kehadiran IndiHome sangat berarti baginya. Komunitas binaan IndiHome lain yang dikunjungi adalah Bengkel Tifa yang berperan penting menjaga tradisi alat musik khas Papua 'Tifa'. Menurut Denis Koibur, pendiri Bengkel Tifa, selain alat musik Tifa, Bengkel Tifa juga membuat Wai Ron yaitu perahu tradisional suku Biak yang digunakan oleh nenek moyang suku Biak untuk berlayar menelusuri samudra. Wai Ron juga digunakan untuk mengikuti Festival Perahu Perang di Samarai Papua Nugini. Bagi Suku Biak, perahu Wai Ron adalah lambang sakral kebudayaan suku Biak, termasuk tato di wajah menjadi bagian dari ciri khas suku Biak Papua. Di sinilah peran Bengkel Tifa yang dinakhodai Denis.  Selanjutnya di bidang pendidikan, Erick juga menyaksikan dan mengapresiasi kontribusi IndiHome dalam mendukung kelanjutan pendidikan generasi muda Papua melalui bantuan ke Yayasan Panti Asuhan Sayap Kasih, Kampung Harapan, dan Distrik Sentani Jayapura Papua. ""Kalian adalah aset masa depan Papua, jangan takut bermimpi, saya yakin suatu hari nanti akan lahir pemimpin-pemimpin dari sini. Karena saya sendiri tidak pernah menyangka akan menjadi Menteri,"" ujarnya untuk menyemangati anak asuh binaan IndiHome di Yayasan Panti Asuhan Sayap Kasih, Jayapura Papua. Sebelumnya, dalam rangka memeriahkan pembukaan PON XX Papua 2021, IndiHome menggelar kegiatan seni musik di tujuh booth berbeda di berbagai venue PON XX. Hadir dalam kegiatan tersebut, talenta binaan IndiHome seperti Marcelina Murtya Umar, pemenang kompetisi Gita dan Nada Papua bersama IndiHome pada 30 April 2021. Acara semakin meriah, pengunjung ikut bernyanyi riang gembira menyaksikan penampilan dari Sanggar Tari Vans Palara yang berarti pencinta alam raya dengan mayoritas anggota komunitas berusia anak-anak hingga remaja. Dalam penyelenggaraan PON XX Papua 2021 ini, TelkomGroup hadir sebagai official platinum telco partner melalui penyediaan digital connecitivity, digital platform, dan digital services di berbagai venue. TelkomGroup menyediakan layanan internet dengan total bandwidth lebih dari 11,5 Gbps yang dilengkapi sistem pencadangan (backup), termasuk pengamanan pada network security. TelkomGroup menyediakan 142 IndiHome, 427 access point internet nirkabel (WiFi), 2 Satelite News Gathering dan 4 media center, yakni 1 main media center di Kota Jayapura serta 3 mini media center di Kabupaten Jayapura, Mimika, dan Merauke.",Erick Thohir Puji Komunitas Seni hingga Budaya Binaan IndiHome di Papua,bantuanpanti,https://news.detik.com/berita/d-5754529/erick-thohir-puji-komunitas-seni-hingga-budaya-binaan-indihome-di-papua?single=1,"Rabu, 06 Okt 2021 08:30 WIB"
"Majelis Ulama Indonesia (MUI) Sulawesi Selatan (Sulsel) mengeluarkan fatwa haram memberikan uang kepada   di jalanan. Menanggapi fatwa itu, Pimpinan Pusat (PP) Muhammadiyah meminta pemerintah setempat memberikan pembinaan kepada pengemis. ""Fatwa MUI Sulsel punya pesan yang kuat sehingga mengeluarkan fatwa seperti itu ya kita hormati, tetapi sebaiknya diimbangi dengan penyediaan sarannya penampungan mereka untuk dibina dan disantuni supaya mereka tidak dikhawatirkan oleh MUI Sulsel itu,"" kata Ketua PP Muhammadiyah Dadang Kahmad kepada wartawan, Senin (1/11/2021). Di pusat penampungan atau pusat rehabilitasi pengemis itu, Dandang mengusulkan agar dilakukan pembinaan untuk meningkatkan produktivitas. Dia mengatakan uang yang diberikan kepada   jalanan itu bisa dialihkan ke tempat penampungan tersebut. ""Jadi ada tempat penampungan, mereka di sana dibuat semacam pembinaan untuk berkarya untuk melakukan produktivitas apapun yang semampu mereka. Lalu mungkin sumbangan-sumbangan itu bisa disalurkan ke sana ya, ke tempat-tempat yang sudah tertampung itu,"" jelasnya. Lebih lanjut Dadang mengatakan fatwa haram memberi uang kepada   di jalanan itu harus dibarengi oleh pembinaan di panti sosial. Kepada pemerintah setempat, Dadang meminta agar panti sosial dimaksimalkan. ""Jadi memang fatwa itu memang harus dibarengi dengan tindakan mendirikan panti-panti jompo, panti-panti untuk menampung orang-orang yang miskin seperti itu, panti-panti sosial dari pemerintah maupun lembaga-lembaga masyarakat,"" sebut dia. Selain itu, memberikan perhatian kepada orang miskin, kata Dadang, adalah salah satu ajaran agama. Akan tetapi penyaluran bantuan itu harus dilakukan dengan cara yang baik. ""Saya kurang tahu kalau tentang soal fatwa ya, tapi kalau soal sosial kita harus memberikan perhatian pada orang-orang miskin dengan cara bagaimanapun juga agar mereka tidak kelaparan, tidak kesusahan, caranya seperti apa, ya cara yang diperbolehkan ajaran agama, makanya harus ditanyakan kepada kita semua, menyantuni fakir miskin adalah perintah dari agama kita, cuma jalannya yang aman, yang baik, yang tidak melahirkan eksploitasi-eksploitasi seperti yang digambarkan oleh alasan MUI Sulsel,"" ujar Dadang. MUI Sulsel sebelumnya mengeluarkan fatwa yang mengharamkan memberikan uang kepada pengemis di jalanan. MUI mengungkapkan para pengemis di jalanan merupakan hasil eksploitasi dari orang tertentu. ""Fatwa ini haram memberi peminta-peminta di jalanan atau ruang publik,"" ujar Sekretaris Umum MUI Sulsel Muammar Bakry kepada  , Senin (1/11). Fatwa yang mengharamkan memberi uang ke pengemis di jalanan itu tertuang dalam fatwa MUI Sulsel Nomor 01 Tahun 2021 tentang Eksploitasi dan Kegiatan Mengemis di Jalanan hingga Ruang Publik. Fatwa ini dirilis pada Sabtu (30/10) lalu. Muammar menjelaskan, terdapat temuan yang signifikan bahwa kebanyakan pengemis di jalanan dieksploitasi orang tertentu. ""Ini kan semacam sindikat, mengorganisir orang lain untuk melakukan kegiatan ini. Jadi biasanya pagi disebar, sore dijemput lagi,"" ungkap dia.","Fatwa Haram MUI Sulsel, Muhammadiyah Minta Pengemis Dibina",bantuanpanti,https://news.detik.com/berita/d-5792863/fatwa-haram-mui-sulsel-muhammadiyah-minta-pengemis-dibina?single=1,"Selasa, 02 Nov 2021 08:57 WIB"
"Sejumlah bantuan mengalir untuk   (66), nenek asal Magelang, Jateng, yang diserahkan tiga anaknya ke Griya Lansia Husnul Khatimah. Bantuan itu datang dari kementerian sosial, komunitas di Malang dan beberapa warga. Bantuan itu ada yang berupa sembako dan uang tunai. Khalayak umum yang mendengar kisah Trimah pun bisa dipastikan meneteskan air mata. Meski ada pro kontra soal penitipan di panti jompo, namun mereka kebanyakan tidak tega melihat nenek 8 cucu itu dititipkan ke panti jompo dengan alasan kesibukan anak-anaknya. ""Alhamdulillah, ada dari Kementerian Sosial, pribadi dan komunitas. Mereka membantu karena melihat kondisi Bu Trimah,"" beber Ketua Yayasan Griya Lansia Husnul Khatimah, Arief Camra kepada detikcom, Rabu (3/11/2021). Griya Lansia sendiri, jelas dia, berkomitmen akan merawat Trimah dengan baik. Selain itu bantuan ini juga untuk lansia-lansia lain dan kegiatan spiritual keagamaan yang dilakukan bersama para lansia lain. ""Kami akan merawat dengan baik, tidak ada perbedaan dan tentunya untuk semua lansia di sini,"" ujar Arief. Penanggungjawab  , Nur Hadi Rahmat mengungkapkan, awal mula Griya Lansia ini dibangun karena keprihatinan pengurus yang kerap kali menemukan beberapa lansia tak terurus. Para lansia ini kebanyakan terlantar di beberapa tempat. Mulai jembatan, terminal, bahkan ada yang membusuk meninggal, karena tak terurus. ""Temuan kami banyak lansia terlantar tidak terurus, ada yang meninggal tidak terurus, ada yang sampai membusuk di jembatan, di terminal, kan ada. Terus kami punya inisiatif membangun griya lansia ini,"" cerita Nur Hadi Rahmat kepada wartawan. Pembangunan lokasi ini digagas Ketua Yayasan Griya Lansia Husnul Khatimah, Arief Camra tahun 2019 lalu. Namun panti ini baru diisi lansia dengan kapasitas banyak pada 2021 lalu. ""Penggagasnya Pak Arief sudah menggerakkan sahabat yatim dhuafa relawannya banyak. Berdiri tahun 2019 mulai awal kita membeli tanah pondasi 2019, baru bisa terwujud 2021. Mulai 2019 itu sudah ada (lansia yang dirawat) dari desa sini sendiri, satu orang. Tapi masih bedeng, satu ruangan,"" tutur Nur Hadi. Karena lokasi ruangan yang digunakan berada di depan dan jaraknya dengan kamar mandi jauh, pengurus berinisiatif membuatkan kamar yang lebih dekat untuk menampung   tersebut, bersama perawatnya. Hal ini untuk memudahkan lansia itu sendiri dan perawatnya. Pembangunan Griya Lansia dimulai hingga akhirnya selesai pada awal 2021 lalu. Tercatat tiga lembaga donatur turut mengembangkan bangunan  . Mulai Nurul Hayat, Sahabat Yatim Dhuafa dan Galena. ""Biaya pembangunan dari ketiganya, tiga lembaga ini yang mempromotorinya. Saat ini total ada 18 kamar, plus tiga bangsal, kapasitas maksimal 60 orang lansia. Ini sudah penuh. Ada yang meninggal kemarin sudah ada yang mau masuk,"" paparnya. Dia menambahkan, para penghuni panti ini berasal dari berbagai macam latar belakang. Mulai dari para gelandangan, lansia yang terlantar tak mampu, yang diserahkan para relawan dari seluruh Indonesia. ""Harus terlantar, atau kalau tidak, ditelantarkan sama keluarganya, terus bukan ODGJ (Orang Dengan Gangguan Jiwa), dan panti kami bukan panti komersial gratis 100 persen,"" ungkapnya. ""Pengiriman sekaligus penyerahan lansia harus ada surat keterangan RT/RW setempat bahwa benar-benar terlantar. Kiriman dari dinsos berbagai daerah, Jombang, Kediri, Tuban, Tulungagung, hampir merata kalau Jawa Timur,"" sambungnya. Untuk merawat 60 lansia pengasuh mengandalkan empat perawat panti. Mereka bertugas merawat para lansia. Mulai menyuapi mereka yang tidak bisa makan, mengganti pampers, hingga memandikan. ""Empat orang bertanggungjawab ke 60, orang. Semuanya yang merawat empat orang itu, sebenarnya ya kurang, tapi ya sulit untuk mencari. Sering ada yang mau masuk begitu langsung mundur, kita memang kurang untuk tenaganya,"" terangnya. Saat detikcom bertandang, sejumlah pekerja tengah sibuk menyelesaikan pembangunan masjid di halaman depan. Lokasi masjid dengan tempat perawatan  hanya dibatasi pagar besi dengan tinggi kurang dari 2 meter. Terpasang banner pada pagar 'Selamat Datang di Griya Lansia Husnul Khatimah Destinasi Wisata Hati Sesungguhnya'. Tempat perawatan dibagi menjadi dua bagian, yakni blok A dan blok B, posisinya berhadapan dengan bagian tengah yang dibuat sebagai ruang terbuka. Bangunan Griya Lansia ini terlihat cukup bersih dan rapi, struktur bangunannya layaknya asrama yang terdiri puluhan kamar yang mampu menampung hingga maksimal 60 lansia. Satu ruangan kamar diisi jumlah penghuni yang berbeda, tergantung luas kamar. Minimal per ruang kamar diisi dua orang. Terbanyak ada yang diisi 5 lansia. Untuk jenis kelamin lansia laki-laki dan perempuan dipisahkan. Semua kamar-kamar menghadap ke taman yang ada di depannya. Bangunan ini membentuk huruf U yang mengelilingi taman kecil, sekaligus digunakan untuk keperluan menjemur pakaian. Tak hanya ruangan saja, ada juga dapur yang digunakan memasak kebutuhan makanan para  , beberapa kamar mandi, kamar petugas perawat dan penjaga panti lansia.",Bantuan Mengalir untuk Trimah-Lansia Griya Lansia Husnul Khatimah Malang,bantuanpanti,https://news.detik.com/berita-jawa-timur/d-5794528/bantuan-mengalir-untuk-trimah-lansia-griya-lansia-husnul-khatimah-malang?single=1,"Rabu, 03 Nov 2021 08:44 WIB"
