artikel,judul,keyword,link,tanggal
"pemerintah demi mencegah meningkatnya mobilitas masyarakat pada akhir tahun. Dengan demikian, risiko penyebaran COVID-19 dapat dicegah agar tak sampai menimbulkan gelombang ketiga Corona. Cuti bersama 24 Desember 2021 dihapus sesuai dengan Surat Keputusan Bersama (SKB) Menteri Agama, Menteri Ketenagakerjaan, Menteri Pendayagunaan Aparatur Negara dan Reformasi Birokrasi SKB Tiga Menteri Nomor 712 Tahun 2021, Nomor 1 Tahun 2021, serta Nomor 3 Tahun 2021 tentang Hari libur Nasional dan Cuti Bersama 2021. Lalu kenapa cuti bersama dihapus? Berikut penjelasannya. Informasi soal cuti bersama dihapus sudah disampaikan Menko PKM Muhadjir Effendy pada 18 Juni 2021. Ada pula dua libur nasional lainnya yang mengalami pergeseran lantaran 'kejepit' pada akhir pekan. ""Pemerintah memutuskan mengubah dua hari libur nasional dan meniadakan satu hari libur cuti bersama,"" ucap Menteri Koordinator Bidang Pembangunan Manusia dan Kebudayaan (PMK) Muhadjir Effendy dalam konferensi pers kala itu. Untuk diketahui, tanggal 25 Desember dan 1 Januari 2022 sama-sama berada di hari Sabtu. Dengan dihapusnya cuti bersama 24 Desember, pemerintah hendak mencegah peningkatan mobilitas masyarakat, di mana dikhawatirkan banyak orang yang mengambil libur panjang hingga perayaan tahun baru 2022. Dalam SKB 3 Menteri, tercantum bahwa kini cuti bersama Natal 2021 ditiadakan. Ini daftar hari libur dan cuti bersama 2021 yang terbaru sesuai SKB 3 Menteri: 1. Jumat, 1 Januari: Tahun Baru 2021 Masehi 2. Jumat, 12 Februari: Tahun Baru Imlek 2572 Kongzili 3. Kamis, 11 Maret: Isra Mikraj Nabi Muhammad SAW 4. Minggu, 14 Maret: Hari Suci Nyepi Tahun Baru Saka 1943 5. Jumat, 2 April: Wafat Isa Al Masih 6. Sabtu, 1 Mei: Hari Buruh Internasional 7. Kamis, 13 Mei: Kenaikan Isa Al Masih sekaligus Hari Raya Idul Fitri 1442 Hijriah 8. Jumat, 14 Mei: Hari Raya Idul Fitri 1442 Hijriah 9. Rabu, 26 Mei: Hari Raya Waisak 2565 10. Selasa, 1 Juni: Hari Lahir Pancasila 11. Selasa, 20 Juli: Hari Raya Idul Adha 1442 Hijriah 12. Rabu, 11 Agustus: Tahun Baru Islam 1443 Hijriah (diubah) 13. Selasa, 17 Agustus: Hari Kemerdekaan Republik Indonesia 14. Rabu, 19 Oktober: Maulid Nabi Muhammad SAW (diubah) 15. Sabtu, 25 Desember: Hari Raya Natal Cuti bersama 1. Rabu, 12 Mei: Hari Raya Idul Fitri 1442 Hijriah Sementara itu, SKB 3 Menteri soal libur 2022 sudah diterbitkan. Berikut daftar hari libur nasional 2022 sesuai SKB 3 Menteri Nomor 963 Tahun 2021, Nomor 3 Tahun 2021 dan Nomor 4 Tahun 2021 tentang Hari Libur Nasional dan Cuti Bersama 2022. Berikut 16 hari yang ditetapkan sebagai tanggal merah dalam kalender 2022: Cuti bersama dihapus dan kini pemerintah juga akan mengetatkan aturan di masa Natal dan tahun baru (nataru). Menko Muhadjir juga meminta masyarakat tidak membuat rencana bepergian jauh di masa tersebut. ""Kita matangkan aturannya dulu. Pokoknya sementara sekarang jangan ada yang punya rencana mudik. Jadi nggak usah beli tiket dulu, nggak usah merancang dulu untuk bepergian jarak jauh,"" kata Muhadjir di Balai Kota Solo, Rabu (27/10/2021). Muhadjir menyebut pemerintah tidak ingin terjadi gelombang ketiga virus Corona atau COVID-19 setelah libur panjang akhir tahun. Dia mengambil contoh beberapa negara yang saat ini dilanda lonjakan jumlah kasus COVID-19. ""Sekarang kan Eropa hampir semua negara mengalami kenaikan yang drastis, Amerika Selatan, tetangga kita Singapura yang kemarin katanya paling hebat menangani COVID tapi sekarang justru mengalami keparahan, Jepang juga, Korsel juga. Karena itu, kita tidak boleh main-main ini dengan kondisi kita ini, kemudian menganggap remeh,"" tuturnya. Meski aturan masih dimatangkan, Muhadjir mengatakan ada kemungkinan pemerintah akan membuat aturan seperti tahun lalu demi masyarakat. ""Kemungkinan akan kita atur ketat seperti tahun lalu, terutama jangan dicurigai macam-macam. Ini demi keselamatan dan kemaslahatan rakyat Indonesia semua,"" ujarnya.","Cuti Bersama Dihapus, Tanggal Merah Natal-Tahun Baru Jatuh di Hari Sabtu",iduladha,https://news.detik.com/berita/d-5784819/cuti-bersama-dihapus-tanggal-merah-natal-tahun-baru-jatuh-di-hari-sabtu?single=1,"Rabu, 27 Okt 2021 14:04 WIB"
"Polisi masih mengulik jejak pembunuh Tuti Suhartini dan anaknya Amalia Mustika Ratu. Makam kedua warga tersebut pun dibongkar untuk menelisik lebih lanjut misteri kematian ibu dan anak tersebut. Lalu apa hasil autopsi ulang polisi ? Sementara itu puluhan sopir angkot elf di Cianjur mogok karena merasa dirugikan oleh travel gelap. Bagaimana ceritanya? Sejumlah peristiwa menarik lainnya terjadi di Jabar hari ini, berikut ulasannya: Sebulan lebih kasus belum terungkap, polisi membongkar makam Tuti Suhartini (55) dan anak Amalia Mustika Ratu alias Amel (23) di Subang, Jawa Barat, Sabtu (2/10). Kedua jenazah diangkat dari liang lahat dan dilakukan autopsi ulang di tempat oleh tim penyidik gabungan. Polisi enggan mengungkap hasil autopsi ulang jenazah ibu-anak korban pembunuhan sadis itu. Autopsi dilakukan untuk mengecek korban dibunuh dengan senjata tajam atau bukan. Selain itu, polisi menelusuri kembali jejak waktu pelaku menghabisi korban. ""Hasil autopsi itu langsung dikirimkan kepada penyidik, jadi kita tidak sembarangan, karena kita minta itu penyidik dari Polres Subang, dari hasil autopsi itu nanti dilaporkan ke penyidik untuk dievaluasi kembali,"" ucap Kabid Humas Polda Jabar Kombes Erdi A Chaniago di Mapolda Jabar, Jalan Soekarno Hatta, Kota Bandung, Rabu (6/10/2021). Erdi menuturkan autopsi ulang dilakukan oleh penyidik untuk mencari kesesuaian dengan bukti dan petunjuk baru yang dimiliki penyidik. Polisi juga ingin mencari tahu penyebab kematian dari ibu-anak tersebut. ""Kita melihat lagi kesesuaian. Apakah penyebab kematiannya kedua korban tersebut dibunuh, apakah melakukan perlawanan, apakah kemudian untuk menentukan waktu kematiannya? Kita cari kesesuaian kembali,"" ujarnya. ""Sehingga setelah melihat hasil autopsi tersebut, di antaranya juga mengenai alat yang digunakan. Apakah tumpul atau tajam?"" kataErdi menambahkan. Puluhan angkutan umum elf di Cianjur menggelar aksi mogok memprotes keberadaan travel gelap yang makin marak. Pasalnya keberadaan travel gelap membuat angkutan elf sepi penumpang. Bahkan travel gelap semakin aktif beroperasi usai memiliki legalitas atau berbadan hukum. Ade Ruslan, sopir elf, mengatakan para sopir sudah geram dengan maraknya travel gelap. Sebelumnya travel gelap hanya beroperasi saat momen mudik lebaran, namun kini di hari biasa pun juga beroperasi. ""Jadi sekarang juga terus beroperasi, tidak hanya di momen mudik lebaran Idul Fitri atau Idul Adha. Setiap hari mereka naik-turunkan penumpang,"" ujar dia saat ditemui di Terminal Pasirhayam, Rabu (6/10/2021). Menurutnya para sopir sudah beberapa kali melakukan protes, namun tidak ada tindakan dari Dinas Perhubungan atau pihak terkait. ""Sudah bosan protes, mulai dari audiensi hingga mogok beroperasi. Janjinya mau ditindak atau ditertibkan, tapi nyatanya sekarang tetap beroperasi. Bahkan informasinya mereka ada yang berbadan hukum, jadi merasa bebas untuk mengangkut penumpang,"" kata dia. Ade menegaskan para sopir akan terus mogok jika masalah tersebut tak kunjung selesai.""Kalau tidak kunjung ada solusi, kami akan terus mogok,"" tegasnya. ""Percuma mau beroperasi juga, penumpang tidak ada. Semuanya diambil oleh travel gelap. Percuma ada trayek, karena travel gelap bebas kemana saja,"" tambahnya. Senada, Pian, sopir trayek Cianjur-Agrabinta, mengatakan sejak maraknya travel gelap, setiap beroperasi angkutan elf hanya mendapat satu atau dua penumpang. ""Paling banyak empat penumpang. Sering nya paling hanya dua penumpang. Mau dapat penghasilan dari mana dengan penumpang yang hanya segitu. Jangankan untuk keluarga, untuk bensin saja kurang,"" ucapnya. Dia berharapDishub bisa bertindak tegas terkait maraknya travel gelap. ""Kalau dibiarkan terus, angkutan elf bisa mati,""pungkasnya. Polisi menetapkan tujuh tersangka terkait peristiwa bentrokan maut di lahan tebu perbatasan antara Kabupaten Indramayu dan Majalengka yang menewaskan dua petani. Para tersangka itu merupakan pentolan dan anggota Forum Komunikasi Masyarakat Indramayu Selatan (F-Kamis). ""Di waktu sesaat setelah kejadian kita langsung mengamankan anggota F-Kamis dan pemeriksaan terhadap 26 orang. Kita tetapkan tujuh tersangka, salah satunya ketua F-Kamis,"" kata Kapolres Indramayu AKBP M Lukman Syarif kepada awak media saat jumpa pers di Mapolres Indramayu, Jawa Barat, Rabu (6/10/2021). Lukman mengatakan konflik lahan garapan tebu di wilayah PG Jatitujuh terjadi selama bertahun-tahun. Menurutnya, F-Kamis selama ini terus memprovokasi masyarakat dan petani untuk mempertahankan lahan garapan secara sepihak, dalam artian enggan bermitra dengan PG Jatitujuh. ""Kita laksanakan tindakan tegas. Tidak ada premanisme, intimidasi dan pemerasan terhadap masyarakat kecil. Sebetulnya petani ingin bermitra,"" ucap Lukman. Sekadar diketahui, ketua F-Kamis merupakan salah seorang anggota DPRD Kabupaten Indramayu dari Partai Demokrat yang berinisial T. Dari hasil pemeriksaan polisi, T diduga terlibat dalam memprovokasi petani. ""Ketua F-Kamis ini perannya menggerakkan, menghasut dan melawan petani yang menggarap atau menjadi mitra (PG Jatitujuh),"" kata Lukman. Selain memprovokasi petani yang bentrok. Lukman menambahkan F-Kamis juga berperan dalam provokasi terhadap kepolisian. ""Beberapa hari lalu kita lakukan penindakan dan dihadang orang-orang yang bawa senjata tajam (sajam),"" kata Lukman. Sebelumnya, ketua F-Kamis yang diamankan kepolisian merupakan anggota DPRD Kabupaten Indramayu dari Partai Demokrat. DPC Partai Demokrat Indramayu mengaku telah menyiapkan langkah-langkah terkait kadernya yang diduga terlibat dalam konflik petani tebu itu. Ketua Badan Penelitian dan Pengembangan (Balitbang) DPC Partai Demokrat Harris Solihin partainya masih menyelidiki keterlibatan T selaku Ketua F-Kamis dalam peristiwa bentrok yang menewaskan dua petani itu. ""Menurut penjelasannya, dia sebagai ketua F-Kamis. Tetapi itu di luar dari organisasi kami (partai),"" kata Harris saat jumpa pers di kantorDPRD KabupatenIndramayu, Jawa Barat, Selasa (5/10/2021). Pertokoan di Kawasan Kanis, Jalan RE Martadinata, Kabupaten Ciamis, Jawa Barat, hangus terbakar, Rabu (6/10/2021). Dalam peristiwa tersebut 2 orang meninggal dunia dan 1 orang mengalami luka-luka. Ada 3 toko yang sudah terbakar, yakni toko tembakau (bako), toko donat dan kios makanan. Sampai pukul 18.30 WIB, petugas pemadam kebakaran dari Ciamis dibantu dari Tasikmalaya masih melakukan pendinginan karena api di bagian dalam pertokoan masih menyala. Wakil Bupati Ciamis Yana D Putra meninjau langsung ke lokasi kebakaran. Yana menjelaskan semua armada Damkar Ciamis dan tangki pengisi air dikerahkan. Dibantu dari PDAM, kepolisian dan pihak lainnya termasuk bantuan dari Damkar Kota Tasikmalaya. ""Api masih menyala di bagian dalam, sekarang masih melakukan pemadaman. Semua damkar kita kerahkan. Dari kejadian ini sementara ada 2 korban meninggal dunia dan 1 orang luka-luka. Sudah dievakuasi,"" ujar Yana. Yana menyatakan belum mengetahui pasti penyebab kebakaran tersebut. Pihaknya akan melakukan identifikasi terkait asal api yang membakar sejumlah pertokoan di Ciamis. ""Kita akan cari tahu penyebab kebakaran,"" katanya. Diketahu di belakang pertokoan tersebut adalah rumah. Korban meninggal diduga terjebak api dan yang sedang sakit sehingga tidak bisa menyelamatkan diri. Sementara itu Soni, seorang anggota keluarga pemilik toko mengatakan berdasarkan keterangan dari adik iparnya api diduga dari kompor minyak yang lupa dimatikan oleh pegawai. ""Saya tanya ke adik ipar, katanya kompor lupa dimatikan. Pegawai pulang sore. Yang ada di rumah tidak mengetahui, saat tau api sudah membesar. Maunolong tidak sempat. Tadi tiga orang di dalam,"" ujarnya. Ustaz Solmed mengadukan ke polisi terkait pencemaran nama baik oleh panitia pengajian di Garut ke Polda Jabar. Polisi akan menindaklanjuti pengaduan itu. ""Ya jadi memang yang bersangkutan 5 Oktober kemarin dia datang dan melapor dalam bentuk surat pengaduan,"" ucap Kabid Humas Polda Jabar Kombes Erdi A Chaniago saat dikonfirmasi, Rabu (6/10/2021). Aduan tersebut berkaitan dengan pencemaran nama baik yang dilakukan Tisna dan Suwarna. Menurut Erdi, pengaduan itu akan ditindaklanjuti oleh tim Direktorat Reserse Kriminal Khusus Polda Jabar. ""Nanti pengaduan tersebut, ini kan bahan dalam rangka penyelidikan. Tentunya surat pengaduan tersebut akan dipelajari oleh Direktorat Kriminal Khusus terkait permasalahan yang dilaporkan oleh ustaz Solmed,"" tutur Erdi. ""Setelah dipelajari, kemudian ada beberapa hal yang akan dilakukan, yaitu dengan memanggil saksinya dalam rangka penyelidikan ya,"" kata Erdi menambahkan. Sebelumnya, ustaz Solmed dituduh oleh Suwarna telah melanggar perjanjian dalam ceramah. Ia membatalkan sepihak, padahal sudah menerima uang Rp 8 juta. Ustaz Solmed pun membantahnya Ustaz Solmed tidak datang ke acara pengajian di Kampung Cisamak, Desa Cisewu, Kecamatan Cisewu, Kabupaten Garut, Jawa Barat karena mendapatkan halangan di jalan. Akses menuju kampung tersebut tertutup imbas longsor. Semula acara pengajian itu di Pangalengan, Bandung, Jawa Barat.",Jabar Hari Ini: Anggota DPRD Tersangka Bentrokan Maut-Sopir Elf Mogok,iduladha,https://news.detik.com/berita-jawa-barat/d-5756042/jabar-hari-ini-anggota-dprd-tersangka-bentrokan-maut-sopir-elf-mogok?single=1,"Rabu, 06 Okt 2021 21:15 WIB"
"Hari  digeser pemerintah dari 19 Oktober menjadi 20 Oktober 2021. Ada alasan kenapa pemerintah menggeser hari libur. Kebijakan ini diambil sebagai langkah antisipasi munculnya kasus baru Covid-19. ""Sebagai antisipasi munculnya kasus baru Covid-19, hari libur Maulid Nabi digeser 20 Oktober 2021,"" tegas Dirjen Bimas Islam Kamaruddin Amin di situs Kementerian Agama seperti dikutip, Selasa (12/10/2021). Kamaruddin Amin menegaskan, bahwa Maulid Nabi Muhammad Saw tidak berubah, tetap 12 Rabiul Awal. Hanya, hari libur dalam rangka memperingatinya yang digeser. ""Maulid Nabi Muhammad Saw tetap 12 Rabiul Awal. Tahun ini bertepatan 19 Oktober 2021 M.  yang digeser menjadi 20 Oktober 2021 M,"" paparnya. Perubahan   ini tertuang dalam Keputusan bersama Menag, Menaker, dan Menpan RB No 712, 1, dan 3 tahun 2021 tentang Perubahan Kedua atas Keputusan Bersama Menag, Menaker, Menpan dan RB No 642, 4, dan 4 tahun 2020 tentang Hari Libur Nasional dan Cuti Bersama. Sebelumnya, perubahan juga dilakukan pada hari libur peringatan Tahun Baru Hijriyah. Tahun barunya tetap 1 Muharram 1443 H, bertepatan 10 Agustus 2021. Namun, hari libur dalam rangka memperingatinya digeser menjadi 11 Agustus 2021. ""Perubahan juga terjadi terkait cuti bersama dalam rangka Hari Raya Natal yang awalnya ditetapkan pada 24 Desember, akhirnya diputuskan untuk ditiadakan,"" tandasnya. Menteri Agama Yaqut Cholil Qoumas menambahkan, perubahan mempertimbangkan kondisi dan situasi COVID-19. Hari Libur Nasional dan Cuti 2022 Sementara itu ke depan, Kemenag bersama dua Menteri lainnya bakal menentukan cuti bersama 2022 setelah menetapkan tanggal hari libur nasional 2022 pada bulan September lalu. Untuk pelaksanaan cuti bersama tahun 2022 akan ditetapkan kemudian dengan mempertimbangkan kondisi pandemi COVID-19. 1 Januari Tahun Baru 2022 Masehi 1 Februari Tahun Baru Imlek 2573 Kongzili 28 Februari Isra Mikraj Nabi Muhammad SAW 3 Maret Hari Suci Nyepi Tahun Baru Saka 1944 15 April Wafat Isa Al Masih 1 Mei Hari Buruh Internasional 2-3 Mei Hari Raya Idul Fitri 1443 Hijriyah 16 Mei Hari Raya Waisak 2566 BE 26 Mei Kenaikan Isa Al Masih 1 Juni Hari Lahir Pancasila 9 Juli Hari Raya Idul Adha 1443 Hijriyah 30 Juli Tahun Baru Islam 1444 Hijriyah 17 Agustus Hari Kemerdekaan RI 8 Oktober Maulid Nabi Muhammad SAW 25 Desember Hari Raya Natal","Libur Maulid Nabi 2021 Digeser Sehari, Ini Jadwalnya",iduladha,https://travel.detik.com/travel-news/d-5763526/libur-maulid-nabi-2021-digeser-sehari-ini-jadwalnya?single=1,"Selasa, 12 Okt 2021 14:20 WIB"
"Jarang tampil di televisi,   ternyata punya bisnis sampingan. Turun tangan merawat sapinya sendiri, dirinya sukses menuai keuntungan dari menjadi juragan sapi. Akhir-akhir ini banyak selebriti yang memiliki bisnis sampingan sebagai penghasilan tambahan selain dari pekerjaannya di dunia hiburan. Mulai dari yang memiliki perkebunan luas hingga beternak hewan-hewan seperti kambing dan sapi. Tidak sedikit dari para selebriti ini yang kemudian berhasil menjalankan bisnis sampingannya tersebut. Bahkan sebagian dari mereka kini telah secara penuh pensiun dari pekerjaannya di dunia hiburan. Ada Narji 'Cagur', Akri 'Patrio' bahkan mantan pemeran Wiro Sableng, Kenken Sukendro diketahui berhasil dengan bisnis sampingan yang mereka jalani. Aktor lawas yang identik dengan tubuhnya yang mungil ternyata juga tak lepas dari memiliki usaha sampingan. Adalah Ucok Baba, aktor ternama Indonesia yang ternyata memiliki bisnis peternakan sapi. Melalui akun YouTube pribadinya @Ucok Baba Official, Ucok Baba membagikan salah satu momennya saat mengurus sapi-sapi di lapaknya. Ia mengaku bahwa kegiatannya menjadi juragan sapi ini akan sibuk saat Idul Adha atau waktu ibadah qurban menjelang. Dalam unggahannya tersebut,   memperlihatkan dirinya sendiri yang ikut turun tangan dalam mengurus lapak sapinya. Mulai dari menyiapkan banner untuk lapaknya hingga memeriksa kesehatan sapi-sapi yang datang sebelum dijual satu persatu. ""Pertama kali harus ikat dulu talinya dan tegakkan kepalanya. Jadi kalau sudah hadap ke atas, tubuhnya kita lihat, di mana kekurangannya. Lihat tubuhnya, bobot badannya, kaki-kakinya, bagian belakang dan semuanya. Makanya di sini sebelum dibeli kita akan tunjukkin dulu kepada pembeli kalau sapinya ini sehat,"" kata Ucok Baba. Sekali datang, sapi yang dijajakan di lapak milik Ucok Baba bisa berjumlah hingga 20 ekor. Tidak hanya sapi, kambing pun juga disediakan oleh Ucok Baba untuk memenuhi kebutuhan dan keinginan pembeli. Untuk memastikan kesehatan sapinya sudah sesuai standar yang perlu dipenuhi, Ucok Baba juga mengakui dirinya telah berada di bawah pengawasan Kementerian Kesehatan dalam mengurus hewan-hewan ternaknya. Tubuhnya yang mungil tidak membuat Ucok Baba segan untuk ikut memeriksa sapi-sapinya yang baru saja turun dari truk-truk pengangkut. Menurut keterangan yang disampaikan oleh   juga di kandang ternaknya ini ia menyediakan beragam hewan dengan beragam jenis dan ukuran. Bukan tanpa maksud, Ucok Baba berharap seluruh hewan-hewan ternaknya ini bisa dibeli dan disesuaikan dengan kebutuhan para konsumen yang datang.",,iduladha,https://food.detik.com/info-kuliner/d-5788918/jarang-tampil-di-tv-ucok-baba-kini-sibuk-jadi-juragan-sapi?single=1,"Sabtu, 30 Okt 2021 16:00 WIB"
"Berawal dari hobi dan coba-coba, pria ini sukses  . Ia bisa menjual 1.000 ekor sapi dan mendapat omzet hingga Rp20 miliar! Memiliki hobi jika ditekuni tidak mustahil bisa mendatangkan kesuksesan dan untung yang besar. Menjalani kegiatan yang disenangi dengan penuh komitmen dan bersungguh-sungguh tidak akan menghianati hasil yang nantinya bisa didapatkan. Terus mencoba dan tidak takut gagal menjadi kunci utama jika kamu ingin mengawali sebuah bisnis yang dirintis seorang diri. Mulai dari modal yang sedikit dan terus berupaya untuk mengembangkannya bukan hal mudah yang bisa dilakukan oleh semua orang tanpa komitmen dan kemauan yang keras. Kesuksesan yang berawal dari hobi ini telah dibuktikan oleh seorang pria yang diketahui memiliki latar belakang pendidikan kehutanan. Berawal dari coba-coba merawat dua ekor sapi, siapa sangka dirinya kini justru berhasil beternak ribuan ekor sapi di kandangnya sendiri. Mengutip YouTube @kandangkuofficial (19/3), Jimmy yang merupakan lulusan dari Fakultas Kehutanan Institut Pertanian Bogor (IPB) kini tengah sibuk mengurus ribuan ekor sapi di kandangnya yang berlokasi di kawasan Bubulak, Bogor. Peternak muda yang sukses ini mengaku awalnya hanya coba-coba karena dirinya senang memelihara hewan-hewan. Dimulai sejak 2012, Jimmy merawat dua ekor sapi miliknya dengan sangat baik. Banyak hewan-hewan lain selain sapi yang juga dipelajarinya untuk diternak. Tujuh tahun berlangsung, pada tahun 2019, Jimmy tidak menyangka dirinya sukses memenuhi kandangnya dengan ribuan ekor sapi. ""Apalagi untuk momen-momen kurban, kita bisa (menjual) hingga lebih dari 1.000 ekor sendiri. Kira-kira setahun itu bisa sampe 3.000 ekor,"" kata Jimmy. Meski latar belakang pendidikannya berbeda jauh dengan pekerjaannya saat ini, Jimmy mengaku bisa sukses karena menekuni hobi. Ikan, ayam, kelinci, domba hingga sapi pernah dirawat oleh Jimmy dengan tangannya sendiri. Mulai dari mengurus pakan hingga mencari celah untuk menjual hewan ternaknya dilakukan sendiri oleh Jimmy. Untuk mengembangkan bisnis   miliknya, hanya butuh waktu satu tahun untuk bisa membuat kandang sapi berukuran besar. Kandang pertamanya sendiri ini bahkan bisa menampung 50 hingga 100 ekor sapi. Menjaga kepuasan konsumen dengan meningkatkan kualitas sapinya, momen Idul Adha menjadi kesempatan emas yang tidak pernah dilepas oleh Jimmy. Mematok harga sapi berkisar Rp16 juta hingga Rp100 juta, semua sapi-sapinya selalu laku di pasaran bahkan hingga diborong oleh penjual-penjual hewan kurban kecil yang menjadi retailernya. Tidak selalu mulus, kegagalan justru menjadi kunci utama yang membuat Jimmy sukses menjadi peternak sapi seperti saat ini. Tetapi karena dijalankan dengan sungguh-sungguh dan komitmen dirinya kini bahkan bisa meraup omzet hingga Rp20 miliar. Menjalankan usaha dengan sepenuh hati walaupun hanya merawat hewan menjadi rahasia Jimmy untuk menghasilkan sapi berkualitas tinggi. ia juga mengakui bahwa menjaga nama baik dan kepercayaan pelanggan menjadi penyelamat bisnis  nya saat terpuruk hingga berkembang pesat.",,iduladha,https://food.detik.com/info-kuliner/d-5766422/kisah-sukses-alumni-ipb-ternak-sapi-hingga-raih-omzet-rp20-miliar?single=1,"Kamis, 14 Okt 2021 15:00 WIB"
