artikel,judul,keyword,link,tanggal
"Perwakilan buruh yang melakukan aksi di depan kantor Gubernur DKI Jakarta Anies Baswedan telah menemui Kepala Dinas Tenaga Kerja, Transmigrasi, dan Energi DKI Jakarta Andri Yansyah. Mereka adalah buruh yang terafiliasi dengan Konfederasi Serikat Pekerja Indonesia (KSPI). Hari ini para buruh melakukan aksi turun ke jalan. Salah satu tuntutannya adalah meminta kenaikan Upah Minimum Kabupaten/Kota (UMK) 2022 sebesar 7-10%. Aksi diikuti oleh ratusan buruh Salah satu orator, Tri Widyanto mengatakan bahwa Gubernur DKI Jakarta berkomitmen untuk menaikkan upah minimum 2022. ""Alhamdulillah komitmen Balai Kota, disampaikan Kadisnaker bahwa UMP 2022, Gubernur berkomitmen akan tetap menaikkan UMP 22,"" kata dia menyampaikan hasil pertemuan perwakilan buruh dengan Kadisnaker DKI Jakarta, Selasa (26/10/2021). Namun, dari hasil pertemuan tersebut belum diputuskan berapa kenaikan upah minimum yang disepakati. ""Besarannya tuntutan kita adalah 10%. Nanti menurut Balai Kota selanjutnya akan melihat kajian BPS pada 5 November, dan kali ini peraturannya UMP tidak ditetapkan per 1 November tapi tanggal 19 November. Sebelum penetapan, dia (Pemprov DKI) mengundang perwakilan serikat buruh,"" ujarnya. ""Mudah-mudahan ini menjadi awal perjuangan kita terkait upaya yang kita perjuangkan,"" tambah Tri.","Digeruduk Buruh, Anies Janji Upah Minimum Tahun Depan Naik",serikatburuh,https://finance.detik.com/berita-ekonomi-bisnis/d-5783278/digeruduk-buruh-anies-janji-upah-minimum-tahun-depan-naik?single=1,"Selasa, 26 Okt 2021 14:45 WIB"
"(UI) bersama aliansi   bakal menggeruduk Istana Merdeka, Jakarta, hari ini. Mereka bakal menggelar aksi demonstrasi dalam rangka memperingati Hari Sumpah Pemuda, yang jatuh pada hari ini. ""Evaluasi untuk negara ini belum selesai. Masih banyak hal yang harus disuarakan. Momentum dua tahun Jokowi-Ma'ruf harus digunakan untuk memberi evaluasi terhadap kinerja Kabinet Indonesia Maju,"" tulis BEM UI dalam akun Instagramnya, seperti dilihat, pada Kamis (28/10/2021). Titik aksi dari BEM UI berada di Patung Kuda, Jakarta Pusat. Mereka berkumpul terlebih dahulu di kampus UI sekitar pukul 08.00 WIB. Massa dari BEM UI ini nantinya akan bergabung dengan sejumlah elemen masyarakat yang tergabung dalam Gerakan Buruh Bersama Rakyat (Gebrak). ""Dalam rangka memperingati Hari Sumpah Pemuda tahun 2021 di tengah catatan 2 tahun kepemimpinan rezim Jokowi-MA, pemerintah gagal menyejahterakan rakyat,"" kata Ketua Sentral Gerakan Buruh Nasional (SGBN) M Yahya kepada wartawan, Selasa (26/10/2021). Yahya mengungkapkan unjuk rasa itu rencananya akan digelar pada pukul 11.00-17.00 WIB. Titik kumpul demonstran berada di depan Kedutaan Besar (Kedubes) Amerika Serikat. ""Massa aksi kurang-lebih 500 orang,"" ujarnya. Sementara itu, Ketua Umum Kongres Aliansi Serikat Buruh Indonesia (Kasbi) Nining Elitos mengatakan ada sejumlah tuntutan yang diusung dalam unjuk rasa itu. Pertama, tuntutan mencabut UU Nomor 11 Tahun 2019 tentang Cipta Kerja dan berbagai aturan turunannya. Gebrak juga mendesak penghentian pemutusan hubungan kerja (PHK), setop kriminalisasi dan penangkapan aktivis, serta jaminan persamaan hak dan perlindungan bagi pekerja rumah tangga dan buruh migran. Mereka juga menuntut jaminan perlindungan bagi buruh di berbagai sektor, pengusutan korupsi di BPJS Ketenagakerjaan, pengembalian 58 orang pegawai KPK, penghentian pembungkaman dan represivitas terhadap gerakan rakyat. ""Tuntutan Gebrak itu cabut   UU Cipta Kerja beserta turunannya, hentikan pembungkaman dan represivitas terhadap gerakan rakyat, usut kasus korupsi BPJS, usut kasus korupsi bantuan sosial, setop PHK sepihak, hentikan kekerasan terhadap perempuan. Rezim Jokowi-Amin gagal sejahterakan rakyat,"" tutur Nining. Beberapa elemen masyarakat yang berencana ikut aksi di Istana pada 28 Oktober antara lain Kasbi, Konfederasi Persatuan Buruh Indonesia (KPBI), Konsorsium Pembaruan Agraria (KPA), Sentral Gerakan Buruh Nasional (SGBN), Konfederasi Serikat Nasional (KSN), Serikat Pekerja Media dan Industri Kreatif untuk Demokrasi (SINDIKASI), LBH Jakarta, YLBHI, SP-Perbankan, KPR, SEMPRO, LMND-DN, hingga GMNI-Presidium.",Mahasiswa dan Buruh Gelar Demonstrasi di Depan Istana Hari Ini,serikatburuh,https://news.detik.com/berita/d-5785924/mahasiswa-dan-buruh-gelar-demonstrasi-di-depan-istana-hari-ini?single=1,"Kamis, 28 Okt 2021 09:20 WIB"
"Badan Eksekutif Mahasiswa (BEM) Universitas Indonesia (UI) bersama sejumlah elemen masyarakat yang tergabung dalam Gerakan Buruh Bersama Rakyat (Gebrak) menggelar aksi demonstrasi memperingati Hari Sumpah Pemuda. Aksi akan berlangsung di depan Istana Negara, Jakarta, siang ini. Pantauan   Kamis (28/10/2021), pukul 11.05 WIB petugas menutup Jalan Medan Merdeka Barat. Kendaraan tidak bisa melintas menuju Istana negara dan sebaliknya. Jalan ditutup dengan barier oranye dan dijaga sejumlah aparat TNI-Polri. Kendaraan hanya bisa melintas dari Jalan Budi Kemuliaan menuju Jalan Medan Merdeka Selatan. Tampak petugas mengenakan hazmat putih berbaris di depan patung kuda. Dua mobil Barracuda polisi juga terlihat bersiaga di lokasi. Kawat berduri juga disiagakan. Sejumlah buruh mengenakan pakai merah mulai berdatangan ke lokasi. Seperti diketahui, BEM Universitas Indonesia (UI) bersama aliansi buruh bakal menggeruduk Istana Merdeka, Jakarta, hari ini. Mereka bakal menggelar aksi demonstrasi dalam rangka memperingati Hari Sumpah Pemuda, yang jatuh pada hari ini. ""Evaluasi untuk negara ini belum selesai. Masih banyak hal yang harus disuarakan. Momentum dua tahun Jokowi-Ma'ruf harus digunakan untuk memberi evaluasi terhadap kinerja Kabinet Indonesia Maju,"" tulis BEM UI dalam akun Instagramnya, seperti dilihat, pada Kamis (28/10) Titik aksi dari BEM UI berada di Patung Kuda, Jakarta Pusat. Mereka berkumpul terlebih dahulu di kampus UI sekitar pukul 08.00 WIB. Massa dari BEM UI ini nantinya akan bergabung dengan sejumlah elemen masyarakat yang tergabung dalam Gerakan Buruh Bersama Rakyat (Gebrak). Ketua Umum Kongres Aliansi Serikat Buruh Indonesia (Kasbi) Nining Elitos mengatakan ada sejumlah tuntutan yang diusung dalam unjuk rasa itu. Pertama, tuntutan mencabut UU Nomor 11 Tahun 2019 tentang Cipta Kerja dan berbagai aturan turunannya. Gebrak juga mendesak penghentian pemutusan hubungan kerja (PHK), setop kriminalisasi dan penangkapan aktivis, serta menjamin persamaan hak dan perlindungan bagi pekerja rumah tangga dan buruh migran. Mereka juga menuntut jaminan perlindungan bagi buruh di berbagai sektor, pengusutan korupsi di BPJS Ketenagakerjaan, pengembalian 58 orang pegawai KPK, penghentian pembungkaman dan represivitas terhadap gerakan rakyat. Beberapa elemen masyarakat yang berencana ikut aksi di Istana pada 28 Oktober antara lain Kasbi, Konfederasi Persatuan Buruh Indonesia (KPBI), Konsorsium Pembaruan Agraria (KPA), Sentral Gerakan Buruh Nasional (SGBN), Konfederasi Serikat Nasional (KSN), Serikat Pekerja Media dan Industri Kreatif untuk Demokrasi (SINDIKASI), LBH Jakarta, YLBHI, SP-Perbankan, KPR, SEMPRO, LMND-DN, hingga GMNI-Presidium.","Ada Demo Mahasiswa-Buruh, Jalan Medan Merdeka Barat Ditutup",serikatburuh,https://news.detik.com/berita/d-5786164/ada-demo-mahasiswa-buruh-jalan-medan-merdeka-barat-ditutup?single=1,"Kamis, 28 Okt 2021 12:01 WIB"
"Buruh yang terafiliasi dengan Konfederasi Serikat Pekerja Indonesia (KSPI) hari ini melakukan aksi turun ke jalan. Salah satu tuntutannya adalah meminta kenaikan Upah Minimum Kabupaten/Kota (UMK) 2022 sebesar 7-10%. Aksi salah satunya dilakukan di depan kantor Gubernur DKI Jakarta Anies Baswedan. Berikut fakta-faktanya: Ketua Divisi Aksi Garda Metal DKI Jakarta, Rifqi Mubarok yang melakukan orasi di atas mobil bak, menyampaikan bahwa buruh menuntut upah minimum 2022 naik karena biaya kebutuhan hidup telah meroket. ""(Kenaikan upah) itu sesuai dengan kenaikan seluruh harga kebutuhan hidup di DKI Jakarta pada saat ini. Itu sesuai melalui survei-survei pasar yang dilakukan kawan-kawan buruh,"" katanya. Dia menjelaskan mulai dari harga sembako hingga biaya pendidikan anak mengalami kenaikan. Atas dasar itu para kepala daerah diharapkan dapat membuat kebijakan yang berpihak kepada buruh, dalam hal ini menaikkan upah minimum tahun depan sesuai aspirasi buruh. ""Jangan sampai karena kamu keliru memutuskan kebijakan, banyak orang yang sengsara, banyak orang yang dimiskinkan, banyak orang yang melarat, banyak orang yang tidak mampu bertahan hidup yang akhirnya orang itu terjerumus kepada lembah kemiskinan yang lebih dalam,"" tambah Mubarok. Pantauan   di lokasi, perwakilan buruh dipersilakan masuk ke dalam kantor Anies untuk menyampaikan aspirasinya. Mereka menghadap Kepala Dinas Tenaga Kerja, Transmigrasi, dan Energi DKI Jakarta Andri Yansyah. ""Kita diminta siapkan 7 perwakilan untuk masuk ke dalam Balai Kota,"" jelas Mubarok. Para buruh berharap bahwa para kepala daerah memiliki keberanian untuk memutuskan kebijakan yang berpihak kepada kaum buruh, salah satunya mengenai upah minimum tahun depan. ""Kita harap ada hasil terbaik terkait suara buruh Jakarta. Kita harap pimpinan punya keberanian untuk memutuskan kebijakan yang berpihak kepada kita semua,"" tambah dia. Salah satu orator, Tri Widyanto mengatakan bahwa Gubernur DKI Jakarta berkomitmen untuk menaikkan upah minimum 2022. ""Alhamdulillah komitmen Balai Kota, disampaikan Kadisnaker bahwa UMP 2022, Gubernur berkomitmen akan tetap menaikkan UMP 22,"" kata dia menyampaikan hasil pertemuan perwakilan buruh dengan Kadisnaker DKI. Namun, dari hasil pertemuan tersebut belum diputuskan berapa kenaikan upah minimum yang disepakati. Setidaknya, menurut dia hari ini menjadi awal perjuangan buruh dalam menuntut kenaikan upah minimum. ""Besarannya tuntutan kita adalah 10%. Nanti menurut Balai Kota selanjutnya akan melihat kajian BPS pada 5 November, dan kali ini peraturannya UMP tidak ditetapkan per 1 November tapi tanggal 19 November. Sebelum penetapan, dia (Pemprov DKI) mengundang perwakilan serikat buruh,"" ujarnya.",3 Fakta Buruh Geruduk Kantor Anies Tuntut Upah Minimum 2022 Naik,serikatburuh,https://finance.detik.com/berita-ekonomi-bisnis/d-5783583/3-fakta-buruh-geruduk-kantor-anies-tuntut-upah-minimum-2022-naik?single=1,"Selasa, 26 Okt 2021 18:00 WIB"
"Elemen buruh dan mahasiswa dari BEM Universitas Indonesia (UI) akan menggelar aksi   hari ini. Setidaknya ada 1.000 massa buruh dan 200 massa BEM SI yang turun di aksi demonstrasi dalam rangka memperingati Hari Sumpah Pemuda, yang jatuh pada hari ini. ""Sekitar 1.000 dari Gebrak (Gerakan Buruh Bersama Rakyat). Kita koordinasi dengan mahasiswa. Ada sekitar 200 kalau yang dari BEM SI,"" kata Ketua Umum Kongres Aliansi Serikat Buruh Indonesia (Kasbi) Nining Elitos kepada  , Kamis (28/10/2021). Titik kumpul  buruh berada di depan Kedutaan Besar (Kedubes) Amerika Serikat. Mereka kemudian akan bergerak ke depan Istana, Jakarta. Sementara itu, untuk massa dari BEM SI, titik aksi berada di Patung Kuda, Jakarta Pusat. Mereka berkumpul terlebih dahulu di kampus UI. Nining mengatakan ada sejumlah tuntutan yang diusung dalam unjuk rasa itu. Pertama, tuntutan mencabut UU Nomor 11 Tahun 2019 tentang Cipta Kerja dan berbagai aturan turunannya. Gebrak juga mendesak penghentian pemutusan hubungan kerja (PHK), setop kriminalisasi dan penangkapan aktivis, serta menjamin persamaan hak dan perlindungan bagi pekerja rumah tangga dan buruh migran. Mereka juga menuntut jaminan perlindungan bagi buruh di berbagai sektor, pengusutan korupsi di BPJS Ketenagakerjaan, pengembalian 58 orang pegawai KPK, penghentian pembungkaman dan represifitas terhadap gerakan rakyat. Selain itu, Gebrak  penghentian kekerasan terhadap perempuan. ""Tuntutan Gebrak itu cabut omnibus law UU Cipta Kerja beserta turunannya, hentikan pembungkaman dan represifitas terhadap gerakan rakyat, usut kasus korupsi BPJS, usut kasus korupsi bantuan sosial, setop PHK sepihak, hentikan kekerasan terhadap perempuan. Rezim Jokowi-Amin gagal sejahterakan rakyat,"" tutur Nining. Beberapa elemen masyarakat yang berencana ikut aksi di Istana hari ini antara lain Kasbi, Konfederasi Persatuan Buruh Indonesia (KPBI), Konsorsium Pembaruan Agraria (KPA), Sentral Gerakan Buruh Nasional (SGBN), Konfederasi Serikat Nasional (KSN), Serikat Pekerja Media dan Industri Kreatif untuk Demokrasi (SINDIKASI), LBH Jakarta, YLBHI, SP-Perbankan, KPR, SEMPRO, LMND-DN, hingga GMNI-Presidium.","1.200 Massa Buruh-Mahasiswa Demo Depan Istana, Ini Tuntutannya",serikatburuh,https://news.detik.com/berita/d-5786082/1200-massa-buruh-mahasiswa-demo-depan-istana-ini-tuntutannya?single=1,"Kamis, 28 Okt 2021 11:12 WIB"
"Sejumlah elemen masyarakat yang tergabung dalam  (Gebrak) akan menggelar aksi unjuk rasa di depan   Jakarta, hari ini. Kebijakan lalu lintas pun telah disiapkan terkait demo tersebut. Dirlantas Polda Metro Jaya Kombes Sambodo Purnomo Yogo mengatakan kebijakan lalu lintas masih bersifat situasional. Sejauh ini belum ada rencana untuk melakukan penutupan jalan. ""Pengalihan arus lalin masih sebatas situasional melihat perkembangan di lapangan,"" kata Sambodo saat dihubungi, Kamis (28/10/2021). Namun, dia mengatakan, jika nantinya massa pendemo datang dalam jumlah masif, Sambodo menyebut jalan di kawasan  akan ditutup sementara. ""Kemungkinan akan ada penutupan nanti di Patung Kuda. Kemudian putaran Harmoni, kemudian di Kedubes AS, tapi lihat situasi,"" tutur Sambodo. Sejumlah elemen masyarakat yang tergabung dalam Gerakan Buruh Bersama Rakyat (Gebrak) berencana menggelar aksi unjuk rasa di Istana Negara, Jakarta. Aksi unjuk rasa itu akan digelar tepat pada Hari Sumpah Pemuda atau 28 Oktober. ""Dalam rangka memperingati Hari Sumpah Pemuda tahun 2021 di tengah catatan  , pemerintah gagal menyejahterakan rakyat,"" kata Ketua Sentral Gerakan Buruh Nasional (SGBN) M Yahya kepada wartawan, Selasa (26/10). Yahya mengungkapkan unjuk rasa itu rencananya digelar pada pukul 11.00-17.00 WIB. Titik kumpul demonstran berada di depan Kedutaan Besar (Kedubes) Amerika Serikat. Massa aksi kurang-lebih 500 orang,"" ujarnya. Sementara itu, Ketua Umum Kongres Aliansi Serikat Buruh Indonesia (Kasbi) Nining Elitos mengatakan ada sejumlah tuntutan yang diusung dalam unjuk rasa itu. Pertama, tuntutan mencabut UU Nomor 11 Tahun 2019 tentang Cipta Kerja dan berbagai aturan turunannya. Gebrak juga mendesak penghentian pemutusan hubungan kerja (PHK), setop kriminalisasi dan penangkapan aktivis, serta jaminan persamaan hak dan perlindungan bagi pekerja rumah tangga dan buruh migran. Mereka juga menuntut jaminan perlindungan bagi buruh di berbagai sektor, pengusutan korupsi di BPJS Ketenagakerjaan, pengembalian 58 orang pegawai KPK, penghentian pembungkaman dan represivitas terhadap gerakan rakyat. Selain itu, Gebrak menuntut penghentian kekerasan terhadap perempuan. ""Tuntutan Gebrak itu cabut   UU Cipta Kerja beserta turunannya, hentikan pembungkaman dan represivitas terhadap gerakan rakyat, usut kasus korupsi BPJS, usut kasus korupsi bantuan sosial, setop PHK sepihak, hentikan kekerasan terhadap perempuan. Rezim Jokowi-Amin gagal sejahterakan rakyat,"" tutur Nining. Beberapa elemen masyarakat yang berencana ikut aksi di Istana pada 28 Oktober antara lain Kasbi, Konfederasi Persatuan Buruh Indonesia (KPBI), Konsorsium Pembaruan Agraria (KPA), Sentral Gerakan Buruh Nasional (SGBN), Konfederasi Serikat Nasional (KSN), Serikat Pekerja Media dan Industri Kreatif untuk Demokrasi (SINDIKASI), LBH Jakarta, YLBHI, SP-Perbankan, KPR, SEMPRO, LMND-DN, hingga GMNI-Presidium.","Mahasiswa dan Buruh Demo Istana Hari Ini, Pengalihan Lalin Situasional",serikatburuh,https://news.detik.com/berita/d-5785953/mahasiswa-dan-buruh-demo-istana-hari-ini-pengalihan-lalin-situasional?single=1,"Kamis, 28 Okt 2021 09:30 WIB"
"Wakil Ketua DPD RI Mahyudin menggelar vaksinasi massal COVID-19 di Kalimantan Timur. Hal tersebut sesuai dengan surat nomor KP.09.00/2671/DPDRI/IX/2021 tentang Hal Penyampaian Daftar Distribusi Vaksin COVID 19 untuk Daerah Pemilihan Anggota DPD RI tertanggal 28 September 2021. Mahyudin menjelaskan surat tersebut ditujukan kepada Direktur Jenderal Pencegahan dan Pengendalian Kesehatan di Jakarta. Untuk selanjutnya diberikan dan dimanfaatkan oleh anggota DPD RI pada kegiatan vaksinasi di daerah pemilihannya. Sebagaimana diketahui, pada perpanjangan PPKM pada 21 September-4 Oktober 2021 lalu, ada dua daerah di Kalimantan Timur yang menerapkan PPKM Level 4, yakni Kota Balikpapan dan Kabupaten Kutai Kartanegara. Hal tersebut pun menjadi perhatian serius Mahyudin yang juga merupakan anggota DPD RI dari Dapil Provinsi Kalimantan Timur. Sehingga ia menggelar vaksinasi yang dimulai pada Kamis, (7/10) lalu. Ia menjelaskan kegiatan vaksinasi serempak ini dilakukan oleh anggota DPD RI di enam Kabupaten/Kota antara lain Kutim, Balikpapan, Samarinda, Kubar, Mahulu dan Bontang dengan target sebanyak 10.000 dosis vaksin selama bulan Oktober 2021. Mahyudin menjelaskan vaksinasi yang digelar pihaknya di Kota Samarinda beberapa waktu lalu tersebut menggunakan 1.500 dosis vaksin jenis Pfizer. Adapun pelaksanaan vaksinasi yang berlokasi di Jalan Mulawarman Samarinda ini bermitra dengan berbagai organisasi sosial. Mulai dari IWAPI Kaltim, komunitas ojek online, partai politik, dan serikat buruh. ""Kami melaksanakan kegiatan ini bercermin dari proses vaksinasi di beberapa kota kabupaten, langkah yang diambil adalah menginput lebih awal peserta vaksinasi sesuai arahan Dinas Kesehatan Provinsi Kaltim dan Dinas Kesehatan Kota Samarinda,"" ucap Staf Ahli Mahyudin, Vani Tambajong dalam keterangan tertulis, Rabu (27/10/2021). ""Dalam mendata kami memperhatikan beberapa faktor yang dapat mempengaruhi kelancaran proses kegiatan di lapangan, antara lain terkait jumlah tenaga medis dan ruang yang tersedia. Dengan memperhatikan dua hal tersebut maka panitia menentukan berapa peserta untuk jam tertentu, nomor antrean dan jam kehadiran peserta,"" imbuhnya. Vani mengungkap, berdasarkan pantauan di lapangan, antusiasme warga Samarinda terlihat sejak pagi dimulainya kegiatan. Dalam kegiatan ini, pihaknya juga mengutamakan vaksinasi untuk warga usia lanjut. Sehingga, kalangan usia lanjut mendapat perlakuan khusus oleh panitia acara selama vaksinasi","Kebut Herd Immunity, Waket DPD Gelar Vaksinasi Massal di Kaltim",serikatburuh,https://news.detik.com/berita/d-5785315/kebut-herd-immunity-waket-dpd-gelar-vaksinasi-massal-di-kaltim?single=1,"Rabu, 27 Okt 2021 18:09 WIB"
