artikel,judul,keyword,link,tanggal
"Sejumlah kabar menarik muncul dari Jawa Barat. Mulai dari pria Garut dikubur hidup-hidup hingga pria di Bandung nekat bobol mesin ATM di markas TNI. Berikut rangkuman dalam Jabar hari ini : Video pria membobol mesin anjungan tunai mandiri (ATM) milik salah satu bank di media sosial (medsos). Aksi itu berlangsung di markas TNI. Nekat euy! Video viral yang dilihat  , Selasa (26/10/2021), terlihat seorang pria asal Bandung ini tengah berada di dalam ruangan ATM. Dalam video juga terlihat ada seorang anggota berseragam TNI. Narasi dalam video itu menyebutkan bahwa lokasi ATM yang dibobol pelaku berada di area Kodiklat TNI AD, Jalan Sumbawa, Kota Bandung. Aksi nekat sang maling itu tepergok personel TNI. ""Viral apes maling kepergok bobol mesin ATM di kompleks militer oleh anggota TNI,"" tulis keterangan video itu. Kapen Kodiklat TNI AD Letkol Effendi membenarkan adanya kejadian tersebut. Menurut dia, aksi pria bobol ATM itu berlangsung pada Jumat (22/10). ""Iya betul kejadiannya. Tapi secara lebih jelasnya saya belum dapat informasi,"" ujar Effendi saat dihubungi. Menurut dia, aksi pria bobol ATM tersebut tepergok anggota provost. Pihak Kodiklat TNI AD lantas menyampaikan peristiwa itu kepada pihak bank, yang kemudian ditindaklanjuti dengan membuat laporan ke polisi. ""Itu sudah ditangkap. Dari pihak bank yang melaporkan ke polisi,"" tutur Effendi. Bripka NR, seorang polisi nakal yang bertugas di Polres Majalengka, dipecat dengan tidak hormat. Oknum polisi penikmat sabu itu sebelumnya ditahan di Lapas Majalengka. Pemecatan Bripka NR ditandai dengan upacara PDTH di Mapolres Majalengka pada Senin (25/10). Kapolres Majalengka AKBP Edwin Affandi mengatakan upacara PTDH itu dilaksanakan secara in absentia lantaran Bripka NR tidak hadir. ""Jadi kemarin kita melaksanakan upacara Pemberhentian Tidak Dengan Hormat (PDTH) kepada Bripka NR, anggota Polres Majalengka,"" kata Edwin saat diwawancarai di Mapolres Majalengka, Selasa (26/10/2021). Dia menjelaskan pemecatan terhadap Bripka NR disebabkan karena yang bersangkutan terbukti menggunakan sabu pada 2019. Saat itu, kata Edwin, Bripka NR juga diketahui sering melakukan pelanggaran disiplin. ""Pemberhentian ini disebabkan karena yang bersangkutan melakukan penyalahgunaan narkoba jenis sabu-sabu pada 25 Maret 2019. Kejadian tersebut merupakan akumulatif dari pelanggaran disiplin dan kode etik yang dilakukan oleh bersangkutan,""ucapnya. Dua terdakwa kasus azan jihad di Kabupaten Majalengka, yang sempat viral pada 2020, dihukum pidana percobaan. Hukuman tersebut dijatuhkan dalam sidang putusan di PN Majalengka, Selasa (26/10/2021). Namun dalam putusan tersebut, dua terdakwa tidak harus mendekam di balik jeruji besi. Sebab, hukuman pidana enam bulan dan denda itu merupakan hukuman percobaan yang mengharuskan keduanya tidak melakukan tindak pidana selama satu tahun ke depan. ""Putusan hukuman percobaan enam bulan penjara, tanpa ditahan. Artinya ketika dalam satu tahun yang berangkutan melakukan tindak pidana apapun, dan sudah ada putusan dari hakim, maka putusan itu dieksekusi,"" kata hakim ketua, Kopsah, saat dikonfirmasi detikcom. Menurut Kopsah, kedua terdakwa terbukti melanggar Pasal 45 A ayat 2 Undang-Undang ITE. Meski begitu, dia menjelaskan, ada hal-hal yang meringankan terhadap vonis yang dijatuhkan oleh majelis hakim. ""Hal yang meringankan, terdakwa mengaku bersalah, menyesal, sudah meminta maaf kepada masyarakat dan salat taubah. Hal yang memberatkan perbuatan terdakwa yaitu meresahkan,"" ucap Kopsah. Polisi mengungkap kasus penemuan jasad pria yang terkubur di kaki Gunung Cikuray, Garut. Pria itu ternyata dikubur hidup-hidup. Kapolres Garut AKBP Wirdhanto Hadicaksono mengatakan jasad pria yang ditemukan terkubur berbalut karung di kaki Gunung Cikuray itu bernama Maman (50). ""Korban dikeroyok belasan orang sebelum dikubur,"" ujar Wirdhanto kepada wartawan di Polres Garut, Selasa (26/10/2021). Dia menyebut ada 14 warga yang mengeroyok Maman, baik menggunakan senjata maupun tangan kosong. Maman, yang babak belur, kemudian digotong ke kaki Gunung Cikuray. ""Lokasinya berada 2 kilometer dari TKP awal,"" ungkap Wirdhanto. Maman, yang masih mengembuskan napas, kemudian dimasukkan ke dalam lubang yang digali pelaku. Setelah dimasukkan ke dalam karung, Maman kemudian dikubur hidup-hidup. ""Saat korban dikubur, ada yang melihat korban masih hidup. Kemudian salah satu pelaku turun ke lubang dan menghabisi nyawa pelaku dengan luka sayatan,"" katanya. Setelah digorok di bagian leher dan mati, para pelaku kemudian lanjut mengubur korban. Kejadian itu berlangsung pada Selasa (21/10). Kasus itu terungkap dari laporan keluarga korban yang menyatakan Maman hilang sejak 11 Oktober 2021. Polisi kemudian melakukan penyelidikan dan menerima informasi pengeroyokan di Cigedug hingga akhirnya Maman ditemukan tewas. Massa buruh di Kota Cimahi turun ke jalan. Mereka berunjuk rasa di depan kantor wali kota Cimahi menuntut kenaikan Upah Minimum Kabupaten/Kota (UMK) 2022 sebesar 10 persen. UMK 2021 di Kota Cimahi sebesar Rp 3.241.929 sesuai Surat Keputusan Gubernur Jawa Barat No. 561/Kep.774-Yanbangsos/2020 tentang Upah Minimum Kabupaten/Kota di Daerah Provinsi Jawa Barat Tahun 2021. ""Lalu untuk UMK tahun 2022, kami meminta agar naik serendah-rendahnya 10 persen ketimbang UMK tahun 2021,"" kata Sekretaris KC FSPMI Bandung Raya Hendrayana Hendri, Selasa (26/10/2021). Sebelum ada UU Omnibus Law, menurut Hendra, upah diatur melalui penerapan hitungan Kebutuhan Hidup Layak (KHL). Sementara aturan upah sekarang mengacu pada inflasi daerah atau laju pertumbuhan ekonomi. ""Pasti akan dipilih yang nilainya lebih rendah agar kenaikan tidak terlalu besar, karena itu kami minta unsur KHL dimasukkan dalam penghitungan UMK,"" kata Hendrayana. Selain menuntut kenaikan UMK 2022, mereka juga meminta pencabutan UU Omnibus Law dan Perjanjian Kerja Bersama (PKB) tanpa Omnibus Law. ""Kami menilai jika UU Cipta Kerja-Omnibus Law sudah terlalu jauh dari amanat UUD 45. Ini adalah aksi awal bahwa buruh akan terus melawan bergerak menolak Omnibus law,"" kata Hendrayana. Ia meminta Pemkot Cimahi tidak sekadar menampung aspirasi yang disampaikan para buruh tanpa ada kejelasan lebih lanjut. ""Harapan kami, Pemkot Cimahi bukan sekedar mendengar dan menyampaikan tapi ada aksi nyata. Kami yakin Cimahi bisa membuat kebijakan yang berpihak pada pemenuhan kesejahteraan buruh,"" tutur Hendrayana. Di Bandung, Sejumlah buruh yang tergabung dalam berbagai organisasi menggelar aksi unjuk rasa di depan Gedung Sate, Kota Bandung. Mereka menggelar aksi untuk mengawal pembahasan upah minimum provinsi (UMP) Jabar. Pantauan detikcom, Selasa (26/10/2021), aksi ini digelar dengan menutup Jalan Diponegoro atau akses jalan yang berada di depan Kantor Gubernur Jawa Barat Ridwan Kamil. ""Hari ini aksi pemanasan saja, aksi di mana kita nanti tanggal 19-20 dan 29-30 November UMP (pembahasan dan penetapan) Jawa Barat,"" kata koordinator aksi Ajat. Ajat menyebut, pada Tanggal 19-20 dan 29-30 buruh di Jawa Barat juga akan menggelar aksi serupa dengan massa yang lebih banyak. ""Itu pertempuran sesungguhnya, (aksi digelar) di depan Halaman Gedung Sate,"" ujarnya. Aksi ini dijaga ketat oleh pihak kepolisian. Karena masih dalam situasi pandemi COVID-19 buruh yang menjadi peserta aksi tetap menjaga jarak dan memakai masker. ""Perlu disampaikan, hari ini kita sampaikan permohonan tuntutan sekaligus mengingatkan kepada Gubernur Jabar bahwa ada kewajiban untuk mensejahterakan buruh pekerja se Jabar di 27 kabupaten kota,"" ucapnya. Tak hanya di tingkat provinsi, aksi ini juga akan digelar di setiap daerah di Jawa Barat dengan tuntutan yang sama. ""Besok sampai Jumat nanti ada gerakan yang masif di kota dan kabupaten, November ini dewan pengupahan merumuskan dan membicarakan besaran upah minimum yang akan berlaku di Jabar tahun 2022,"" katanya. Pihaknya juga meminta kepada para pimpinan serikat buruh agar mengawal penetapan UMP di setiap daerahnya. Menurut Ajat, masih banyak daerah UMP nya rendah dan harus dinaikkan karena biaya hidup yang semakin meningkat. ""Ciayumajakuning sangat jauh dengan Bandung Raya, apalagi Karawang, ini jadi tantangan semua. Kita minta agar upahnya tidak jauh berbeda, karena biaya hidup sama,"" ujarnya. Menurutnya, aksi kali ini digelar tidak terlalu lama. Aksi sebenernya akan dilakukan sebelum penetapan UMP nanti. ""Kita tidak akan melaksanakan aksi cukup panjang, setelah orasi pimpinan, audiensi pimpinan dengan pihak gubernur, balik kanan dan kita akan siapkan aksi di daerah,"" ujarnya",Jabar Hari Ini: Pria di Garut Dikubur Hidup-hidup dan Polisi Penikmat Sabu Dipecat,serikatburuh,https://news.detik.com/berita-jawa-barat/d-5783935/jabar-hari-ini-pria-di-garut-dikubur-hidup-hidup-dan-polisi-penikmat-sabu-dipecat?single=1,"Selasa, 26 Okt 2021 20:03 WIB"
"Sejumlah elemen masyarakat yang tergabung dalam Gerakan  Bersama Rakyat (Gebrak) berencana menggelar aksi unjuk rasa di Istana Negara, Jakarta. Aksi unjuk rasa itu akan digelar tepat di Hari Sumpah Pemuda atau 28 Oktober. ""Dalam rangka memperingati Hari Sumpah Pemuda tahun 2021 di tengah catatan 2 Tahun kepemimpinan rezim Jokowi-MA, Pemerintah gagal mensejahterakan rakyat,"" kata Ketua Sentral Gerakan  Nasional (SGBN) M Yahya kepada wartawan, Selasa (26/10/2021). Yahya mengungkapkan aksi unjuk rasa itu rencananya akan digelar pada pukul 11.00-17.00 WIB. Titik kumpul demonstran berada di depan Kedutaan Besar (Kedubes) Amerika Serikat. ""Massa aksi kurang-lebih 500 orang,"" ujarnya. Sementara itu, Ketua Umum Kongres Aliansi Serikat Buruh Indonesia (Kasbi) Nining Elitos mengatakan ada sejumlah tuntutan yang diusung dalam unjuk rasa itu. Pertama, tuntutan mencabut UU Nomor 11 Tahun 2019 tentang Cipta Kerja dan berbagai aturan turunannya. Gebrak juga mendesak penghentian pemutusan hubungan kerja (PHK), setop kriminalisasi dan penangkapan aktivis, serta menjamin persamaan hak dan perlindungan bagi pekerja rumah tangga dan buruh migran. Mereka juga menuntut jaminan perlindungan bagi buruh di berbagai sektor, pengusutan korupsi di BPJS Ketenagakerjaan, pengembalian 58 orang pegawai KPK, penghentian pembungkaman dan represifitas terhadap gerakan rakyat. Selain itu, Gebrak menuntut penghentian kekerasan terhadap perempuan. ""Tuntutan Gebrak itu cabut  UU Cipta Kerja beserta turunannya, hentikan pembungkaman dan represifitas terhadap gerakan rakyat, usut kasus korupsi BPJS, usut kasus korupsi bantuan sosial, setop PHK sepihak, hentikan kekerasan terhadap perempuan. Rezim Jokowi-Amin gagal sejahterakan rakyat,"" tutur Nining. Beberapa elemen masyarakat yang berencana ikut aksi di Istana pada 28 Oktober antara lain Kasbi, Konfederasi Persatuan  Indonesia (KPBI), Konsorsium Pembaruan Agraria (KPA), Sentral Gerakan Buruh Nasional (SGBN), Konfederasi Serikat Nasional (KSN), Serikat Pekerja Media dan Industri Kreatif untuk Demokrasi (SINDIKASI), LBH Jakarta, YLBHI, SP-Perbankan, KPR, SEMPRO, LMND-DN, hingga GMNI-Presidium.",Buruh Bakal Aksi di Istana pada 28 Oktober,serikatburuh,https://news.detik.com/berita/d-5783490/buruh-bakal-aksi-di-istana-pada-28-oktober?single=1,"Selasa, 26 Okt 2021 16:39 WIB"
"Sejumlah buruh yang tergabung dalam berbagai organisasi menggelar aksi unjuk rasa di depan Gedung Sate, Kota Bandung. Mereka menggelar aksi untuk mengawal pembahasan upah minimum provinsi (UMP) Jabar. Pantauan  , Selasa (26/10/2021), aksi ini digelar dengan menutup Jalan Diponegoro atau akses jalan yang berada di depan Kantor Gubernur Jawa Barat Ridwan Kamil. ""Hari ini aksi pemanasan saja, aksi di mana kita nanti tanggal 19-20 dan 29-30 November UMP (pembahasan dan penetapan) Jawa Barat,"" kata koordinator aksi Ajat. Ajat menyebut, pada Tanggal 19-20 dan 29-30 buruh di Jawa Barat juga akan menggelar aksi serupa dengan massa yang lebih banyak. ""Itu pertempuran sesungguhnya, (aksi digelar) di depan Halaman Gedung Sate,"" ujarnya. Aksi ini dijaga ketat oleh pihak kepolisian. Karena masih dalam situasi pandemi COVID-19 buruh yang menjadi peserta aksi tetap menjaga jarak dan memakai masker. ""Perlu disampaikan, hari ini kita sampaikan permohonan tuntutan sekaligus mengingatkan kepada Gubernur Jabar bahwa ada kewajiban untuk mensejahterakan buruh pekerja se Jabar di 27 kabupaten kota,"" ucapnya. Tak hanya di tingkat provinsi, aksi ini juga akan digelar di setiap daerah di Jawa Barat dengan tuntutan yang sama. ""Besok sampai Jumat nanti ada gerakan yang masif di kota dan kabupaten, November ini dewan pengupahan merumuskan dan membicarakan besaran upah minimum yang akan berlaku di Jabar tahun 2022,"" katanya. Pihaknya juga meminta kepada para pimpinan serikat buruh agar mengawal penetapan UMP di setiap daerahnya. Menurut Ajat, masih banyak daerah UMP nya rendah dan harus dinaikkan karena biaya hidup yang semakin meningkat. ""Ciayumajakuning sangat jauh dengan Bandung Raya, apalagi Karawang, ini jadi tantangan semua. Kita minta agar upahnya tidak jauh berbeda, karena biaya hidup sama,"" ujarnya. Menurutnya, aksi kali ini digelar tidak terlalu lama. Aksi sebenernya akan dilakukan sebelum penetapan UMP nanti. ""Kita tidak akan melaksanakan aksi cukup panjang, setelah orasi pimpinan, audiensi pimpinan dengan pihak gubernur, balik kanan dan kita akan siapkan aksi di daerah,"" ujarnya.","Kawal Pembahasan UMP Jabar, Buruh Demo di Depan Gedung Sate",serikatburuh,https://news.detik.com/berita-jawa-barat/d-5783215/kawal-pembahasan-ump-jabar-buruh-demo-di-depan-gedung-sate?single=1,"Selasa, 26 Okt 2021 14:22 WIB"
"Massa buruh berunjuk rasa di depan kantor Pemkab Karawang. Tuntutannya buruh yaitu meminta kenaikan Upah Minimum Kabupaten/Kota (UMK) 2022 sebesar 10 persen dan mendesak UU Omnibus Law dicabut. Demonstran yang turun ke jalan ini dari Federasi Serikat Pekerja Metal Indonesia (FSPMI) Karawang. Koordinator aksi, Dedi Heryadi mengatakan, aksi unjuk rasa yang digelar hari ini merupakan rangkaian aksi buruh se-nasional. ""Hari ini merupakan serangkaian aksi buruh serentak di berbagai daerah untuk menuntut pencabutan Undang-Undang Omnibus Law, juga upah layak. Karena selama ini kenaikan UMK hanya kisaran empat persen dan tidak mencukupi untuk memenuhi kebutuhan hidup. Selayaknya itu sepuluh persen,"" kata Dedi saat diwawancarai di lokasi aksi unjuk rasa di depan gerbang utama Pemkab Karawang, Selasa (26/10/2021). Biasanya, kata dia, kenaikan upah mencapai 400 ribu, tetapi di tahun 2020 hanya 100 ribu. ""Kebayang dengan kenaikan upah hanya 100 ribu dinilai kami tidak layak, apalagi untuk saat ini ada peningkatan tarif dasar listrik. Secara otomatis kebutuhan hidup yang lain juga ikut naik,"" ujarnya. Selain itu, demonstran juga menuntut pencabutan UU Omnibus Law dan memprotes PHK sepihak. ""Banyak buruh yang kena PHK sepihak hingga akhirnya tidak mendapatkan pesangon padahal dalam UU Nomor 13 Tahun 2003 tentang ketenagakerjaan sudah jelas tentang aturan pesangon,"" ucap Dedi. Sementara itu, dia menjelaskan, aksi buruh akan bergulir hingga dua hari ke depan dengan massa lebih banyak. ""Hari ini ada kurang lebih 500 buruh dan masih berlanjut besok hingga tanggal 28 nanti, dengan serikat buruh lainnya. Kami juga meminta dukungan Pemkab agar mencabut Omnibus Law,"" ujar Dedi.",Massa Buruh di Karawang Tuntut UMK 2022 Naik 10 Persen,serikatburuh,https://news.detik.com/berita-jawa-barat/d-5783083/massa-buruh-di-karawang-tuntut-umk-2022-naik-10-persen?single=1,"Selasa, 26 Okt 2021 13:21 WIB"
"Wakil Presiden Ma'ruf Amin, meresmikan pembangunan Balai Latihan Kerja (BLK) Komunitas di Papua dan Papua Barat. Secara simbolis, peresmian dilangsungkan di Yayasan Global Mission International Indonesia (GMII), Sentani, Jayapura, hari ini. Ma'ruf mengatakan Papua yang memiliki wilayah terluas di Indonesia, menyimpan potensi sumber daya alam yang bernilai ekonomis dan strategis. Untuk itu, pemerintah melalui Kementerian Ketenagakerjaan meresmikan BLK guna mewujudkan ketersediaan SDM kompeten yang merata di seluruh Tanah Air. ""Memperhatikan potensi yang dimiliki Papua, Kementerian Ketenagakerjaan mengambil peran dalam peningkatan kompetensi SDM melalui program pembangunan Balai Latihan Kerja (BLK) Komunitas,"" kata Ma'ruf Amin dalam keterangan tertulis, Sabtu (16/10/2021). Lebih lanjut Ma'ruf menyampaikan sejak tahun 2017-2020, Kemnaker telah mengalokasikan pembangunan BLK Komunitas sebanyak 12 lembaga di Papua dan Papua Barat. Adapun lembaga ini tersebar di Papua sebanyak 7 lembaga dan Papua Barat sebanyak 5 lembaga. Di tahun 2021, Kemnaker mengalokasikan program dan anggaran pembangunan BLK Komunitas sebanyak 21 lembaga penerima bantuan pembangunan BLK Komunitas. Hal ini meliputi 12 lembaga di Papua dan 9 lembaga di Papua Barat. Ma'ruf menjelaskan pembangunan BLK Komunitas merupakan upaya untuk mendekatkan akses peningkatan kompetensi SDM di Papua dan Papua Barat. Meski demikian, upaya ini tidak akan berjalan maksimal jika tidak didukung dengan kerja sama dan sinergi dari Pemerintah Daerah, dunia usaha dan dunia industri, serta komunitas di masyarakat. ""Ini menjadi tugas besar bagi kita semua untuk menyiapkan manajemen yang baik, sarana dan prasarana yang baik, serta menyiapkan SDM kompeten dan hebat dalam memperkuat ekosistem inovasi yang ada,"" ujarnya. Sememntara itu, Menteri Ketenagakerjaan, Ida Fauziyah menjelaskan BLK Komunitas bertujuan untuk mempermudah masyarakat di seluruh Indonesia dalam mengakses pelatihan. ""Kami ingin menunjukkan bahwa dengan pembangunan BLK Komunitas ini, pemerintah bertekad untuk menjangkau segala sudut yang belum terjangkau oleh lembaga pelatihan, baik lembaga pelatihan pemerintah maupun lembaga pelatihan swasta,"" katanya. Sejak tahun 2017-2020, Ida mengatakan pihaknya telah membangun 2.127 BLK Komunitas yang tersebar di lembaga keagamaan dan komunitas serikat pekerja/serikat buruh di seluruh Indonesia. Di tahun ini, pembangunan 21 BLK Komunitas di Papua dan Papua Barat pun menjadi komitmennya pemerintah dalam membangun Papua dan Papua Barat, khususnya terkait pembangunan SDM. Ida berharap adanya BLK Komunitas dapat meningkatkan keahlian masyarakat. ""Dengan adanya BLK Komunitas ini diharapkan dapat memberikan bekal keterampilan teknis produksi atau keahlian vokasi sesuai kebutuhan pasar kerja bagi komunitas dan masyarakat sekitarnya dalam bekerja atau berwirausaha,"" pungkasnya.",Wapres-Menaker Resmikan Pembangunan 21 BLK di Papua dan Papua Barat,serikatburuh,https://news.detik.com/berita/d-5770031/wapres-menaker-resmikan-pembangunan-21-blk-di-papua-dan-papua-barat?single=1,"Sabtu, 16 Okt 2021 17:42 WIB"
"Kementerian Ketenagakerjaan menggelar dialog terkait implementasi dan evaluasi Peraturan Perusahaan dan Perjanjian Kerja Bersama (PP-PKB) pascapenetapan Undang-Undang Nomor 11 Tahun 2020 tentang Cipta Kerja Klaster Ketenagakerjaan dan Peraturan Turunannya. Agenda tersebut diselenggarakan di Yogyakarta, Kamis (14/10). Direktur Jenderal Pembinaan Hubungan Industrial dan Jaminan Sosial Tenaga Kerja (PHI dan Jamsos) Kemnaker Indah Anggoro Putri menerangkan penyelenggaraan dialog ini guna memberikan pemahaman, menyamakan persepsi, dan interpretasi pengaturan syarat kerja melalui PP/PKB pascapenetapan UU Cipta Kerja Klaster Ketenagakerjaan serta peraturan turunannya. ""Dialog juga dilaksanakan untuk meningkatkan pemahaman peserta dialog mengenai kebijakan hubungan industrial pasca diterbitkannya UU Cipta Kerja Klaster Ketenagakerjaan dan peraturan turunannya, dan menjaring ide dan gagasan yang konstruktif dari peserta dialog dalam rangka meningkatkan kualitas dan kuantitas pengaturan syarat kerja melalui Peraturan Perusahaan maupun Perjanjian Kerja Bersama,"" jelas Putri dalam keterangan tertulis, Jumat (15/10/2021). Ia menguraikan pemerintah telah menetapkan empat Peraturan Pemerintah sebagai turunan dari UU Cipta Kerja Klaster Ketenagakerjaan, yaitu PP Nomor 34 Tahun 2021 tentang Penggunaan Tenaga Kerja Asing, PP Nomor 35 Tahun 2021 tentang Perjanjian Kerja Waktu Tertentu, Alih Daya, Waktu Kerja dan Waktu Istirahat, dan Pemutusan Hubungan Kerja, PP Nomor 36 Tahun 2021 tentang Pengupahan, dan PP Nomor 37 Tahun 2021 tentang Penyelenggaraan Program Jaminan Kehilangan Pekerjaan. ""Keempat PP tersebut merupakan bagian dari rencana besar pemerintah untuk menempatkan tenaga kerja dan pekerja/buruh Indonesia sebagai aset penting bangsa yang produktif dan tangguh. Hal itu juga yang selalu disampaikan Bu Ida Fauziyah,"" tutur Putri. Putri menyampaikan muatan PP tersebut ada yang bersifat tetap, yaitu mempertahankan ketentuan yang lama atau yang dimaksudkan sebagai penegasan dan ada juga yang mengubah ketentuan yang lama, yaitu dengan menghapus maupun mengatur materi yang baru. Kehadiran UU Cipta Kerja dan peraturan pelaksananya, lanjut Putri, bukan untuk mendegradasi kualitas PP atau PKB. Sebab, perubahan peraturan perundang-undangan tidak serta merta mengubah ketentuan PP atau PKB yang masih berlaku, kecuali dilakukan perubahan atas dasar kesepakatan pekerja/buruh atau serikat pekerja/serikat buruh dengan pengusaha. ""Adapun terkait kesepakatan dalam PKB, hakikatnya adalah kesepakatan kedua belah pihak yang merupakan undang-undang bagi para pihak,"" ujarnya. Sementara itu, Kepala Dinas Tenaga Kerja Provinsi D.I.Yogyakarta Aria Nugrahadi menyampaikan data dari wajib lapor ketenagakerjaan triwulan II di Daerah Istimewa Yogyakarta menunjukkan dari 5349 perusahaan di DIY, 1182 di antaranya memiliki PP dan 465 perusahaan sudah memiliki PKB. Aria mengatakan pihaknya melakukan berbagai upaya untuk meningkatkan sarana hubungan industrial tersebut. ""Pembinaan pembinaan terus kami lakukan, adanya e-PP dan e-PKB juga mempermudah pencatatan dan pendaftaran. Untuk itu kami berharap dengan dilaksanakannya kegiatan ini dapat mendukung dan meningkatkan jumlah perusahaan yang membuat PP maupun PKB di wilayah Yogyakarta,"" papar Aria. Sebagai informasi, kegiatan dialog diselenggarakan sekaligus untuk mendengarkan dan memberikan rekomendasi konkret bagi dua sektor pekerjaan yang terdampak pandemi, di antaranya yakni pada sektor pariwisata dan pada sektor garmen di wilayah Yogyakarta",Kemnaker Gelar Dialog Bahas Implementasi Perjanjian Kerja Bersama,serikatburuh,https://news.detik.com/berita/d-5768504/kemnaker-gelar-dialog-bahas-implementasi-perjanjian-kerja-bersama?single=1,"Jumat, 15 Okt 2021 15:55 WIB"
