artikel,judul,keyword,link,tanggal
"Kalangan pengusaha merespons serikat buruh yang minta agar upah minimum 2022 naik 7-10%. Mereka heran permintaan itu dasarnya dari mana, mengingat situasi dan kondisi ekonomi Indonesia yang baru mulai pulih. Ketua Umum DPD HIPPI DKI Jakarta, Sarman Simanjorang mengatakan saat ini pengusaha sedang memutar otak agar tetap mampu bertahan sampai ekonomi kembali normal. Pihaknya meminta serikat buruh mengerti akan tekanan berat yang dihadapi dunia usaha saat ini. ""Dalam kondisi ketidakpastian ini sangat tidak elok jika teman-teman Serikat Buruh/Pekerja meminta kenaikan UMP (upah minimum provinsi) secara berlebihan. Teman-teman (buruh) harus mengerti akan tekanan berat yang dihadapi dunia usaha saat ini,"" kata Sarman dalam keterangan tertulis dikutip  , Minggu (31/10/2021). Serikat buruh diminta menunggu dan menghormati hasil keputusan Kementerian Ketenagakerjaan (Kemenaker) yang sudah dibahas bersama Dewan Pengupahan Nasional. Saat ini penetapan masih menunggu data dari Badan Pusat Statistik (BPS) yang akan dijadikan variabel untuk menghitung besaran upah minimum. ""Mari kita hormati proses dan format baru tersebut, berapa besaran yang diputuskan itulah yang harus kita terima dan taati karena sudah diatur dalam Peraturan Pemerintah dan sudah mempertimbangkan berbagai aspek,"" imbuhnya. Bersambung ke halaman selanjutnya. Dunia usaha mengajak Serikat Pekerja/Buruh untuk menciptakan iklim usaha dan investasi yang kondusif agar investor tidak ragu masuk ke Indonesia dengan menggambarkan bahwa buruh/pekerja Indonesia sangat produktif dan siap menyambut para investor membuka usahanya di Indonesia. ""Mari kita hadapi bersama ketidakpastian ini dengan saling bergandengan tangan, saling menopang dan memahami untuk dapat bertahan dan bangkit kembali ketika COVID semakin melandai. Ekonomi membaik maka kesejahteraan buruh/pekerja juga akan semakin membaik,"" imbuhnya. Dalam waktu dekat Kemenaker akan mengumumkan besaran kenaikan upah minimum 2022. Formula baru penetapan diatur dalam Peraturan Pemerintah (PP) Nomor 36 Tahun 2021 tentang Pengupahan. Format baru itu memakai pendekatan beberapa variabel seperti jumlah rata-rata per kapita rumah tangga, rata-rata jumlah anggota rumah tangga yang sudah bekerja, dan jumlah rata-rata anggota rumah tangga. Pertumbuhan ekonomi dan inflasi masing masing daerah juga akan dilihat mana yang lebih tinggi, serta adanya batas atas dan atas bawah sebagai dasar penetapan upah minimum.","Buruh Mau Upah Naik 10% Tahun Depan, Pengusaha Minta Pengertiannya",serikatburuh,https://finance.detik.com/berita-ekonomi-bisnis/d-5790672/buruh-mau-upah-naik-10-tahun-depan-pengusaha-minta-pengertiannya?single=1,"Minggu, 31 Okt 2021 18:15 WIB"
"Berbagai kelompok melaksanakan aksi  di dekat Istana Merdeka. Selain membawa spanduk Jokowi Mundur, ada beberapa hal yang terjadi saat aksi unjuk rasa tersebut. Massa demonstran berkumpul di Patung Kuda Arjuna Wiwaha, Jl Medan Merdeka Barat. Mereka tertahan di Patung Kuda, padahal rencananya berdemo di depan Istana Merdeka. Beberapa elemen ikut aksi, antara lain KASBI, Konfederasi Persatuan Buruh Indonesia (KPBI), Konsorsium Pembaruan Agraria (KPA), Sentral Gerakan Buruh Nasional (SGBN), Konfederasi Serikat Nasional (KSN), Serikat Pekerja Media dan Industri Kreatif untuk Demokrasi (SINDIKASI), LBH Jakarta, YLBHI, SP-Perbankan, KPR, SEMPRO, LMND-DN, hingga GMNI-Presidium. ""Sekitar 1.000 dari Gebrak (Gerakan Buruh Bersama Rakyat). Kita koordinasi dengan mahasiswa. Ada sekitar 200 kalau yang dari BEM SI,"" kata Ketua Umum Kongres Aliansi Serikat Buruh Indonesia (Kasbi) Nining Elitos kepada  , Kamis (28/10/2021). Selain itu, BEM Universitas Indonesia (UI) bergabung dengan Gebrak di lokasi. Mahasiswa UI berkumpul terlebih dulu di kampus pukul 08.00 WIB. Berikut ini serba-serbi aksi dari siang hingga sore hari tersebut. Ribuan personel gabungan dari TNI-Polri disiagakan menjelang aksi demo Gerakan Buruh Bersama Rakyat (Gebrak) di sekitar Istana Negara, Jakarta Pusat. Selain itu, kawat berduri disiagakan di sekitar lokasi. ""(Sebanyak) 1.955 personel gabungan TNI-Polri dan pemerintah provinsi (pemprov) dan kawat berduri,"" ucap Kasubbag Humas Polres Metro Jakarta Pusat AKP Sam Suharto kepada  , Kamis (28/10). Ada juga aparat yang menggunakan   atau alat pelindung diri (APD). Mereka berjaga di depan barisan massa demo. Baju   putih itu mencolok di antara penjagaan polisi dan TNI di lokasi. Diketahui, saat ini di Indonesia masih mengalami masa pandemi virus Corona (COVID-19). DKI Jakarta sendiri menerapkan PPKM level 2. Berdasarkan pantauan pukul 11.05 WIB petugas menutup Jalan Medan Merdeka Barat. Kendaraan tidak bisa melintas menuju Istana negara dan sebaliknya. Jalan ditutup dengan barier oranye dan dijaga sejumlah aparat TNI-Polri. Kendaraan hanya bisa melintas dari Jalan Budi Kemuliaan menuju Jalan Medan Merdeka Selatan. Kawat berduri juga disiagakan. Sejumlah buruh mengenakan pakai merah mulai berdatangan ke lokasi. Penutupan tak hanya di Jl Medan Merdeka Barat. Jalan-jalan di sekitar Istana negara seperti Kawasan Harmoni hingga Gambir pun ditutup. Salah satu kelompok demonstran membentangkan spanduk Presiden Joko Widodo (Jokowi) untuk mundur. Pantauan di lokasi, Kamis (28/10/2021), spanduk tersebut dibawa oleh massa dari Aliansi Rakyat Menggugat. Di spanduk putih tersebut, tertulis 'Mosi Tidak Percaya kepada DPR RI dan Pemerintahan Jokowi-Ma'ruf. Jokowi Mundur.' Sepanduk tuntutan Jokowi Mundur tidak hanya satu, tapi ada spanduk lainnya yang meminta Jokowi Mundur. Spanduk tersebut bertulisan 'Cabut UU Ombudslaw atau Jokowi Mundur.' Rencananya, massa dari sejumlah elemen masyarakat menggelar aksi demo di depan Istana Merdeka. Namun polisi menyekat di kawasan Patung Kuda Arjuna Wiwaha, Jl Medan Merdeka Barat. Dirlantas Polda Metro Jaya Kombes Sambodo Purnomo Yogo mengatakan massa aksi hanya diizinkan menyampaikan aspirasi di kawasan sekitar Patung Arjuna Wiwaha atau Patung Kuda. ""Iya kita tahan di sini (patung kuda),"" kata Dirlantas Polda Metro Jaya Kombes Sambodo Purnomo Yogo kepada wartawan di lokasi, Kamis (28/10/2021). Sambodo menuturkan Jalan Medan Merdeka Barat menuju Istana Negara dan sebaliknya ditutup. Massa aksi tidak dapat melanjutkan long march menuju Istana Negara. ""Kita sekat di depan gedung Sapta Pesona,"" tuturnya. Ada 13 tuntutan yang dibawa Gebrak. Dari cabut omnibus law hingga wujudkan demokrasi dan kebebasan berekspresi. 1) Cabut   dan seluruh PP turunannya PP no 34, no 36, dan no 37. 2) Tolak penghapusan upah sektoral, berlakukan kembali upah sektoral kaum buruh seperti semula, dan berlakukan kenaikan UMK 2022 sebesar 15% 3) Stop PHK sepihak, stop  ! Berikan jaminan kepastian kerja dan kebebasan berserikat. 4) Stop kriminalisasi dan penangkapan aktivis, bebaskan seluruh aktivis gerakan rakyat yang ditangkap dan didiskriminasi. 5) Berikan persamaan hak dan perlindungan bagi pekerja rumah tangga (APRT) dan seluruh buruh migran, sahkan RUU PPRT. 6) Jamin dan lindungi kaum buruh di sektor industri: pariwisata, perhotelan, perkebunan, pertambangan, perikanan, kelautan, konstruksi, transportasi,   atau ojol. 7) Usut tuntas kasus korupsi BPJS TK dan korupsi bansos Pandemi COVID-19. 8) Tolak pemberangusan pegawai KPK, pekerjakan kembali 58 orang pegawai KPK seperti semula tanpa syarat. 9) Mendesak pemerintah menghentikan rencana liberalisasi agraria dan pembentukan Badan Bank Tanah, serta segera mengembalikan semangat reforma agraria berdasarkan cita-cita UUD 1945, TAP MPR XI/2001 tentang Pembaruan Agraria, dan Pengelolaan Sumber Daya Alam dan Undang-Undang Pokok Agraria 1960. 10) Laksanakan reforma agraria sejati sebagai jalan penyelesaian konflik agraria dan pemenuhan hak rakyat atas tanah. 11) Gratiskan biaya pendidikan di masa pandemi. 12) Stop kapitalisasi dan komersialisasi sistem pendidikan. 13) Wujudkan demokrasi dan kebebasan berekspresi seluruh kampus.",Serba-serbi Aksi Demonstrasi Tuntut Mundur Presiden Jokowi,serikatburuh,https://news.detik.com/berita/d-5787173/serba-serbi-aksi-demonstrasi-tuntut-mundur-presiden-jokowi?single=1,"Kamis, 28 Okt 2021 20:03 WIB"
"Kementerian Ketenagakerjaan (Kemenaker) menargetkan bisa umumkan Upah Minimum Kabupaten/Kota (UMK) 2022 di November. Pihaknya menyebut akan mempertimbangkan segala masukan yang ada. ""Kita targetkan awal November (UMK 2022 diumumkan). Terkait dengan masukan, tuntutan, dan lainnya kita pertimbangkan,"" kata Sekretaris Jenderal Kemenaker, Anwar Sanusi kepada detikcom, Minggu (31/10/2021). Lantas, apakah UMK 2022 akan naik atau turun? Anwar menjelaskan pihaknya sedang menunggu data dari Badan Pusat Statistik (BPS) untuk menjadi indikator penetapan besaran upah minimum di tahun depan. Data itu di antaranya tingkat konsumsi rata-rata rumah tangga dan data konsumsi pekerja di rumah tangga. ""Kita nunggu data dari BPS terkait dengan pertumbuhan ekonomi daerah, inflasi, angka kelayakan hidup,"" imbuhnya. Sebelumnya diberitakan serikat buruh meminta UMK 2022 naik 7-10%. Tuntutan itu diminta karena biaya kebutuhan hidup dinilai telah meroket mulai dari kebutuhan sembako hingga biaya pendidikan. ""Dari survei ditemukan yang paling mengalami lonjakan kenaikan harga adalah transportasi, terutama angkot dengan pandemi sedikit sekali yang beroperasi jadi berpindah ke transportasi online sehingga biaya transport meningkat tajam. Terus harga bahan pokok juga meningkat rata-rata 7-10%,"" kata Presiden KSPI Said Iqbal dalam konferensi pers virtual, Senin (25/10/2021). Sementara Wakil Ketua Umum Kadin bidang Ketenagakerjaan Adi Mahfudz mempertanyakan dasar dari angka kenaikan upah minimum sebesar 10% yang diminta oleh serikat buruh. Sebab, perhitungan kenaikan upah telah diatur lewat regulasi. ""Tentu bukan masalah 10% atau masuk akalnya, bukan itu, dasar dari 10% itu apa? Itu saya kira yang paling penting. Kan saat ini kita harus taat juga dengan regulasi yang sudah ada bahwa sudah ada Undang-undang Nomor 11 Tahun 2020 tentang Cipta Kerja dan juga ada Peraturan Pemerintah Nomor 36 Tahun 2021 tentang Pengupahan,"" kata Adi, Kamis (28/10/2021).","Kemenaker Bakal Umumkan UMK 2022 di November, Naik?",serikatburuh,https://finance.detik.com/berita-ekonomi-bisnis/d-5790417/kemenaker-bakal-umumkan-umk-2022-di-november-naik?single=1,"Minggu, 31 Okt 2021 13:26 WIB"
"Tarif tes Real Time Polymerase Chain Reaction (RT- ) masih jadi perbincangan hangat di kalangan masyarakat. Kali ini sorotan datang dari pihak serikat buruh. Presiden Partai Buruh sekaligus KSPI, Said Iqbal meminta pemerintah agar tarif PCR ditetapkan menjadi Rp 100 ribu. Pasalnya, di India saja sudah sekitar Rp 96 ribu. ""Partai buruh meminta kepada pemerintah untuk PCR harganya mendekati apa yang seharga di India Rp 100 ribu bukan Rp 275 ribu atau Rp 300 ribu,"" kata Said dalam konferensi pers virtual, Sabtu (30/10/2021). Lebih lanjut, jika pemerintah menilai harga pasaran tes PCR adalah Rp 300 ribu, maka selisihnya Rp 200 ribu harus disubsidi pemerintah. Pihaknya mengaku sudah melakukan survei ke lapangan mengenai usulannya tersebut. ""Karena partai buruh sudah memeriksa ke klinik swasta, rumah sakit swasta, komponen mahal mereka harus menyiapkan tenaga khusus untuk membayar gaji dari perawat atau bidan dan tenaga PCR untuk melakukan tes PCR. Mungkin materialnya bisa turun tapi harga tenaga kerja, partai buruh tidak setuju,"" lanjutnya. Said berharap Kementerian Kesehatan (Kemenkes) bisa menindakalnjuti hal tersebut ""Bisa dipikirkan oleh kemenkes, pasti bisa. Partai buruh minta harga PCR Rp 100 ribu dengan subsidi Rp 200 ribu kepada klinik swasta sedangkan puskesmas dan RS pemerintah akan mudah bagi Kemenkes untuk memasukkan subsidi yaitu terkait penambahan biaya covid,"" jelasnya. Lalu bagaimana respons pemerintah?   Juru Bicara Kementerian Kesehatan (Kemenkes) dr Siti Nadia Tarmizi mengatakan, untuk menurunkan harga PCR perlu dilakukan pengkajian dan konsultasi dengan berbagai pihak. Menurutnya, mengenai kebijakan penurunan harga PCR pun akan dilakukan evaluasi. ""Kita perlu kaji dahulu dan berkonsultasi dengan banyak pihak. Tentunya kalau penurunan harga PCR diperlukan akan dilakukan evaluasi kembali penetapan harganya,"" kata Nadia kepada detikcom. Seperti diketahui, saat ini harga PCR berkisar antara Rp 275 ribu sampai Rp 300 ribu berdasarkan permintaan Presiden Joko Widodo. Saat ditanya perihal subsidi tes PCR mandiri, Nadia menuturkan, jika keperluan tes PCR untuk tracing kasus COVID-19 maka biaya PCR tersebut akan ditanggung pemerintah atau Kemenkes. Lain halnya dengan PCR yang dibutuhkan untuk syarat perjalanan atau kebutuhan pribadi. ""Kalau yang terkait suspek covid dan tracing tentu bisa diberikan gratis. Tapi kalau skrining untuk berpergian ini menjadi tanggungan pribadi,"" pungkasnya.","Buruh Minta Tarif PCR Rp 100 Ribu dan Disubsidi, Pemerintah Jawab Begini",serikatburuh,https://finance.detik.com/berita-ekonomi-bisnis/d-5789930/buruh-minta-tarif-pcr-rp-100-ribu-dan-disubsidi-pemerintah-jawab-begini?single=1,"Minggu, 31 Okt 2021 06:48 WIB"
"Kementerian Ketenagakerjaan (Kemenaker) tetap mengacu pada Undang-undang (UU) Nomor 11 Tahun 2020 tentang Cipta Kerja dan Peraturan Pemerintah (PP) Nomor 36 Tahun 2021 tentang Pengupahan untuk menetapkan Upah Minimum Kabupaten/Kota ( ) 2022. Meskipun, ditolak serikat buruh. ""Perhitungan UMK 2022 pakai PP 36 Tahun 2021,"" kata Sekretaris Jenderal Kemenaker, Anwar Sanusi kepada detikcom, Minggu (31/10/2021). Sebelumnya diberitakan Konfederasi Serikat Pekerja Indonesia (KSPI) meminta pemerintah tetap mengacu pada PP Nomor 78 Tahun 2015 untuk menetapkan UMK 2022. Formula UU Cipta Kerja dan PP Nomor 36 Tahun 2021 diminta abaikan karena aturan itu masih berproses di Mahkamah Konstitusi (MK). ""Bagaimana mungkin suatu UU yang sedang berproses secara hukum (dipakai), pemerintah tidak menghormati proses hukum tersebut. Untuk itu pakai dasar PP Nomor 78 Tahun 2015, jelas itu. Jadi PP Nomor 36 Tahun 2021 tentang Pengupahan dan UU Nomor 11 Tahun 2020 tentang Omnibus Law tidak bisa digunakan sebagai dasar penetapan UMK 2022,"" kata Presiden KSPI Said Iqbal dalam konferensi pers virtual, Senin (25/10/2021). Lalu, dipakainya formula itu disebut bisa membuat upah tahun depan turun. Sementara serikat buruh meminta   2022 naik sekitar 7-10%. ""Kalau pakai rumus PP Nomor 36 Tahun 2021, upah itu turun, bukan naik. Berani nggak pemerintah memutuskan itu? Silakan saja kalau mau menimbulkan gejolak dari buruh, silakan, silakan putuskanlah,"" kata Said. Kembali ke Kemenaker, pihaknya menilai proses MK tidak menggugurkan berlakunya aturan sebelum diputuskan batal. ""Proses MK kan tidak menggugurkan berlakunya aturan, kecuali nanti diputuskan untuk dibatalkan,"" tutur Anwar. Saat ini penetapan   2022 masih dibahas bersama Dewan Pengupahan Nasional (Depenas). Untuk menetapkannya masih menunggu data dari Badan Pusat Statistik (BPS) sebagai indikator penetapan besaran upah minimum di tahun depan. ""Kita nunggu data dari BPS terkait dengan pertumbuhan ekonomi daerah, inflasi, angka kelayakan hidup. Kita targetkan awal November (UMK 2022 diumumkan),"" imbuh Anwar.","Meski Ditolak Buruh, UMK 2022 Tetap Pakai Formula UU Cipta Kerja!",serikatburuh,https://finance.detik.com/berita-ekonomi-bisnis/d-5790550/meski-ditolak-buruh-umk-2022-tetap-pakai-formula-uu-cipta-kerja?single=1,"Minggu, 31 Okt 2021 16:30 WIB"
"Sejumlah petugas kepolisian membagikan   gratis kepada massa yang menggelar aksi di sekitar Patung Kuda, Jakarta Pusat. Melalui alat pengeras suara, polisi mengingatkan bahwa Indonesia masih dalam kondisi pandemi COVID-19. ""Perhatian! Petugas kepolisian dari Polres Metro Jakarta Pusat akan mulai membagikan  . Harap jangan berebut. COVID masih ada! ganti maskernya karena tadi basah sesudah hujan,"" ucap seorang petugas kepolisian menggunakan pengeras suara di bawah jembatan penyeberangan orang (JPO) dekat Patung Kuda, Jakarta Pusat, Kamis (28/10/2021). Selain itu, tampak petugas kepolisian membagikan roti kepada massa aksi. Tak lupa, petugas petugas turut menyampaikan rasa terima kasih kepada massa karena telah menggelar aksi secara damai. ""Kita juga akan membagikan roti gratis. Tolong jangan berebut. Kita harap semua kebagian. Terima kasih dari kami Polres Metro Jakarta Pusat karena telah menggelar aksi tanpa ada aksi anarkis dan perusakan, terima kasih,"" terang petugas. Para peserta terlihat menyambut pemberian   dan roti dari polisi tersebut dengan bertepuk tangan. Mereka tampak membagikan masker tersebut kepada peserta aksi lainnya. Spanduk peringatan potensi munculnya gelombang ketiga COVID-19 terlihat terpasang di sekitar Patung Kuda, Jakarta Pusat. Spanduk dipasang di jembatan penyeberangan orang (JPO) di depan gedung Sapta Pesona. ""Potensi Munculnya Gelombang Ketiga Penyebaran COVID-19 Karena: Adanya Kerumunan dan Tidak Mentaati Prokes,"" demikian tulisan salah satu spanduk. ""Kerumunan dan Tidak Taat Prokes Berpotensi Terjadinya Gelombang Ketiga Penyebaran COVID-19,"" demikian isi spanduk lainnya. Seperti diketahui, elemen buruh dan mahasiswa dari BEM Universitas Indonesia (UI) akan menggelar aksi unjuk rasa hari ini. Setidaknya ada 1.000 massa buruh dan 200 massa BEM SI yang turun di aksi demonstrasi dalam rangka memperingati Hari Sumpah Pemuda, yang jatuh pada hari ini. ""Sekitar 1.000 dari Gebrak (Gerakan Buruh Bersama Rakyat). Kita koordinasi dengan mahasiswa. Ada sekitar 200 kalau yang dari BEM SI,"" kata Ketua Umum Kongres Aliansi Serikat Buruh Indonesia (Kasbi) Nining Elitos kepada  , Kamis (28/10).",Polisi Bagi-bagi Masker ke Massa Demo di Patung Kuda: COVID Masih Ada!,serikatburuh,https://news.detik.com/berita/d-5786779/polisi-bagi-bagi-masker-ke-massa-demo-di-patung-kuda-covid-masih-ada?single=1,"Kamis, 28 Okt 2021 16:49 WIB"
"Presiden KSPI Said Iqbal mengatakan ini ada 4 hal yang sedang diperjuangkan buruh. Di antaranya UMK (Upah Minimum Kabupaten/Kota) 2022 naik hingga 10%, batalkan atau cabut Undang-undang Omnibus Law. Kemudian, terapkan UMSK 2021-2022, serta perjanjian kerja bersama tanpa omnibus law. Dia mengatakan, seluruh serikat buruh akan bergabung dan melakukan aksi baik itu tuntutan dari buruh pabrik, buruh tani, tenaga honorer dan pekerja informal. ""Sekarang sedang marak aksi kenaikan UMK 7-10%, partai buruh akan ikut. Partai buruh menyatakan dengan serikat pekerja di seluruh Indonesia akan turun aksi sekaligus berjuang bersama. Begitu pula partai buruh dengan tegas menyatakan akan mendukung dan bersama serikat petani. Saya akan perintahkan kawan-kawan buruh pabrik ikut aksi petani dalam memperjuangkan haknya,"" kata Said, yang juga Presiden Partai Buruh, dalam konferensi pers virtual, Sabtu (30/10/2021). Said tidak menyebut secara pasti kapan buruh akan melakukan aksi lagi. Namun dia memastikan, aksi-aksi yang disebutkan tersebut merupakan aksi yang konstitusional, menghindari kekerasan, tidak melanggar ketertiban dan memperhatikan aturan PPKM. Sementara itu, Sekretaris Jenderal KSPI Ferri Nuzarli menambahkan buruh berhak untuk meminta kenaikan upah di tahun depan. Dia menilai, pertumbuhan ekonomi saat ini sudah kunjung membaik dan besaran konsumsi masyarakat pun harus ikut diperbaiki. ""Pasalnya pertumbuhan ekonomi kita bagus. Jadi layaklah masuk akal kalo kita pada situasi ini minta upah naik 7-10%. Masih masuk akal bagaimana buruh di lapangan minta upah naik. Untuk meningkatkan daya beli buruh, tahun lalu kita sudah sangat rendah ga mungkin tahun ini kita ditekan lagi sehingga daya beli kita rendah,"" katanya. Dia mengatakan pemerintah dalam menentukan UMK ini mengacu pada data BPS. Padahal sebelum-sebelumnya melihat dari survei pasar. ""Kita berharap upah ini (mengacu) Permenaker 13 dan diatur survei pasar bukan dari BPS. Sekarang semuanya menunggu data BPS. Ini udah ga benar, dan hal yang kita tolak,"" ujarnya. ""Saya selalu tekankan, tolong survei terus PP 36 itu dengan Permenaker nomor 13. Itu harus dilakukan setiap tahun agar tahu ketinggalan upah buruh berapa,"" pungkasnya.",Buruh Wanti-wanti UMK Tahun Depan Naik 10%,serikatburuh,https://finance.detik.com/berita-ekonomi-bisnis/d-5789539/buruh-wanti-wanti-umk-tahun-depan-naik-10?single=1,"Sabtu, 30 Okt 2021 16:30 WIB"
"Massa demonstran yang merupakan gabungan dari mahasiswa dan buruh berkumpul di kawasan Patung Kuda Arjuna Wiwaha, Jl Medan Merdeka Barat, Jakarta Pusat. Mereka mengklaim kepemimpinan Presiden Joko Widodo ( ) dan Wakil Presiden Ma'ruf Amin gagal. ""Dalam momentum dua tahun Jokowi-Ma'ruf menjadi pimpinan di negeri ini, kita menyimpulkan gagal mensejahterakan rakyat bangun kesatuan rakyat untuk kedaulatan rakyat,"" ujar Ketua Umum Kongres Aliansi Serikat Buruh Indonesia (KASBI) Nining Elitos saat ditemui di lokasi demo, Kamis (28/10/2021). Nining menuding para pejabat pemerintah hanya membutuhkan rakyat saat pemilihan umum (pemilu). Pasalnya, mereka membutuhkan suara rakyat untuk meraih kekuasaan. ""Kita menyimpulkan bahwa rezim hari ini, mereka butuh rakyat ketika pemilu, ketika ingin meraih kursi kekuasaan. Setelah itu, rakyat dilupakan, itulah kondisi kita saat ini,"" tuturnya. ""Di masa pandemi, seharusnya pemerintah lebih fokus bagaimana mencari jalan keluar soal pandemi, yaitu tentang persoalan agar kaum buruh tidak semakin di PHK. Tapi memaksa diri mensahkan UU Cipta Kerja yang sejak dari awal tidak dikehendaki oleh rakyat,"" sambungnya. Lebih lanjut, Nining membeberkan sejak awal rakyat sudah memberikan kritikan agar Omnibus Law tidak disahkan. Hanya, menurut Nining, Jokowi ataupun perwakilan rakyat di DPR tidak pernah mendengar, bahkan memaksa melahirkan satu regulasi yang dianggap Nining 'ugal-ugalan'. Nining turut menyayangkan pihak pemerintah yang hari ini tidak kunjung menemui mereka yang sedang berdemo. Dia menyentil pemerintah yang dianggap hanya menerima tamu 'berpakaian rapi'. ""Inilah pemerintah kita hari ini, kalau orang-orang yang bermobil mewah, berpakaian rapih, itu pasti diterima. Tapi itu sudah diperlihatkan rezim Jokowi-Ma'ruf Amin bagaimana melahirkan kebijakan  , UU Cipta Kerja bagian dari para kapital, rakyat tidak penting bagi mereka. Padahal kekuasaan yang diraih mereka hari ini dipilih oleh rakyat,"" imbuh Nining.","Pendemo Sebut Jokowi Hanya Butuh Rakyat Saat Pemilu, Setelah Itu Dilupakan",serikatburuh,https://news.detik.com/berita/d-5786761/pendemo-sebut-jokowi-hanya-butuh-rakyat-saat-pemilu-setelah-itu-dilupakan?single=1,"Kamis, 28 Okt 2021 16:42 WIB"
