artikel,judul,keyword,link,tanggal
"Setiap peringatan Hari Kesaktian Pancasila, tanggal 1 Oktober, saya selalu kangen dengan Pak De, panggilan untuk Pak A Dahlan Ranuwihardjo, mantan Ketum PB HMI 1951-1953, Ketua Dewan Pertimbangan dan Penasehat PB HMI 1963-1966. Guru, ayahanda, dan kawan berdebat. Pak Dahlan adalah pelaku sejarah agar HMI tidak dibubarkan Presiden Soekarno. Saat itu, Mas Sulastomo (Ketum PB HMI) sedang menjalankan tugas di Aceh untuk praktik sebagai calon dokter. Lalu diangkatlah Munajat Aminarto sebagai Pejabat Ketua Umum PB HMI. Sekjen PB HMI tetap, pak Mar'ie Muhammad. Praktis, yang ""banyak"" terlibat adalah Pak Dahlan dan senior lainnya, misalnya Pak Ahmad Tirto Sudiro, Pak Rajab Batubara, Pak Sanusi, dan menteri Roeslan Abdulgani. Di masa tahun 1960-an, konflik politik dan pertarungan ideologi semakin tajam. Dan Partai Komunis Indonesia (PKI) di hasil Pemilu 1955 adalah partai politik pemenang nomor 4 di DPR dengan suara 16,36% (39 kursi) dan di Badan Konstituante dengan suara 16.47% (80 kursi) setelah PNI, Masyumi, dan Partai NU. Meskipun cuma nomor empat, PKI mampu merebut hati Soekarno. Dekat dan melekat. PKI diasumsikan mampu mempengaruhi proses penetapan kebijakan negara melalui Presiden Soekarno. Eksperimentasi pemerintahan Presiden Sukarno menjadi celah bagi PKI untuk eksis dan membesar. Soekarno menetapkan kebijakan Manifesto Politik UUD 1945, Sosialisme Indonesia, Demokrasi Terpimpin, Ekonomi Terpimpin, dan Kepribadian Indonesia (Manipol Usdek) sebagai haluan negara. Lalu menggabungkan kekuatan faham Nasionalisme, Agama, Nasionalisme (Nasakom) dalam pemerintahan. Dan, menggalang kekuatan negara berkembang yang membuat poros lima negara : Jakarta, Phnom Penh, Hanoi, Pyongyang, dan Peking. Membangun kekuatan Nefos (New Emerging Forces) tahun 1962 sebagai antitesa melawan Poros Oldnefos, yaitu kekuatan negara maju yang berwatak imperialis. PKI itu nyata berkuasa. Grand design PKI menguasai Indonesia, salah satunya adalah dengan meluluh-lantakkan kekuatan (politik) Islam. Bangsa Indonesia yang relijius, harus dibabat habis dari organisasinya. Menjadi porak-poranda, hancur dari dalam. PKI dan underbownya, CGMI, Lekra, Barisan Tani Indonesia (BTI), dan organisasi setujuan: Baperki, dan lainnya, tiada henti melakukan agitasi propaganda membangun opini untuk membubarkan HMI. Berdasarkan keputusan Presiden Nomor 200/1960, tanggal 17 Agustus 1960 Partai Masyumi harus membubarkan diri. Kalau tidak, Partai Masyumi akan diumumkan sebagai 'partai terlarang'. Alasannya petinggi Masyumi terlibat pemberontakan Pemerintahan Revolusioner Republik Indonesia/ Perjuangan Rakyat Semesta (PRRI/ Permesta) di Sumatera Barat. Lalu, Partai Masyumi membubarkan diri. Dengan Kepres Nomor 139/1963, tanggal 10 Juni 1963, Gerakan Pemuda Islam Indonesia (GPII) dinyatakan bubar. Alasannya karena terlibat pengeboman presiden di Cikini, 30 November 1957 dan peristiwa penembakan presiden pada saat sholat Idul Adha di lapangan Ikada, 1962. Lalu, GPII bubar. Pelajar Islam Indonesia (PII) tidak lepas dari target gerpol PKI dan anteknya untuk dibubarkan. PII pecah (dipecah) dua: PII Menteng dan PII jalan Bungah, adalah bagian dari strategi untuk mengantisipasi jika PII Menteng dibubarkan, masih ada PII jalan Bungah. Para pengurus tidak memahami bahwa pecahnya PII adalah bagian dari strategi politik semata. Ada yang berkelahi fisik sesama pengurus. PKI nyaris berhasil menghancurkan kekuatan politik Islam. Di tingkat partai politik dan pemuda Islam sudah berhasil. PII konflik internal. Nah, tinggal penghancuran di tingkat mahasiswa dengan sasaran: HMI. Banyak peristiwa dan opini untuk mendesak agar Soekarno membubarkan HMI. Dari peristiwa Utrect di Universitas Brawijaya Cabang Jember, yang melarang HMI hidup di kampus. Lalu, CGMI dan kawan seideologi mengeluarkan HMI dari anggota Perserikatan Perhimpunan Mahasiswa Islam (PPMI). Mereka berhasil. Oktober 1964 HMI diskors dari keanggotaan PPMI. Hal ini berlanjut pada upaya terus untuk pelarangan kader HMI di Majelis Mahasiswa Indonesia (MMI) agar HMI tidak dapat menjabat di organisasi intra kampus, seperti di UI, ITB, UGM, IPB, Unpad, Unhas, USU, dan lainnya. Semua tantangan ini dihadapi pantang mundur oleh kader HMI. HMI juga difitnah sebagai anak kandung Masyumi, Islam radikal, menolak Soekarno sebagai pemimpin besar revolusi (Pembesrev), anti revolusi, antek imperialis, dan sekeranjang fitnah agar Presiden Soekarno membubarkan HMI, seperti Partai Masyumi dan GPII yang telah diperintah untuk bubar. Menghadapi situasi gawat ini, PB HMI membuka jalan ke istana. Melakukan komunikasi politik untuk memberikan informasi banding atas fitnah PKI ke Soekarno. Salah satunya melalui menteri Pak Roeslan Abdulgani, Sucipto, dan menteri Syarif Tayeb. Sampai kemudian Presiden Soekarno bersedia menjadi instruktur memberikan materi di kegiatan perkaderan HMI meningkatkan militansi yang progresif revolusioner di seluruh Indonesia. Dan HMI mengakui Presiden Soekarno sebagai Pembesrev. Tapi sebagai kompromi politiknya, HMI Cabang Jember dibekukan akibat kasus Utrect. Pak Asri Harahap (ketum cabang) marah menyalahkan PB HMI. Ya itulah kompromi politik. Mau apa lagi. Solidaritas membela HMI agar jangan dibubarkan datang dari PII dan Generasi Muda Islam (Gemuis) yang dikomandani GP Anshor, Pak Yusuf Hasyim. ""Langkahi mayatku sebelum membubarkan HMI"" dari kader PII menjadi energi yang mengobarkan semangat perjuangan kader HMI. Dari PMKRI juga membela HMI. Support moral dan politik datang juga dari petinggi ABRI/ Angkatan Darat, Jenderal Ahmad Yani. Bahkan kader HMI dilatih fisik dan teknik menggunakan senjata. Pak Yani mengatakan, ""Jika HMI hari ini diganyang oleh PKI, maka tidak mustahil, besok atau lusa PKI akan mengganyang Angkatan Darat"". Inilah puncak skenario pengganyangan HMI oleh CGMI, PKI, dan antek-anteknya. DN Aidit, ketua politbiro PKI berpidato provokatif dan memfitnah HMI. ""Kalau kalian kader CGMI tidak bisa membubarkan HMI, kalian pakai sarung saja !"", kata Aidit. Istora seakan runtuh. Gemuruh sorak-sorai menggema sambil meneriakkan yel-yel ""Bubarkan HMI"". Saat Presiden Soekarno akan berpidato, PKI berharap agar ada instruksi presiden untuk membubarkan HMI. Dalam penggalan pidatonya, Soekarno berkata, ""Jika HMI kontra revolusioner, maka HMI akan saya bubarkan"". Istora mau runtuh. Penuh pekik dan suara lantang meneriakkan bubarkan HMI. Berulang-ulang. Lalu Soekarno melanjutkan pidatonya lagi, ""Jika CGMI atau PKI kontra revolusioner, maka juga akan saya bubarkan!"". Akhirnya, strategi PKI mendesak Soekarno agar membubarkan HMI gagal total. Itulah sebagian isi buku ""Mengapa Bung Karno Tidak Membubarkan HMI?"" Oleh Pak Dahlan, dan saya sebagai editor buku (dibantu Alfan Alfian dan Sa'dun). Roeslan Abdulgani mengatakan bahwa buku ini merupakan historiografi, yang mungkin saja bersifat subyektif dari penulis. Tapi hal itu penting untuk membuka mozaik sejarah dari semua sumber. Buku ini disusun dari semasa Pak Dahlan masih hidup hingga wafat. Belum sempat diterbitkan, Pak Dahlan wafat. Lalu kami mengundang para senior mengadakan rapat untuk membahas buku ini. Ada Mar'ie Muhammad, Sulastomo, Yusuf Syakir, Solikhin, Ahmad Nurhani, Sularso, Harun Kamil, Alfan Alfian, Sa'dun. Kesimpulannya, buku ini diterbitkan. Tapi Bab I tentang Pertanggungjawaban Politik adalah Pertanggungjawaban Sejarah, dikeluarkan dari buku karena menyangkut peristiwa politik nasional yang mengungkap tokoh-tokoh yang telah wafat. Misalnya tentang Oie Tjoe Tat, Zulkifli Lubis, tokoh-tokoh Masyumi, PSi, PNI, dan lainnya. Biarlah mereka tenang di alam keabadian. Semoga Pak De Dahlan selalu damai dan berbahagia bersama kekasihnya di surga.",Niat PKI untuk Mengganyang dan Membubarkan HMI,iduladha,https://news.detik.com/kolom/d-5749316/niat-pki-untuk-mengganyang-dan-membubarkan-hmi?single=1,"Jumat, 01 Okt 2021 20:54 WIB"
"Video Ketua DPP PAN Ahmad   soal sumbangannya ke ponpes milik Gus Miftah yang menyinggung dukungan Pemilu 2024 viral di media sosial. Mumtaz Rais, yang menganggap dirinya 'Bang Jago', tak heran jika videonya itu viral. Putra Amien Rais itu membuat video berdurasi 45 detik yang ditujukan kepada Pondok Pesantren (Ponpes) Ora Aji, Sleman, DIY, milik Gus Miftah. Dalam video itu, Mumtaz, yang menyebut dirinya Bang Jago, awalnya mendoakan agar jemaah dakwah Gus Miftah mewabah, lalu memberikan bantuan Rp 100 juta. ""Terkait ramai-ramai soal video viral itu sejatinya apa yang dilakukan bang jago itu viral, terkait itu atau terkait ini atau terkait sana, terkait sini, yang mana-mana pasti viral, bang jago main gitar viral, main drum viral, nangis mendengar kabar bahwa Ketua DPW PAN Papua meninggal viral, pidato pembukaan tanpa teks tanpa   viral,"" kata Mumtaz kepada wartawan, Rabu (6/10/2021). Masih di dalam video yang sama, Mumtaz juga menyinggung soal Pemilu 2024. Ia secara terang-terangan meminta agar jemaah Gus Miftah mendukungnya. Di akhir video, Mumtaz mengancam akan menghentikan sumbangan ke Ponpes Ora Aji jika tidak memilihnya dalam Pemilu 2024. Adik kandung Hanafi Rais ini menganggap apa pun yang viral dari dirinya sudah biasa. Mumtaz tidak heran lagi dengan keviralannya itu, termasuk soal sumbangan ke ponpes Gus Miftah dan dukungan Pemilu 2024. ""Jadi buat bang jago itu biasa, bang jago  solat viral, terakhir bang jago makan sama Pak RK viral. Jadi viral itu sudah keseharian bang jago, tahu nggak. Kembali ke yang sumbangan tadi, jadi ya begitulah jadi   viral, main bola viral, main gitar viral,"" lanjut dia. Sementara itu, Waketum PAN Viva Yoga mengatakan kegiatan Mumtaz Rais menyumbang dan meminta dukungan untuk Pemilu 2024 hanya guyonan. Viva mengatakan keduanya memang memiliki hubungan dekat. ""Hubungan Mumtaz Rais dan Gus Miftah sudah seperti saudara, adik-kakak. Keduanya suka humor, bercanda, berdebat, dan sama-sama memiliki kepedulian terhadap masyarakat,"" ujarnya. Jubir PAN itu menilai kedekatan antara Mumtaz dan Gus Miftah seperti tidak ada batasan. Untuk itu, dia menyebut ekspresi Mumtaz ke Gus Miftah hanya sekadar candaan. ""Ekspresi Mumtaz Rais adalah sikap sebagai saudara tanpa pembatas. Tak ada sikap melecehkan atau merendahkan Gus Miftah,"" ujarnya. ""Itu ekspresi guyonan atau gojekan Mumtaz dan Gus Miftah yang terasa  ,"" lanjut Viva. Miftah Maulana Habiburrahman atau Gus Miftah sendiri mengatakan video tersebut jelas diambil tanpa persetujuan dari pihak Ponpes Ora Aji. Ia pun tidak mau ambil pusing dengan hal tersebut. ""Ya saya pikir begini, kalau ada video seperti itu, jelas kontennya di luar persetujuan kami sebagai pihak pondok. Kalau kemudian beliau   seperti itu, ya silakan saja. Mau disetop atau tidak, nggak ada urusan kok, makanya kami juga tidak ambil pusing,"" kata Gus Miftah saat dihubungi wartawan, Selasa (5/10). ""Kalau dia mau   orang ulang tahun, ya silakan saja, siapa pun boleh. Tapi bukan donasi, namanya donasi itu kan donasi ke pondok. Kita nggak ada donatur. Kalau dia   (saat) ulang tahun,  . Tapi pakai  itu ya  saja,"" sambungnya. Gus Miftah mengatakan selama ini banyak orang yang menyumbang ke ponpesnya. Akan tetapi tidak pernah ada yang menyumbang dengan embel-embel harus mendukung satu pihak. ""Mohon maaf, teman saya   dari itu saja banyak dan  . Dan nggak ada syarat apa-apa. Banyak yang kemudian tahu perjuangan saya,   santri semua saya gratiskan. Kemudian mereka   itu biasa dan tanpa syarat apa pun,"" tegasnya. Gus Miftah juga menekankan Ponpes Ora Aji tidak bisa dibeli politikus mana pun walaupun mereka pernah menyumbang Ponpes Ora Aji. ""Lah memangnya Ora Aji itu (sumbangannya) dari dia? Kan nggak juga to? Kalau kemudian ada orang   sebagai donatur, ya alhamdulillah, silakan menyumbang. Tapi kalau menyetop, katakanlah secara politik harus memilih seseorang atau saya   kalau milih siapa   bahasanya  , (Ponpes) Ora Aji  ! (tidak dijual),"" tegasnya. Selama ini, kata Gus Miftah, Mumtaz Rais tidak rutin menyumbang. Hanya pada momen-momen tertentu saja, seperti Idul Adha. ""Nggak, biasa-biasa saja. Kalau ada kepentingan, misalnya Idul Adha, kurban itu biasa to, yang kurban juga tidak hanya dia. Ya kan kalau dia kurban itu sering aku sebutkan. Misalnya kalau yang kurban Pak Menteri atau siapa, semuanya saya sebutkan,"" ucapnya.",Mumtaz si Bang Jago Viral karena Video 'Beli' Suara Gus Miftah,iduladha,https://news.detik.com/berita/d-5756278/mumtaz-si-bang-jago-viral-karena-video-beli-suara-gus-miftah?single=1,"Kamis, 07 Okt 2021 07:00 WIB"
"Warga Desa Talangkembar, Montong, Tuban, sempat menyegel pintu gerbang balai desa pada Jumat (1/10). Penyegelan dilakukan sebagai bentuk protes menyikapi salah satu   (kasun) yang diduga telah berselingkuh. Kepala dusun yang dimaksud adalah Slamet Idul Adha, Kepala Dusun Kenthi. Kini Slamet melaporkan warga yang sempat mendemo dirinya. Slamet juga melaporkan Kepala Desa Talangkembar, Kurniali. Laporan pengaduan dilayangkan Slamet ke Polres Tuban pada Kamis (7/10). Ada 9 nama orang yang dilaporkan yakni warga, perangkat desa, dan Kades Kurniali. ""Iya ada sembilan orang yang saya laporkan ke Polres Tuban. Salah satunya pak kades."" ujar Slamet kepada detikcom, Senin (11/10/2021). Slamet melaporkan 9 orang itu dengan dugaan penghasutan sesuai dengan pasal 160 KUHP. Selain itu juga karena diduga melakukan pembiaran menggelar aksi demo di balai desa setempat tanpa adanya surat pemberitahuan kepada pihak berwajib. Karena ada unjuk rasa dengan menyegel pintu gerbang balai desa Talangkembar sehingga mengakibatkan pelayanan desa terganggu. ""Dugaannya penghasutan, pasal 160 KUHP. Dan demo tanpa pemberitahuan serta Kades tidak melakukan keputusan penetapan PTUN,"" kata Slamet. Selain itu, Slamet juga mengatakan bahwa kasus dugaan  yang dituduhkan kepadanya tidak terbukti. Surat Pemberitahuan Perkembangan Hasil Penyidikan (SP2HP) menerangkan hasil gelar perkara yang menyimpulkan bahwa perkara perzinaannya belum cukup bukti. Slamet menambahkan karena tidak cukup bukyi, maka kasusnya tidak bisa dinaikkan statusnya dari penyelidikan ke penyidikan. ""Berdasarkan SP2HP yang disampaikan Satreskrim Polres Tuban tertanggal 21 Januari 2021, tidak cukup bukti sehingga dihentikan,"" imbuh Slamet. Sementara itu, Heri Subagyo, penasehat hukum Slamet mengatakan bahwa Kades Talangkembar bersama delapan warga desa setempat diduga telah menghalang-halangi pelaksanaan penetapan pengadilan dengan nomor nomor 130/G/2021/PTUN.Sby tanggal 23 September 2021. Salah satu poin dalam penetapan pengadilan itu adalah mewajibkan tergugat untuk menunda pelaksanaan keputusan objek sengketa yakni Surat Keputusan Kades Talangkembar nomor 188.45/1/KPTS/414.410.05/2021 tanggal 28 Januari 2021 tentang pemberhentian perangkat Desa Talangkembar atas nama Slamet Idul Adha, jabatan Kepala Dusun Kenti. ""Kepala desa salah satu tergugat. Seyogyanya menghormati dan melaksanakan penetapan PTUN Sebagaimana tertuang dalam penetapan ini,"" terang Heri. Heri menuturkan apabila Kades Talangkembar menolak penetapan PTUN Surabaya, maka perbuatan itu merupakan bentuk pelanggaran terhadap perintah pengadilan berdasarkan Undang-Undang yang berlaku. Kemudian imbasnya dimungkinkan akan timbul tuntutan hukum lagi. ""Kita berharap semua menghormati proses hukum yang berjalan, termasuk melaksanakan penetapan pengadilan,"" Jelas Heri Subagyo. Sementara itu, Kades Talangkembar Kurniali mengatakan dirinya hingga saat ini belum mendengar adanya pelaporan ke polisi terkait dirinya dan beberapa warga lainnya usai terjadinya unjuk rasa. ""Saya belum dengar secara resmi, saya juga belum terima surat, malah saya dengar itu karena baca media,"" terang Kurniali. Kurniali menuturkan jika proses pemberhentian Slamet telah sesuai aturan dan mekanisme yang berlaku. ""Jadi pemberhentian pak Wo itu sudah sesuai mekanisme dan aturan. Mulai musdes yang dihadiri para BPD, Perangkat Desa, Tokoh masyarakat dan agama hingga rekomendasi dari camat telah dilalui sehingga terbit SK,"" kata Kurniali. Slamet sendiri mendapat tuduhan dari warga telah melakukan perselingkuhan atau zina terhadap istri warga yang ditinggal suaminya. Saat itu Slamet diketahui warga masuk ke rumah seorang perempuan yang ditinggal suaminya. Beberapa warga Dusun Kenti yang mengetahui hal itu langsung menggerebeknya. ""Peristiwa ini sudah sejak bulan Januari lalu. Saat digrebek oleh warga, oknum  hanya pakai celana pendek. Banyak warga yang ikut grebek, termasuk suami dari wanita tersebut "" jelas Kasmidi (40), salah satu warga desa Talangkembar.",Kepala Dusun di Tuban Ini Laporkan Warga yang Demo Dirinya Soal Perselingkuhan,iduladha,https://news.detik.com/berita-jawa-timur/d-5761991/kepala-dusun-di-tuban-ini-laporkan-warga-yang-demo-dirinya-soal-perselingkuhan?single=1,"Senin, 11 Okt 2021 14:34 WIB"
"Video Ketua DPP PAN Bidang Pengembangan Organisasi dan Keanggotaan (POK)  soal sumbangannya ke ponpes milik   viral di media sosial.   menyinggung sumbangannya dengan dukungan Pemilu 2024. Putra Amien Rais itu membuat video berdurasi 45 detik yang ditujukan untuk  , Sleman, DIY, milik Gus Miftah. Dalam video tersebut,   yang menyebut dirinya Bang Jago awalnya mendoakan agar jemaah Kinthiliyah (sebutan untuk jemaah dakwah Gus Miftah) mewabah. Ia kemudian memberikan bantuan sebesar Rp 100 juta. ""Bang Jago nggak banyak bicara. Bang Jago langsung aksi bukan teori. Menyumbang uang tunai sebesar Rp 100 juta rupiah untuk semua Kinthiliyah. Mantap,"" ujar Mumtaz dalam video yang viral di media sosial Twitter, dikutip Selasa (5/10/2021). Masih di dalam video, Mumtaz juga menyinggung soal  . Ia secara terang-terangan meminta agar jemaah Kinthiliyah mendukungnya. ""Gus, ingat pemilu 2024. Jangan jual DPR RI dari partai lain. Tunggal, Mumtaz Rais. Jangan Kamto, jangan Kamta, jangan Mbah Badri, jangan Gandung, jangan yang lain-lain,"" lanjut Mumtaz. Di akhir video, Mumtaz mengancam akan menghentikan sumbangan ke Ponpes Ora Aji jika tidak memilihnya dalam Pemilu 2024. ""Kalau nggak saya setop sumbangan ke Ponpes Ora Aji. I Love you full, full Gusku,"" pungkas Mumtaz. Sementara itu, Miftah Maulana Habiburrahman atau   mengatakan video tersebut jelas diambil tanpa persetujuan dari pihak Ponpes Ora Aji. Ia pun tidak mau ambil pusing dengan hal tersebut. ""Ya saya pikir begini, kalau ada video seperti itu jelas kontennya di luar persetujuan kami sebagai pihak pondok. Kalau kemudian beliau ngomong seperti itu ya silakan saja. Mau disetop atau tidak nggak ada urusan kok, makanya kami juga tidak ambil pusing,"" kata Gus Miftah saat dihubungi wartawan, Selasa (5/10). ""Kalau dia mau nyumbang orang ulang tahun ya silakan saja, siapa pun boleh. Tapi bukan donasi, namanya donasi itu kan donasi ke pondok. Kita nggak ada donatur. Kalau dia ngasih (saat) ulang tahun, ngasih nyumbang. Tapi pakai ngancam-ngancam itu ya biarin saja,"" sambungnya. Gus Miftah mengatakan, jika selama ini banyak orang yang menyumbang ke ponpesnya. Akan tetapi, tidak pernah ada yang menyumbang dengan embel-embel harus mendukung satu pihak. ""Mohon maaf, teman saya nyumbang dari itu saja banyak dan silent. Dan nggak ada syarat apa-apa. Banyak yang kemudian tahu perjuangan saya, ngurusi santri semua saya gratiskan. Kemudian mereka ngasih itu biasa dan tanpa syarat apapun,"" tegasnya. Gus Miftah juga menekankan jika Ponpes Ora Aji tidak bisa dibeli politikus manapun. Walaupun mereka pernah menyumbang Ponpes Ora Aji. ""Lah memangnya Ora Aji itu (sumbangannya) dari dia? Kan nggak juga to? Kalau kemudian ada orang ngaku-ngaku sebagai donatur ya alhamdulillah silakan menyumbang. Tapi kalau menyetop katakan lah secara politik harus memilih seseorang, atau saya nyumbang kalau milih siapa gitu. Bahasanya gini, (Ponpes) Ora Aji   (tidak dijual),"" tegasnya. Selama ini, kata Gus Miftah, Mumtaz Rais tidak rutin menyumbang. Hanya pada momen-momen tertentu saja seperti Idul Adha. ""Enggak biasa-biasa saja. Kalau ada kepentingan, misalnya Idul Adha, kurban itu biasa to, yang kurban juga tidak hanya dia. Ya kan kalau dia kurban itu sering aku sebutkan. Misalnya kalau yang kurban pak Menteri, atau siapa, semuanya saya sebutkan,"" ucapnya. Menurutnya, ia tidak akan mengambil langkah hukum. Ia membiarkan publik dan jemaahnya untuk menilai. ""Kan kita nggak ada urusan orang yang bikin bukan kita. Biarkan masyarakat yang menilai. Jemaah yang menilai,"" pungkasnya.",Viral Mumtaz Rais Sumbang Ponpes Gus Miftah-Minta Dukungan Pemilu 2024,iduladha,https://news.detik.com/berita-jawa-tengah/d-5754371/viral-mumtaz-rais-sumbang-ponpes-gus-miftah-minta-dukungan-pemilu-2024?single=1,"Selasa, 05 Okt 2021 19:58 WIB"
