artikel,judul,keyword,link,tanggal
"Pemerintah memutuskan meniadakan cuti bersama untuk libur nasional Natal dan tahun baru. Demi mencegah melonjaknya lagi kasus positif corona, ada indikasi pemerintah bakal menerapkan pembatasan perjalanan lagi. Dikutip dari detiknews, keputusan penghapusan cuti bersama Natal dan tahun baru termuat dalam Surat Keputusan Bersama Tiga Menteri. SKB Menteri Agama, Menteri Ketenagakerjaan, serta Menteri Pendayagunaan Aparatur Negara dan Reformasi BirokrasiSKB tersebut bernomor 712 Tahun 2021, Nomor 1 Tahun 2021, serta Nomor 3 Tahun 2021 tentang Hari libur Nasional dan Cuti Bersama 2021 Penghapusan cuti bersama pada dua hari libur akhir tahun tersebut merupakan upaya pemerintah mencegah peningkatan mobiltas masyarakat. Dikhawatirkan akan banyak orang mengambil libur panjang dan kemudian memanfaatkannya untuk berlibur atau pulang kampung. Dengan dihapuskannya cuti bersama tersebut, apakah pemerintah akan membatasi pergerakan dan perjalanan orang sebagaimana diterapkan pada Idul Fitri lalu? ""Kemungkinan besar akan kami atur secara ketat seperti tahun lalu, jangan dicurigai macam-macam, ini demi keselamatan dan kemaslahatan masyarakat Indonesia,"" kata Menteri Koordinator Bidang Pembangunan Manusia dan Kebudayaan (Menko PMK) Muhadjir Effendy, dikutip dari Antara. ""Walaupun sekarang kasus COVID-19 sudah landai dan turun, tidak boleh kemudian kita lengah, harus tetap waspada tinggi. Nataru ini kalau kita los tanpa ada pembatasan atau aturan, biasanya diikuti dengan pergerakan orang besar-besaran dari satu tempat ke tempat yang lain, kemudian pasti akan dibarengi dengan kasus COVID-19,"" lanjut dia. Sehari sebelumnya, Selasa (26/10), Menteri Perhubungan (Menhub) Budi Karya Sumadi mengungkapkan rencana pemerintah untuk melakukan pengendalian mobilitas masyarakat dan pengetatan protokol kesehatan. Itu dilakukan untuk mencegah terjadinya lonjakan kasus COVID-19, usai masa libur Natal 2021 dan Tahun Baru 2022. ""Semua pihak harus belajar dari negara-negara lain yakni Tiongkok, Inggris, Jerman dan beberapa negara lainnya, yang mengalami gelombang ketiga kasus COVID-19. Saya harap seluruh pemangku kepentingan dapat bersama-sama kompak menjaga kondisi yang sudah mulai membaik ini,""  papar Budi Karya. ""Saya mendorong agar ramp check pada seluruh moda dapat dilakukan. Tidak hanya pengecekan kelaikan sarana, tetapi juga pengecekan kondisi kesehatan awak transportasinya,"" sambung dia.","Cuti Bersama Natal-Tahun Baru Dihapus, Bakal Ada Penyekatan Perjalanan Lagi?",idulfitri,https://oto.detik.com/berita/d-5785513/cuti-bersama-natal-tahun-baru-dihapus-bakal-ada-penyekatan-perjalanan-lagi?single=1,"Rabu, 27 Okt 2021 19:55 WIB"
"Berkat kemampuan dan konsisten untuk mencapai hasil yang maksimal, Raisa Martika Tamara menyumbangkan medali emas di PON XX 2021 PAPUA untuk Kontingen Jawa Barat. Pencapaiannya itu sekaligus memantapkan Posisi #JABARJUARA di Peringkat 1. Tim Hockey Indoor Provinsi Jawa Barat, Raisa Martika Tamara dan Siti Anisa berhasil meraih kemenangan ketika melawan Papua Barat dengan skor 6-0. Kemenangan kembali diraih saat melawan tim Hockey Indoor Jawa Tengah dengan skor 1-0. Raisa bersama timnya pun mendapatkan medali emas di PON XX 2021 PAPUA. Seperti apa sosok Raisa Martika Tamara yang merupakan atlet hockey berhijab asal Jawa Barat? Wolipop berbincang dengan atlet peraih medali emas PON Papua 2021 ini. Raisa sudah tertarik pada dunia olahraga sejak duduk di bangku Sekolah Dasar. Dia awalnya mengikuti ekstrakulikuler basket. ""Aku hanya ikut kurang lebih satu tahun karena basket banyak saingannya, susah untuk berkembang. Lalu aku 'dipaksa' oleh orangtua mengikuti olahraga hockey pada tahun 2005. Saya sampai nangis-nangis nggak mau dan diantar ke tempat latihan,"" ujarnya. Raisa tidak mau latihan karena tempat latihannya sangat jauh dari kota Cianjur. ""Apalagi latihannya sangat capek karena jogging sering ke gunung hampir tiap minggunya,"" tuturnya. ""Sampai akhirnya aku sendiri jatuh hati pada olahraga ini ketika melihat ada beberapa senior yang kepanggil untuk mengikuti PON pada waktu itu. Dari situ aku serius dan memakai hati dalam berlatih, sampai akhirnya aku masuk tim inti kabupaten Cianjur pertama kali ikut pertandingan besar waktu itu PORDA (pekan olahraga daerah) 2006 di Karawang,"" lanjut Raisa. Dari sertifikat PORDA tersebut, ia bisa masuk jalur prestasi ke SMANSA 1 Cianjur. Dan pencapaiannya terus berlanjut hingga dia diterima di Universitas Pendidikan (UPI) Bandung, Jawa Barat melalui jalur PMDK. Wanita 29 tahun itu menceritakan jika yang pertama kali memperkenalkan olahraga hoki adalah guru senamnya, ibu Yeni. Gurunya tersebut yang kemudian memperkenalkannya pada seorang pelatih hockey. ""Beliau yang memperkenalkan guru atau pelatih hoki di SMAN 1 Warungkondang yakni pak Yuyun Rahayu. Beliau lah yang mengajarkan saya dari 0 hingga saat ini,"" ucapnya. Raisa juga menuturkan kedua orangtuanya mendukung pilihannya. Ayahnya wiraswasta menjual karpet. Sang ibu pensiun sejak Oktober 2021 sebagai Kepala SMAN 1 Sukaresmi, Kabupaten, Jawa Barat. Raisa mengungkapkan suka dan duka menjalani olahraga hockey. Klik halaman selanjutnya.... Setelah awalnya merasa berat menjalani latihan hockey, Raisa perlahan menyukai olahraga tersebut. Apalagi dia mendapatkan banyak teman baru karena hockey merupakan olahraga tim. ""Jadi karena setiap hari bareng-bareng mereka sudah seperti keluarga kedua aja gitu rasanya "" tuturnya. Namun dibalik itu, ia harus mengorbankan waktunya dan hari libur besar lainnya. Hari-harinya harus dihabiskannya di lapangan hockey untuk berlatih. ""Kita jadi jarang kumpul bareng sama keluarga besar, kaya momen Idul Fitri, Idul Adha, tahun baru atau libur panjang lainnya kita menghabiskan waktu di lapangan seperti try out luar negeri atau luar kota,"" lanjutnya. Dengan segala perjuangannya Raisa pun merasa mendapatkan medali emas merupakan pengalaman paling berkesan. Dia pun berterimakasih pada pelatihnya atas pencapaiannya tersebut. ""Aku mendapatkan medali emas karena kepercayaan terbesar ada di pelatih asing aku dia bernama Muhammad Dharma Raj. Karena beliau lah aku berada di titik sekarang. Pelatih yang bisa membuat atletnya berubah menjadi jauh lebih baik, pelatih yang menekankan atletnya percaya pada diri sendiri,"" ujar Raisa. Pengalaman berkesan lainnya selama menjadi atlet hockey adalah pada2014 ketika ia terpilih oleh pelatihnya di UPI yaitu Uwa Salmon Firarqie. Dia ikut menjadi bagian dari tim yang bermain ajang international di UPSI Malaysia. ""Beliau salah satu pelatih yang bisa mengajarkan saya dasar yang betul bermain hoki, bermain yang menggunakan otak bukan kekerasan, bermain yang menggunakan tehnik tinggi untuk menghindari lawan,"" lanjutnya. Pada masa pandemi Corona ini pun Raisa mendapatkan pengalaman berkesan. Dia dan rekan-rekan timnya serta pelatih mereka terpapar virus Corona. ""Selama sebulan full kita tidak ke mana-mana dan tidak beraktivitas ke luar gedung. Mungkin itu yang membuat kita kuat sampai sekarang. Karena kebersamaan itu yang melekat pada diri kita,"" kenang Raisa. Raisa mengetahui akan mengikuti PON PAPUA pada 2018. Saat itu sebelum PON ada BK PON di Jatinangor, Jawa Barat dan PORDA. ""Ketika pertama kali menginjak tanah Papua pun hati saya bergetar, melihat keindahan alam dan seisinya. Saya Cinta Timur Indonesia. Kalau bukan karena PON PAPUA mungkin saya tidak bisa menginjakan kaki saya di tanah Papua,"" lanjutnya lagi. Raisa menjelaskan detik-detik saat ia mendapatkan medali emas. ""Setelah hone atau pluit wasit terakhir ditiup usai akhir pertandingan. Saya lemas sekujur tubuh dan langsung sujud bersyukur kepada Allah 'akhirnya yang saya nanti-nantikan dan impikan terwujud.' Lelah cape stres saya tergantikan oleh kemenangan pada final kemarin melawan DKI Jakarta,"" tuturnya. Bagi kamu yang ingin menjadi atlet hockey, Raisa berbagi pesannya. Menurutnya kamu harus bisa memanfaatkan kesempatan. ""Kesempatan itu datang berkali-kali, tapi bagaimana kita menggunakan kesempatan itu sebaik mungkin. Maka dari itu jangan hilangkan kesempatan itu dengan mudah. Butuh kerja keras dan mental yang kuat untuk mendapatkan kesempatan itu,"" tutupnya. 1. Juara II Putri Hockey Indoor 2010 Kejuaraan Piala Menegpora, Jakarta 2. Juara I Putri Hockey Field 2010 Liga Hockey Jawa Barat, Bandung 3. Juara III Putri Hockey Field 2011 Liga Hockey Mahasiswa Nasional, Jakarta 4. Juara II Putri Hockey Field 2011 UNPAD, Bandung 5. Peserta Putri Hockey Indoor 2011 Indonesian Open, International Cibubur 6. Juara III Putri Hockey Indoor 2011 Kejurnas Piala Menegpora, Jakarta 7. Juara II Putri Hockey Indoor 2011 Kejurnas ITB, Bandung 8. Peserta Kejurbar Bola Tangan 2012 se-Kawa Barat, Bandung 9. Panitia Pelaksana Pertandingan Hockey Indoor Sukmalindo (Indonesia-Malaysia) 2013, Bandung 10. Juara II Putri Hockey Indoor 2013 UPSI Kejuaraan Internasional, Malaysia 11. Juara II Putri Hockey Indoor 2013 Kejuaraan ISTN, Jakarta 12. Juara III Putri Hockey Indoor 2013 Kejurnas ITB, Bandung 13. Juara I Putri Hockey Field 2014 Kejuaraan UNY, Yogyakarta 14. Juara II Putri Hockey Indoor 2014 Kejurnas Piala Menegpora, Jakarta 15. Juara II Putri Hockey Indoor 2014, Kejurnas, Jakarta 16. Juara I Putri Hockey Indoor 2015 IHRPT Nasional, Cimahi 17. Juara III Putri Hockey Indoor 2016, PON, Bandung 18. Juara III Putri Hockey Field 2017, Kejurnas, Jakarta 19. Juara I Putri Hockey Indoor 2018, Festival Cervo Hockey, se-Jawa Barat, Bandung 20. Juara I kategori Hockey Mix 2018, KHRPT Nasional, Bandung 21. Juara III Putri Hockey Indoor 2018 Kejurnas, Cimahi 22. Juara II Putri Hockey Indoor 2019 Kejurda Hockey Indoor Piala Gubernur, Bandung 23. Juara III Putri Hockey Indoor 2019 BK PON, Bamdung 24. Juara I Putri Hockey Indoor 2021 PON PAPUA, Papua 25. Juara III Putri Hockey Field 2018 Pekan Olahraga Daerah se-Jawa Barat, Bogor 26. Peserta PORDA 2014, Bekasi 27. Peserta PORDA 2010, Karawang",,idulfitri,https://wolipop.detik.com/hijab-profile/d-5771725/ini-raisa-martika-tamara-atlet-hockey-hijab-peraih-medali-emas-pon-papua?single=1,"Senin, 18 Okt 2021 10:30 WIB"
"Menjelang libur Natal dan Tahun Baru, sejumlah pihak mewanti-wanti risiko   di RI akibat tingginya mobilitas masyarakat. Lonjakan kasus COVID-19 sebelumnya disebut-sebut terjadi pasca libur Idul Fitri. Lantas, akankah   diperketat kembali? Menjawab itu, Karopenmas Divisi Humas Polri Brigjen Pol Rusdi Hartono menyebut hingga kini belum ada kepastian soal aturan pembatasan mobilitas di momen Natal dan Tahun Baru mendatang. Namun ia menegaskan, pemerintah telah meniadakan cuti bersama dibarengi persiapan perayaan momen Tahun Baru. ""Apabila kita bicara Tahun Baru, sudah ada kebijakan pemerintah bahwa masalah cuti bersama, libur bersama, itu ditiadakan. Kemudian pembatasan daripada bepergian Aparatur Sipil Negara ini sudah jelas,"" ujarnya dalam diskusi daring, Kamis (29/10/2021). ""Karena kita belajar dari penambahan angka   pasca perayaan Idul Fitri kemarin. Ini tentunya perlu kita cermati bersama, pemerintah telah mengurangi kegiatan-kegiatan masalah Tahun Baru ini sudah disosialisasikan untuk bisa bagaimana kegiatan-kegiatan Tahun Baru ini dapat berjalan tanpa meningkatnya angka penularan COVID-19,"" sambung Rusdi. Rusdi menambahkan, pihaknya kini masih menunggu kebijakan dari pemerintah terkait peraturan perayaan Natal dan Tahun Baru. ""Kita masih menunggu bagaimana kebijakan pemerintah tentang libur Natal dan Tahun baru. Apakah perayaan Tahun Baru ini diperbolehkan atau tidak, tentunya kita masih menunggu kebijakan pemerintah,"" pungkasnya.",,idulfitri,https://health.detik.com/berita-detikhealth/d-5786244/prediksi-lonjakan-covid-19-akhir-tahun-menguat-ppkm-bakal-diperketat-lagi?single=1,"Kamis, 28 Okt 2021 12:40 WIB"
"Seorang perempuan bernama Liswati menangis histeris saat 32 orang dari kantor    , PT Indo Tekno Nusantara (ITN), diamankan oleh pihak kepolisian. Tangisnya disebabkan anaknya turut serta dibawa ke Polda Metro Jaya. Yang ditangisi Liswati adalah Ade Afifah, yang merupakan anak pertamanya. Liswati menuturkan sebelumnya anaknya menganggur cukup lama sebelum bekerja di perusahaan ni. Perempuan berkerudung merah jambu ini menangis karena khawatir anaknya akan dipenjara dan tidak pulang-pulang ke rumah. Sejumlah wartawan mencoba menenangkannya, tetapi Lisnawati tak berhenti menangis. Diketahui, Ditkrimsus Polda Metro Jaya melakukan penggerebekan di kawasan perumahan elite Kota Tangerang. Tempat tersebut dijadikan kantor  dari 13 aplikasi , yang sepuluh di antaranya ilegal. Dari penggerebekan tersebut diamankan 32 orang ke Polda Metro Jaya untuk dimintai keterangan lebih lanjut. Liswati tahu dari anaknya bahwa kantornya digerebek polisi. ""Anak saya nelpon dari pagi katanya di kantornya ada polisi. Saya udah kalang kabut dari pagi saya nangis,"" katanya kepada wartawan di lokasi, Kamis (14/10/2021). Menjelang Lebaran Idul Fitri lalu, Ade Afifah sudah tidak memiliki pekerjaan. Anak Liswati ini baru kembali bekerja pada 7 September 2021 di perusahaan   pinjol ini. Liswati mengaku dirinyalah yang mencarikan pekerjaan untuk anaknya. Sebelumnya Ade Afifah ingin bekerja di Bekasi tapi tidak diizinkan Liswati. ""Saya pagi-pagi cari lowongan pekerjaan awalnya di sini tutup. Setelahnya ada yang mengabarkan lagi   buka terus daftar di sini sebagai  . Di-  dulu sebelum bekerja di sini,"" tambah Liswati. Ade Afifah baru menerima gaji sebesar Rp 1,4 juta dari 14 hari pertama dirinya bekerja. Menurut Liswati, anaknya menangis menerima gaji tersebut karena jam kerjanya mencapai 10,5 jam per hari. Liswati merupakan warga Kecamatan Cipondoh, Kota Tangerang. ""Anak saya   juga terkait jam kerjanya, kata dia kerja dari pukul 08.30 sampai pukul 19.00 tapi kok aku gajian segini doang, nggak bisa bayar kontrakan rumah. Saya minta untuk sabar, eh dilanjut sama dia kerjanya sampai sekarang,"" ujarnya. Gaji Ade Afifah bulan lalu diberikan kepada Liswati sebesar Rp 800 ribu untuk keperluan sehari-hari. Karena hal ini, dia terpaksa belum bisa membayar sewa kontrakannya bulan lalu. Liswati tidak mengetahui gaji sebesar itu akan bertambah atau tidak jika anaknya sudah bekerja selama satu bulan penuh. ""Anak saya belum berkeluarga. Eh sampai sekarang kerja   gaji bulan ini eh malah kayak ,"" ucapnya sambil sesenggukan.","Ibu Ini Menangis, Anaknya Pekerja Pinjol Tangerang Dibawa Polisi",idulfitri,https://news.detik.com/berita/d-5767161/ibu-ini-menangis-anaknya-pekerja-pinjol-tangerang-dibawa-polisi?single=1,"Kamis, 14 Okt 2021 17:41 WIB"
"Kisah penderitaan akibat  tidak hanya dirasakan oleh masyarakat yang meminjam uang dari aplikasi pinjol itu sendiri. Pekerjanya juga 'menderita' dengan  mereka juga bekerja lebih dari 8 jam per hari. Seperti yang dialami oleh Ade Afifah, pekerja di kantor PT Indo Tekno Nusantara, perusahaan collector pinjol yang berlokasi di Rukan Crwon Green Lake City, Cipondoh, Tangerang. Jam kerja dan upah yang diterima Ade Afifah ini diungkap oleh ibundanya, Liswati. ""Anak saya nangis juga terkait jam kerjanya, kata dia kerja dari pukul 08.30 WIB sampai pukul 19.00 WIB tapi kok aku gajian segini doang,"" kata Liswati di Tangerang, Kamis (15/10/2021). Menurut Liswati, anaknya yang bekerja sebagai telemarketing PT ITN itu  . Setiap bulan ia tidak menyisihkan uang karena hampir separuh gajinya habis untuk bayar kontrakan sebesar Rp 800 ribu. ""Nggak bisa bayar kontrakan rumah. Saya minta untuk sabar, eh dilanjut sama dia kerjanya sampai sekarang,"" ujarnya. Liswati tidak mengetahui gaji sebesar itu akan bertambah atau tidak jika anaknya sudah bekerja selama satu bulan penuh. ""Anak saya belum berkeluarga. Eh sampai sekarang kerja  gaji bulan ini eh malah kayak  ,"" ucapnya sambil sesenggukan. Liswati mengatakan anaknya menerima bekerja di perusahaan pinjol walau   karena sudah menganggur sejak Lebaran Idul Fitri lalu. Ade Afifah sendiri bekerja sejak 7 September 2021. Liswati mengaku dialah yang mencarikan pekerjaan untuk anaknya. Sebelumnya, Ade Afifah ingin bekerja di Bekasi tapi tidak diizinkan Liswati. ""Saya pagi-pagi cari lowongan pekerjaan awalnya di sini tutup. Setelahnya, ada yang mengabarkan lagi   buka terus daftar di sini sebagai  . Di-  dulu sebelum bekerja di sini,"" tambah Liswati. Sebelumnya, Liswati datang ke kantor ITN saat digerebek polisi pada Kamis (14/10) kemarin. Liswati menangis karena khawatir anaknya ditahan polisi. ""Anak saya   dari pagi katanya di kantornya ada polisi. Saya udah kalang kabut dari pagi saya nangis,"" katanya kepada wartawan di lokasi, Kamis (14/10/2021).","Pekerja Pinjol Kerja Hampir 11 Jam Per Hari, Gaji Cuma Rp 1,4 Juta",idulfitri,https://news.detik.com/berita/d-5768199/pekerja-pinjol-kerja-hampir-11-jam-per-hari-gaji-cuma-rp-14-juta?single=1,"Jumat, 15 Okt 2021 12:47 WIB"
"Penggerebekan sejumlah kantor  di Jakarta, Tangerang hingga Sleman, menguak fakta lain soal rentenir gaya baru ini. Salah satunya menyangkut gaji karyawan pinjol itu sendiri. Seperti diketahui, jajaran kepolisian tengah gencar melakukan penindakan terhadap keberadaan pinjol ilegal yang menjamur. Arahan tegas Presiden Joko Widodo untuk menindak pinjol yang mencekik masyarakat ditindaklanjuti dengan serius oleh jajaran kepolisian. Kurang dari sepekan terakhir ini, jajaran kepolisian telah mengamankan ratusan orang karyawan   di beberapa tempat. Bareskrim Polri sendiri mengungkap adanya 371 laporan terkait jaringan pinjol ilegal. Dari pengungkapan kasus pinjol ilegal ini, terungkap besaran gaji para karyawan. Ada yang gajinya memprihatinkan, tetapi ada juga yang terbilang fantastis. Berikut rangkuman   terkait gaji karyawan pinjol di beberapa lokasi: Bareskrim Polri menangkap 7 karyawan pinjol ilegal jaringan Jakarta-Tangerang. Tujuh karyawan  ini mendapatkan gaji yang cukup fantastis, mencapai Rp 20 juta per bulan. ""(Gaji berkisar) di antara Rp 15 sampai Rp 20 juta per bulan,"" ujar Dirtipideksus Bareskrim Brigjen Helmy Santika saat ditemui di kantornya, Jakarta Selatan, Jumat (15/10/2021). Para tersangka ini tidak hanya bekerja untuk satu perusahaan pinjol ilegal, melainkan banyak perusahaan. Mereka sudah beraksi selama 1 tahun. ""Ada yang sudah 3 bulan, 6 bulan, variatif. Ada yang 1 tahun malah,"" imbuh Helmy. Ketujuh tersangka ini berinisial RJ, JT, AY, HC, AL, VN, dan HH. Mereka memiliki peran sebagai operator   dan   atau  melalui dunia maya. Mereka digerebek di markas pinjol di Pantai Indah Kapuk (PIK), Penjaringan, Apartemen Taman Anggrek, Apartemen Laguna Pluit, Apartemen Green Bay Pluit, dan 2 lokasi di Cengkareng, Jakarta Barat. Penangkapan berlangsung pada Selasa (12/10), sekitar pukul 03.00 WIB dini hari. Helmy mengungkapkan, biaya akomodasi para karyawan pinjol ini didanai oleh seorang  Saat ini ZJ masih dalam perburuan polisi. Berbeda dengan karyawan pinjol yang ditangkap oleh Bareskrim, karyawan   Cipondoh, Kota Tangerang. justru mendapatkan gaji di bawah upah minimum regional (UMR) Kota Tangerang. Liswati, ibu dari Ade Afifah yang bekerja di PT Indo Tekno Nusantara ini mengungkapkan anaknya mendapat gaji dari kantornya sebesar Rp 1,4 juta per bulan. Ade Afifah juga disebut bekerja hampir 11 jam setiap harinya. ""Anak saya nangis juga terkait jam kerjanya, kata dia kerja dari pukul 08.30 WIB sampai pukul 19.00 WIB tapi kok aku gajian segini doang,"" kata Liswati di Tangerang, Kamis (15/10/2021). Menurut Liswati, anaknya yang bekerja sebagai telemarketing PT ITN itu . Setiap bulan ia tidak menyisihkan uang karena hampir separuh gajinya habis untuk bayar kontrakan sebesar Rp 800 ribu. ""Nggak bisa bayar kontrakan rumah. Saya minta untuk sabar,   dilanjut sama dia kerjanya sampai sekarang,"" ujarnya. Liswati mengatakan anaknya menerima bekerja di perusahaan pinjol walau upah di bawah UMR karena sudah menganggur sejak Lebaran Idul Fitri lalu. Ade Afifah sendiri bekerja sejak 7 September 2021. Liswati mengaku dialah yang mencarikan pekerjaan untuk anaknya. Sebelumnya, Ade Afifah ingin bekerja di Bekasi tapi tidak diizinkan Liswati. ""Saya pagi-pagi cari lowongan pekerjaan awalnya di sini tutup. Setelahnya, ada yang mengabarkan lagi udah buka terus daftar di sini sebagai telemarketing. Di-training dulu sebelum bekerja di sini,"" tambah Liswati PT Indo Tekno Nusantara adalah perusahaan yang bergerak di bidang . Kantor tersebut digerebek jajaran Ditreskrimsus Polda Metro Jaya pada Kamis (14/10) lalu. Dari lokasi tersebut polisi mengamankan 32 karyawan pinjol. Tiga orang jadi tersangka, salah satunya adalah Direktur PT Indo Tekno Nusantara yang berinisial P. Sementara itu, gaji karyawan   di Sleman, Daerah Istimewa Yogyakarta (DIY) setara dengan upah minimum regional (UMR) Yogyakarta. Tetapi, beberapa di antaranya ada yang belum menerima gaji. ""Gajinya UMR Yogya. Ada yang saya tanya gajinya berapa, ada yang bilang Rp 2,1 (juta) ada yang belum gajian,"" kata Kabid Humas Polda DIY, Kombes Yuliyanto, kepada wartawan di Mapolda DIY, Jumat (15/10/2021). Yuli menyebut karyawan   itu tak semuanya berasal dari Yogyakarta. Sebagian berasal dari luar Yogyakarta, bahkan luar Jawa. ""Karyawannya ada yang baru dua hari (kerja), ada yang sudah satu bulan,"" terangnya. ""Mereka (tugasnya) menagih, mengingatkan seperti itu. Kalau yang lain saya belum tahu,"" kata Yuli. Adapun, kantor pinjol di Sleman ini berlokasi di Jl Prof Herman Yohanes, Samirono, Caturtunggal, Kecamatan Depok. Polda Jawa Barat dan Polda DIY mengamankan 83 orang dari  itu.",Gaji Karyawan Pinjol Ilegal Terungkap Usai Kantornya Digerebek Polisi,idulfitri,https://news.detik.com/berita/d-5769328/gaji-karyawan-pinjol-ilegal-terungkap-usai-kantornya-digerebek-polisi?single=1,"Sabtu, 16 Okt 2021 07:30 WIB"
"Jajaran kepolisian sedang gencar melakukan penindakan terhadap keberadaan pinjaman online (pinjol) ilegal yang menjamur. Penggerebekan di sejumlah kantornya yang terletak di Jakarta, Tangerang, hingga Sleman menguak fakta gaji karyawan pinjol itu sendiri. Penderitaan akibat pinjol tidak hanya dirasakan oleh masyarakat yang meminjam uang. Pekerjanya juga 'menderita' dengan gaji yang dianggap tidak sesuai setelah bekerja rodi hampir 11 jam per hari. Seperti yang dialami oleh Ade Afifah (22), pekerja di kantor PT Indo Tekno Nusantara, perusahaan collector pinjol yang berlokasi di Rukan Crwon Green Lake City, Cipondoh, Tangerang. Jam kerja dan upah yang diterima Ade Afifah ini diungkap oleh ibundanya, Liswati. ""Anak saya nangis juga terkait jam kerjanya, kata dia kerja dari pukul 08.30 WIB sampai pukul 19.00 WIB tapi kok aku gajian segini doang,"" kata Liswati di Tangerang, Kamis (15/10/2021). Menurut Liswati, anaknya yang bekerja menelepon nasabah pinjol itu digaji Rp 1,4 juta per bulan. Setiap bulan ia tidak bisa menyisihkan uang karena hampir separuh gajinya habis untuk bayar kontrakan sebesar Rp 800 ribu. ""Nggak bisa bayar kontrakan rumah. Saya minta untuk sabar, eh dilanjut sama dia kerjanya sampai sekarang,"" ujarnya. Liswati mengatakan anaknya menerima bekerja di perusahaan pinjol walau upah di bawah UMR karena sudah menganggur sejak Lebaran Idul Fitri lalu. Ade Afifah sendiri bekerja sejak 7 September 2021. Liswati mengaku dialah yang mencarikan pekerjaan untuk anaknya. Sebelumnya, Ade Afifah ingin bekerja di Bekasi tapi tidak diizinkan Liswati. ""Saya pagi-pagi cari lowongan pekerjaan awalnya di sini tutup. Setelahnya, ada yang mengabarkan lagi udah buka terus daftar di sini sebagai telemarketing. Di-training dulu sebelum bekerja di sini,"" tambah Liswati. Sebelumnya, Liswati datang ke kantor ITN saat digerebek polisi pada Kamis (14/10). Liswati menangis karena khawatir anaknya ditahan polisi. ""Anak saya nelepon dari pagi katanya di kantornya ada polisi. Saya udah kalang kabut dari pagi saya nangis,"" katanya. Begitu juga yang dialami karyawan pinjol ilegal di Jalan Prof Herman Yohanes, Depok, Sleman, Daerah Istimewa Yogyakarta (DIY). Ternyata karyawan pinjol ilegal itu digaji dengan UMR Yogyakarta. ""Gajinya UMR Yogya. Ada yang saya tanya gajinya berapa, ada yang bilang Rp 2,1 (juta) ada yang belum gajian,"" kata Kabid Humas Polda DIY, Kombes Yuliyanto, kepada wartawan di Mapolda DIY. Meski begitu, ada juga tujuh karyawan pinjol ilegal di Jakarta yang terungkap memiliki gaji fantastis yaitu mencapai Rp 20 juta/bulan. Hal itu diketahui saat Direktorat Tindak Pidana Ekonomi Khusus (Dittipideksus) Bareskrim Polri membongkar jaringan pinjol ilegal yang bergerak di delapan wilayah di Jakarta dan Tangerang. ""Di antara Rp 15 sampai Rp 20 juta per bulan,"" ujar Dirtipideksus Bareskrim Brigjen Helmy Santika saat ditemui di kantornya, Jakarta Selatan, Jumat (15/10/2021). Ketujuh tersangka ini berinisial RJ, JT, AY, HC, AL, VN, dan HH. Mereka memiliki peran sebagai operator SMS blasting dan desk collection atau menagih utang melalui dunia maya.",Terungkap! Kerja Rodi Rentenir Pinjol Ilegal 'Cuma' Digaji Segini,idulfitri,https://finance.detik.com/fintech/d-5770725/terungkap-kerja-rodi-rentenir-pinjol-ilegal-cuma-digaji-segini?single=1,"Minggu, 17 Okt 2021 13:01 WIB"
