artikel,judul,keyword,link,tanggal
"pada tahun ini telah resmi ditiadakan. Dengan demikian, tidak ada libur pada tanggal 24 Desember seperti tahun-tahun sebelumnya. Dihapusnya cuti bersama Natal tertuang Surat Keputusan Bersama (SKB) Menteri Agama, Menteri Ketenagakerjaan, Menteri Pendayagunaan Aparatur Negara dan Reformasi Birokrasi yakni SKB Tiga Menteri Nomor 712 Tahun 2021, Nomor 1 Tahun 2021, serta Nomor 3 Tahun 2021 tentang Hari libur Nasional dan Cuti Bersama 2021. Pada 18 Juni 2021, Menko PMK Muhadjir Effendy pernah menjelaskan isi dari SKB 3 Menteri yang isinya cuti bersama Natal dihapus. Sejalan dengan itu, pemerintah menggeser dua hari libur nasional. ""Pemerintah memutuskan mengubah dua hari libur nasional dan meniadakan satu hari libur cuti bersama,"" ucapnya. Berikut daftar hari libur tahun 2021 usai cuti bersama Natal dihapus dan digesernya dua hari libur nasional: 1. Jumat, 1 Januari: Tahun Baru 2021 Masehi 2. Jumat, 12 Februari: Tahun Baru Imlek 2572 Kongzili 3. Kamis, 11 Maret: Isra Mikraj Nabi Muhammad SAW 4. Minggu, 14 Maret: Hari Suci Nyepi Tahun Baru Saka 1943 5. Jumat, 2 April: Wafat Isa Al Masih 6. Sabtu, 1 Mei: Hari Buruh Internasional 7. Kamis, 13 Mei: Kenaikan Isa Al Masih sekaligus Hari Raya Idul Fitri 1442 Hijriah 8. Jumat, 14 Mei: Hari Raya Idul Fitri 1442 Hijriah 9. Rabu, 26 Mei: Hari Raya Waisak 2565 10. Selasa, 1 Juni: Hari Lahir Pancasila 11. Selasa, 20 Juli: Hari Raya Idul Adha 1442 Hijriah 12. Rabu, 11 Agustus: Tahun Baru Islam 1443 Hijriah (diubah) 13. Selasa, 17 Agustus: Hari Kemerdekaan Republik Indonesia 14. Rabu, 19 Oktober: Maulid Nabi Muhammad SAW (diubah) 15. Sabtu, 25 Desember: Hari Raya Natal Cuti bersama 1. Rabu, 12 Mei: Hari Raya Idul Fitri 1442 Hijriah.","Cuti Bersama Natal Dihapus, Ini Daftar Hari Libur 2021",iduladha,https://finance.detik.com/berita-ekonomi-bisnis/d-5785055/cuti-bersama-natal-dihapus-ini-daftar-hari-libur-2021?single=1,"Rabu, 27 Okt 2021 15:41 WIB"
"Pemerintah melakukan perubahan pada hari libur nasional untuk peringatan Maulid Nabi. Hari libur yang awalnya jatuh pada Selasa, 19 Oktober 2021 diubah menjadi Rabu, 20 Oktober 2021. ""Sesuai arahan Bapak Presiden dan hasil keputusan Rapat Koordinasi Tingkat Menteri, maka perlu dilakukan tindakan terukur dan efektif untuk mengendalikan penyebaran pandemi COVID-19,"" ujar Menko PMK Muhadjir Effendy pada konferensi pers Jumat (18/6/2021) menjelaskan alasan perubahan tanggal merah. Dengan perubahan ini maka daftar tanggal merah Oktober 2021 adalah Rabu (20/10/2021), selain libur pada akhir pekan seperti biasa. Perubahan ini tercantum pada Surat Keputusan Bersama (SKB) Menag, Menaker, dan MenPAN RB. Alasan lain perubahan daftar   adalah untuk menghindari long weekend, yang berisiko mengakibatkan orang beramai-ramai liburan atau travelling. Kerumunan ini berisiko meningkatkan penularan dan jumlah kasus COVID-19. Muhadjir menjelaskan, perubahan tanggal merah pada peringatan keagamaan tidak dilakukan sembarangan. Perubahan hanya dilakukan pada peringatan yang tidak memiliki ritual ibadah. Perubahan tidak dilakukan pada peringatan keagamaan sebaliknya. 1. Jumat, 1 Januari: Tahun Baru 2021 Masehi 2. Jumat, 12 Februari: Tahun Baru Imlek 2572 Kongzili 3. Kamis, 11 Maret: Isra Mi'raj Nabi Muhammad SAW 4. Minggu, 14 Maret: Hari Suci Nyepi Tahun Baru Saka 1943 5. Jumat, 2 April: Wafat Isa Al Masih 6. Sabtu, 1 Mei: Hari Buruh Internasional 7. Kamis, 13 Mei: Kenaikan Isa Al Masih sekaligus Hari Raya Idul Fitri 1442 Hijriah 8. Jumat, 14 Mei: Hari Raya Idul Fitri 1442 Hijriah 9. Rabu, 26 Mei: Hari Raya Waisak 2565 10. Selasa, 1 Juni: Hari Lahir Pancasila 11. Selasa, 20 Juli: Hari Raya Idul Adha 1442 Hijriah 12. Rabu, 11 Agustus: Tahun Baru Islam 1443 Hijriah (diubah) 13. Selasa, 17 Agustus: Hari Kemerdekaan Republik Indonesia 14. Rabu, 20 Oktober: Maulid Nabi Muhammad SAW (diubah) 16. Sabtu, 25 Desember: Hari Raya Natal. Terkait daftar   Oktober 2021, Muhadjir kembali mengingatkan pentingnya vaksin dan melaksanakan protokol kesehatan. Keduanya adalah senjata ampuh mencegah penularan dan kembali melonjaknya jumlah kasus COVID-19. Situasi yang lebih baik saat ini jangan sampai mengakibatkan penurunan tingkat kedisiplinan. COVID-19 masih ada di sekitar masyarakat dan berisiko menginfeksi siapa saja.","Daftar Tanggal Merah Oktober 2021, Ingat Libur Maulid Nabi Digeser",iduladha,https://www.detik.com/edu/detikpedia/d-5750827/daftar-tanggal-merah-oktober-2021-ingat-libur-maulid-nabi-digeser?single=1,"Minggu, 03 Okt 2021 13:58 WIB"
"Berkat kemampuan dan konsisten untuk mencapai hasil yang maksimal, Raisa Martika Tamara menyumbangkan medali emas di PON XX 2021 PAPUA untuk Kontingen Jawa Barat. Pencapaiannya itu sekaligus memantapkan Posisi #JABARJUARA di Peringkat 1. Tim Hockey Indoor Provinsi Jawa Barat, Raisa Martika Tamara dan Siti Anisa berhasil meraih kemenangan ketika melawan Papua Barat dengan skor 6-0. Kemenangan kembali diraih saat melawan tim Hockey Indoor Jawa Tengah dengan skor 1-0. Raisa bersama timnya pun mendapatkan medali emas di PON XX 2021 PAPUA. Seperti apa sosok Raisa Martika Tamara yang merupakan atlet hockey berhijab asal Jawa Barat? Wolipop berbincang dengan atlet peraih medali emas PON Papua 2021 ini. Raisa sudah tertarik pada dunia olahraga sejak duduk di bangku Sekolah Dasar. Dia awalnya mengikuti ekstrakulikuler basket. ""Aku hanya ikut kurang lebih satu tahun karena basket banyak saingannya, susah untuk berkembang. Lalu aku 'dipaksa' oleh orangtua mengikuti olahraga hockey pada tahun 2005. Saya sampai nangis-nangis nggak mau dan diantar ke tempat latihan,"" ujarnya. Raisa tidak mau latihan karena tempat latihannya sangat jauh dari kota Cianjur. ""Apalagi latihannya sangat capek karena jogging sering ke gunung hampir tiap minggunya,"" tuturnya. ""Sampai akhirnya aku sendiri jatuh hati pada olahraga ini ketika melihat ada beberapa senior yang kepanggil untuk mengikuti PON pada waktu itu. Dari situ aku serius dan memakai hati dalam berlatih, sampai akhirnya aku masuk tim inti kabupaten Cianjur pertama kali ikut pertandingan besar waktu itu PORDA (pekan olahraga daerah) 2006 di Karawang,"" lanjut Raisa. Dari sertifikat PORDA tersebut, ia bisa masuk jalur prestasi ke SMANSA 1 Cianjur. Dan pencapaiannya terus berlanjut hingga dia diterima di Universitas Pendidikan (UPI) Bandung, Jawa Barat melalui jalur PMDK. Wanita 29 tahun itu menceritakan jika yang pertama kali memperkenalkan olahraga hoki adalah guru senamnya, ibu Yeni. Gurunya tersebut yang kemudian memperkenalkannya pada seorang pelatih hockey. ""Beliau yang memperkenalkan guru atau pelatih hoki di SMAN 1 Warungkondang yakni pak Yuyun Rahayu. Beliau lah yang mengajarkan saya dari 0 hingga saat ini,"" ucapnya. Raisa juga menuturkan kedua orangtuanya mendukung pilihannya. Ayahnya wiraswasta menjual karpet. Sang ibu pensiun sejak Oktober 2021 sebagai Kepala SMAN 1 Sukaresmi, Kabupaten, Jawa Barat. Raisa mengungkapkan suka dan duka menjalani olahraga hockey. Klik halaman selanjutnya.... Setelah awalnya merasa berat menjalani latihan hockey, Raisa perlahan menyukai olahraga tersebut. Apalagi dia mendapatkan banyak teman baru karena hockey merupakan olahraga tim. ""Jadi karena setiap hari bareng-bareng mereka sudah seperti keluarga kedua aja gitu rasanya "" tuturnya. Namun dibalik itu, ia harus mengorbankan waktunya dan hari libur besar lainnya. Hari-harinya harus dihabiskannya di lapangan hockey untuk berlatih. ""Kita jadi jarang kumpul bareng sama keluarga besar, kaya momen Idul Fitri, Idul Adha, tahun baru atau libur panjang lainnya kita menghabiskan waktu di lapangan seperti try out luar negeri atau luar kota,"" lanjutnya. Dengan segala perjuangannya Raisa pun merasa mendapatkan medali emas merupakan pengalaman paling berkesan. Dia pun berterimakasih pada pelatihnya atas pencapaiannya tersebut. ""Aku mendapatkan medali emas karena kepercayaan terbesar ada di pelatih asing aku dia bernama Muhammad Dharma Raj. Karena beliau lah aku berada di titik sekarang. Pelatih yang bisa membuat atletnya berubah menjadi jauh lebih baik, pelatih yang menekankan atletnya percaya pada diri sendiri,"" ujar Raisa. Pengalaman berkesan lainnya selama menjadi atlet hockey adalah pada2014 ketika ia terpilih oleh pelatihnya di UPI yaitu Uwa Salmon Firarqie. Dia ikut menjadi bagian dari tim yang bermain ajang international di UPSI Malaysia. ""Beliau salah satu pelatih yang bisa mengajarkan saya dasar yang betul bermain hoki, bermain yang menggunakan otak bukan kekerasan, bermain yang menggunakan tehnik tinggi untuk menghindari lawan,"" lanjutnya. Pada masa pandemi Corona ini pun Raisa mendapatkan pengalaman berkesan. Dia dan rekan-rekan timnya serta pelatih mereka terpapar virus Corona. ""Selama sebulan full kita tidak ke mana-mana dan tidak beraktivitas ke luar gedung. Mungkin itu yang membuat kita kuat sampai sekarang. Karena kebersamaan itu yang melekat pada diri kita,"" kenang Raisa. Raisa mengetahui akan mengikuti PON PAPUA pada 2018. Saat itu sebelum PON ada BK PON di Jatinangor, Jawa Barat dan PORDA. ""Ketika pertama kali menginjak tanah Papua pun hati saya bergetar, melihat keindahan alam dan seisinya. Saya Cinta Timur Indonesia. Kalau bukan karena PON PAPUA mungkin saya tidak bisa menginjakan kaki saya di tanah Papua,"" lanjutnya lagi. Raisa menjelaskan detik-detik saat ia mendapatkan medali emas. ""Setelah hone atau pluit wasit terakhir ditiup usai akhir pertandingan. Saya lemas sekujur tubuh dan langsung sujud bersyukur kepada Allah 'akhirnya yang saya nanti-nantikan dan impikan terwujud.' Lelah cape stres saya tergantikan oleh kemenangan pada final kemarin melawan DKI Jakarta,"" tuturnya. Bagi kamu yang ingin menjadi atlet hockey, Raisa berbagi pesannya. Menurutnya kamu harus bisa memanfaatkan kesempatan. ""Kesempatan itu datang berkali-kali, tapi bagaimana kita menggunakan kesempatan itu sebaik mungkin. Maka dari itu jangan hilangkan kesempatan itu dengan mudah. Butuh kerja keras dan mental yang kuat untuk mendapatkan kesempatan itu,"" tutupnya. 1. Juara II Putri Hockey Indoor 2010 Kejuaraan Piala Menegpora, Jakarta 2. Juara I Putri Hockey Field 2010 Liga Hockey Jawa Barat, Bandung 3. Juara III Putri Hockey Field 2011 Liga Hockey Mahasiswa Nasional, Jakarta 4. Juara II Putri Hockey Field 2011 UNPAD, Bandung 5. Peserta Putri Hockey Indoor 2011 Indonesian Open, International Cibubur 6. Juara III Putri Hockey Indoor 2011 Kejurnas Piala Menegpora, Jakarta 7. Juara II Putri Hockey Indoor 2011 Kejurnas ITB, Bandung 8. Peserta Kejurbar Bola Tangan 2012 se-Kawa Barat, Bandung 9. Panitia Pelaksana Pertandingan Hockey Indoor Sukmalindo (Indonesia-Malaysia) 2013, Bandung 10. Juara II Putri Hockey Indoor 2013 UPSI Kejuaraan Internasional, Malaysia 11. Juara II Putri Hockey Indoor 2013 Kejuaraan ISTN, Jakarta 12. Juara III Putri Hockey Indoor 2013 Kejurnas ITB, Bandung 13. Juara I Putri Hockey Field 2014 Kejuaraan UNY, Yogyakarta 14. Juara II Putri Hockey Indoor 2014 Kejurnas Piala Menegpora, Jakarta 15. Juara II Putri Hockey Indoor 2014, Kejurnas, Jakarta 16. Juara I Putri Hockey Indoor 2015 IHRPT Nasional, Cimahi 17. Juara III Putri Hockey Indoor 2016, PON, Bandung 18. Juara III Putri Hockey Field 2017, Kejurnas, Jakarta 19. Juara I Putri Hockey Indoor 2018, Festival Cervo Hockey, se-Jawa Barat, Bandung 20. Juara I kategori Hockey Mix 2018, KHRPT Nasional, Bandung 21. Juara III Putri Hockey Indoor 2018 Kejurnas, Cimahi 22. Juara II Putri Hockey Indoor 2019 Kejurda Hockey Indoor Piala Gubernur, Bandung 23. Juara III Putri Hockey Indoor 2019 BK PON, Bamdung 24. Juara I Putri Hockey Indoor 2021 PON PAPUA, Papua 25. Juara III Putri Hockey Field 2018 Pekan Olahraga Daerah se-Jawa Barat, Bogor 26. Peserta PORDA 2014, Bekasi 27. Peserta PORDA 2010, Karawang",,iduladha,https://wolipop.detik.com/hijab-profile/d-5771725/ini-raisa-martika-tamara-atlet-hockey-hijab-peraih-medali-emas-pon-papua?single=1,"Senin, 18 Okt 2021 10:30 WIB"
"Puluhan angkutan umum elf di Cianjur menggelar aksi mogok memprotes keberadaan travel gelap yang makin marak. Pasalnya keberadaan travel gelap membuat angkutan elf sepi penumpang. Bahkan travel gelap semakin aktif beroperasi usai memiliki legalitas atau berbadan hukum. Ade Ruslan, sopir elf, mengatakan para sopir sudah geram dengan maraknya travel gelap. Sebelumnya travel gelap hanya beroperasi saat momen mudik lebaran, namun kini di hari biasa pun juga beroperasi. ""Jadi sekarang juga terus beroperasi, tidak hanya di momen mudik lebaran Idul Fitri atau Idul Adha. Setiap hari mereka naik-turunkan penumpang,"" ujar dia saat ditemui di Terminal Pasirhayam, Rabu (6/10/2021). Menurutnya para sopir sudah beberapa kali melakukan protes, namun tidak ada tindakan dari Dinas Perhubungan atau pihak terkait. ""Sudah bosan protes, mulai dari audiensi hingga mogok beroperasi. Janjinya mau ditindak atau ditertibkan, tapi nyatanya sekarang tetap beroperasi. Bahkan informasinya mereka ada yang berbadan hukum, jadi merasa bebas untuk mengangkut penumpang,"" kata dia. Ade menegaskan para sopir akan terus mogok jika masalah tersebut tak kunjung selesai. ""Kalau tidak kunjung ada solusi, kami akan terus mogok,"" tegasnya. ""Percuma mau beroperasi juga, penumpang tidak ada. Semuanya diambil oleh travel gelap. Percuma ada trayek, karena travel gelap bebas kemana saja,"" tambahnya. Senada, Pian, sopir trayek Cianjur-Agrabinta, mengatakan sejak maraknya travel gelap, setiap beroperasi angkutan elf hanya mendapat satu atau dua penumpang. ""Paling banyak empat penumpang. Sering nya paling hanya dua penumpang. Mau dapat penghasilan dari mana dengan penumpang yang hanya segitu. Jangankan untuk keluarga, untuk bensin saja kurang,"" ucapnya. Dia berharap Dishub bisa bertindak tegas terkait maraknya travel gelap. ""Kalau dibiarkan terus, angkutan elf bisa mati,"" pungkasnya.","Geram Marak Travel Gelap, Puluhan Angkutan Elf di Cianjur Mogok Operasi",iduladha,https://news.detik.com/berita-jawa-barat/d-5755047/geram-marak-travel-gelap-puluhan-angkutan-elf-di-cianjur-mogok-operasi?single=1,"Rabu, 06 Okt 2021 12:19 WIB"
"Haji berasal dari bahasa Arab al-hajju yang berarti al-qashdu, yakni sengaja. Menurut definisi syara, haji adalah menyengaja pergi ke Ka'bah untuk melakukan amalan-amalan tertentu. Sementara itu, umrah diartikan sebagai ziarah. Dalam istilah syara umrah adalah menziarahi Ka'bah untuk melaksanakan amalan-amalan tertentu. Perintah untuk menunaikan haji dan umrah termaktub dalam Al Quran surat Al Baqarah ayat 196. Allah SWT berfirman sebagai berikut: وَاَتِمُّوا الْحَجَّ وَالْعُمْرَةَ لِلّٰهِ ۗ فَاِنْ اُحْصِرْتُمْ فَمَا اسْتَيْسَرَ مِنَ الْهَدْيِۚ وَلَا تَحْلِقُوْا رُءُوْسَكُمْ حَتّٰى يَبْلُغَ الْهَدْيُ مَحِلَّهٗ ۗ فَمَنْ كَانَ مِنْكُمْ مَّرِيْضًا اَوْ بِهٖٓ اَذًى مِّنْ رَّأْسِهٖ فَفِدْيَةٌ مِّنْ صِيَامٍ اَوْ صَدَقَةٍ اَوْ نُسُكٍ ۚ فَاِذَآ اَمِنْتُمْ ۗ فَمَنْ تَمَتَّعَ بِالْعُمْرَةِ اِلَى الْحَجِّ فَمَا اسْتَيْسَرَ مِنَ الْهَدْيِۚ فَمَنْ لَّمْ يَجِدْ فَصِيَامُ ثَلٰثَةِ اَيَّامٍ فِى الْحَجِّ وَسَبْعَةٍ اِذَا رَجَعْتُمْ ۗ تِلْكَ عَشَرَةٌ كَامِلَةٌ ۗذٰلِكَ لِمَنْ لَّمْ يَكُنْ اَهْلُهٗ حَاضِرِى الْمَسْجِدِ الْحَرَامِ ۗ وَاتَّقُوا اللّٰهَ وَاعْلَمُوْٓا اَنَّ اللّٰهَ شَدِيْدُ الْعِقَابِ ࣖ - ١٩٦ Artinya: ""Dan sempurnakanlah ibadah haji dan umrah karena Allah. Tetapi jika kamu terkepung (oleh musuh), maka (sembelihlah) hadyu yang mudah didapat, dan jangan kamu mencukur kepalamu, sebelum hadyu sampai di tempat penyembelihannya. Jika ada di antara kamu yang sakit atau ada gangguan di kepalanya (lalu dia bercukur), maka dia wajib berfidyah, yaitu berpuasa, bersedekah atau berkurban. Apabila kamu dalam keadaan aman, maka barangsiapa mengerjakan umrah sebelum haji, dia (wajib menyembelih) hadyu yang mudah didapat. Tetapi jika dia tidak mendapatkannya, maka dia (wajib) berpuasa tiga hari dalam (musim) haji dan tujuh (hari) setelah kamu kembali. Itu seluruhnya sepuluh (hari). Demikian itu, bagi orang yang keluarganya tidak ada (tinggal) di sekitar Masjidilharam. Bertakwalah kepada Allah dan ketahuilah bahwa Allah sangat keras hukuman-Nya."" (QS. Al Baqarah: 196) Haji dan umrah merupakan dua jenis ibadah yang berbeda, khususnya dari segi hukum. Berikut perbedaan antara haji dan umrah dari segi hukum, rukun, waktu dan tempat pelaksanaan, serta kondisi fisik yang dibutuhkan. Haji merupakan rukun Islam yang kelima. Hukum menunaikan ibadah haji adalah wajib bagi yang mampu. Dalil tentang kewajiban haji juga dijelaskan dalam Al Quran. Allah SWT berfirman dalam Q.S Ali 'Imran ayat 97 sebagai berikut: فِيهِ ءَايَٰتٌۢ بَيِّنَٰتٌ مَّقَامُ إِبْرَٰهِيمَ ۖ وَمَن دَخَلَهُۥ كَانَ ءَامِنًا ۗ وَلِلَّهِ عَلَى ٱلنَّاسِ حِجُّ ٱلْبَيْتِ مَنِ ٱسْتَطَاعَ إِلَيْهِ سَبِيلًا ۚ وَمَن كَفَرَ فَإِنَّ ٱللَّهَ غَنِىٌّ عَنِ ٱلْعَٰلَمِينَ Artinya:""Padanya terdapat tanda-tanda yang nyata, (di antaranya) maqam Ibrahim; barangsiapa memasukinya (Baitullah itu) menjadi amanlah dia; mengerjakan haji adalah kewajiban manusia terhadap Allah, yaitu (bagi) orang yang sanggup mengadakan perjalanan ke Baitullah. Barangsiapa mengingkari (kewajiban haji), maka sesungguhnya Allah Maha Kaya (tidak memerlukan sesuatu) dari semesta alam."" Dalam sebuah hadits disebutkan bahwa kewajiban haji ini hanya berlaku sekali seumur hidup. Adapun, pelaksanaan haji berikutnya hukumnya adalah sunnah. ""Haji itu wajibnya hanya satu kali, dan selebihnya adalah sunnah."" (HR. Ahmad, Nasai, dan Ibnu Majah) Sementara itu, hukum melaksanakan umrah adalah wajib menurut sebagian ulama dan sunnah menurut sebagian yang lain. Artinya, ada perbedaan pandangan di kalangan ulama terkait hukum umrah. Hukum wajib dalam umrah merujuk pada Al Quran sebagaimana dalam surat Al Baqarah ayat 196. Sedangkan, umrah yang hukumnya sunnah merujuk pada sebuah hadits yang diriwayatkan Tirmidzi. ""Nabi pernah ditanya mengenai umrah, Apakah umrah wajib? Beliau menjawab tidak, dan ketika kau umrah maka itu lebih baik bagimu."" (HR. al-Tirmidzi). Namun, para ahli hadits berpendapat bahwa hadits yang diriwayatkan oleh Tirmidzi di atas adalah lemah (dhaif). Ada serangkaian amalan yang harus dikerjakan baik saat haji maupun umrah. Dikutip dari buku Panduan Ibadah Haji dan Umrah oleh Retno Widyani dan Mansyur Pribadi, ada perbedaan jumlah amalan atau rukun antara haji dan umrah. Rukun haji terdiri atas ihram, wukuf, tawaf ifadah, sai, tahallul, dan tertib. Sedangkan umrah hanya terdiri dari ihram, tawaf umrah, sai, dan tahallul. Perbedaan antara haji dan umrah lainnya adalah waktu pelaksanaan. Ibadah haji hanya dilaksanakan di bulan haji. Artinya, haji dilakukan berdasarkan waktu yang telah ditetapkan oleh syara dan hanya berlangsung sekali dalam setahun. Haji biasanya dilaksanakan mulai bulan syawal hingga hari raya Idul Adha. Sementara itu, umrah adalah ibadah yang tidak terikat oleh waktu. Ibadah ini bisa dilakukan kapan saja atau sepanjang tahun. Terdapat perbedaan tempat pelaksanaan antara haji dan umrah setelah miqat. Miqat adalah batas antara boleh tidaknya atau perintah mulai atau berhenti untuk melafadzkan niat. Dikutip dari buku Ensiklopedia Fikih Indonesia oleh Ahmad Sarwat, ibadah haji dilaksanakan mulai dari miqat - Mekkah (Masjidilharam) - Arafah - Muzdalifah - Mina. Sedangkan umrah meliputi miqat - Mekkah (Masjidilharam). Tawaf dan sai untuk umrah dilaksanakan di Madjidilharam.  juga terletak pada kesiapan fisik bagi para jamaah. Haji membutuhkan waktu yang lebih lama dan rangkaian yang lebih panjang daripada umrah. Sehingga, kekuatan fisik jamaah haji lebih besar dibandingkan dengan jamaah umrah.","5 Perbedaan Haji dan Umroh, Hukum hingga Waktu Pelaksanaan",iduladha,https://www.detik.com/edu/detikpedia/d-5788039/5-perbedaan-haji-dan-umroh-hukum-hingga-waktu-pelaksanaan?single=1,"Jumat, 29 Okt 2021 14:02 WIB"
"Langkah pemerintah menggeser   untuk membatasi mobilitas warga dikritik karena sudah tidak lagi relevan. Pemerintah sebelumnya merevisi libur dan cuti bersama 2021 atas pertimbangan lonjakan jumlah kasus COVID-19. Dihimpun  , Selasa (12/10/2021), pemerintah melakukan dua kali revisi libur dan cuti bersama 2021. Dari dua kali revisi itu, terdapat dua   'kejepit' yang digeser pemerintah. Berikut perjalanan revisi libur dan cuti bersama 2021 yang dilakukan pemerintah: Revisi pertama dilakukan pada Februari 2021. Saat itu pemerintah memutuskan cuti bersama dipangkas menjadi dua hari. Kesepakatan ini tertuang dalam Surat Keputusan Bersama (SKB) Menteri Agama, Menteri Ketenagakerjaan, Menteri Pendayagunaan Aparatur Negara dan Reformasi Birokrasi Nomor 281 Tahun 2021, Nomor 1 Tahun 2021, Nomor 1 Tahun 2021 tentang Perubahan Atas Keputusan Bersama Menteri Agama, Menteri Ketenagakerjaan, Menteri Pendayagunaan Aparatur Negara dan Reformasi Birokrasi Nomor 642 Tahun 2020, Nomor 4 Tahun 2020, Nomor 4 tahun 2020 tentang Hari libur Nasional dan Cuti Bersama Tahun 2021. ""Dalam Surat Keputusan Bersama (SKB) sebelumnya, terdapat tujuh hari cuti bersama. Setelah dilakukan peninjauan kembali SKB, cuti bersama dikurangi dari semula tujuh hari menjadi hanya tinggal dua hari saja"" ujar Menko Muhadjir, Senin (22/2/2021). Cuti bersama tahun 2021 yang dipangkas sebanyak lima hari adalah 12 Maret (cuti bersama dalam rangka Isra Mikraj Nabi Muhammad SAW); 17, 18, 19 Mei (cuti bersama dalam rangka Hari Raya Idul Fitri 1442 Hijriah); dan 27 Desember (cuti bersama dalam rangka Hari Raya Natal 2021). Berikut jadwal libur dan cuti bersama 2021 yang ditetapkan Februari 2021: Hari libur nasional 2021 1. Jumat, 1 Januari: Tahun Baru 2021 Masehi 2. Jumat, 12 Februari: Tahun Baru Imlek 2572 Kongzili 3. Kamis, 11 Maret: Isra Mikraj Nabi Muhammad SAW 4. Minggu, 14 Maret: Hari Suci Nyepi Tahun Baru Saka 1943 5. Jumat, 2 April: Wafat Isa Al Masih 6. Sabtu, 1 Mei: Hari Buruh Internasional 7. Kamis, 13 Mei: Kenaikan Isa Al Masih sekaligus Hari Raya Idul Fitri 1442 Hijriah 8. Jumat, 14 Mei: Hari Raya Idul Fitri 1442 Hijriah 9. Rabu, 26 Mei: Hari Raya Waisak 2565 10. Selasa, 1 Juni: Hari Lahir Pancasila 11. Selasa, 20 Juli: Hari Raya Idul Adha 1442 Hijriah 12. Selasa, 10 Agustus: Tahun Baru Islam 1443 Hijriah 13. Selasa, 17 Agustus: Hari Kemerdekaan Republik Indonesia 14. Selasa, 19 Oktober: Maulid Nabi Muhammad SAW 15. Sabtu, 25 Desember: Hari Raya Natal Cuti bersama 1. Rabu, 12 Mei: Hari Raya Idul Fitri 1442 Hijriah 2. Jumat, 24 Desember: Hari Raya Natal Pertengahan tahun ini pemerintah kembali merevisi jadwal libur nasional dan cuti bersama. Hal ini bertepatan dengan lonjakan COVID-19. Keputusan merevisi libur dan cuti bersama diambil atas pertimbangan kasus COVID-19 yang terus melonjak. Pernyataan itu disampaikan Menko PMK Muhadjir Effendy dalam jumpa pers, Jumat (18/6/2021). Keputusan diambil setelah pemerintah menggelar rapat lintas kementerian. ""Pemerintah memutuskan mengubah dua hari libur nasional dan meniadakan satu hari libur cuti bersama,"" kata Muhadjir. Saat ini pemerintah mengubah 2   dan menghapus 1 cuti bersama. Tahun ini tak ada cuti bersama pada Hari Raya Natal 24 Desember. Berikut poin keputusannya: 1. Libur tahun baru Islam 1443 Hijriah yang jatuh pada hari Selasa 10 Agustus 2021 diubah menjadi Hari Rabu 11 Agustus 2021 2. Libur Maulid Nabi Muhammad SAW pada tanggal 19 Oktober 2021 diubah menjadi Rabu tanggal 20 Oktober 2021 3. Libur cuti bersama Hari Natal 2021 pada tanggal 24 Desember 2021 ditiadakan Sedangkan libur Hari Raya Idul Adha pada 20 Juli 2021 tetap ada. Berikut ini daftar libur lengkapnya: Hari libur nasional 2021 1. Jumat, 1 Januari: Tahun Baru 2021 Masehi 2. Jumat, 12 Februari: Tahun Baru Imlek 2572 Kongzili 3. Kamis, 11 Maret: Isra Mikraj Nabi Muhammad SAW 4. Minggu, 14 Maret: Hari Suci Nyepi Tahun Baru Saka 1943 5. Jumat, 2 April: Wafat Isa Al Masih 6. Sabtu, 1 Mei: Hari Buruh Internasional 7. Kamis, 13 Mei: Kenaikan Isa Al Masih sekaligus Hari Raya Idul Fitri 1442 Hijriah 8. Jumat, 14 Mei: Hari Raya Idul Fitri 1442 Hijriah 9. Rabu, 26 Mei: Hari Raya Waisak 2565 10. Selasa, 1 Juni: Hari Lahir Pancasila 11. Selasa, 20 Juli: Hari Raya Idul Adha 1442 Hijriah 12. Rabu, 11 Agustus: Tahun Baru Islam 1443 Hijriah (diubah) 13. Selasa, 17 Agustus: Hari Kemerdekaan Republik Indonesia 14. Rabu, 19 Oktober: Maulid Nabi Muhammad SAW (diubah) 16. Sabtu, 25 Desember: Hari Raya Natal Cuti bersama 1. Rabu, 12 Mei: Hari Raya Idul Fitri 1442 Hijriah",2 Hari Besar Keagamaan 'Kejepit' yang Liburnya Digeser Pemerintah,iduladha,https://news.detik.com/berita/d-5763268/2-hari-besar-keagamaan-kejepit-yang-liburnya-digeser-pemerintah?single=1,"Selasa, 12 Okt 2021 11:42 WIB"
