artikel,judul,keyword,link,tanggal
"Perintah untuk menunaikan zakat termaktub dalam Al Quran. Salah satunya pada surat Al-Baqarah ayat 110. Allah SWT berfirman sebagai berikut: وَأَقِيمُوا۟ ٱلصَّلَوٰةَ وَءَاتُوا۟ ٱلزَّكَوٰةَ ۚ وَمَا تُقَدِّمُوا۟ لِأَنفُسِكُم مِّنْ خَيْرٍ تَجِدُوهُ عِندَ ٱللَّهِ ۗ إِنَّ ٱللَّهَ بِمَا تَعْمَلُونَ بَصِيرٌ Artinya:"" Dan dirikanlah shalat dan tunaikanlah zakat. Dan kebaikan apa saja yang kamu usahakan bagi dirimu, tentu kamu akan mendapat pahala nya pada sisi Allah. Sesungguhnya Allah Maha Melihat apa-apa yang kamu kerjakan."" Berdasarkan Peraturan Menteri Agama No 52 Tahun 2014, zakat adalah harta yang wajib dikeluarkan seorang muslim atau badan usaha yang dimiliki orang Islam untuk diberikan kepada yang berhak menerima sesuai dengan syariat Islam. Terdapat delapan golongan penerima zakat, sebagaimana dijelaskan dalam surat At Taubah ayat 60. Penerima zakat adalah fakir, miskin, amil, mualaf, riqab, gharimin, fisabilillah, dan ibnu sabil. ۞ اِنَّمَا الصَّدَقٰتُ لِلْفُقَرَاۤءِ وَالْمَسٰكِيْنِ وَالْعَامِلِيْنَ عَلَيْهَا وَالْمُؤَلَّفَةِ قُلُوْبُهُمْ وَفِى الرِّقَابِ وَالْغَارِمِيْنَ وَفِيْ سَبِيْلِ اللّٰهِ وَابْنِ السَّبِيْلِۗ فَرِيْضَةً مِّنَ اللّٰهِ ۗوَاللّٰهُ عَلِيْمٌ حَكِيْمٌ - ٦٠ Artinya: ""Sesungguhnya zakat itu hanyalah untuk orang-orang fakir, orang miskin, amil zakat, yang dilunakkan hatinya (mualaf), untuk (memerdekakan) hamba sahaya, untuk (membebaskan) orang yang berhutang, untuk jalan Allah dan untuk orang yang sedang dalam perjalanan, sebagai kewajiban dari Allah. Allah Maha Mengetahui, Mahabijaksana.""  yang berfungsi untuk membersihkan jiwa seseorang dinamakan zakat fitrah. Zakat berasal dari kata ""zaka"" yang artinya suci, baik, berkah, tumbuh, dan berkembang. Di dalam zakat terkandung harapan untuk memperoleh keberkahan, kebersihan jiwa, dan memupuk kebaikan, dilansir dari situs Badan Amil Zakat Nasional (BAZNAS). Dalam firmanNya, Allah SWT telah menjelaskan   sebagai pembersih jiwa seseorang di surat At Taubah ayat 103, خُذْ مِنْ اَمْوَالِهِمْ صَدَقَةً تُطَهِّرُهُمْ وَتُزَكِّيْهِمْ بِهَا وَصَلِّ عَلَيْهِمْۗ اِنَّ صَلٰوتَكَ سَكَنٌ لَّهُمْۗ وَاللّٰهُ سَمِيْعٌ عَلِيْمٌ - ١٠٣ Artinya: ""Ambillah zakat dari harta mereka, guna membersihkan dan menyucikan mereka, dan berdoalah untuk mereka. Sesungguhnya doamu itu (menumbuhkan) ketenteraman jiwa bagi mereka. Allah Maha Mendengar, Maha Mengetahui."" Zakat fitrah wajib dikeluarkan bagi setiap muslim pada bulan Ramadhan, tepatnya menjelang Idul Fitri. Besaran zakat fitrah setara dengan 3,5 liter atau sekitar 2,5 kilogram makanan pokok. Zakat ini bisa berupa beras, gandum, dan sejenisnya sesuai dengan daerah yang bersangkutan. Selain itu, zakat fitrah bisa diganti dengan uang dengan nominal setara dengan harga makanan pokok sesuai besaran zakat tersebut. Semoga kita selalu ingat dan dilapangkan rizkinya sehingga dapat selalu membayar zakat.","Zakat yang Berfungsi sebagai Pembersih Jiwa Seseorang, Ini Penjelasannya",idulfitri,https://www.detik.com/edu/detikpedia/d-5765316/zakat-yang-berfungsi-sebagai-pembersih-jiwa-seseorang-ini-penjelasannya?single=1,"Kamis, 14 Okt 2021 06:00 WIB"
"Ketua Umum Partai Kebangkitan Bangsa (PKB) Abdul Muhaimin Iskandar atau   mewanti-wanti pemerintah soal gelombang ketiga Corona atau COVID-19 di Indonesia. Dia meminta pemerintah waspada menjelang masa libur Natal dan tahun baru 2022. Gus Muhaimin mengatakan pemerintah harus mengambil langkah antisipatif. Menurut dia, lonjakan kasus COVID-19 seusai masa libur hari raya Idul Fitri 2021 harus dijadikan bahan pertimbangan. ""Ya, saya kira memang harus lebih fokus dan serius mengantisipasi prediksi gelombang ketiga. Epidemiolog dan para pakar lain sudah mewanti-wanti kita semua, tinggal bagaimana pemerintah menyikapinya,"" kata Gus Muhaimin kepada wartawan, Kamis (28/10/2021). Dia mengaku tak ada masalah jika pemerintah kembali memperketat pelaksanaan PPKM. Dia menilai kebijakan pemerintah harus berorientasi pada keselamatan bersama. Selain itu, Gus Muhaimin mendukung penghapusan libur cuti bersama Natal dan tahun baru. Penghapusan itu sudah resmi disampaikan oleh pemerintah. ""Kalau memang dirasa perlu PPKM diperketat lagi ya monggo saja. Demi kebaikan dan keselamatan kita bersama, saya kira perlu juga dilakukan,"" tutur Gus Muhaimin. Wakil Ketua DPR RI ini meminta pemerintah menyusun regulasi yang prorakyat.   mengatakan pemerintah harus membuat regulasi yang betul-betul mempertimbangkan aspek keadilan serta kemampuan rakyat. Gus Muhaimin mencontohkan wacana mewajibkan tes PCR bagi seluruh pengguna moda transportasi. Dia mengingatkan perlunya pertimbangan aspek keadilan dalam penerapan tes PCR sebagai syarat menggunakan moda transportasi. ""Kabarnya kan PCR mau diwajibkan untuk semua moda transportasi, nah itu bagus. Tapi kalau masih harus berbayar berapapun nominalnya saya kira itu bukan solusi. Misalnya naik angkot harus PCR, masyarakat jelas keberatan itu, lebih mahal PCR-nya ketimbang ongkos angkotnya,"" ujar Gus Muhaimin.",Gus Muhaimin Wanti-wanti Pemerintah soal Gelombang Ketiga COVID,idulfitri,https://news.detik.com/berita/d-5787120/gus-muhaimin-wanti-wanti-pemerintah-soal-gelombang-ketiga-covid?single=1,"Kamis, 28 Okt 2021 19:31 WIB"
"pada tahun ini telah resmi ditiadakan. Dengan demikian, tidak ada libur pada tanggal 24 Desember seperti tahun-tahun sebelumnya. Dihapusnya cuti bersama Natal tertuang Surat Keputusan Bersama (SKB) Menteri Agama, Menteri Ketenagakerjaan, Menteri Pendayagunaan Aparatur Negara dan Reformasi Birokrasi yakni SKB Tiga Menteri Nomor 712 Tahun 2021, Nomor 1 Tahun 2021, serta Nomor 3 Tahun 2021 tentang Hari libur Nasional dan Cuti Bersama 2021. Pada 18 Juni 2021, Menko PMK Muhadjir Effendy pernah menjelaskan isi dari SKB 3 Menteri yang isinya cuti bersama Natal dihapus. Sejalan dengan itu, pemerintah menggeser dua hari libur nasional. ""Pemerintah memutuskan mengubah dua hari libur nasional dan meniadakan satu hari libur cuti bersama,"" ucapnya. Berikut daftar hari libur tahun 2021 usai cuti bersama Natal dihapus dan digesernya dua hari libur nasional: 1. Jumat, 1 Januari: Tahun Baru 2021 Masehi 2. Jumat, 12 Februari: Tahun Baru Imlek 2572 Kongzili 3. Kamis, 11 Maret: Isra Mikraj Nabi Muhammad SAW 4. Minggu, 14 Maret: Hari Suci Nyepi Tahun Baru Saka 1943 5. Jumat, 2 April: Wafat Isa Al Masih 6. Sabtu, 1 Mei: Hari Buruh Internasional 7. Kamis, 13 Mei: Kenaikan Isa Al Masih sekaligus Hari Raya Idul Fitri 1442 Hijriah 8. Jumat, 14 Mei: Hari Raya Idul Fitri 1442 Hijriah 9. Rabu, 26 Mei: Hari Raya Waisak 2565 10. Selasa, 1 Juni: Hari Lahir Pancasila 11. Selasa, 20 Juli: Hari Raya Idul Adha 1442 Hijriah 12. Rabu, 11 Agustus: Tahun Baru Islam 1443 Hijriah (diubah) 13. Selasa, 17 Agustus: Hari Kemerdekaan Republik Indonesia 14. Rabu, 19 Oktober: Maulid Nabi Muhammad SAW (diubah) 15. Sabtu, 25 Desember: Hari Raya Natal Cuti bersama 1. Rabu, 12 Mei: Hari Raya Idul Fitri 1442 Hijriah.","Cuti Bersama Natal Dihapus, Ini Daftar Hari Libur 2021",idulfitri,https://finance.detik.com/berita-ekonomi-bisnis/d-5785055/cuti-bersama-natal-dihapus-ini-daftar-hari-libur-2021?single=1,"Rabu, 27 Okt 2021 15:41 WIB"
"Hari  digeser pemerintah dari 19 Oktober menjadi 20 Oktober 2021. Ada alasan kenapa pemerintah menggeser hari libur. Kebijakan ini diambil sebagai langkah antisipasi munculnya kasus baru Covid-19. ""Sebagai antisipasi munculnya kasus baru Covid-19, hari libur Maulid Nabi digeser 20 Oktober 2021,"" tegas Dirjen Bimas Islam Kamaruddin Amin di situs Kementerian Agama seperti dikutip, Selasa (12/10/2021). Kamaruddin Amin menegaskan, bahwa Maulid Nabi Muhammad Saw tidak berubah, tetap 12 Rabiul Awal. Hanya, hari libur dalam rangka memperingatinya yang digeser. ""Maulid Nabi Muhammad Saw tetap 12 Rabiul Awal. Tahun ini bertepatan 19 Oktober 2021 M.  yang digeser menjadi 20 Oktober 2021 M,"" paparnya. Perubahan   ini tertuang dalam Keputusan bersama Menag, Menaker, dan Menpan RB No 712, 1, dan 3 tahun 2021 tentang Perubahan Kedua atas Keputusan Bersama Menag, Menaker, Menpan dan RB No 642, 4, dan 4 tahun 2020 tentang Hari Libur Nasional dan Cuti Bersama. Sebelumnya, perubahan juga dilakukan pada hari libur peringatan Tahun Baru Hijriyah. Tahun barunya tetap 1 Muharram 1443 H, bertepatan 10 Agustus 2021. Namun, hari libur dalam rangka memperingatinya digeser menjadi 11 Agustus 2021. ""Perubahan juga terjadi terkait cuti bersama dalam rangka Hari Raya Natal yang awalnya ditetapkan pada 24 Desember, akhirnya diputuskan untuk ditiadakan,"" tandasnya. Menteri Agama Yaqut Cholil Qoumas menambahkan, perubahan mempertimbangkan kondisi dan situasi COVID-19. Hari Libur Nasional dan Cuti 2022 Sementara itu ke depan, Kemenag bersama dua Menteri lainnya bakal menentukan cuti bersama 2022 setelah menetapkan tanggal hari libur nasional 2022 pada bulan September lalu. Untuk pelaksanaan cuti bersama tahun 2022 akan ditetapkan kemudian dengan mempertimbangkan kondisi pandemi COVID-19. 1 Januari Tahun Baru 2022 Masehi 1 Februari Tahun Baru Imlek 2573 Kongzili 28 Februari Isra Mikraj Nabi Muhammad SAW 3 Maret Hari Suci Nyepi Tahun Baru Saka 1944 15 April Wafat Isa Al Masih 1 Mei Hari Buruh Internasional 2-3 Mei Hari Raya Idul Fitri 1443 Hijriyah 16 Mei Hari Raya Waisak 2566 BE 26 Mei Kenaikan Isa Al Masih 1 Juni Hari Lahir Pancasila 9 Juli Hari Raya Idul Adha 1443 Hijriyah 30 Juli Tahun Baru Islam 1444 Hijriyah 17 Agustus Hari Kemerdekaan RI 8 Oktober Maulid Nabi Muhammad SAW 25 Desember Hari Raya Natal","Libur Maulid Nabi 2021 Digeser Sehari, Ini Jadwalnya",idulfitri,https://travel.detik.com/travel-news/d-5763526/libur-maulid-nabi-2021-digeser-sehari-ini-jadwalnya?single=1,"Selasa, 12 Okt 2021 14:20 WIB"
"Para pecinta Toyota Avanza dan Daihatsu Xenia yang tergabung dalam Komunitas mobil Avanza Xenia Solutions (AXS ) GOTHIC Cikarang tengah bersuka cita, karena komunitas mobil yang memiliki 1.550 anggota ini tengah menginjak usia ke-6 tahun. Dalam siaran resmi yang diterima detikOto, pada tanggal 24 October 2021, Komunitas mobil Avanza Xenia Solutions (AXS ) GOTHIC Cikarang menggelar event tahunan ""Anniversary 6th"" di Taman Wisata Legok Jambore, Cariu Bogor, dengan Tema 'Semangat berkarya menuju Kebersamaan di era Pandemi'. Demi memeriahkan hari jadi, AXS GOTHIC mengundang seluruh member Avanza Xenia Solutions dari seluruh nusantara yang terdiri dari lebih dari 50 wilayah dan dihadiri lebih dari 200 Tamu undangan dan umum, tercatat 1.000 orang yang terdiri dari member dan anggota keluarga ikut hadir dengan menerapkan prokes ketat. Menurut Ahmad Priantno Selaku ketua panitia acara, diadakannya perayaan anniversary 6th Avanza Xenia Solutions (AXS) GOTHIC Cikarang, komunitas ini dilahirkan dengan tujuan agar bisa menjadi wadah komunikasi antar member AXS senusantara, yang bisa menambah erat tali persaudaraan, sehingga kekompakan terus terjaga. ""Semoga AXS Gothic semakin berkembang, selalu mengedepankan silaturahmi untuk lebih kompak, solid dan bersatu, menjadi pelopor keselamatan berlalu lintas, menjalin kerjasama dengan wilayah dan komunitas lain baik club non club,"" ujar Ahmad. Dalam perayaan hari jadi AXS GOTHIC ke-6 ini, panitia menghadirkan acara Santunan Anak Yatim, hiburan music, DJ, car display modifikasi dengan doorprize yg sangat menarik, berupa velg, sepeda, tv, kulkas dan masih banyak hadiah mewah lainnya. ""Untuk kegiatan kedepannya lebih mengutamakan kegiatan Baksos bantuan bencana (banjir dll), santunan anak yatim (menjelang idul fitri), dan kegiatan bidang otomotive service bareng dng salah satu bengkel ternama,"" tutup Ahmad.",Selamat Ulang tahun AXS Gothic!,idulfitri,https://oto.detik.com/komunitas-mobil/d-5789213/selamat-ulang-tahun-axs-gothic?single=1,"Sabtu, 30 Okt 2021 12:00 WIB"
"Langkah pemerintah menggeser   untuk membatasi mobilitas warga dikritik karena sudah tidak lagi relevan. Pemerintah sebelumnya merevisi libur dan cuti bersama 2021 atas pertimbangan lonjakan jumlah kasus COVID-19. Dihimpun  , Selasa (12/10/2021), pemerintah melakukan dua kali revisi libur dan cuti bersama 2021. Dari dua kali revisi itu, terdapat dua   'kejepit' yang digeser pemerintah. Berikut perjalanan revisi libur dan cuti bersama 2021 yang dilakukan pemerintah: Revisi pertama dilakukan pada Februari 2021. Saat itu pemerintah memutuskan cuti bersama dipangkas menjadi dua hari. Kesepakatan ini tertuang dalam Surat Keputusan Bersama (SKB) Menteri Agama, Menteri Ketenagakerjaan, Menteri Pendayagunaan Aparatur Negara dan Reformasi Birokrasi Nomor 281 Tahun 2021, Nomor 1 Tahun 2021, Nomor 1 Tahun 2021 tentang Perubahan Atas Keputusan Bersama Menteri Agama, Menteri Ketenagakerjaan, Menteri Pendayagunaan Aparatur Negara dan Reformasi Birokrasi Nomor 642 Tahun 2020, Nomor 4 Tahun 2020, Nomor 4 tahun 2020 tentang Hari libur Nasional dan Cuti Bersama Tahun 2021. ""Dalam Surat Keputusan Bersama (SKB) sebelumnya, terdapat tujuh hari cuti bersama. Setelah dilakukan peninjauan kembali SKB, cuti bersama dikurangi dari semula tujuh hari menjadi hanya tinggal dua hari saja"" ujar Menko Muhadjir, Senin (22/2/2021). Cuti bersama tahun 2021 yang dipangkas sebanyak lima hari adalah 12 Maret (cuti bersama dalam rangka Isra Mikraj Nabi Muhammad SAW); 17, 18, 19 Mei (cuti bersama dalam rangka Hari Raya Idul Fitri 1442 Hijriah); dan 27 Desember (cuti bersama dalam rangka Hari Raya Natal 2021). Berikut jadwal libur dan cuti bersama 2021 yang ditetapkan Februari 2021: Hari libur nasional 2021 1. Jumat, 1 Januari: Tahun Baru 2021 Masehi 2. Jumat, 12 Februari: Tahun Baru Imlek 2572 Kongzili 3. Kamis, 11 Maret: Isra Mikraj Nabi Muhammad SAW 4. Minggu, 14 Maret: Hari Suci Nyepi Tahun Baru Saka 1943 5. Jumat, 2 April: Wafat Isa Al Masih 6. Sabtu, 1 Mei: Hari Buruh Internasional 7. Kamis, 13 Mei: Kenaikan Isa Al Masih sekaligus Hari Raya Idul Fitri 1442 Hijriah 8. Jumat, 14 Mei: Hari Raya Idul Fitri 1442 Hijriah 9. Rabu, 26 Mei: Hari Raya Waisak 2565 10. Selasa, 1 Juni: Hari Lahir Pancasila 11. Selasa, 20 Juli: Hari Raya Idul Adha 1442 Hijriah 12. Selasa, 10 Agustus: Tahun Baru Islam 1443 Hijriah 13. Selasa, 17 Agustus: Hari Kemerdekaan Republik Indonesia 14. Selasa, 19 Oktober: Maulid Nabi Muhammad SAW 15. Sabtu, 25 Desember: Hari Raya Natal Cuti bersama 1. Rabu, 12 Mei: Hari Raya Idul Fitri 1442 Hijriah 2. Jumat, 24 Desember: Hari Raya Natal Pertengahan tahun ini pemerintah kembali merevisi jadwal libur nasional dan cuti bersama. Hal ini bertepatan dengan lonjakan COVID-19. Keputusan merevisi libur dan cuti bersama diambil atas pertimbangan kasus COVID-19 yang terus melonjak. Pernyataan itu disampaikan Menko PMK Muhadjir Effendy dalam jumpa pers, Jumat (18/6/2021). Keputusan diambil setelah pemerintah menggelar rapat lintas kementerian. ""Pemerintah memutuskan mengubah dua hari libur nasional dan meniadakan satu hari libur cuti bersama,"" kata Muhadjir. Saat ini pemerintah mengubah 2   dan menghapus 1 cuti bersama. Tahun ini tak ada cuti bersama pada Hari Raya Natal 24 Desember. Berikut poin keputusannya: 1. Libur tahun baru Islam 1443 Hijriah yang jatuh pada hari Selasa 10 Agustus 2021 diubah menjadi Hari Rabu 11 Agustus 2021 2. Libur Maulid Nabi Muhammad SAW pada tanggal 19 Oktober 2021 diubah menjadi Rabu tanggal 20 Oktober 2021 3. Libur cuti bersama Hari Natal 2021 pada tanggal 24 Desember 2021 ditiadakan Sedangkan libur Hari Raya Idul Adha pada 20 Juli 2021 tetap ada. Berikut ini daftar libur lengkapnya: Hari libur nasional 2021 1. Jumat, 1 Januari: Tahun Baru 2021 Masehi 2. Jumat, 12 Februari: Tahun Baru Imlek 2572 Kongzili 3. Kamis, 11 Maret: Isra Mikraj Nabi Muhammad SAW 4. Minggu, 14 Maret: Hari Suci Nyepi Tahun Baru Saka 1943 5. Jumat, 2 April: Wafat Isa Al Masih 6. Sabtu, 1 Mei: Hari Buruh Internasional 7. Kamis, 13 Mei: Kenaikan Isa Al Masih sekaligus Hari Raya Idul Fitri 1442 Hijriah 8. Jumat, 14 Mei: Hari Raya Idul Fitri 1442 Hijriah 9. Rabu, 26 Mei: Hari Raya Waisak 2565 10. Selasa, 1 Juni: Hari Lahir Pancasila 11. Selasa, 20 Juli: Hari Raya Idul Adha 1442 Hijriah 12. Rabu, 11 Agustus: Tahun Baru Islam 1443 Hijriah (diubah) 13. Selasa, 17 Agustus: Hari Kemerdekaan Republik Indonesia 14. Rabu, 19 Oktober: Maulid Nabi Muhammad SAW (diubah) 16. Sabtu, 25 Desember: Hari Raya Natal Cuti bersama 1. Rabu, 12 Mei: Hari Raya Idul Fitri 1442 Hijriah",2 Hari Besar Keagamaan 'Kejepit' yang Liburnya Digeser Pemerintah,idulfitri,https://news.detik.com/berita/d-5763268/2-hari-besar-keagamaan-kejepit-yang-liburnya-digeser-pemerintah?single=1,"Selasa, 12 Okt 2021 11:42 WIB"
"Pemerintah terus mengingatkan masyarakat bahwa pandemi belum usai. Pergerakan virus COVID-19 dinamis pada tingkat global, tingkat kepatuhan protokol kesehatan di Tanah Air, serta target cakupan vaksinasi yang masih hasih harus dikejar jadi pengingat bahwa kewaspadaan harus tetap ditingkatkan. Juru Bicara Pemerintah Vaksinasi COVID-19 Kementerian Kesehatan dr. Siti Nadia Tarmidzi menjelaskan situasi global pandemi COVID-19 yang diharapkan dapat menjadi pembelajaran. Berdasarkan laporan Badan Kesehatan Dunia (WHO) per 26 Oktober 2021, terjadi peningkatan jumlah kasus dan kematian di tingkat global. ""Salah satu yang dianggap mempengaruhi peningkatan kasus tersebut adalah sudah dilakukannya berbagai pelonggaran dan penurunan kepatuhan terhadap protokol kesehatan, seperti penggunaan masker, cuci tangan, dan jaga jarak,"" tutur Nadia dalam keterangan tertulis, Rabu (27/10/2021). Dari situasi tersebut, katanya, Indonesia dapat mengambil pelajaran bahwa vaksin saja belum cukup, melainkan harus diimbangi dengan kepatuhan terhadap protokol kesehatan yang sudah ditetapkan. Di Tanah Air, kata dia, meski situasi pandemi terkendali, namun hari libur panjang dalam rangka Natal dan Tahun Baru akan segera tiba. Potensi peningkatan mobilitas pada waktu tersebut, dapat membuka risiko terjadinya lonjakan kasus dan bahkan gelombang ketiga. ""Kita dapat mencegah potensi lonjakan kasus atau potensi gelombang ketiga dengan menjadikan mobilitas tidak meningkat sampai pada angka 10% seperti pada kondisi Nataru 2020 dan pasca Idul Fitri 2021,"" tutur Nadia. Saat ini, menurutnya, terdapat 105 kabupaten/kota di 30 provinsi yang terlihat ada tren peningkatan kasus konfirmasi dalam 7 minggu terakhir. Hal ini tentunya menuntut kewaspadaan bersama, mengingat Indonesia telah berada dalam kondisi terus menekan angka penularan kasus COVID-19 sekaligus menekan jumlah kasus positif pada level serendah mungkin. Lebih lanjut, Nadia juga terus mengimbau masyarakat untuk tidak ragu dan tidak takut ikut vaksinasi. ""Kita bisa akhiri pandemi COVID-19 jika kita bersatu melawannya. Sejarah membuktikan, vaksin beberapa kali telah menyelamatkan dunia dari pandemi. Vaksin adalah salah satu temuan berharga dunia sains,"" ujarnya. Sementara itu, Juru Bicara Pemerintah untuk COVID-19 dan Duta Adaptasi Kebiasaan Baru dr. Reisa Broto Asmoro menyoroti penurunan tingkat kepatuhan Prokes di tengah masyarakat. ""Dari seluruh lokasi kerumunan yang dipantau dalam 7 hari terakhir, restoran dan kedai (20,6%) dan tempat wisata (9,9%) termasuk ke dalam kategori kepatuhan memakai masker kurang dari 60%. Ini adalah titik lengah,"" ujar Reisa. Ia mengingatkan meski berkumpul dengan orang-orang yang sudah divaksin dan diketahui status kesehatannya melalui aplikasi PeduliLindungi, namun sebaiknya kita tidak terlalu percaya diri untuk berkerumun dan melakukan kontak tanpa memakai masker. Apalagi, kata Reisa, cakupan vaksinasi nasional belum mencapai 100%. Menurutnya, baru sekitar 25% dari kelompok masyarakat rentan yang divaksin lengkap dan baru 50% warga rentan dan umum yang sudah vaksin kesatu. Untuk kelompok usia 12-17 tahun, baru 3,1 juta lebih anak yang telah divaksin lengkap dan 3,8 juta baru mendapatkan dosis pertama. ""Dan yang paling serius adalah kaum lansia masih banyak yang harus dipersuasi untuk ikut vaksinasi,"" tuturnya. Cakupan vaksinasi lansia saat ini, kata Reisa, masih jauh dari harapan, karena lansia adalah kelompok pertama yang divaksinasi sejak awal tahun 2021. Reisa menyebutkan ini adalah titik lengah yang besar. Apabila di ruang publik masih banyak yang belum divaksin, risiko tertular COVID-19 masih tetap tinggi. Selama konfirmasi kasus baru masih ada, meski rendah, fakta tersebut menunjukkan bahwa penularan masih terjadi. Karena itu ia terus mengajak masyarakat untuk bantu gencarkan vaksinasi lansia, kelompok rentan dan anak, sambil tetap disiplin protokol kesehatan, yakni mengenakan masker, menjaga jarak, dan mencuci tangan dengan air mengalir dan sabun. Juga mengimbau untuk mengurangi mobilitas serta menjauhi kerumunan. ""Pandemi masih ada, dia tidak berakhir di kota dan kabupaten kita kalau tidak berakhir di seluruh Indonesia,"" tegas Reisa.",,idulfitri,https://health.detik.com/berita-detikhealth/d-5785643/ingat-pandemi-belum-usai-jangan-ciptakan-titik-lengah?single=1,"Rabu, 27 Okt 2021 21:53 WIB"
"Menko Pembangunan Manusia dan Kebudayaan (PMK) Muhadjir Effendy mengatakan, perubahan tanggal merah pada peringatan keagamaan hanya dilakukan untuk peringatan yang tidak memiliki ritual ibadah. Begitu pula sebaliknya, perubahan tidak akan dilakukan pada peringatan hari besar yang memiliki ritual ibadah tertentu. Salah satu alasan pergeseran hari libur nasional termasuk libur Maulid Nabi Muhammad SAW dilakukan untuk menekan penyebaran pandemi COVID-19. Penetapan ini juga didasarkan pada hasil evaluasi selama dua tahun terakhir semenjak pandemi COVID-19 berlangsung. ""Sesuai arahan Bapak Presiden dan hasil keputusan Rapat Koordinasi Tingkat Menteri, maka perlu dilakukan tindakan terukur dan efektif untuk mengendalikan penyebaran pandemi COVID-19,"" ujar Muhadjir pada konferensi pers, Jumat (18/6/2021) lalu. Perubahan jadwal libur Maulid Nabi 2021 tertuang dalam Surat Keputusan Bersama (SKB) 3 menteri, yaitu Menteri Agama, Menteri Ketenagakerjaan, dan Menteri Pendayagunaan Aparatur Negara dan Reformasi Birokrasi Nomor 281 Tahun 2021, Nomor 1 Tahun 2021 tentang Perubahan Atas Keputusan Bersama Menteri Agama, Menteri Ketenagakerjaan, Menteri Pendayagunaan Aparatur Negara dan Reformasi Birokrasi Nomor 642 Tahun 2020, Nomor 4 Tahun 2020, Nomor 4 tahun 2020 tentang Hari libur Nasional dan Cuti Bersama Tahun 2021. Berdasarkan SKB 3 menteri tersebut, terdapat dua pergeseran hari libur nasional, yaitu libur Tahun Baru Islam 1443 Hijriah yang jatuh pada hari Selasa, 10 Agustus 2021, diubah menjadi hari Rabu, 11 Agustus 2021 dan Libur Maulid Nabi Muhammad SAW pada tanggal 19 Oktober 2021 diubah menjadi Rabu tanggal 20 Oktober 2021. Muhadjir menjelaskan, alasan lain perubahan   dan lainnya adalah untuk menghindari long weekend yang berisiko meningkatkan tingginya mobilitas untuk berlibur dan memicu kerumunan. Hal tersebut berisiko terhadap kenaikan jumlah kasus COVID-19. Menurut keputusan terbaru, terdapat 16 kali hari libur nasional pada tahun 2021. Berikut hari libur nasional 2021: 1. Jumat, 1 Januari: Tahun Baru 2021 Masehi 2. Jumat, 12 Februari: Tahun Baru Imlek 2572 Kongzili 3. Kamis, 11 Maret: Isra Mi'raj Nabi Muhammad SAW 4. Minggu, 14 Maret: Hari Suci Nyepi Tahun Baru Saka 1943 5. Jumat, 2 April: Wafat Isa Al Masih 6. Sabtu, 1 Mei: Hari Buruh Internasional 7. Kamis, 13 Mei: Kenaikan Isa Al Masih sekaligus Hari Raya Idul Fitri 1442 Hijriah 8. Jumat, 14 Mei: Hari Raya Idul Fitri 1442 Hijriah 9. Rabu, 26 Mei: Hari Raya Waisak 2565 10. Selasa, 1 Juni: Hari Lahir Pancasila 11. Selasa, 20 Juli: Hari Raya Idul Adha 1442 Hijriah 12. Rabu, 11 Agustus: Tahun Baru Islam 1443 Hijriah 13. Selasa, 17 Agustus: Hari Kemerdekaan Republik Indonesia 14. Rabu, 20 Oktober:  16. Sabtu, 25 Desember: Hari Raya Natal","Libur Maulid Nabi Muhammad Digeser, Mengapa?",idulfitri,https://www.detik.com/edu/edutainment/d-5759889/libur-maulid-nabi-muhammad-digeser-mengapa?single=1,"Sabtu, 09 Okt 2021 16:04 WIB"
