artikel,judul,keyword,link,tanggal
"Pahlawan nasional tidak termasuk gelar kehormatan Veteran Republik Indonesia. Ketentuan mengenai pahlawan nasional ini diatur dalam Undang-Undang Negara Republik Indonesia Nomor 20 Tahun 2009. Pahlawan Nasional merupakan gelar yang diberikan kepada warga negara Indonesia atau seseorang yang berjuang melawan penjajahan di wilayah yang sekarang menjadi wilayah Negara Kesatuan Republik Indonesia, gugur atau meninggal dunia demi membela bangsa dan negara, atau yang semasa hidupnya melakukan tindakan kepahlawanan atau menghasilkan prestasi dan karya yang luar biasa bagi pembangunan dan kemajuan bangsa dan negara Republik Indonesia. Gelar berupa Pahlawan Nasional dan di dalam pemberian Gelar dapat disertai dengan pemberian Tanda Jasa dan atau Tanda Kehormatan, seperti dikutip dari laman Kementerian Sekretariat Negara RI. Prof. Dr. M. Sardjito lahir di Magetan, Madiun, Jawa Timur pada 13 Agustus 1889. Sardjito mendirikan rumah sakit sederhana di rumahnya di Desa Sendang Jimbung dan menyediakan vaksin dan obat untuk mendukung kekuatan Angkatan Perang dan Rakyat. Namanya diabadikan menjadi nama Rumah Sakit Umum pusat Dr. Sardjito di Kabupaten Sleman, Yogyakarta. Sardjito terlibat langsung dalam pendirian dan pengembangan beberapa perguruan tinggi di Indonesia, seperti Universitas Gadjah Mada (UGM), Universitas Airlangga (Unair), Universitas Brawijaya (Unibraw), Universitas Hasanuddin (Unhas), Universitas Andalas (Unand), Universitas Jenderal Soedirman (Unsoed), dan Universitas Islam Indonesia (UII). Ruhana Kuddus (Roehana Koeddoes) lahir pada 20 Desember 1884 di Koto Gadang Agam, Sumatra Barat. Ruhana Kuddus merupakan pahlawan nasional yang berjuang memajukan kehidupan perempuan. Pada 1911, Ruhana Kuddus mendirikan sekolah Kerajinan Amai Setia (KAS). Pada 1912, ia memimpin Surat Kabar Ruhana Kuddus yang semua karyawannya perempuan. Ruhana Kuddus juga mendirikan sekolah kerajinan menjahit pada 1916. Ia lalu menjadi redaktur surat kabar Perempoean Bergerak pada 1921. Ruhana Kuddus juga mengajar di Sekolah Vereeniging Sudiefonds Minangkabau (VSM) Fort de Kock (Bukittinggi), sambil menulis untuk surat kabar Tjahaja Soematra dan menjadi koresponden tetap surat kabar Dagblad Radio. Sultan Himayatuddin Muhammad Saidi lahir di Buton, awal abad ke-18 Masehi. Sultan Buton ke-20 dan Sultan Buton ke-23 ini memimpin perlawanan gerilya terhadap Belanda di Gunung Siontapina, tempat ia kelak wafat. Ia menentang kebijakan-kebijakan penjajahan Belanda yang merugikan rakyat Buton. Sultan Himayatuddin Muhammad Saidi atau Oputa Yi Koo pindah ke kawasan belantara Lakasuba untuk merumuskan pola pertahanan baru yang dikenal dengan Perang Rakyat Semesta. Pola pertahanannya terbagi atas tiga unit pasukan reaksi cepat Sambo-samboekea, yaitu di wilayah Kamaru, Pasar Wajo, dan Sampolawa. A.A. Maramis lahir di Paniki Bawah, Minahasa, 20 Juni 1897. Sekembalinya dari belajar,   nasional ini pulang ke Indonesia pada 1924 dan membuka praktik pengacara di Semarang hingga 1926. Ia merupakan satu-satunya orang Minahasa dalam daftar anggota BPUPKI dan Panitia Sembilan dan dikenal sebagai Pendiri Negara RI. A.A. Maramis merupakan Menteri Keuangan RI yang memerintahkan mencetak Oeang Kertas RI (ORI) pertama setelah ekonomi Indonesia terpuruk setelah perang pasca kemerdekaan. Pada 1950, ia menerima gelar Doktor Honoris Causa (HC) dari University for Easterin, University of Manila dalam ilmu hukum karena dianggap berjasa dalam pengembangan ilmu hukum Indonesia. Selanjutnya pahlawan nasional K.H. Masjkur >>> K.H. Masjkur lahir di Singosari, Malang dan wafat di Jakarta, 18 Desember 1992. Pahlawan nasional ini merupakan anggota BPUPKI yang termasuk salah seorang penggagas lahirnya dasar negara Pancasila. Pada 1923, K.H. Masjkur mendirikan Madrasah Misbahul Wathon. Ia juga ikut mendirikan Nahdlatul Ulama (NU) pada 1926 dan menjadi ketua cabang NU Malang pertama. Pada 1954, ia mendirikan Serikat Buruh Muslimin Indonesia (Sarbumusi). Prof. K.H. Abdul Kahar Muzakkar lahir di Kampung Gading Selatan, Yogyakarta, 16 April 1907. Abdul Kahar Muzakkar aktif dalam BPUPKI dan ikut mencanangkan Piagam Jakarta. Ia memperjuangkan kemerdekaan Indonesia lewat Gerakan Pelajar Indonesia dan Perhimpunan Indonesia Raya cabang Mesir, di mana ia menjadi ketuanya. Lewat diplomasinya, Indonesia berhasil mendapat pengakuan kemerdekaan dari Mesir pada 18 November 1946. Abdul Kahar Muzakkar merupakan pelopor dan rektor Sekolah Tinggi Islam Jakarta bersama Moh. Hatta, Moh. Natsir Moh. Roem, dan K.H. Wahid Hasyim. Pada 1940, ia pernah ditangkap Belanda karena ikut serta dalam Konferensi Islam dan Pameran Kebudayaan Islam di Tokyo, Jepang. Mgr. Albertus Soegijapranata merupakan vikaris apostolik Semarang yang kemudian menjadi uskup agung pribumi pertama. Selama revolusi nasional, pahlawan nasional ini berusaha untuk meningkatkan pengakuan kedaulatan Indonesia di dunia luas dan meyakinkan orang Katolik untuk berjuang demi Indonesia. Nama Soegijapranata diabadikan sebagai nama perguruan tinggi di Semarang, Universitas Katolik Soegijapranata. Laksamana Muda John Lie (Jahja Daniel Dharma) adalah perwira tinggi TNI yang menembus blokade Belanda untuk barter hasil bumi dengan senjata. Pahlawan nasional ini kemudian menyerahkan senjata itu kepada pejabat seperti Bupati Riau sebagai sarana perjuangan melawan penjajah. John Lie setidaknya 15 kali melakukan operasi penyelundupan senjata perjuangan dengan kapal kecil cepat yang harus melawan ombak besar dan patroli Belanda di Indonesia dan Inggris di Singapura. Tan Malaka (Ibrahim Gelar Datuk Sutan Malaka) lahir pada 2 Juni 1897. Pahlawan nasional ini merupakan pejuang kemerdekaan RI da pendiri pasukan Gerilya Pembela Prokalamasi. Tan Malaka juga seoran pendiri sekolah sekaligus guru. Ia mengajar anak-anak berbahasa Melayu di Morawa, Deli, Sumatra Utara sejak 1920, dan membuka Sekolah Rakyat di Semarang. Tan Malaka kerap menulis tentang kesenjangan kaum kapitalis dan pekerja, penderitaan kuli kebut teh, dan kehidupan pribumi di Sumatra dalam berbagai surat kabar. Urip Sumoharjo (Oerip Sumoharjo) lahir di Purworejo, 22 Februari 1893. Urip Sumoharjo adalah jenderal dan kepala staf umum TNI pertama di masa revolusi nasional Indonesia. Pahlawan nasional yang menyenangi taktik perang gerilya ini merupakan salah satu penentang Perjanjian Renville. Selanjutnya pahlawan nasional Cut Nyak Dhien>>> Cut Nyak Dhien (Tjoet Nja' Dhien) lahir di Lampadang, Kerajaan Aceh, 1848. Pahlawan nasional ini melawan Belanda termasuk dalam Perang Aceh. Setelah suami pertamanya, pejuang Ibrahim Lamnga gugur, Cut Nyak Dhien menikah dengan Teuku Umar setelah dijanjikan dapat ikut turun di medan perang jika menerima lamaran. Setelah Teuku Umar wafat pada 1899, Cut Nyak Dhien terus berjuang di pedalaman Meulaboh. Ia ditangkap dan akhirnya diasingkan ke Sumedang untuk mengurangi pengaruhnya atas perlawanan rakyat Aceh hingga wafat pada 1908. Bung Tomo lahir dengan nama Sutomo pada 3 Oktober 1920. Bung Tomo merupakan tokoh orator yang mendorong pertahanan rakyat Indonesia dalam Pertempuran 10 November 1945. Pertempuran ini yang memukul mundur sementara pasukan Inggris di Surabaya. Kartini merupakan pahlawan nasional yang mendorong kesetaraan bagi perempuan, salah satunya dengan mengupayakan pembukaan sekolah-sekolah bagi anak-anak di daerahnya. Lewat korespondensi dengan berbagai orang, R.A. Kartini berhasil membuka sekolah yang menekankan pada budi pekerti dan karakter anak. Fatmawati merupakan orang yang menjahit bendera pusaka Sang Saka Merah Putih. Bendera Merah Putih jahitan Fatmawati dikibarkan pada Proklamasi Kemerdekaan Indonesia pada 17 Agustus 1945. Mohammad Yamin adalah sastrawan, sejarawan, budayawan, politikus, dan ahli hkum yang mempelopori Sumpah Pemuda dan dasar negara Indonesia Pancasila. Anggota BPUPKI ini mendorong hak asasi manusia masuk dalam konstitusi negara. Saat menjadi Menteri Kehakiman, Mohammad Yamin membebaskan 950 tahanan politik yang dipenjara tanpa proses pengadilan karena cap komunis atau sosialis. Sementara itu, Saat menajdi Menteri Pengajaran, Pendidikan, dan Kebudayaan, Mohammad Yamin merintis pendirian perguruan tinggi, salah satunya Universitas Andalas di Padang dan Perguruan Tinggi Pendidikan Guru yang kelak jadi Universitas Pendidikan Indonesia (UPI) di Bandung. Sisingamangaraja XII (Patuan Bosar Sinambela) adalah Maharaja Toba, atau raja di negeri Toba, Sumatra Utara yang berperang melawan Belanda. Penobatan Sisingamangaraja XII sebagai maharaja bersamaan dengan politik pintu terbuka Belanda yang memaksakan perjanjian pendek di Kesultanan Aceh dan Toba. Kedua kerajaan ini jadi penting untuk dikuasai Belanda sebab membuka hubungan dagang dengan negara-negara Eropa lainnya. Pada tahun 1873 Belanda melakukan invasi militer ke Aceh lewat Perang Aceh yang diteruskan dengan perang di Tanah Batak pada 1878. Sisingamangaraja yang berhubungan dekat dengan Kerajaan Aceh menolak dan menyatakan perang. Jenderal Besar TNI (Anumerta) Soedirman merupakan   nasional panglima besar TNI pertama yang lahir pada 24 Januari 1916. Guru dan Kepala Sekolah di sekolah dasar Muhammadiyah ini semula tetap mengajar setelah Jepang menduduki Hindia Belanda pada 1942. Ia lalu bergabung dengan tentara Pembela Tanah Air (PETA) yang disponsori Jepang dan melakukan pemberontakan hingga diasingkan ke Bogor. Jenderal Soedirman memimpin petempuran melawan pasukan Inggris dan Belanda di Ambarawa yang menyebabkan penarikan diri tentara Inggris. Ia juga memimpin perang gerilya saat Agresi Militer II di Yogyakarta. Dari Sobo, dekat Gunung Lawo, Jenderal Soedirman memimpin kegiatan militer di Pulau Jawa, termasuk Serangan Umum 1 Maret 1949 di Yogyakarta yang dipimpin Letnan Kolonel Soeharto yang kelak jadi Presiden ke-2 RI.","17 Nama Pahlawan Nasional Indonesia, Siswa Wajib Tahu",serikatburuh,https://www.detik.com/edu/detikpedia/d-5764333/17-nama-pahlawan-nasional-indonesia-siswa-wajib-tahu?single=1,"Rabu, 13 Okt 2021 09:20 WIB"
"Menteri Ketenagakerjaan, Ida Fauziyah mengatakan Undang-Undang Nomor 11 Tahun 2020 tentang Cipta Kerja hadir untuk memberikan kepastian perlindungan kepada para pekerja. Tak cuma itu, menurutnya UU ini juga hadir untuk memberikan kesempatan kepada para pencari kerja. ""Jadi kehadiran undang-undang ini sangat penting. Kita harus ingat ada sekelompok angkatan kerja yang tidak punya asosiasi pengangguran,"" kata Ida dalam keterangan tertulis, Rabu (6/10/2021). Dalam Rapat Kerja Nasional (Rakernas) Serikat Pekerja PT BNI di Bogor, Jawa Barat, Ida menjelaskan bahwa setiap tahunnya dibutuhkan lapangan kerja untuk 2,9 juta orang. Selain itu, jumlah ini juga ditambah pengangguran yang mencapai 8,7 juta orang, dari sebelumnya sebanyak 5 juta. Menurutnya, penambahan angka pengangguran ini merupakan imbas dari COVID-19. ""Oleh karena itu, undang-undang ini diharapkan memberikan kesempatan kepada angkatan kerja baru untuk bisa masuk ke dalam dunia kerja,"" ujarnya. Ida menilai kesempatan untuk angkatan kerja baru dapat dilakukan dengan membangun hubungan industrial yang kondusif. Sehingga, memungkinkan terjadinya investasi baru yang masuk ke Indonesia. ""Lapangan pekerjaan baru terjadi jika terjadi hubungan industrial yang harmonis,"" ucapnya. Ia pun menyampaikan terima kasih kepada seluruh serikat pekerja/serikat buruh, khususnya serikat pekerja BNI atas kontribusi yang positif dalam membangun hubungan industrial yang kondusif. Hal ini ditunjukkan dengan dukungan dari serikat pekerja/serikat buruh atas beberapa kebijakan Pemerintah. ""Saya menyampaikan terima kasih. Saya juga meminta kepada teman-teman Serikat Pekerja agar terus menjaga hubungan industrial yang harmonis,"" harapnya. ""Dalam dinamika ketenagakerjaan, hubungan industrial sangat dinamis. Sekarang yang perlu kita dorong adalah bagaimana dialog sosial itu terjadi, dan dialog sosial yang paling efektif itu apabila dilakukan secara Bipartit,"" sambung Ida. Ida meyakini jika pola hubungan industri yang kondusif terjadi dalam seluruh dunia industri, maka kesempatan bagi pencari kerja dalam mendapatkan pekerjaan akan menjadi terbuka.",Menaker: Lapangan Kerja Baru Terjadi Jika Hubungan Industrial Harmonis,serikatburuh,https://finance.detik.com/berita-ekonomi-bisnis/d-5755963/menaker-lapangan-kerja-baru-terjadi-jika-hubungan-industrial-harmonis?single=1,"Rabu, 06 Okt 2021 20:03 WIB"
"Aksi   dan buruh dilakukan di depan Gedung Negara Grahadi. Aksi yang dilakukan dengan menutup satu lajur ini membuat arus lalu lintas Jalan Gubernur Suryo sempat tersendat. Massa yang membawa satu buah kendaraan terbuka itu menuntut hak serikat pekerja dan menuntut Uang kuliah tunggal (UKT). Kendaraan itu diparkir di depan Grahadi dan massa bergantian melakukan orasi. Mahasiswa yang turun dalam aksi di Grahadi dari Universitas Negeri Surabaya (Unesa). Sedangkan buruh dari Kongres Aliansi Serikat Buruh Indonesia (KASBI). Dari pantauan , kendaraan dari arah Jalan Basuki Rahmat maupun Jalan Simpang Dukuh yang akan ke Jalan Gubernur Suryo mulai melambat. Massa yang berjumlah sekitar 100 orang itu tampak duduk-duduk di tengah jalan. ""Kita tidak harus diam saja, kita harus memperjuangkan hak-hak kita. Hidup buruh, hidup mahasiswa, hidup perempuan yang melawan,"" kata orator tersebut, Kamis (14/10/2021). Ketua Komisaris GMNI Unesa, Amirullah Hakim mengatakan, buruh dan mahasiswa turun untuk menolak kapitalisme. ""Karena ini suara mahasiswa juga, jadi ideologinya juga kita menolak namanya kapitalisme,"" kata Hakim kepada wartawan. Dia juga menyebut uang yang telah dibayar ke kampusnya tidak sesuai dengan apa yang mereka dapat di perguruan tingginya. ""Sekarang kita kan di masa pandemi. Jadi   yang dikeluarkan dan kita sudah bayar, itu tidak sesuai dengan fasilitas yang kita peroleh,"" pungkasnya.",Demo Mahasiswa-Buruh di Depan Grahadi Sempat Bikin Lalin Tersendat,serikatburuh,https://news.detik.com/berita-jawa-timur/d-5766838/demo-mahasiswa-buruh-di-depan-grahadi-sempat-bikin-lalin-tersendat?single=1,"Kamis, 14 Okt 2021 14:50 WIB"
"Sejumlah buruh yang tergabung dalam Kongres Aliansi Serikat Buruh Indonesia (KASBI) menggelar aksi unjuk rasa di depan Gedung Sate, Bandung. Mereka menuntut pemerintah untuk memenuhi sepuluh tuntutan rakyat (Sepultura) yang salah satunya agar Omnibus Law dicabut. Aksi tersebut digelar bagian dari peringatan berdirinya Federasi Serikat Buruh Dunia (WTFU). Dalam aksinya mereka menyampaikan sejumlah tuntutan yang tertuang dalam sepuluh tuntutan rakyat (Sepultura). Sepuluh tuntutan itu, yakni cabut omnibus law, tolak penghapusan upah sektoral, stop PHK sepihak, stop kriminalisasi dan penangkapan aktivis, berikan persamaan hak dan perlindungan bagi PRT dan buruh migran, angkat seluruh penyuluh PLKB dan APPBI menjadi pegawai ASN, jamin dan lindungi kaum buruh di berbagai sektor, vaksin gratis untuk seluruh kaum buruh dan tolak pemberangusan pegawai KPK. ""Dalam aksi hari ini kita dari KASBI instruksi nasional untuk seluruh daerah anggota KASBI di Indonesia ini momen peringatan berdirinya WFTU dan kebetulan kita bergabung di WFTU. Kedua, momen hari ini kita menuntut pencabutan Omnibus Law Cilaka,"" ucap Koordinator Aksi Siti Eni di lokasi unjuk rasa, Kamis (14/10/2021). Pantauan  , para peserta membuat aksi teatrikal di sela-sela orasi. Tampak seorang pria, mengenakan kostum gurita yang menjadi simbol jeratan oligarki. ""Bagi kita bukan UU Cipta Kerja yang memang dalam kenyataannya hari ini adalah UU Cilaka itu sendiri sudah dipraktikkan di pabrik-pabrik dengan dalih pandemi COVID-19 untuk PHK sepihak dan dirumahkan. Kita juga menuntut sepultura,"" kata Eni melanjutkan. Eni mengatakan selain di Bandung KASBI juga menggelar aksi serentak di Karawang, Subang, Bandung raya, Bekasi dan Indramayu. Menurutnya, unjuk rasa ini wajib. ""Hari ini perlawanan itu kita kobarkan dari KASBI bahwa tujuan kita adalah menggerakkan hati mereka yang belum tergerak artinya persatuan untuk melakukan pergerakan karena Omnibus Law Cilaka itu tidak hanya dirasakan KASBI saja melainkan seluruh klaster buruh, nelayan, mahasiswa, buruh dan yang lainnya,"" ujarnya. ""Kita secara bersama-sama akan mengajak mereka untuk melakukan sebuah pergerakan,"" ucap Siti. Sementara itu, ratusan buruh di Karawang juga menggelar aksi unjuk rasa di depan Kantor Pemkab Karawang. Mereka menyampaikan berbagai tuntutan terutama meminta agar kesejahtaraan para buruh lebih diperhatikan. Koordinator aksi dari Federasi Serikat Pekerja Karawang (FSPEK) Kongres Aliansi Serikat Buruh Indonesia (KASBI) Raswita mengungkapkan gelaran aksi ini dilakukan serentak oleh KASBI di seluruh wilayah di Indonesia, dengan membawa beberapa tuntutan rakyat. ""Adapun tuntutannya itu, yakni menuntut pelayanan kesehatan umum gratis bagi semua kalangan, peningkatan kesejahteraan hidup bagi kaum buruh dan pensiunan atau korban PHK, kebebasan berserikat dan menyampaikan pendapat, hancurkan rasisme dan segala bentuk diskriminasi, perlindungan terhadap lingkungan hidup, juga meminta Pemkab Karawang mendukung pencabutan Omnibus Law dan seluruh PP turunanya; Peraturan Pemerintah No.34, No.35, No.36, dan No.37,"" katanya, Kamis (14/10/2021). ""Kemudian menolak penghapusan upah sektoral, seperti semula, stop PHK sepihak, stop Union Busting dan berikan jaminan kepastian kerja dan kebebasan berserikat, stop kriminalisasi dan penangkapan aktivis, bebaskan seluruh aktivis gerakan rakyat yang ditangkap dan dikriminalisasi, berikan persamaan hak dan perlindungan bagi Pekerja Rumah Tangga (PRT) dan seluruh buruh Migran, dan sahkan RUU PPRT,"" ucap Raswita menambahkan. Selain itu, pihaknya juga meminta agar seluruh Penyuluh KB (PLKB) dan Penyuluh Perikanan (APPBI) diangkat menjadi pegawai ASN, berikan gaji dan hak-haknya sesuai ketentuan, dan menuntut jaminan perlindungan kaum buruh di sektor industri, pariwisata, perhotelan, perkebunan, pertambangan, perikanan, kelautan, kontruksi, transportasi, driver online atau ojek online. ""Terus jgta berikan vaksin gratis untuk seluruh kaum buruh dan seluruh rakyat Indonesia, usut tuntas kasus Korupsi BPJS TK dan Korupsi Bansos Pandemi COVID-19,"" ungkapnya. Sementara itu, pihak buruh yang berunjuk rasa juga menyoroti soal pemberangusan pegawai KPK. Mereka memin 58 orang pegawai KPK kembali dipekerjakan seperti semula tanpa syarat dan menuntaskan kemiskinan ekstrem yang terjadi di Karawang. ""Salah satu halnya juga soal kemiskinan ekstrem di Karawang, bagaimana kinerja Pemkab selama ini,"" ujarnya.","Desak Omnibus Law Dicabut, Buruh Gelar Demo di Depan Gedung Sate",serikatburuh,https://news.detik.com/berita-jawa-barat/d-5766687/desak-omnibus-law-dicabut-buruh-gelar-demo-di-depan-gedung-sate?single=1,"Kamis, 14 Okt 2021 13:49 WIB"
"Pemerintah melalui Kementerian Ketenagakerjaan (Kemnaker) mendorong pengurus Serikat Pekerja/Serikat Buruh (SP/SB) perempuan, agar sering melakukan dialog sosial dengan manajemen perusahaan. Utamanya terkait pentingnya membangun budaya zero tolerance for harassment. Hal ini guna memberikan rasa aman bagi pekerja perempuan. Dalam diskusi panel High-Level Dialogue Forum Global Deal di Jakarta, Senin (11/10) malam, Sekjen Kemnaker, Anwar Sanusi menegaskan kekerasan atau pelecehan seksual baik verbal maupun nonverbal tidak boleh terjadi pada pekerja, terutama pekerja perempuan. ""Dialog sosial akan sangat berpengaruh dan memberikan manfaat bagi inklusivitas pekerja perempuan di dunia kerja,"" ujar Anwar dalam keterangan tertulis, Selasa (12/10/2021). Menurutnya, inisiasi dialog sosial ini harus datang dari perempuan karena perempuan dinilainya lebih peka ketimbang laki-laki. Ia meminta agar perempuan lebih proaktif dalam berdialog sekaligus menyosialisasikan ke kalangan pekerja dan perusahaan melalui forum-forum yang ada di perusahaan, agar tidak boleh terjadi kekerasan dan pelecehan. ""Jika sering dilakukan sosialisasi, maka ruang bagi siapa pun yang akan melakukan kekerasan atau pelecehan menjadi tertutup,"" terangnya. Anwar menjelaskan sosialisasi antikekerasan atau pelecehan tidak hanya di tempat kerja. Melainkan juga di lingkungan luar seperti keluarga dan lingkungan sosialnya. ""Selain itu, dialog sosial yang melibatkan organisasi maupun asosiasi akan sangat mendukung terlahirnya kebijakan-kebijakan yang dapat dijadikan pedoman untuk tercapainya kesetaraan gender di tempat kerja dan memastikan kerja layak untuk semua orang,"" katanya. Melalui dialog sosial, lanjut Anwar, serikat pekerja/serikat buruh perempuan bisa berdiskusi tentang pentingnya membangun budaya zero tolerance for harassment, termasuk terhadap pelecehan dan kekerasan seksual. Dengan begitu diharapkan perempuan dapat merasa lebih aman dan nyaman saat bekerja. ""Sesuai arahan Menaker Bu Ida Fauziyah, kalau perusahaan punya komitmen, orang tidak berani macam-macam melakukan kekerasan atau pelecehan seksual,"" katanya. Dikatakannya, Kemnaker berpedoman pada Sustainable Development Goals (SDGs) mengenai pengarusutamaan gender dan promosi pekerjaan yang layak dan mencerminkan adanya kerangka dan standar internasional yang mengatur kesetaraan gender, Konvensi Penghapusan Segala Bentuk Diskriminasi terhadap Perempuan (CEDAW), Deklarasi Beijing dan Mimbar Aksi untuk Pemberdayaan Perempuan, Konvensi inti ILO, serta Deklarasi, Konsensus, dan Rencana Kerja ASEAN. Ia menyebut pedoman dan kebijakan tersebut merupakan hasil dari dialog sosial antara pemerintah dan organisasi sebagai rujukan dalam penyusunan strategi khusus Kemnaker. ""Kami berharap strategi ini dapat bermanfaat bagi transformasi Indonesia yang lebih produktif dan kompetitif dengan memajukan kesetaraan gender dan perlakuan yang sama bagi semua pekerja perempuan dan laki-laki,"" pungkasnya.","Cegah Pelecehan, Kemnaker Beri Pesan Ini ke Serikat Pekerja Perempuan",serikatburuh,https://news.detik.com/berita/d-5764470/cegah-pelecehan-kemnaker-beri-pesan-ini-ke-serikat-pekerja-perempuan?single=1,"Selasa, 12 Okt 2021 23:20 WIB"
"Wakil Ketua DPD Mahyudin menggelar vaksinasi massal di Provinsi Kalimantan Timur selama bulan Oktober dengan 10.000 dosis vaksin Pfizer. Kegiatan dilakukan di enam kabupaten/kota, yakni Kutai Timur, Balikpapan, Samarinda, Kutai Barat, Mahulu, dan Bontang. ""Kami melaksanakan kegiatan ini bercermin dari proses vaksinasi di beberapa kota kabupaten. Langkah yang diambil adalah meng-input lebih awal peserta vaksinasi sesuai arahan Dinas Kesehatan Provinsi Kaltim dan Dinas Kesehatan Kota Samarinda,"" ungkap Staf Ahli Mahyudin, Vani Tambajong dalam keterangan tertulis, Jumat (8/10/2021). Salah satu kegiatan vaksinasi digelar pada Kamis (7/10) kemarin di kota Samarinda dengan 1.500 dosis vaksin jenis Pfizer. Kegiatan berlokasi di jalan Mulawarman Samarinda. Adapun tim kerja vaksinasi bermitra dengan berbagai organisasi sosial, IWAPI Kaltim, komunitas ojek online, partai politik, dan serikat buruh. ""Dalam mendata, kami memperhatikan beberapa faktor yang dapat mempengaruhi kelancaran proses kegiatan di lapangan, antara lain terkait jumlah tenaga medis dan ruang yang tersedia,"" ujar Vani. Dengan memperhatikan kedua hal itu, kata dia, panitia menentukan berapa peserta untuk waktu tertentu, nomor antrean, dan waktu kehadiran peserta. Vani juga menyampaikan ketidakhadiran Mahyudin dalam kegiatan vaksinasi disebabkan adanya kegiatan Paripurna Badan Musyawarah DPD. ""Beliau senang dan sangat bersyukur vaksin jenis Pfizer hadir di tengah minat dan kesadaran tinggi masyarakat kota Samarinda untuk mengikuti kegiatan vaksinasi. Ini pertanda baik sebab ada perubahan stigma, yang dulu masyarakat takut divaksin namun dengan imbauan pemerintah membuat sadar pentingnya divaksin,"" kata dia. Sebagai informasi, Mahyudin menjadi senator pertama yang melaksanakan vaksinasi massal. Penyelenggaraan vaksinasi berdasarkan surat nomor KP.09.00/2671/DPDRI/IX/2021 Hal Penyampaian Daftar Distribusi Vaksin COVID-19 untuk Daerah Pemilihan Anggota DPD Tertanggal 28 September 2021 yang ditujukan kepada Direktur Jenderal Pencegahan dan Pengendalian Kesehatan di Jakarta selanjutnya untuk diberikan dan dimanfaat anggota DPD pada kegiatan vaksinasi di daerah pemilihannya. Adapun surat nomor KP.09.00/2671/DPDRI/IX/2021 menyebut, vaksin yang dibagi kepada warga Samarinda berjenis Pfizer.",Waket DPD Gelar Vaksinasi Massal di 6 Kabupaten/Kota Kaltim,serikatburuh,https://news.detik.com/berita/d-5758559/waket-dpd-gelar-vaksinasi-massal-di-6-kabupatenkota-kaltim?single=1,"Jumat, 08 Okt 2021 15:24 WIB"
