artikel,judul,keyword,link,tanggal
"Kementerian Koperasi dan UKM (Kemenkop UKM) bersama Badan Amil Zakat Nasional (BAZNAS) dan Pemerintah Provinsi (Pemprov) Daerah Istimewa Yogyakarta (DIY) memberikan bantuan modal usaha serta sembako kepada lebih dari 10 ribu mustahik (penerima zakat) dengan nilai total mencapai sekitar Rp 10 miliar. Pemberian bantuan modal usaha ini dalam rangka mendorong UMKM yang terkena dampak akibat pandemi COVID-19 selama dua tahun terakhir. Berdasarkan data Bank Indonesia (BI) 2021, sebanyak 87,5% UMKM di Indonesia terdampak pandemi COVID-19. Sementara itu, sebanyak 93,2% UMKM terdampak pada sisi penjualan yang menurun. ""Tentunya dalam mengatasi kondisi ini, pemerintah tak bisa tinggal diam. Untuk mencegah penurunan kegiatan ekonomi yang lebih buruk, maka dibutuhkan suatu tindakan konkret,"" ujar Menteri Koperasi dan UKM Teten Masduki dalam keterangan tertulis, Jumat (27/8/2021). Hal ini dia ungkapkan saat penyaluran Kita Jaga Usaha UMKM Bangkit secara simbolis di kantor Gubernur DIY. Teten menegaskan UMKM merasakan dampak yang sangat dalam karena pandemi. Mulai dari turunnya omzet sampai penutupan usaha. Ditambah, saat yang bersamaan daya beli masyarakat ikut turun. Untuk itu, pemerintah dan lembaga maupun pemerintah daerah (Pemda) memastikan pelaku usaha kecil, mampu beradaptasi untuk bertahan, pulih, dan melanjutkan usaha di masa pandemi. ""Saya mengapresiasi Pemprov Yogyakarta yang pertumbuhan ekonominya tumbuh 11% di atas pertumbuhan ekonomi nasional di kuartal II-2021. Di mana mayoritas didorong oleh gerakan stimulus yang diberikan ke UMKM,"" kata Teten. Teten juga mengapresiasi kepada Baznas yang telah cepat tanggap dengan inisiatif bersama Kemenkop UKM untuk membantu UMKM terdampak pandemi. Jika bulan puasa yang lalu telah diberikan santunan untuk kaum Dhuafa dan Yatim Piatu, maka sekarang diberikan bantuan untuk Pengusaha Kuliner seperti Warung Tegal, Warung Padang, Bakso, Soto, Pecel Lele, dan Warung makan lainnya yang terdampak pandemi COVID-19. ""Zakat dan dana umat yang dikelola Baznas sebelumnya dioptimalkan pemanfaatannya untuk hal-hal produktif dan kemaslahatan. Tapi sekarang lebih produktif untuk modal usaha. Jadi ibadah dan pahalanya lebih besar lagi,"" sebut Teten. Diketahui, Peluncuran program bantuan tunai untuk usaha mikro ini tersebar di wilayah PPKM Jawa dan Bali yang dikemas dalam program Kita Jaga Usaha, dan dipusatkan di Kota Yogyakarta. Yogyakarta sendiri dipilih menurut Teten, lantaran kementerian melihat sudah banyaknya inisiatif yang dilakukan Pemprov Yogyakarta kepada UMKM untuk bertahan saat pandemi. Pemerintah, lanjut Teten, menargetkan pada 2024, sebanyak 30 juta UMKM dapat terhubung ke ekosistem digital. Hingga Agustus 2021, sudah ada 15,3 juta UMKM atau 23,9% total UMKM yang telah tergabung dalam e-commerce. Sementara itu, Ketua Baznas KH Noor Achmad mengatakan Baznas sebagai lembaga yang diamanatkan oleh Undang-Undang untuk mengelola dana zakat, infak, dan sedekah memiliki peran yang sangat penting dalam membantu kegiatan ekonomi khususnya pelaku UMKM. Baznas membentuk program sebagai respon darurat ekonomi COVID-19 yang terdiri dari UMKM Bangkit dan Dapoer Kuliner Nusantara. Adapun target penyaluran pada Kita Jaga Usaha ini sebesar Rp 13.857.261.770 dengan 10.290 mustahik penerima manfaat. ""UMKM Bangkit ini program pemberian bantuan langsung kepada 10 ribu pelaku UMKM di wilayah PPKM level 3 dan level 4 dengan jumlah bantuan sebesar Rp1 juta per orang. Total bantuan UMKM Bangkit sebesar Rp 10 miliar,"" ujar Noor Achmad. Sementara Program Dapoer Kuliner Nusantara merupakan program pemberdayaan warteg, warung nasi, warung padang, dan usaha kuliner skala kecil lainnya untuk menyediakan 123.888 paket makanan, yang akan didistribusikan kepada pelaku isoman, panti asuhan, panti jompo, lembaga pemasyarakatan, pesantren, rumah singgah, nakes, dan warga terdampak PPKM. Program Dapoer Kuliner Nusantara juga akan melakukan skema cash for work (CFW) bagi pekerja marginal yang akan membantu dalam pelaksanaan program. Total dana Program Dapoer Kuliner Nusantara sebesar Rp 3.857.261.770. ""Kedua program tersebut di atas akan Baznas luncurkan dengan tajuk Kita Jaga Usaha,"" jelas Noor. Gubernur DIY Sri Sultan Hamengkubuwono X menyambut baik program Kita Jaga Usaha yang diinisiasi oleh Baznas. Di mana bantuan itu akan bisa mendorong kemajuan bagi UMKM di Yogyakarta yang potensinya besar. ""Ini akan menjadi stimulus perekonomian nasional secara khusus Yogyakarta sendiri. Tujuan utama bagaimana melindungi dan meningkatkan ekonomi UMKM. Saya punya harapan, ke depan akan ada kemudahan persyaratan bantuan semacam ini serta tepat sasaran untuk pemulihan nasional,"" ujarnya. Ia juga bersyukur, di tengah pandemi pertumbuhan ekonomi Yogyakarta masih bisa tumbuh 11% di kuartal II-2021. Sri Sultan berharap, pertumbuhan selanjutnya di kuartal II dan IV tak jatuh terlalu dalam. ""UMKM memang menjadi salah satu pendukungnya. Semoga bisa terus bangkit,"" pungkasnya.",Kemenkop hingga BAZNAS Keroyokan Bantu Modal Pelaku Usaha Mikro,bantuan panti,https://finance.detik.com/berita-ekonomi-bisnis/d-5698878/kemenkop-hingga-baznas-keroyokan-bantu-modal-pelaku-usaha-mikro?single=1,"Jumat, 27 Agu 2021 15:15 WIB"
"Dua jaringan toko kacamata terkenal di Australia yang dimiliki oleh perusahaan asing meraih laba berlipat ganda setelah mengklaim tunjangan gaji JobKeeper. Peritel global Specsavers mengklaim lebih dari AU$90 juta (Rp900 miliar lebih) untuk mendapat bantuan dana dari program 'JobKeeper' dan tercatat sebagai salah satu penerima terbesar yang diketahui publik. Informasi yang diperoleh ABC mengungkapkan saingan Specsavers yaitu Luxotticajuga meraih laba lebih dari dua kali lipat setelah menerima puluhan juta dolar JobKeeper. Luxottica merupakan perusahaan induk dari jaringan toko kacamata OPSM dan Sunglass Hut. Baik Specsavers maupun Luxottica merupakan perusahaan milik asing. Specsavers berbasis di Guernsey, wilayah Inggris yang bebas pajak. ""Kedua perusahaan ini memperoleh keuntungan peningkatan laba sebesar $130 juta,"" kata analis investasi Dean Paatsch. ""Tanpa JobKeeper, hal itu tidak akan pernah terjadi. Kita tak bisa tiba-tiba mendapat laba 100 persen lebih banyak kecuali bila pengeluaran turun,"" jelasnya. Tunjangan JobKeeper merupakan subsidi gaji yang menelan biaya AU$90 miliar (Rp900 triliun lebih) kepada sekitar 1juta perusahaan yang mencakup sekitar 3,8 juta pekerja. Nama-nama perusahaan penerima JobKeeper serta jumlah uang yang mereka terima tidak terbuka untuk publik. Tapi dokumen yang diajukan ke regulator keuangan ASIC dan diperoleh ABC mengungkapkan nilai subsidi ini terhadap Specsavers dan Luxottica. Pendapatan Specsavers anjlok pada April tahun lalu di tengah lockdown sebelum pulih kembali saat ekonomi dibuka. Pendapatannya sepanjang tahun turun hanya 1persen, sementara laba melonjak $78 juta menjadi $150 juta. Specsavers menerima sekitar $92 juta dari JobKeeper, sementara menurut informasi yang diterima ABC perusahaan itu mengembalikan sekitar $4 juta. ""Dana pembayar pajak tetap membayar subsidi gaji ini meski pun di setiap negara bagian dan teritori, kecuali Victoria, semuanya sudah normal kembali setelah bulan Juli,"" jelas Dean Paatsch. ""Hal ini menguntungkan bagi perusahaan yang mengalir langsung ke keuntungan para pemilik di luar negeri,"" katanya. Specsavers beroperasi di Australia mencakup kantor pusat bersama sekitar 500 usaha optik dan audiologi, yang dimiliki secara independen dalam struktur seperti waralaba. ""Mereka semua melihat penurunan pendapatan yang dramatis dan masing-masing dari mereka secara individual memenuhi syarat untuk JobKeeper,"" kata seorang juru bicara Specsavers kepada ABC. ""Skema JobKeeper sangat bernilai karena memungkinkan mitra toko kami untuk bertahan, terus memberikan layanan mendesak dan penting serta menjaga pegawai mereka tetap bekerja,"" tambahnya. Jaringan toko ini terus memberikan layanan optometri selama lockdown sementara bagian ritel yang tidak penting dibatasi. Luxottica South Pacific Holdings memiliki sekitar 200 gerai Sunglass Hut dan sebagian besar dari 300 gerai OPSM di Australia. Pendapatan dalam operasinya di Australia turun lima persen sementara labanya melonjak sebesar $50 juta menjadi $67 juta. Laporan keuangannya menunjukkan pengeluaran untuk gaji karyawan, atas bantuan tunjangan JobKeeper, telah turun sebesar $56 juta. ""Sekali lagi, semua peningkatan besar dari peningkatan laba mereka terjadi karena adanya tunjangan JobKeeper,"" ujar Paatsch. ""Perusahaan-perusahaan ini sama sekali tidak melakukan kesalahan; mereka secara sah memenuhi syarat untuk skema bantuan ini,"" katanya. ""Jika Anda memenuhi syarat dalam sekejap, Anda terus menerima subsidi selama enam bulan, terlepas dari apakah usaha Anda telah kembali normal atau tidak,"" papar Dean Paatsch. Perusahaan induk Luxottica berbasis di Paris dan diketuai serta sebagian dimiliki oleh salah satu dari 100 orang terkaya di dunia versi Forbes. Luxottica tidak menjawab pertanyaan ABC tentang JobKeeper. Tahun keuangan Specsavers adalah dari Maret 2020 hingga Februari 2021, sedangkan tahun keuangan OPSM adalah dari Januari hingga Desember 2020. Bendahara Negara (Treasurer) Josh Frydenberg menjelaskan JobKeeper telah menyelamatkan setidaknya 700.000 pekerjaan. ""Tanpa JobKeeper, lebih banyak pekerjaan akan hilang dan usaha terpaksa ditutup,"" katanya. Perusahaan yang memenuhi syarat mulai menerima JobKeeper pada awal 2020, dan berlangsung hingga tersebut hingga sekitar akhir September ketika pendapatan mereka dievaluasi kembali. Sampai saat itu, perusahaan menerima dana $1.500 per karyawan yang memenuhi syarat setiap dua minggu. Evaluasi pada bulan September mengakibatkan sebagian besar pekerja dan setengah dari perusahaan tidak lagi berhak menerima JobKeeper. Frydenberg membela langkah pemerintah yang tidak mengevaluasi ulang omset perusahaan penerima lebih awal untuk memastikan omset mereka telah pulih. ""Dalam pandangan perbendaharaan negara saat itu, adalah menjaga JobKeeper ini untuk memberikan kepastian dan dukungan bagi perekonomian,"" katanya. Frydenberg juga membela langkah pemerintah yang tidak memasukkan ketentuan pengembalian dana bila ternyata perusahaan mengalami keuntungan. Anggota DPR dari oposisi Andrew Leigh mengatakan keuntungan para pengecer toko kacamata itu menunjukkan bagaimana subsidi gaji menjadi ""tunjangan perusahaan"" untuk sejumlah pihak. ""Pendekatan jangka pendek pemerintah terhadap JobKeeper telah membuat jutaan dolar mengalir ke perusahaan berbasis di surga pajak dan miliarder di luar negeri,"" katanya. Seorang pengusaha kacamata Robyn Main menyediakan layanan bagi penghuni panti jompo di Kota Perth. Ia hampir tidak memiliki pekerjaan awal tahun lalu karena fasilitas perawatan lansia menjalani lockdown, namun memutuskan untuk tidak mengambil tunjangan JobKeeper. ""Saya tidak membutuhkannya, jadi mengapa harus mengambil sesuatu bila kita tidak membutuhkannya?"" ujar Robyn. ""Kami masih memiliki tabungan, kondisi kami baik-baik saja,"" tambahnya. Usaha kacamata mengalami pemulihan pada paruh kedua tahun 2020, sehingga Robyn pun mempekerjakan seorang anggota staf untuk pertama kalinya. Menurut Robyn, perusahaan besar seharusnya mempertimbangkan untuk mengembalikan tunjangan JobKeeper yang pada akhirnya tidak mereka butuhkan. ""Saya berharap mereka memikirkan generasi mendatang dan siapa yang akan membayar beban keuangan negara ini,"" jelasnya.",2 Perusahaan Asing Terima Tunjangan Gaji Jutaan Dolar Selama Lockdown di Australia,bantuan panti,https://news.detik.com/abc-australia/d-5728128/2-perusahaan-asing-terima-tunjangan-gaji-jutaan-dolar-selama-lockdown-di-australia?single=1,"Jumat, 17 Sep 2021 14:05 WIB"
"PT Taspen (Persero) memberikan bantuan senilai Rp 50 juta kepada Yayasan Yatim Piatu Da'arul Rahman, Pejaten, Jakarta Selatan. Bantuan ini merupakan bagian dari program tanggung jawab sosial dan lingkungan (TJSL) Taspen Peduli. Bantuan tersebut diserahkan oleh Komisaris Utama Taspen Suhardi Alius dan Direktur Utama Taspen A.N.S Kosasih kepada Ketua Yayasan Yatim Piatu Da'arul Rahman KH. Ahmad Saiful Habib, SE di Aula Kantor Taspen Cabang Jakarta Selatan, Jumat (17/9). ""Taspen terus berkomitmen mengusung semangat Taspen Peduli dalam setiap program tanggung jawab sosialnya. Sebagai perusahaan asuransi dan bergerak di bidang sosial, kami tidak hanya memberikan kepedulian dan dukungan kepada pihak atau kelompok tertentu. Program TJSL kali ini merupakan wujud nyata partisipasi aktif kami dalam memberikan kepedulian dan dukungan kepada seluruh lapisan masyarakat dengan berbagai latar belakang,"" kata A.N.S Kosasih dalam keterangan tertulis, Minggu (19/9/2021). ""Kami berharap bantuan kali ini dapat dimanfaatkan sebaik mungkin untuk kebutuhan dan pemenuhan beberapa rencana yayasan ke depan. Taspen akan tetap berkomitmen menjalankan beragam program TJSL yang sejalan dengan core bisnis perusahaan dan memberikan dampak yang signifikan bagi seluruh masyarakat Indonesia,"" sambung Kosasih. Ketua Yayasan Yatim Piatu Da'arul Rahman KH. Ahmad Saiful Habib menyampaikan apresiasi atas bantuan yang diberikan Taspen. Ia mengatakan bantuan kali ini akan dimanfaatkan untuk kebutuhan yayasan, terutama proyek perluasan asrama yang saat ini sedang dilakukan. ""Kami berharap, bantuan yang diberikan ini dapat memberikan kebaikan bagi seluruh pihak dan menjadi amal ibadah,"" ungkap Ahmad. Kosasih menambahkan sebelumnya Taspen memberikan bantuan serupa kepada beberapa yayasan panti asuhan dan panti sosial. Pada momen HUT ke-58, Taspen memberikan bantuan sebesar Rp 400 juta kepada Pesantren An Nawawi Tanara (PENATA) di Serang, Banten. Taspen juga memberikan Rp 100 juta kepada Yayasan Beri Perubahan Yogyakarta, dan Rp 55,8 juta kepada Panti Sosial Asuhan Anak Balita Tunas Bangsa Jakarta. Selain itu, Taspen memberikan bantuan kepada Yayasan Cinta Qur'an Jakarta, Rumah Piatu Muslimin Jakarta, Panti Asuhan Aisyiyah Jakarta, Panti Asuhan Bersinar Jakarta, Yayasan TPA Al-Istiqomah Bekasi dan bantuan senilai Rp 25 juta kepada Panti Sosial Tresna Werdha Budi Mulia Jakarta berupa perlengkapan kebersihan. Kosasih menyampaikan bantuan-bantuan tersebut merupakan program TJSL yang rutin dijalankan Taspen dalam rangka meningkatkan kesejahteraan sosial dan kualitas pendidikan di berbagai yayasan yatim piatu dan panti sosial. Kosasih menyatakan komitmen perusahaan dalam menjalankan program TJSL membuat Taspen meraih empat penghargaan di ajang Nusantara CSR Awards 2021 untuk kategori pilar sosial, ekonomi, dan lingkungan pada beberapa waktu lalu.",Taspen Beri Bantuan Rp 50 Juta ke Ponpes Yatim Piatu Da'arul Rahman,bantuan panti,https://news.detik.com/berita/d-5730669/taspen-beri-bantuan-rp-50-juta-ke-ponpes-yatim-piatu-daarul-rahman?single=1,"Minggu, 19 Sep 2021 17:02 WIB"
"Risland Indonesia, developer yang menaungi Apartemen Sky House BSD+ dan Sky House Alam Sutera+ bersama Bright Property Service Indonesia (BPSI) menyalurkan bantuan sembako ke salah satu panti asuhan di Kalideres. Sky House dan BPSI juga membagikan lebih dari 1.000 paket bantuan ke masyarakat terdampak COVID-19 yang berada di lingkungan sekitar perusahaan. Bantuan tersebut diberikan sebagai salah satu wujud nyata kepedulian Apartemen Sky House dan BPSI kepada sesama. Penyaluran bantuan ini diserahkan oleh perwakilan Sky House BSD+ dan Alam Sutera+, serta BPSI kepada pengurus Panti Tuna Grahita Belaian Kasih dengan menerapkan protokol kesehatan ketat. Seluruh tim Sky House dan BPSI yang hadir pada kegiatan tersebut juga dipastikan dalam kondisi sehat dan negatif COVID-19 melalui hasil test swab antigen yang dilakukan sebelum menuju lokasi. Penyaluran bantuan telah dilaksanakan sejak bulan Agustus 2021 dan puncaknya dilakukan pada hari Kamis (16/9). Penyaluran bantuan tersebut diharapkan dapat membantu mengurangi beban dari dampak wabah COVID-19 terhadap perubahan aktivitas dan penurunan pendapatan ekonomi masyarakat.",Sky House dan Bright Property Service Indonesia Gelar Aksi Sosial,bantuan panti,https://news.detik.com/berita/d-5732711/sky-house-dan-bright-property-service-indonesia-gelar-aksi-sosial?single=1,"Selasa, 21 Sep 2021 09:04 WIB"
"di Kabupaten Kampar,  , bentrok dengan pihak sekuriti perusahaan. Ratusan anak pekerja kebun terdampak sehingga harus dievakuasi. Bentrokan terjadi pada Selasa (14/9/2021) di wilayah kerja PT Padasa Enam Utama pukul 10.00 WIB. Awalnya, puluhan sekuriti datang dan meminta pekerja meninggalkan mes. ""Ini buntut dari PHK ratusan pekerja oleh perusahaan. Pekerja pernah demo juga dan demo terakhir itu di kantor gubernur,"" kata kuasa hukum pekerja, Norma Sari Simangunsong, Rabu (15/9/2021). Norma mengatakan total ada 618 pekerja di-PHK oleh perusahaan. Dalam PHK itu, pekerja dijanjikan mendapat pesangon hingga uang pindah rumah. Sayangnya, janji pihak perusahaan tidak pernah terealisasi. Pekerja kemudian mengajukan gugatan ke Pengadilan Hubungan Industrial di Kota Pekanbaru untuk minta keadilan. ""618 orang di-PHK, lalu dibujuk perusahaan untuk kerja lagi. Sisa tinggal 200-an dan itu juga banyak sudah pulang kampung sama cari kerja lain. PKH katanya ada pesangon, tapi tidak ada sama sekali. Katanya ada uang pindah rumah 2-7 juta, itu juga tidak terealisasi,"" ucap Norma. Akibat tidak ada penyelesaian itulah pihak pekerja mengajukan gugatan ke PHI. Sayang, gugatan belum selesai perusahaan sudah berulang kali memaksa pekerja keluar dari mes. ""Di tengah buruh mengajukan gugatan ke PHI, kemarin terjadilah upaya pengusiran paksa. Ada 7 luka-luka, pihak perusahaan sewa pihak ketiga untuk mengusir, bawa kayu balok, pentungan, parang termasuk samurai,"" ujarnya. Akibat konflik itu, ratusan anak pekerja kebun tersebut dievakuasi TNI AU dan Komnas Perlindungan Anak (Komnas PA) untuk menghindari dampak konflik. ""Anak-anak pekerja kebun yang trauma dievakuasi langsung oleh Komnas PA dan TNI AU,"" ujar Norma, Selasa (21/9/2021). Norma mengaku telah mengadukan konflik antara mantan pekerja dan PT Pedasa Enam Utama di Kampar, Riau. Dia mengadukan soal nasib anak-anak pekerja yang trauma. ""Kami memang ada adukan soal anak-anak ini kepada Komnas PA. Jadi evakuasi telah dilakukan sejak awak konflik, anak-anak ini banyak trauma karena banyak sekuriti dan polisi, mereka terganggu,"" katanya. Dia menuturkan anak-anak di pengungsian takut karena selama ini melihat konflik langsung. ""Terbukti, saat di pengungsian Dinas Sosial di Rumbai, anak-anak trauma, ketakutan. Selama ini kan mereka tinggal di emperan-emperan rumah karena takut,"" katanya. Ada sekitar 200 anak pekerja terdampak konflik, sehingga mereka minta dievakuasi dari mes Pedasa ke tempat evakuasi di Kemensos Rumbai. TNI AU turut membantu proses evakuasi. ""Kita TNI AU hanya menyelamatkan anak-anak. Komnas PA minta bantuan, ya kita bantu. Kita evakuasi, diantar ke panti sosial, sampai, selesai,"" kata Kepala Penerangan dan Perpustakaan (Kapentak) Lanud Roesmin Nurjadin, Letkol Zukri, kepada wartawan, Rabu (22/9/2021). Zukri mengatakan prajurit diturunkan ke lokasi bersama Komnas PA merupakan bentuk panggilan jiwa. Karena itu, pihaknya menurunkan prajurit dan dua truk untuk mengevakuasi ratusan anak pada akhir pekan lalu. ""Kita sebagai tentara manusiawi. Dengar kabar itu ya kami evakuasi anak-anaklah,"" katanya. Untuk menghilangkan trauma anak-anak, TNI AU berencana turun ke lokasi konflik. Sebab, selama ini anak-anak mengalami trauma akibat konflik berkepanjangan yang terjadi di PT Padasa Enam Utama. ""Nanti kita kunjungan ke sana biar tidak terganggu psikisnya karena trauma yang dialami di perkebunan itu,"" kata Zukri. Zukri mengakui masih ada anak-anak di PT Pedasa yang belum dievakuasi. Sebab, pada evakuasi pertama, kapasitas kendaraan terbatas dan tak bisa mengangkut seluruh anak. ""Masih ada yang belum dievakuasi, kami tidak semua,"" kata Zukri. Kapolres Kampar AKBP Rido Purba angkat bicara soal konflik antara mantan pekerja dan perusahaan sawit. Rido mengatakan, sebelum konflik, pekerja sudah diberi surat peringatan dan minta tidak ada provokator. ""Peristiwa bentrok ini terjadi antara mantan karyawan yang masih menempati rumah atau aset PT Padasa dengan pihak security yang ditugaskan management perusahaan melakukan pengosongan rumah tersebut,"" kata Rido dalam keterangannya, Selasa (21/9/2021). Sebelum pengosongan paksa rumah milik perusahaan tersebut, pihak perusahaan telah mengirim surat pemberitahuan sebanyak tiga kali. Mereka diminta mengosongkan rumah tersebut karena statusnya sudah tak lagi sebagai karyawan. ""Rumah itu sendiri sebenarnya juga banyak yang tak ditempati, namun masih dikuasai oleh eks karyawan dan digembok mereka. Sementara rumah itu juga akan diperlukan dan digunakan untuk karyawan mereka,"" kata Kapolres. Bentrokan terjadi karena saat pengosongan rumah tersebut terjadi perlawanan mantan karyawan sehingga timbul kegaduhan. Bahkan berujung beberapa orang dari kedua belah pihak ada yang mengalami luka akibat lemparan batu atau pukulan benda tumpul. Rido menuturkan saat kejadian itu pihak sekuriti perusahaan memang membawa pentungan dan tameng berbahan rotan untuk kelengkapan pengamanan. Sementara mantan karyawan membawa potongan kayu dan juga ada yang membawa senjata tajam jenis parang. ""Beberapa saat setelah kejadian, anggota Polsek XIII Koto Kampar yang mendapat informasi tersebut tiba di TKP. Tetapi saat itu kedua pihak yang bentrok sudah bubar karena kejadiannya berlangsung singkat,"" katanya. Kedua belah pihak saling lapor ke polisi. Pihak mantan karyawan datang melapor ke SPKT Polres Kampar dan pihak sekuriti perusahaan melapor ke Polsek XIII Koto Kampar. Rido menjelaskan status mantan karyawan karena telah di-PHK setelah melakukan mogok kerja selama berbulan-bulan. Namun peringatan tersebut tidak dipedulikan hingga akhirnya mereka didiskualifikasi dan tidak lagi jadi karyawan. ""Sebenarnya mantan karyawan ini juga merupakan korban dari pihak tertentu yang memprovokasi mereka dulu untuk melakukan mogok kerja, yang akhirnya merugikan diri mereka sendiri,"" katanya.",Ironi Anak-anak Riau Terjepit di Konflik Pekerja Vs Perusahaan Sawit,bantuan panti,https://news.detik.com/berita/d-5735960/ironi-anak-anak-riau-terjepit-di-konflik-pekerja-vs-perusahaan-sawit?single=1,"Rabu, 22 Sep 2021 22:13 WIB"
"Pemerintah pusat akan mengumumkan nasib Pemberlakuan Pembatasan Kegiatan Masyarakat (PPKM) petang ini, apakah diperpanjang atau tidak. PPKM memberikan dampak yang positif bagi pengendalian COVID-19, yakni dengan menurunkannya tren kasus harian dan tingkat keterisian rumah sakit (BOR). Di samping pengendalian COVID-19, pemerintah melalui Kementerian Sosial (Kemensos) pun menyalurkan sejumlah bantuan sosial kepada warga. Bantuan itu berupa bansos tunai (BST), bantuan pangan non tunai (BPNT), serta program keluarga harapan (PKH). Bantuan Sosial Tunai (BST) adalah bantuan berupa uang yang diberikan kepada keluarga miskin, tidak mampu, dan/atau rentan yang terkena dampak wabah COVID-19. Besaran Bantuan Sosial Tunai adalah senilai Rp.600.000,-/keluarga/bulan. Sedangkan, bantuan PKH disesuaikan dengan anggota keluarga penerima. Bila dirinci, keluarga yang memiliki ibu hamil atau balita akan menerima bantuan Rp 3 juta per tahun. Keluarga yang memiliki anak SD menerima Rp 900.000 per tahun, anak SMP Rp 1,5 juta per tahun, dan anak SMA Rp 2 juta per tahun. Tiga jenis bansos itu disalurkan untuk mengantisipasi dampak ekonomi akibat PPKM 2021. Lalu bagaimana cara mengecek apakah menerima bansos atau tidak? Kepala Dinas Sosial Jawa Barat Dodo Suhendar mengatakan warga bisa mengecek dengan mendatangi desa atau kelurahan masing-masing. ""Data ada di desa atau kelurahan masing-masing, dengan memperlihatkan NIK yang bersangkutan penerima atau bukan,"" ujar Dodo saat dihubungi  , Senin (20/9/2021). Selain itu, warga Jabar yang telah terdaftar dalam daftar terpadu kesejahteraan sosial (DTKS) juga bisa mengecek melalui laman cekbansos.kemensos.go.id. Di dalam laman itu memasukkan alamat dan identitas sesuai KTP. ""Iya bisa dicoba juga melalui laman tersebut,"" kata Dodo. Selain dari Kemensos, Pemprov Jabar juga tengah menggodok bansos yang diperuntukkan bagi pedagang pasar, usaha kecil, usaha wisata dan budaya dan Lembaga Kesejahteraan Sosial atau panti sosial. ""Untuk bansos provinsi sedang proses usulan penetapan sasaran oleh gubernur, mudah-mudahan bulan depan bisa tersalurkan,"" ujar Dodo.",Begini Cara Cek Bantuan PPKM di Jabar,bantuan panti,https://news.detik.com/berita-jawa-barat/d-5732023/begini-cara-cek-bantuan-ppkm-di-jabar?single=1,"Senin, 20 Sep 2021 16:10 WIB"
