artikel,judul,keyword,link,tanggal
"UNU Jogja didirikan 10 Maret 2017 sebagai kampus kader berbasis pesantren inklusif dan keumatan. Prodi di UNU Jogja yaitu agribisnis, akuntansi, farmasi, informastika, manajemen, pendidikan bahasa Inggris, pendidikan guru sekolah dasar, studi islam interdisipliner, teknik elektro, teknik komputer, dan teknologi hasil pertanian. Sistem seleksi PMB UNU Jogja di masa pandemi menggunakan jalur seleksi rapor. Sebelumnya, seleksi masuk menggunakan sistem tes online CBT. Seleksi rapor digunakan untuk mengukur kemampuan akademik. Calon pendaftar PMB UNU Jogja bisa memilih tiga pilihan prodi saat pendaftaran. Biaya pendaftaran PMB UNU Jogja yakni sebesar Rp 250 ribu. Mahasiswa UNU Jogja dikenakan biaya kuliah yang terdiri dari empat komponen. Biaya kuliah UNU Jogja terdiri dari biaya orientasi dan kemahasiswaan sebesar Rp750 ribu, SPP per semester Rp2,5 juta-3,5 juta sesuai ketentuan prodi, tabungan LabSos semester 1-6 sebesar Rp750 ribu, dan sumbangan pengembangan akademik sebesar Rp 3 juta- 5 juta sesuai ketetapan prodi. - Masuk ke situs pmb.unu-jogja.ac.id, lalu isi formulir dengan menggunakan huruf kapital - Membayar biaya pendaftaran sebesar Rp250 ribu melalui transfer rekening Bank BNI Universitas Nahdlatul Ulama Yogyakarta 999192693 (kode bank 009). - Konfirmasi pembayaran dengan mengirim bukti pembayaran ke WA Admin PMB - Masuk kembali ke situs   dan unggah nilai rapor semester 5 dan 6 - Pengumuman mahasiswa yang lolos masuk UNU Jogja dapat dilihat melalui situs   dan notifikasi via WhatsApp - Daftar ulang mahasiswa yang lolos masuk UNU Jogja dengan mengunggah berkas dan isi biodata diri lengkap di situs UNU Jogja Mahasiswa yang diterima di UNU Jogja bisa mendapat bantuan biaya pendidikan dengan mendaftar dalam seleksi program beasiswa. Program Beasiswa UNU Jogja terdiri dari Beasiswa Tahfidz, Beasiswa Prestasi, Beasiswa Unggul Berprestasi, dan Beasiswa KIP Kuliah. Beasiswa ini didedikasikan kepada para hafidz/hafidzoh yang memiliki hafalan minimum 15 juz dibuktikan dengan sertifikat tahfidz. Penerima beasiswa mendapat keringanan bebas sumbangan pengembangan akademik. Persyaratan: a. Warga Negara Indonesia b. Lulusan SMA/SMK/MA atau sederajat tahun 2019-2021 : - Lulusan SMA/SMK/MA atau sederajat tahun 2021 harus memiliki Surat Keterangan Lulus (SKL). - Lulusan SMA/SMK/MA atau sederajat tahun 2020 dan 2019 harus memiliki ijazah c. Mengikuti Seleksi Masuk Tahun 2021 d. Memiliki sertifikat tahfidz dari Pondok Pesantrean/Lembaga terkait. Beasiswa ini didedikasikan kepada para lulusan terbaik sekolah rangking 1 s/d 5 yang dibuktikan dengan surat rekomendasi Kepala Sekolah. Mahasiswa dengan Beasiswa Prestasi mendapat keringanan bebas sumbangan pengembangan akademik. Persyaratan a. Warga Negara Indonesia b. Lulusan SMA/SMK/MA atau sederajat tahun 2019-2020 c. Memiliki Surat Keterangan Lulus (SKL) d. Mengikuti Seleksi Masuk Tahun 2021 e. Lulusan terbaik sekolah rangking 1-5 dibuktikan dengan Surat Rekomendasi Kepala Sekolah. Beasiswa ini didedikasikan kepada para lulusan berprestasi minimum tingkat provinsi pada bidang olahraga, seni, teknologi yang dibuktikan dengan sertifikat kejuaraan. Penerima beasiswa mendapat keringanan bebas sumbangan pengembangan akademik. a. Warga Negara Indonesia b. Lulusan SMA/SMK/MA atau sederajat tahun 2019-2021: - Lulusan SMA/SMK/MA atau sederajat tahun 2021 harus memiliki Surat Keterangan Lulus (SKL). - Lulusan SMA/SMK/MA atau sederajat tahun 2020 dan 2019 harus memiliki ijazah c. Mengikuti Seleksi Masuk Tahun 2021 d. Lulusan berprestasi minimum tingkat provinsi dibuktikan dengan Sertifikat Kejuaraan. Program beasiswa ini diperuntukkan bagi mahasiswa yang diterima di UNU Jogja termasuk penyandang disabilitas dengan prioritas sasaran mahasiswa pemegang KIP, mahasiswa dari keluarga miskin/rentan miskin dan/atau dengan pertimbangan khusus, mahasiswa afirmasi (papua dan papua barat serta 3T dan TKI), serta mahasiswa terkena bencana, konflik sosial atau kondisi khusus. Persyaratan a. Lulusan SMA/SMK sederajat tahun 2021, 2020 atau 2019 yang belum menjadi mahasiswa. b. Belum pernah ditetapkan sebagai penerima beasiswa KIP Kuliah di salah satu Perguruan Tinggi di bawah Kemendikbud. c. Dinyatakan lulus seleksi calon mahasiswa Universitas Nahdlatul Ulama Yogyakarta melalui alur seleksi Beasiswa KIP Kuliah d. Pemegang atau pemilik KIP atau dari keluarga tidak mampu, dengan ketentuan sebagai berikut : - Berasal dari keluarga Program Keluarga Harapan (PKH) atau dari keluarga pemegang Kartu Keluarga Sejahtera (KKS) - Berasal dari keluarga yang masuk dalam desil kurang dari atau sama dengan kategori 4 (empat) pada Data Terpadu Kesejahteraan Sosial (DTKS) yang diterbitkan oleh Kementerian Sosial. - Berasal dari Panti Sosial atau Panti Asuhan. - Berasal dari keluarga tidak mampu secara ekonomi sesuai dengan ketentuan, yang dibuktikan dengan pendapatan kotor gabungan orang tua/wali sebesar Rp 4.000.000,00 (empat juta rupiah) atau pendapatan kotor gabungan orang tua/wali dibagi jumlah anggota keluarga maksimal Rp750.000,00 (tujuh ratus lima puluh ribu rupiah) per bulan. Program beasiswa ini diperuntukkan bagi calon mahasiswa berprestasi yang berkhidmat kepada jamiyyah dan jamaah Nahdliyin dari seluruh wilayah. Calon mahasiswa yang bisa mendaftar yaitu siswa lulusan terbaik pertama dan kedua pada masing-masing jurusan di sekolah. a. Memiliki Prestasi Ranking 1 (satu) atau 2 (dua) secara akademik masing-masing jurusan di Sekolah, yang dibuktikan dengan Surat Keterangan Kepala Sekolah/ Pengasuh Pondok Pesantren. b. Scan Rapor yang ber-NISN semester 1-5 c. Surat Keterangan Penghasilan Orangtua dan tanggungan keluarga d. Mendaftarkan diri melalui website https://pmb.unu-jogja.ac.id/pendaftaran.php e. Melakukan Daftar Ulang untuk mendapatkan Nomor Induk Mahasiswa (NIM) Gimana detikers, minat masuk  ?","Pendaftaran UNU Jogja Gelombang 3 Mulai Dibuka, Ini Informasi Lengkapnya",panti asuhan,https://www.detik.com/edu/seleksi-masuk-pt/d-5626430/pendaftaran-unu-jogja-gelombang-3-mulai-dibuka-ini-informasi-lengkapnya?single=1,"Kamis, 01 Jul 2021 05:53 WIB"
"Wakil Ketua MPR RI Hidayat Nur Wahid (HNW) membagikan daging kurban, pada Hari Raya Idul Adha 1442 H. Daging kurban dibagikannya kepada sejumlah warga, termasuk mereka yang tengah isolasi mandiri (isoman). Penyerahan daging kurban, itu dilakukan sebagai bagian dari program tebar 1 juta paket kurban yang dicanangkan oleh Ketua Majelis Syuro PKS Dr. Salim Segaf Al Jufri, untuk membantu dan meringankan beban warga yang terdampak pandemi COVID-19. ""Saya mendukung program yang diinisiasi oleh Dr. Salim dengan hadirkan kepedulian nyata terhadap warga terdampak COVID-19, khususnya di daerah pemilihan (dapil) Jakarta II meliputi Jakarta Selatan dan Jakarta Pusat,"" kata Hidayat, Rabu (21/7/2021). Hidayat menerangkan hewan kurban disalurkan bekerja sama dengan kader dan relawan PKS serta tokoh Masyarakat. Pembagian daging 22 ekor sapi dan 11 ekor kambing dilakukan di berbagai kecamatan, masjid dan musala di Jakarta Selatan dan Jakarta Pusat. ""Semoga spirit peduli dan daging kurban yang disalurkan, membantu warga terdampak COVID-19, dan bermanfaat bagi masyarakat untuk menyemangati mereka yang susah akibat pandemi. Serta agar semangat saling membantu dan gotong royong selalu bisa dihadirkan lagi,"" ulas Hidayat. Selain dibagikan kepada warga yang tengah isoman, Hidayat memberikan daging kurban ke fakir miskin, guru ngaji, panti asuhan hingga anak-anak yatim. Hidayat pun mendorong umat Islam agar menjadikan momentum Idul Adha ini sebagai momen menguatkan solidaritas, persatuan, dan toleransi. ""Semua warga, apalagi yang terdampak COVID-19, tanpa membedakan SARA dan afiliasi politik, harus merasakan manfaat dan berkah dari ibadah sosial kurban ini,"" tutur Hidayat. Warga menyambut positif program Tebar Sejuta Paket Kurban yang didukung oleh HNW. Iis, warga Jagakarsa Jakarta Selatan berterima kasih dengan gerakan tebar 1 juta paket kurban ini. Ia mendoakan agar tebar sejuta paket kurban itu membuat Indonesia memperoleh keberkahan di masa sulit pandemi COVID-19. ""Insya Allah berkah, apalagi di tahun ini (sedang pandemi COVID-19), terima kasih kepada Pak Hidayat dan terima kasih kepada PKS yang telah menyelenggarakan kegiatan yang bermanfaat ini,"" ungkap Iis. Selain pendistribusian hewan kurban, Hidayat juga menyalurkan bantuan kepada masyarakat terdampak pandemi COVID-19. Bantuan yang disalurkan terdiri dari makanan, sembako, masker, APD, obat-obatan dan vitamin. Ia juga memberikan uang tunai bagi warga yang sedang isoman. Bantuan lainnya berupa penyediaan ambulans, advokasi akses rumah sakit, hingga dukungan percepatan vaksinasi di sejumlah daerah di Jakarta Pusat dan Selatan. ""Itu semua wujud kecintaan kepada warga dan kepada Indonesia. Membantu Pemerintah dan sesama agar lekas sehat dan selamat dari virus Korona varian delta dengan segala kejahatannya,"" cetus Hidayat.",HNW Bagi Ribuan Paket Kurban ke Pasien Isoman hingga Anak Yatim,panti asuhan,https://news.detik.com/berita/d-5651094/hnw-bagi-ribuan-paket-kurban-ke-pasien-isoman-hingga-anak-yatim?single=1,"Rabu, 21 Jul 2021 14:15 WIB"
"Telkomsel melalui program Corporate Social Responsibility (CSR) yang mengusung semangat #BukaPintuKebaikan menyalurkan bantuan 906 ekor hewan kurban kepada sekitar 56.200 penerima manfaat di sekitar 800 lokasi hingga pelosok negeri. Penyerahan hewan kurban yang terdiri dari 129 ekor sapi dan 777 ekor kambing tersebut dilakukan secara simbolis oleh Telkomsel pada Senin (19/7). ""Idul Adha selalu menjadi momen yang tepat bagi Telkomsel untuk dapat kembali berkontribusi dalam memberikan manfaat bagi masyarakat Indonesia melalui penyaluran bantuan hewan kurban. Upaya ini merupakan wujud nyata dari komitmen Telkomsel yang ingin terus membuka pintu kebaikan dengan berbagi dan memberikan dukungan bagi setiap lapisan masyarakat di segala kondisi, termasuk di masa pandemi yang penuh tantangan saat ini,"" ujar Direktur Utama Telkomsel, Hendri Mulya Syam dalam keterangan tertulis, Rabu (21/7/2021). ""Pada momen Idul Adha tahun ini, Telkomsel juga mengusung semangat gotong royong dengan menjalin kolaborasi bersama mitra-mitra strategis dalam menyediakan sekaligus mendistribusikan hewan kurban agar dapat membantu menjangkau lebih banyak penerima manfaat secara menyeluruh,"" tambahnya. Dalam kegiatan ini, Telkomsel berkolaborasi dengan para mitra strategis yang berasal dari ekosistem bisnis perusahaan. Para mitra tersebut di antaranya komunitas kerohanian Islam Majelis Telkomsel Taqwa (MTT), lembaga sosial terpercaya, yayasan, serta platform crowdfunding seperti KitaBisa.com. Telkomsel juga menggandeng startup digital Ternaknesia yang merupakan salah satu peserta program NextDEV Telkomsel sebagai penghubung UMKM peternak lokal. Adapun aksi kolaboratif tersebut bertujuan untuk memperluas cakupan penyaluran hewan kurban secara konvensional maupun digital. Aksi ini juga dilakukan sebagai bagian dari upaya Telkomsel dalam membantu memperkuat ekonomi digital masyarakat secara inklusif melalui pemberdayaan UMKM peternak lokal. Lebih lanjut Hendri menambahkan sejumlah bantuan hewan kurban juga berasal dari sumbangan karyawan Telkomsel. Keseluruhan bantuan hewan kurban ditargetkan dapat didistribusikan ke sejumlah masjid, rumah sakit, pesantren, lembaga sosial, panti asuhan, yayasan, hingga pemukiman masyarakat di sekitar wilayah kantor dan infrastruktur operasional Telkomsel di berbagai pelosok negeri. Di tengah kondisi saat ini, Hendri menyebut sangat penting bagi masyarakat Indonesia dan para pemangku kepentingan agar dapat saling bahu-membahu dan berbagi dalam menebarkan manfaat. Untuk itu, melalui kegiatan ini, Telkomsel senantiasa mengaktualisasikan dan selalu berusaha membuka berbagai kesempatan untuk saling berbagi, serta menebarkan manfaat bagi setiap lapisan masyarakat di segala fase kehidupan. ""Kami berharap, bantuan yang diberikan ini dapat membawa keberkahan dan manfaat bagi masyarakat Indonesia yang memaknai Hari Raya Idul Adha dengan rasa syukur meski kita masih berada di tengah kondisi pandemi seperti sekarang ini. Melalui dukungan sosial ini, Telkomsel berharap dapat memberikan inspirasi dan memicu semangat bagi para penerima manfaat agar dapat bersama-sama bertahan dan berbagi untuk sesama. Bantuan ini pun diharapkan dapat meringankan tantangan ekonomi sosial yang dialami masyarakat di masa pandemi yang masih berlangsung saat ini,"" katanya. ""Ke depan, Telkomsel akan terus berkomitmen memperkuat upaya kolaboratif dengan para pemangku kepentingan untuk terus bergerak maju, menghadirkan semangat dalam memaksimalkan pemanfaatan teknologi sebagai salah satu upaya mendorong pertumbuhan ekonomi berbasis digital dengan semangat gotong royong,"" tutup Hendri.",Telkomsel Salurkan 906 Hewan Kurban ke 56.200 Orang di 800 Lokasi,panti asuhan,https://news.detik.com/berita/d-5650705/telkomsel-salurkan-906-hewan-kurban-ke-56200-orang-di-800-lokasi?single=1,"Rabu, 21 Jul 2021 09:19 WIB"
"Tentu semua sepakat bahwa anak memegang peran penting dalam kehidupan hari esok. Oleh karenanya, menyiapkan mereka menjadi generasi hebat menjadi sebuah keniscayaan. Persoalan yang muncul kemudian adalah bagaimana nasib anak di tengah pandemi Covid-19? Sudah lebih dari setahun bangsa Indonesia bergulat dengan Covid-19. Kebijakan sering berganti menjadi penanda bahwa sebenarnya pemerintah masih terus mencari strategi. Kondisi tersebut karena pemerintah sampai saat ini belum berhasil menangani atau mencari cara jitu menyelesaikan Covid-19 dengan baik. Keterbatasan data tentang Covid-19 menambah pelik persoalan pemerintah ini. Di tengah penularan Covid yang masih tinggi, kita tetap perlu memikirkan masa depan anak Indonesia. Anak Indonesia perlu diselamatkan dari bahaya virus corona. Ini kata kunci yang perlu sama antara pemerintah pusat, daerah, sampai rumah tangga warga bangsa. Mengapa anak Indonesia perlu selamat dari bencana ini? Pasalnya, mereka adalah bagian dari kelompok rentan. Mereka sangat rentan terpapar Covid-19. Penanganan mereka pun perlu lebih khusus, di tengah masih banyaknya usia dewasa yang terpapar. Selain itu sebagaimana rekomendasi Komisi Perlindungan Anak Indonesia (KPAI) dalam momen Hari Anak Nasional 23 Juli adalah ""pemilahan data yang lebih rinci terkait jumlah anak-anak yang kehilangan salah satu orang tuanya dan atau jumlah anak-anak yang kehilangan kedua orang tuanya."" Persoalan pengasuhan anak di tengah pandemi Covid-19 dihadapkan pada permasalahan yang kompleks. Salah satunya masih cukup rendahnya pemahaman masyarakat terkait Covid-19. Rendahnya pemahaman masyarakat ini salah satunya digempur oleh informasi yang simpang-siur. Informasi hoaks seakan menjadi bagian kehidupan masyarakat Indonesia. Ironisnya, informasi hoaks itu dianggap benar oleh sebagian masyarakat. Saat orang dewasa minim pengetahuan tentang Covid-19, maka akan berimbas pada kehidupan anak. Anak-anak akan menjadi ""mangsa"" ketidaktahuan orang dewasa. Inilah yang mungkin menjadi salah satu faktor tingginya angka anak terpapar Covid-19 di Indonesia. Anak juga dapat terhambat mendapatkan vaksinasi karena ketidaktahuan dan salah informasi yang diterima orang tua. Ketidaktahuan, untuk tidak menyebut sebagai kebodohan, dapat menghancurkan semua. Literasi Covid-19 tampaknya perlu menjadi agenda kebangsaan. Literasi Covid-19 bisa dimulai dari lingkungan terkecil yaitu media sosial. Media sosial memiliki peran cukup signifikan dalam membentuk pemahaman seseorang tentang Covid-19. Oleh karena itu, media sosial perlu dibanjiri dengan informasi benar dengan meminimalisasi adanya hoaks. Ini tidak mudah, karena membuat konten positif membutuhkan   lebih dibandingkan dengan membuat konten hoaks. Konten hoaks mudah saja dibuat, karena tanpa harus mikir. Sedangkan konten benar/positif membutuhkan pemikiran matang, apakah ini layak atau tidak. Maka dari itu, kita perlu menjadi bagian masyarakat   yang mau memproduksi konten positif. Tanpa hal ini masa depan bangsa dapat tergadaikan. Lebih lanjut, tempat ibadah perlu menjadi ruang publik menciptakan masyarakat sadar Covid-19. Tempat ibadah merupakan sentral kehidupan umat yang perlu mewartakan kebenaran. Jika kini masjid, gereja, pura, wihara, klenteng nonaktif dari aktivitas ibadah, ini adalah wujud dari pendidikan sadar Covid-19. Menutup tempat ibadah untuk sementara waktu menjadi sarana komunikasi aktif rumah ibadah dalam menyelamatkan kehidupan. Peran tokoh agama, dai, mubaligh, ulama, dan pemuka agama lainnya perlu menjadi suluh di tengah jumudnya masyarakat. Mereka perlu terus bersuara, bahwa Covid-19 itu benar adanya. Dai di daerah perlu merujuk pada keputusan-keputusan ormas Islam besar dalam menangani hal ini. Keputusan Muhammadiyah dan NU misalnya, dapat menjadi pedoman dalam mendidik warga bangsa tentang bahaya Covid-19. Melalui berbagai kegiatan itu, anak dapat terselamatkan. Menyelamatkan anak dari hulu ini menjadi agenda kebangsaan saat ini. Ada beberapa kondisi anak terdampak situasi Covid secara langsung, yaitu anak yang salah satu orangtuanya meninggal karena Covid, anak yang kehilangan kedua orangtuanya karena Covid, anak yang harus menjalani isolasi mandiri bersama keluarga, dan anak yang menjalani isolasi sendiri, serta anak yang sementara di rumah sendiri karena salah satu orangtua mengurus orangtua lain yang terpapar Covid. Saat anak kehilangan kedua orangtuanya, maka persoalan perencanaan pengasuhan harus dituntaskan. Bagaimana mengasuh mereka, siapa yang akan mengasuh mereka? Pemerintah harus memastikan kesejahteraan anak tersebut. Pemerintah memastikan bahwa anak sebaiknya tetap diasuh oleh keluarga hingga derajat ketiga. Mengirim anak yatim ke lembaga kesejahteraan anak (panti asuhan) adalah alternatif terakhir. Anak merasakan situasi yang sangat berat kehilangan orangtua, jangan sampai kondisi psikologis anak memburuk karena harus dipisahkan dari lingkungannya. Pemerintah harus memberikan dukungan kepada anak melalui keluarga pengasuh dengan bantuan sosial Program Keluarga Harapan, kepastian pembiayaan sekolah anak, hingga pendampingan psikologis. Masyarakat juga harus membantu agar anak dapat menjalani tumbuh kembangnya dengan baik. Pemerintah juga harus mengalokasikan ruang isolasi mandiri anak tanpa orangtua yang disesuaikan dengan kebutuhan usia tumbuh kembang anak. Selain itu, bantuan dan pendampingan pemerintah untuk anak yang harus berada di rumah sendiri juga menjadi hal yang penting. Masyarakat pun dapat berperan lebih mengulurkan tangan kepada anak-anak tersebut sebagai pengejawantahan rasa kemanusiaan. Meskipun seringkali muncul dalam benak masyarakat bahwa anak dapat menularkan Covid, hal ini harus disikapi dengan protokol kesehatan. Pemerintah pun perlu memberikan amunisi yang memadai bagi tenaga kesehatan, pekerja sosial, serta lembaga yang mendampingi anak-anak tersebut agar mereka juga nyaman mendampingi anak-anak. Pada akhirnya, pandemi tidak boleh menambah luka dan kesedihan bagi anak Indonesia. Senyum anak Indonesia perlu terus tersungging dalam keceriaan wajah mereka. Nyanyian kegembiraan anak pun perlu terus didendangkan di tengah kondisi yang semakin tidak menentu.",Menyalamatkan Anak dari Dampak Pandemi,panti asuhan,https://news.detik.com/kolom/d-5653791/menyalamatkan-anak-dari-dampak-pandemi?single=1,"Jumat, 23 Jul 2021 13:02 WIB"
"Ketua MPR Bambang Soesatyo mengungkap sosok   yang menyumbang Rp 2 triliun untuk penanganan pandemi COVID-19 di Sumatera Selatan. Dalam postingan Instagramnya, Bamsoet menceritakan jika Akidi Tio memulai usaha kecap hingga akhirnya memiliki pabrik kecap di Palembang. Selain itu, Akidi Tio juga punya kelenteng di 10 Ulu dan beberapa tempat di Palembang. Bamsoet juga mengungkap jika Akidi punya perusahaan Cipta Futura di Muara Enim. ""Akidi Tio juga pengusaha tambang batu dolomit yaitu batu pembuat pupuk,"" kata dia. Akidi disebut pernah bersumpah kepada keluarganya yang bernama Thong Ju, seorang China Palembang yang kaya raya di era Presiden Soekarno. Dia berjanji jika menjadi kaya, maka akan memberikan sumbangan kepada rakyat Palembang. ""Ini terbukti, janjinya (ditepati) melalui wasiat anak cucunya,"" jelas dia. Tak hanya itu,   juga sering menyumbang dalam jumlah besar di Sumatera Selatan dan di beberapa wilayah di Indonesia ke panti asuhan yatim, orang cacat dan buta. Dari penelusuran  , PT Cipta Futura atau CIFU memiliki perkebunan kelapa sawit di Kabupaten Muara Enim, Sumatera Selatan. CIFU mengembangkan strategi terpadu untuk memproduksi dan mengolah produk sawit dan memanfaatkan keuntungan dari berbagai kondisi alam yang menjadikan Indonesia sebagai salah satu penghasil minyak sawit ideal di dunia. Selain perkebunan CIFU juga memiliki pabrik minyak kelapa sawit matang untuk pengolahan. Kemudian PT Cipta Futura merupakan perusahaan besar swasta nasional yang bergerak di bidang perkebunan kelapa sawit yang telah berdiri sejak Tahun 1989. Perusahaan ini berlokasi di Muara Enim, Sumatera Selatan. Saat ini kami memiliki lahan seluas 8381 Ha. Sebelumnya keluarga pengusaha   menyumbangkan dana Rp 2 triliun untuk penanganan COVID-19 di Sumatera Selatan (Sumsel). Akidi Tio sendiri merupakan pengusaha kelahiran Aceh.",Mulai Terungkap! Ternyata Seperti Ini Sosok Akidi Tio,panti asuhan,https://finance.detik.com/berita-ekonomi-bisnis/d-5663734/mulai-terungkap-ternyata-seperti-ini-sosok-akidi-tio?single=1,"Sabtu, 31 Jul 2021 07:30 WIB"
"Sebanyak 39 warga  , Jawa Tengah, dinyatakan positif  atau COVID-19. Akibatnya, lokasi panti asuhan setempat kini di-  dan kegiatan kunjungan tamu maupun donatur secara tatap muka disetop sementara. Juru bicara Satgas COVID-19 Rembang, Arief Dwi Sulistya, mengatakan kasus Corona di panti asuhan yang berada di Desa Sawahan, Kecamatan kota Rembang, tersebut terdiri dari 37 anak asuhan panti dan 2 orang pengurus panti. ""Panti Asuhan Darul Hadlanah jumlah anak 45, pengurus 2, total 47 orang. Hasil  rapid antigen, positif 39 orang, 37 anak dan 2 pengasuh. Yang negatif 8 anak,"" papar Arief kepada   melalui pesan singkat, Kamis (1/7/2021). Arief menjelaskan, tindakan yang diambil Satgas COVID-19 Rembang saat ini adalah melakukan  lingkungan panti. Warga yang positif diisolasi di ruangan terpisah dengan yang negatif. ""Mengingat usia masih anak-anak 10 sampai dengan 16 tahun dan menjaga psikologi anak, maka isoman anak panti asuhan di- di lingkungan panti asuhan. Anak yang negatif dipisahkan di ruang tersendiri,"" jelasnya. Tim medis dari Puskesmas setempat pun disiagakan untuk memantau kondisi kesehatan warga panti setempat. Termasuk kebutuhan logistik akan disokong dari Pemdes Sawahan serta membentuk posko relawan di depan lokasi panti setempat. ""Pemantauan kesehatan dan obat-obatan dari Puskesmas Rembang 1. Kebutuhan logistik dipenuhi dari pengurus panti asuhan, Pemdes Sawahan dan posko relawan di depan panti asuhan,"" terangnya. Pantauan   pada Kamis (1/7/2021), suasana di sekitar lokasi panti asuhan tampak sepi. Di pagar panti terpasang pesan imbauan dari pihak panti agar para donatur bisa menyalurkan bantuan dengan menghubungi nomor yang telah tertera.","39 Anak dan Pengasuh Kena Corona, Panti Asuhan di Rembang Ini Lockdown",panti asuhan,https://news.detik.com/berita-jawa-tengah/d-5627249/39-anak-dan-pengasuh-kena-corona-panti-asuhan-di-rembang-ini-lockdown?single=1,"Kamis, 01 Jul 2021 15:21 WIB"
"Nama   ramai diperbincangkan karena memberikan sumbangan Rp 2 triliun untuk penanganan pandemi COVID-19 di Sumatera Selatan. Ketua MPR Bambang Soesatyo mengungkap sosok dermawan itu. Melalui video yang diunggah di akun Instagram resminya, Bamsoet menceritakan jika Akidi Tio pernah hidup di Palembang dengan memulai usaha kecap dan akhirnya memiliki pabrik kecap. ""Dia juga yang punya kelenteng di 10 Ulu dan beberapa tempat di Palembang dan dia yang punya Cipta Futura Sawi di Muara Enim,"" tulis Bamsoet, dikutip Jumat (30/7/2021). Selain itu,   juga merupakan pengusaha Tambang batu Dolomit yaitu bahan pembuat pupuk. Dia menambahkan Akidi dulunya hidup di keluarga Thong Ju, China Palembang yang kaya raya di era Presiden Soekarno. Paman Akidi adalah Menteri Perdagangan di Singapura. Ketika hidup,  sempat bersumpah kepada Thong Ju jika dia menjadi kaya, maka akan memberikan sumbangan kepada rakyat Palembang. ""Ini terbukti, janjinya (ditepati) melalui wasiat anak cucunya,"" tambah dia. Sejak dulu dia hidup di keluarga Thong Ju, China Palembang yang kaya era Soekarno, pamannya Menteri Perdagangan Singapore. Tak hanya itu, Akidi Tio juga sering menyumbang dalam jumlah besar di Sumatera Selatan dan di beberapa wilayah di Indonesia ke panti asuhan yatim, orang cacat dan buta.","Bamsoet Ungkap Sosok Akidi Tio yang Sumbang Rp 2 T, Ini Potretnya",panti asuhan,https://finance.detik.com/berita-ekonomi-bisnis/d-5662546/bamsoet-ungkap-sosok-akidi-tio-yang-sumbang-rp-2-t-ini-potretnya?single=1,"Jumat, 30 Jul 2021 08:59 WIB"
