artikel,judul,keyword,link,tanggal
"Korea Utara (Korut) lagi-lagi melakukan uji coba penembakan peluru kendali atau rudal. Setidaknya, dalam sepekan ini  dilaporkan sudah melakukan uji coba rudal sebanyak tiga kali yang membuat negara tetangga siaga. Baru-baru ini, Korea Utara mengklaim sukses menguji coba 'sistem rudal yang dimuat kereta api' pada Rabu (15/9) waktu setempat. Sistem rudal itu diklaim dirancang untuk menangkal setiap kekuatan yang mengancam Korut. Dilansir  , Kamis (16/9/2021), kantor berita Korut, Korean Central News Agency (KCNA) dalam laporan terbarunya mengklaim rudal yang diluncurkan dari kereta api itu berhasil mengudara sejauh 800 kilometer sebelum mengenai target di lautan atau di lepas pantai timur Korut. Otoritas Korea Selatan (Korsel) dan Jepang melaporkan pada Rabu (15/9) waktu setempat bahwa mereka mendeteksi peluncuran dua rudal balistik dari Korut, beberapa hari setelah rezim komunis itu menguji tembak rudal jelajah yang diperkirakan para analis bisa memiliki kemampuan nuklir. Laporan KCNA menyebut bahwa uji coba terbaru itu dilakukan resimen rudal yang dimuat kereta api yang telah direncanakan sejak awal tahun ini. Foto-foto yang dirilis media nasional Korut menunjukkan sebuah rudal berwarna hijau zaitun diluncurkan ke udara meninggalkan kepulan asap dan kobaran api. ""Sistem rudal yang dimuat kereta api berfungsi sebagai sarana serangan balik yang efisien yang mampu memberikan pukulan bersamaan terhadap kekuatan yang memberikan ancaman,"" sebut Pak Jong Chon, seorang Marsekal Korut dan anggota Presidium Politburo Partai Buruh Korea yang mengawasi uji coba sistem rudal itu, seperti dikutip KCNA. Tampak bahwa rudal itu ditembakkan dari atap sebuah kereta yang diparkir di jalur rel sebuah area pegunungan. Korsel dalam laporannya menyebut rudal balistik Korut itu diluncurkan dari area pedalaman di wilayah Yangdok, Korut bagian tengah. Masih dilansir KCNA, bahwa ada rencana untuk memperluas resimen rudal yang dimuat kereta api menjadi kekuatan seukuran brigade di masa mendatang, dan untuk melakukan latihan demi meraup 'pengalaman operasional untuk perang yang sebenarnya'. Pak menyatakan bahwa militer Korut harus mempersiapkan rencana taktis untuk mengerahkan sistem ini di berbagai wilayah lainnya. Uji coba rudal Korut itu dilakukan pada hari yang sama dengan negara tetangganya, Korsel, yang menguji tembak rudal balistik kapal selam (SLBM). Korsel menjadi negara pertama di dunia yang mengembangkan SLBM tanpa memiliki senjata nuklir. KCNA juga melaporkan pada awal pekan ini Korea Utara telah menguji coba 'rudal jelajah jarak jauh' selama akhir pekan lalu. Uji coba tembak rudal ini di tengah kebuntuan panjang dengan Amerika Serikat mengenai denuklirisasi. Seperti dilansir AFP, Senin (13/9), uji coba tembak rudal ini berlangsung pada Sabtu (11/9) dan Minggu (12/9), yang diamati oleh pejabat tingkat tinggi. KCNA menambahkan uji coba yang dilakukan berhasil. Rudal-rudal itu menempuh perjalanan selama 7.580 detik di sepanjang 'orbit penerbangan oval dan pola-8' di atas Korea Utara dan perairan teritorialnya, dan mencapai target 1.500 kilometer jauhnya. Laporan itu menyebut rudal itu sebagai 'senjata strategis yang sangat penting', KCNA menambahkan bahwa secara keseluruhan, efisiensi dan kepraktisan operasi sistem senjata dipastikan sangat baik. Dikatakan juga bahwa pengembangan sistem rudal memiliki 'signifikansi strategis', memberi Korea Utara alat pencegahan lain yang efektif untuk melindungi negara dan membantu dengan kuat menahan manuver militer pasukan musuh'. Dilansir Reuters, Patroli Pantai Jepang menyebut objek yang ditembakkan Korut bisa jadi rudal balistik. Rudal-rudal Korut itu disebut mengudara sejauh 800 Km hingga mencapai ketinggian maksimum 60 Km sebelum jatuh ke laut. ""Korea Utara menembakkan dua rudal balistik tak teridentifikasi dari area pedalaman di tengah wilayahnya menuju pantai timur, dan otoritas intelijen Korea Selatan dan Amerika Serikat melakukan analisis secara detail untuk informasi lebih lanjut,"" sebut Kepala Staf Gabungan Korea Selatan (Korsel) atau JCS. JCS menambahkan bahwa militer Korsel meningkatkan level pengawasannya dan menjaga kesiapan penuh dalam kerja sama erat dengan AS. Komando Indo-Pasifik militer AS secara terpisah menyebut peluncuran rudal Korut itu tidak memberikan ancaman segera untuk para personel, wilayah maupun sekutu-sekutu AS. Perdana Menteri (PM) Jepang, Yoshihide Suga menyebut peluncuran rudal Korut itu 'keterlaluan'. Suga juga mengecam keras aktivitas balistik terbaru Korea Utara yang disebut menjadi ancaman bagi perdamaian dan keamanan di kawasan. Patroli Pantai Jepang, dalam pernyataannya, menyebut rudal-rudal Korut jatuh di luar zona ekonomi eksklusif Jepang. Baik Suga maupun Presiden Korsel, Moon Jae-In, dijadwalkan menggelar rapat dengan dewan keamanan nasional untuk membahas peluncuran rudal Korut itu.",Uji Coba Rudal Korea Utara Makin Menggila,serikat buruh,https://news.detik.com/internasional/d-5727534/uji-coba-rudal-korea-utara-makin-menggila?single=1,"Jumat, 17 Sep 2021 05:00 WIB"
"(Korut) mengklaim sukses menguji coba 'sistem rudal yang dimuat kereta api' pada Rabu (15/9) waktu setempat. Sistem rudal itu diklaim dirancang untuk menangkal setiap kekuatan yang mengancam Korut. Seperti dilansir  , Kamis (16/9/2021), kantor berita Korut,   (KCNA) dalam laporan terbarunya mengklaim rudal yang diluncurkan dari kereta api itu berhasil mengudara sejauh 800 kilometer sebelum mengenai target di lautan atau di lepas pantai timur Korut. Otoritas   (Korsel) dan  melaporkan pada Rabu (15/9) waktu setempat bahwa mereka mendeteksi peluncuran dua , beberapa hari setelah rezim komunis itu menguji tembak rudal jelajah yang diperkirkan para analis bisa memiliki kemampuan nuklir. Laporan KCNA menyebut bahwa uji coba terbaru itu dilakukan resimen rudal yang dimuat kereta api yang telah direncanakan sejak awal tahun ini. ""Sistem rudal yang dimuat kereta api berfungsi sebagai sarana serangan balik yang efisien yang mampu memberikan pukulan bersamaan terhadap kekuatan yang memberikan ancaman,"" sebut Pak Jong Chon, seorang Marsekal Korut dan anggota Presidium Politburo Partai Buruh Korea yang mengawasi uji coba sistem rudal itu, seperti dikutip KCNA. Foto-foto yang dirilis media nasional Korut menunjukkan sebuah rudal berwarna hijau zaitun diluncurkan ke udara meninggalkan kepulan asap dan kobaran api. Tampak bahwa rudal itu ditembakkan dari atap sebuah kereta yang diparkir di jalur rel sebuah area pegunungan. Korsel dalam laporannya menyebut rudal balistik Korut itu diluncurkan dari area pedalaman di wilayah Yangdok, Korut bagian tengah. Dituturkan Pak, seperti dilansir KCNA, bahwa ada rencana untuk memperluas resimen rudal yang dimuat kereta api menjadi kekuatan seukuran brigade di masa mendatang, dan untuk melakukan latihan demi meraup 'pengalaman operasional untuk perang yang sebenarnya'. Pak menyatakan bahwa militer Korut harus mempersiapkan rencana taktis untuk mengerahkan sistem ini di berbagai wilayah lainnya. Uji coba rudal Korut itu dilakukan pada hari yang sama dengan negara tetangganya, Korsel, yang menguji tembak rudal balistik kapal selam (SLBM). Korsel menjadi negara pertama di dunia yang mengembangkan SLBM tanpa memiliki senjata nuklir. Korut sendiri diketahui terus mengembangkan sistem persenjataannya, yang semakin menaikkan pertaruhan untuk perundingan yang buntu dengan target melucuti senjata nuklir dan rudal balistik rezim komunis itu sebagai imbalan untuk pencabutan sanksi-sanksi internasional. ""Rudal bergerak di kereta api menjadi opsi yang relatif muda dan bisa diandalkan untuk negara-negara yang berupaya meningkatkan kemampuan bertahan untuk kekuatan nuklir mereka. Rusia melakukannya. AS (Amerika Serikat) mempertimbangkannya. Sangat masuk akal bagi Korea Utara,"" sebut peneliti senior Federasi Ilmuwan Amerika, Adam Mount, dalam analisisnya via Twitter. Secara terpisah, peneliti senior Carnegie Endowment for International Peace, Ankit Panda, menilai sistem rudal kereta api yang dipamerkan Korut bisa menjadi pijakan untuk mengembangkan platform peluncuran untuk rudal balistik antarbenua (ICBM) bermuatan nuklir yang lebih besar. Dia juga menekankan bahwa beberapa sistem rudal yang dipamerkan Korut mungkin hanyalah 'unjuk teknologi' yang mungkin belum dikembangkan sepenuhnya.",Korea Utara Berhasil Uji Coba Sistem Rudal dari Kereta Api,serikat buruh,https://news.detik.com/internasional/d-5726365/korea-utara-berhasil-uji-coba-sistem-rudal-dari-kereta-api?single=1,"Kamis, 16 Sep 2021 12:49 WIB"
"Wakil Ketua MPR RI Lestari Moerdijat percaya pandemi COVID-19 yang melanda Indonesia dan dunia pada umumnya pasti akan berlalu. Bahkan, tanda-tanda akan berakhirnya pandemi ini sudah terlihat, alain berkurangnya jumlah kasus penularan, berkurangnya tingkat keterisian rumah sakit, serta berkurangnya jumlah kematian akibat COVID-19. Tetapi, perempuan yang disapa Ririe ini mengingatkan COVID-19 tidak akan serta merta hilang dari bumi Indonesia dan dunia pada umumnya. Seperti diingatkan para pakar, virus ini akan berubah dari pandemi menjadi endemi. Oleh karena itu masyarakat harus bersiap melakukan situasi new normal, dengan tetap menjalankan protokol kesehatan. ""Pandemi mengakibatkan krisis yang multidimensional. Karena itu kita harus tetap bersatu, bergotong royong, menghadapi segala kemungkinan dengan berpegangan pada Pancasila, UUD NRI Tahun 1945, NKRI dan Bhinneka Tunggal Ika,"" kata Rerie dalam keterangannya, Senin (13/9/2021). Pernyataan itu disampaikannya di hadapan peserta Sosialisasi Empat Pilar MPR RI, kerja sama MPR dengan Serikat Buruh Nasional Indonesia (SBNI) di Ruang Pertemuan Islamic Centre Kabupaten Brebes Jawa Tengah, Minggu (12/9/). Empat Pilar MPR RI sudah terbukti mampu merekatkan bangsa Indonesia dalam menghadapi segala ancaman dan tantangan, termasuk pandemi COVID-19 saat ini. Sebab pandemi yang hadir sekarang ini bukanlah yang pertama. Tetapi sudah ada pandemi-pandemi lain yang lebih dulu datang, dan empat konsensus kebangsaan itu mampu mengatasi. ""Konsensus ini bisa menjadi panduan dalam kehidupan, termasuk panduan menuju cita-cita, adil makmur dan beradab,"" kata Rerie lagi. Oleh karena itu, meski banyak ideologi yang masuk, bangsa Indonesia tidak boleh berpaling dari Pancasila sebagai dasar dan Ideologi bangsa. UUD NRI 1945 sebagai konstitusi, NKRI sebagai bentuk negara dan Bhinneka Tunggal Ika sebagai semboyan negara",4 Pilar MPR Dinilai Rekatkan Warga Saat Pandemi COVID-19,serikat buruh,https://news.detik.com/berita/d-5721718/4-pilar-mpr-dinilai-rekatkan-warga-saat-pandemi-covid-19?single=1,"Senin, 13 Sep 2021 15:31 WIB"
"Para pelaku industri hasil tembakau (IHT) dan buruh kompak menolak rencana kenaikan tarif cukai hasil tembakau (CHT) atau cukai rokok pada 2022. Rencana itu dikhawatirkan akan berdampak buruk terhadap nasib pekerja industri itu. ""Kami meminta tidak ada kenaikan cukai rokok. Rencana kenaikan cukai rokok yang disampaikan pemerintah, itu akan mematikan nasib jutaan buruh industri rokok dan tembakau di seluruh Indonesia,"" kata Ketua Umum Pengurus Daerah Federasi Serikat Pekerja Rokok Tembakau Makanan dan Minuman Serikat Pekerja Seluruh Indonesia (PD FSP RTMM SPSI) Jawa Timur, Purnomo dalam konferensi pers Senin (20/9/2021) lalu. Penolakan kenaikan cukai rokok seakan rutin terjadi setiap tahunnya. Tetapi apakah benar kebijakan itu berdampak ke industri atau pekerjanya? ""Kenaikan cukai sebenarnya tidak berdampak langsung kepada pekerja rokok,"" ungkap Direktur Riset Center of Reform on Economics (CORE) Indonesia, Piter Abdullah saat dihubungi. Piter menjelaskan dampak ke pekerja atas kenaikan cukai rokok didasarkan asumsi bahwa kenaikan cukai akan menurunkan konsumsi dan produksi rokok. Tetapi faktanya hal itu tidak terjadi, berapapun harganya orang cenderung tetap akan membeli. ""Kenaikan cukai rokok tidak menurunkan konsumsi dan produksi rokok. Artinya tidak ada dampak kenaikan cukai rokok ke pekerja dan buruh rokok,"" imbuhnya. Hanya saja memang, kenaikan cukai rokok secara tidak langsung akan mengurangi keuntungan industri rokok, terutama pengusaha rokok kecil. Itu sebabnya mereka menolak kenaikan cukai rokok setiap tahunnya. Hal yang sama juga dikatakan oleh Director Political Economy & Policy Studies (PEPS), Anthony Budiawan. Kenaikan cukai rokok dinilai tidak berdampak ke pekerja, hal itu dilihat dari enam tahun berturut-turut sebelumnya yang juga terjadi kenaikan. ""Enam tahun ini tidak ada dampak ke pekerja. (Kenaikan cukai rokok ditolak setiap tahun) kamuflase aja, tapi tentu saja tanpa kenaikan lebih bagus bagi industri,"" bebernya.",Benarkah Kenaikan Cukai Rokok Berdampak ke Industri-Pekerja?,serikat buruh,https://finance.detik.com/industri/d-5741158/benarkah-kenaikan-cukai-rokok-berdampak-ke-industri-pekerja?single=1,"Minggu, 26 Sep 2021 21:13 WIB"
",  , telah mengumumkan rencana untuk mengamandemen konstitusi dan membentuk pemerintahan baru. Rencana ini disampaikan beberapa bulan setelah dirinya memecat Perdana Menteri Hichem Mechichi dan menangguhkan parlemen, dalam gerakan yang disebut pengkritiknya sebagai kudeta. Pada Sabtu (11/9) lalu, Saied mengatakan dia akan 'sesegera mungkin' membentuk pemerintahan baru, setelah memilih 'orang-orang dengan integritas paling tinggi'. Meski begitu, Saied tak menjelaskan detail terkait kapan rencananya itu akan diwujudkan. ""Rakyat Tunisia menolak konstitusi,"" katanya, sambil menambahkan bahwa aturan tersebut tidak abadi. ""Kami bisa memperkenalkan amandemen,"" imbuhnya kepada dua stasiun TV, seperti dilansir AFP dan Al Jazeera, Minggu (12/9/2021). Pada Kamis (9/9), salah satu penasihat Saied mengatakan kepada Kantor berita Reuters bahwa sang presiden berencana untuk menangguhkan konstitusi dan menawarkan versi amandemen melalui referendum, yang mendorong oposisi dari partai politik dan serikat buruh UGTT yang kuat. Sebelumnya, Saied juga mengambil alih otoritas eksekutif setelah memecat Perdana Menteri Hicham Mechichi. Eskalasi politik terjadi setelah ribuan warga Tunisia turun ke jalan memprotes penanganan pandemi COVID-19. Demonstrasi tersebut kemudian berakhir ricuh. Presiden Saied juga mengumumkan pembekuan parlemen Tunisia selama 30 hari dan menangguhkan kekebalan semua deputi. Dia mengklaim langkahnya itu diperbolehkan dalam kasus ""bahaya yang akan segera terjadi"" berdasarkan Pasal 80 konstitusi Tunisia. ""Konstitusi tidak mengizinkan pembubaran parlemen, tetapi mengizinkan pekerjaannya ditangguhkan,"" kata Saied. Saied, yang terpilih sebagai Presiden Tunisia pada akhir 2019, mengklaim dirinya sebagai penafsir utama konstitusi. Langkahnya pun mendapat kritik oleh para hakim dan lawan politiknya, khususnya partai Ennahdha yang terinspirasi Islam, blok terbesar di parlemen. Awal bulan ini, para diplomat dari negara-negara G7 - Inggris, Kanada, Prancis, Jerman, Italia, Jepang, dan AS - meminta Saied mengembalikan Tunisia ke ""tatanan konstitusional"" dan mendesaknya untuk menyampaikan jalan yang jelas ke depan terkait masa depan negaranya.",Presiden Tunisia Umumkan Rencana Amandemen Konstitusi,serikat buruh,https://news.detik.com/internasional/d-5720481/presiden-tunisia-umumkan-rencana-amandemen-konstitusi?single=1,"Minggu, 12 Sep 2021 15:24 WIB"
"Menteri Ketenagakerjaan, Ida Fauziyah menggelar Dialog Sosial dengan Pengurus Serikat Pekerja Perempuan di Balai K3 Bandung, Jawa Barat hari ini. Di kesempatan tersebut, Ida mendorong pengurus serikat pekerja/serikat buruh (SP/SB) perempuan untuk berdialog sosial dengan manajemen perusahaan soal pelecehan. Melalui dialog sosial, Ida mengatakan mereka dapat membahas tentang pentingnya membangun budaya zero tolerance, termasuk terhadap pelecehan dan kekerasan seksual. Dengan demikian, perempuan dapat merasa lebih aman dan nyaman saat bekerja. ""Kalau perusahaan punya komitmen itu kan orang gak berani macem-macem melakukan kekerasan atau pelecehan seksual,"" ucap Ida dalam keterangan tertulis, Jumat (10/9/2021). Terkait hal ini, Ida mengatakan kekerasan atau pelecehan seksual, baik verbal atau nonverbal tidak boleh menimpa pekerja, khususnya pekerja perempuan. Untuk itu, ia meminta pekerja perempuan agar lebih sering menggelar dialog sosial dengan manajemen perusahaan. Pasalnya, kata Ida, inisiasi dialog sosial harus datang dari perempuan karena mereka lebih memiliki kepekaan daripada laki-laki. ""Perempuan yang harus proaktif dialog, mensosialisasikan ke kalangan pekerja dan perusahaan melalui forum-forum yang ada di perusahaan agar tidak boleh terjadi kekerasan, pelecehan,"" katanya. Ida menyebut sosialisasi atau dialog sosial yang rutin dilakukan akan menutup ruang bagi mereka yang ingin melakukan kekerasan atau pelecehan. Dirinya pun menegaskan agar seluruh pihak tidak menoleransi tindakan kekerasan dan pelecehan. ""Kita tidak menoleransi kekerasan atau pelecehan. Siapa pun pelakunya. Perempuan pun jika melakukan kekerasan, maka ia wajib diganjar hukuman yang sama,"" ucapnya. Selain itu, Ida menyatakan sosialisasi antikekerasan atau pelecehan juga perlu dilakukan di luar tempat kerja, termasuk di lingkungan keluarga dan lingkungan sosial. Hal ini penting dilakukan guna mencegah pelecehan dan kekerasan terjadi di masyarakat. ""Temen-temen ini perlu memberikan edukasi dan pemahaman kepada masyarakat,"" pungkasnya. Sebagai informasi, dalam acara tersebut turut hadir Dirjen PHI dan Jamsos, Indah Anggoro Putri; Dirjen Binwasnaker dan K3, Haiyani Rumondang; Staf Khusus Menaker, Dita Indah Sari dan M. Reza Hafiz; Kadisnakertrans Provinsi Jawa Barat, Rachmat Taufik Garsadi; dan Kepala Balai K3 Bandung, Muhammad Imran.",Menaker Dorong Pekerja Perempuan Cegah Pelecehan Lewat Dialog Sosial,serikat buruh,https://news.detik.com/berita/d-5718867/menaker-dorong-pekerja-perempuan-cegah-pelecehan-lewat-dialog-sosial?single=1,"Jumat, 10 Sep 2021 23:38 WIB"
"Ketua Pengurus Daerah Serikat Pekerja Rokok Tembakau Makanan dan Minuman Serikat Pekerja Seluruh Indonesia (PD FSP RTMM SPSI) Jawa Tumur, Purnomo menegaskan, pihaknya tidak mencampuri soal simplifikasi tier cukai. Pihaknya fokus pada perlindungan kepentingan buruh dan Penolakan kenaikan cukai. Soal kebijakan Simplifikasi diserahkan kepada pemerintah Pusat.   ""Kami tidak mencampuri urusan Simplifikasi penarikan cukai. Kami fokus pada Penolakan kenaikan cukai dan perlindungan kepentingan buruh. Soal simplifikasi kami serahkan kepada pemerintah Pusat. Serikat pekerja RTMM Jawa Timur fokus melindungi tenaga kerja. Tupoksi FSP RTMM SPSI Jawa Timur adalah perlindungan terhadap anggota atau buruh. Sehingga terkait pengaturan simplifikasi tier cukai kami menyerahkannya kepada pemerintah pusat,"" ujar Ketua PD FSP RTMM SPSI Jawa Timur, Purnomo kepada pers, kemarin di Surabaya. Dalam pemberitaan sebelumnya, Ketua FSP RTMM SPSI Jawa Timur, Purnomo secara tegas menyatakan penolakannya terhadap rencana kenaikan cukai rokok. Karena hal tersebut dapat mengancam nasib ribuan bahkan jutaan buruh rokok dan tembakau. ""Dengan dimuatnya statement kami ini, maka surat kami No 425 /ADM/13.G/PD.RTMM/IX/2021 kami cabut, dan kami anggap selesai. Selanjutnya, kami berharap Kerjasama antara kawan kawan wartawan pers dan media massa dengan PD FSPRTMM Jawa Timur dapat terus ditingkatkan"" papar Ketua PD FSP RTMM SPSI Jawa Timur Purnomo. Pada kesempatan yang sama, Ketua PD FSP RTMM SPSI Jawa Timur, Purnomo juga menjelaskan pihaknya sudah berkirim surat kepada Presiden RI yang disampaikan melalui Gubernur Jawa Timur, Khofifah Indar Parawansa. Surat tersebut antara lain meminta pemerintah membatalkan rencana kenaikan cukai rokok. Pemerintah juga diminta tidak merevisi PP 109/2012. Bagaimana sikap buruh lainnya? Buka halaman selanjutnya. Berbeda dengan Ketua FSP RTMM SPSI Jawa Timur, Ketua Asosiasi Petani Tembakau Indonesia Provinsi Nusa Tenggara Barat (APTI NTB) Sahminudin, justru berpendapat, Simplifikasi tier cukai rokok yang dikampanyekan salah satu perusahaan rokok besar kepada berbagai instansi pemerintah khususnya kementrian keuangan, bukan lagi penyederhanaan cukai rokok. Tapi pengurangan golongan tembakau. Bahkan penghilangan pabrik pabrik rokok kecil dan menengah. Kelak kalau simplifikasi rokok dibiarkan terus terjadi tidak tertutup kemungkinan pabrik atau perusahaan rokok yang tersisa di Indonesia, hanya tinggal tiga bahkan hanya ada satu. Industri rokok atau tembakau nasional nasibnya akan sama dengan industri garam. Yang berjaya adalah garam import. ""Penyebutan simplifikasi tier cukai rokok itu adalah pembodohan dan pembohongan. Dari 10 golongan rokok dihilangkan menjadi 4. Jadi yang sebernanya terjadi, itu bukan simplifikasi tapi pengurangan atau penghilangan golongan rokok. Bahkan upaya mematikan industri rokok di tanah air,"" tegas Ketua APTI NTB Sahminudin. Menurut Sahminudin Pemerintah khususnya Menkeu menyetujui simplifikasi yang disodorkan oleh perusahaan rokok asing karena bagian dari konspirasi FCTC (Framework convention tobacco control), konvensi untuk mematikan industri rokok di tanah air. Nanti digantikan oleh rokok import. ""Industri rokok di tanah air mau dimatikan, petani dan buruh rokok akan kehilangan lapangan pekerjaan, lewat simplifikasi, masak didukung pemerintah? Kita harus berpikir Panjang ke depan, untuk melindungi nasib dan masa depan petani tembakau dan cengkih juga buruh buruh yang bekerja di industri rokok dan tambekau, "" tegas Sahminudin.. Lebih lanjut Sahminudin menjelaskan, Saat ini rokok di tanah air terdiri dari 3 golongan. Sigaret kretek tangan (SKT), Sigaret kretek mesin (SKM) dan Sigaret putih mesin. Total Tier cukai rokoknya berjumlah 10 golongan. Terdiri dari SKT 4 golongan. SKM ada 3 golongan cukai rokok. Dan SPM juga ada 3 tier golongan cukai. Di SKT ada 4 golongan tier cukai rokok golongan III, golongan II, dan Golongan I B dan IA. Di SKM ada 3 golongan. Golongan 2 B dan golongan 2A, dan golongan 1. Di SPM ada golongan tier cukai rokok. Golongan 2 A, golongan 2 B, Golongan 1. ""Cukai Hasil Tembakau Golongan III lebih kecil dari Golongan II dan lebih kecil dari golongan Golongan I. Golongan IA lebih besar dari Golongan I B. Atau golongan I B lebih kecil dari golongan I A. Demikian juga di SPM. Golongan II B lebih kecil cukai hasil tembakaunya dari golongan IIA. Golongan IIA lebih kecil dari golongan I. Rokok jenis sigaret kretek mesin atau SKM dan Sigaret Putih Mesin atau SPM, jumlah golongannya sama 3. Tapi golongan cukai hasil tembakau SPM lebih tinggi dari pada cukai hasil tembakau SKM. Atau CHT SKM lebih rendah dari CHT nya SPM,"" papar Sahminudin. Sahminudin memaparkan, Kalau simplifikasi jadi dilakukan, dari 10 golongan cukai akan dijadikan 4 cukai hasil tembakau. Bahkan nanti kemungkinan menjadi satu jenis cukai hasil tembakau. Beratri industri rokok yang memproduksi rokok dengan jumlah sedikit pun harus membayar cukai rokok sama besarnya dengan industri besar. ""Lama lama ini akan mematikan pabrik pabrik rokok kecil. Perusahaan rokok yang memproduksi rokok dengan jumlah kecil disamakan bayar cukainya dengan pabrik rokok besar. Pabrik rokok kecil akan mati. Otomatis penyerapan tembakau juga menjadi sedikit. Dan hanya diserap satu peruahaan rokok besar. Kalau sudah satu perusahaan rokok berarti itu monopoli. Perusahaan rokok yang melakukan monopoli itu, bisa dengan seenaknya menentukan harga beli tembakau petani . Ini berbahaya"" papar Sahminudin. Ditambahkan oleh Ketua APTI NTB, tahun 2007 jumlah golongan rokok cukai hasil tembakau ada 25-30 golongan. Dilakukan simplifikasi menjadi 10. Akibat simplifikasi jumlah pabrik atau perusahaan rokok yang semula 4.793 tahun 2008 langsung drop pabrik rokok menjadi 3. 295. Dilakukan simplifikasi terus saat ini perusahaan atau pabrik rokok tinggal 456 pabrik. ""Simplifikasi dilakukan mulai tahun 2008 sampai 2018. Setiap tahun dilakukan pengurangan golongan Cukai Hasil Tembakau. Sampai sekarang jumlahnya menjadi 10. Akibatnya pabrik rokok tinggal 456 pabrik rokok. Pabrik rokok yang lain mati karena gak tahan bayar cukai rokok dan persyaratan pendirian keberadaan pabrik rokok. Otomatis tenaga kerja kehilangan lapangan pekerjaan,' Papar Sahminudin. Lebih lanjut Sahminuddin memaparkan, Petani tembakau juga kehilangan pembeli tembakau. Kalau pabrik rokok banyak harga rokok murah sehingga konsumen rokok mampu membeli rokok. Kalau pabrik rokoknya sedikit berarti rokoknya Jadi mahal. Konsumen gak sanggup beli. Di sisi lain, kalau masyarakat gak sanggup beli rokok bermerk, pabrik rokok akan banyak yang tutup. Jumlah tenaga kerja akan kehilangan lapangan pekerjaan. Petani tembakau juga akan kehilangan pembeli. Ini dampak buruk dari Simplifikasi cukai",Beda Sikap Buruh soal Simplifikasi Tarif Cukai Rokok,serikat buruh,https://finance.detik.com/industri/d-5740691/beda-sikap-buruh-soal-simplifikasi-tarif-cukai-rokok?single=1,"Minggu, 26 Sep 2021 15:56 WIB"
