artikel,judul,keyword,link,tanggal
"Dinas Kesehatan DKI Jakarta mengajak pengurus RT/RW untuk mendata lagi warganya yang belum divaksin COVID-19. Hal ini penting dilakukan untuk mengetahui berapa banyak warga DKI yang belum divaksin agar bisa segera diminta melakukan vaksinasi COVID-19 secepatnya. Berdasarkan data dari Komite Penanganan COVID-19 dan Pemulihan Ekonomi Nasional (KPC-PEN) yang digabungkan (overlay) dengan data Dinas Kependudukan dan Pencatatan Sipil DKI Jakarta terdapat 2,7 juta warga ber-KTP DKI Jakarta yang belum divaksin. Kepala Dinas Kesehatan Provinsi DKI Jakarta Widyastuti mengatakan berdasarkan hasil survei diketahui bahwa beberapa faktor warga belum divaksin di antaranya penyakit komorbid tertentu hingga adanya penolakan atau kurangnya kesadaran akan pentingnya vaksinasi COVID-19. ""Saat ini banyak jenis vaksin tersedia dan lokasi vaksinasi yang mudah dijangkau. Untuk yang komorbid tertentu, dengan adanya vaksin Moderna dan Pfizer yang relatif lebih bisa diterima tentunya atas rekomendasi dari teman-teman sejawat dari organisasi profesi. Jadi sebenarnya sudah tidak perlu ragu lagi,"" ujarnya dikutip dari situs resmi Pemprov DKI, Kamis (9/9/2021). Widyastuti menjelaskan komunikasi risiko COVID-19 merupakan elemen penting dari kesehatan masyarakat agar tidak abai dan hal-hal yang tidak boleh dilakukan bisa dihindari. Selain itu, komunikasi risiko diperlukan agar penularan tidak semakin meluas dan masyarakat tidak panik atau cemas. ""Dalam penerapan strategi komunikasi risiko peran pengurus RT/RW dan tokoh-tokoh kunci di masyarakat sebagai teladan (role model) menjadi sangat penting untuk mengedukasi masyarakat terkait penanganan COVID-19, termasuk agar warga mau divaksin,"" terangnya. Menurutnya, melalui peran dan dukungan pengurus RT/RW serta tokoh masyarakat melaksanakan komunikasi risiko yang baik tentunya kepercayaan masyarakat terhadap program pemerintah dapat terbentuk. Partisipasi dan pemetaan dari pengurus RT/RW sangat diperlukan untuk memastikan berapa orang per RT yang riil tinggal DKI Jakarta tapi belum divaksin. Melalui bantuan pengurus RT/RW pemetaan warga belum divaksin akan lebih mudah. ""Peran itu semua dibutuhkan, tidak mungkin kita bekerja sendiri, memberikan komunikasi risiko yang baik sehingga dapat membentuk opini warga yang lebih positif lagi,"" ungkapnya. Ia menambahkan pemetaan oleh pengurus RT/RW perlu dilakukan untuk memperoleh data riil warga yang belum divaksin sehingga akan memudahkan Pemerintah Provinsi (Pemprov) DKI Jakarta khususnya Dinas Kesehatan untuk melakukan intervensi di titik atau lokasi tertentu. Pasalnya, tidak dipungkiri bahwa dinamika kependudukan juga menjadi kendala tersendiri di lapangan. Banyak juga warga ber-KTP DKI Jakarta namun sudah tidak berdomisili di Jakarta. Meskipun secara data sudah ada tapi terjadi dinamika kependudukan yang luar biasa. Upaya Door to door dalam rangka identifikasi dan mengajak supaya mau divaksin merupakan suatu sistem strategi vaksin yang sudah kita kerjakan. ""Setelah kita melakukan sweeping alamat rumah-rumah warga yang belum divaksin kita temukan KTP-nya DKI tapi tidak tinggal di Jakarta. Untuk itu, kita dorong peran serta RT/RW untuk memetakan yang sebenarnya,"" tandasnya.",Dinkes DKI Ajak Pengurus RT/RW Data Warga Belum Divaksin COVID-19,organisasi profesi,https://news.detik.com/berita/d-5716133/dinkes-dki-ajak-pengurus-rtrw-data-warga-belum-divaksin-covid-19?single=1,"Kamis, 09 Sep 2021 11:28 WIB"
"Salah satu guru terbaik Fakultas Kedokteran (FK) Unair meninggal setelah berjuang melawan COVID-19 lebih 1 bulan. Dr dr Tommy Sunartomo, SpAn KIC, Staf Pengajar Departemen Anestesiologi & Reanimasi FK Unair dan RSU dr Soetomo meninggal di usia 75 tahun usai alami  . Long COVID-19 merupakan gejala Corona dalam jangka panjang yang dialami pasien beberapa bulan, pasca infeksi atau saat masa pemulihan. Sedangkan almarhum dokter Tommy sudah 1 bulan dinyatakan negatif COVID-19. Sebelumnya almarhum sempat menjalani perawatan di RS Khusus Inveksi Universitas Airlangga (RSKI Unair). Dokter Tommy saat itu dirawat bersebelahan dengan mendiang Prof Hendrian Dwikoloso Soebagjo SpM(K) FICS pada 3 Agustus dan terlebih dahulu gugur karena COVID-19. Dokter kelahiran Madiun ini wafat menyusul istri tercinta, Nana Fauzana, yang sudah 40 hari meninggal dunia karena COVID-19. Dia meninggal satu orang anak, Dr dr Prananda Surya Airlangga MKes SpAn. Almarhum dokter Tommy termasuk sosok guru pencetak lulusan terbaik di FK Unair. Para dokter hebat hingga profesor lahir dari tangan dinginnya, seperti Dekan  , Prof Dr dr Budi Santoso SpOG (K) hingga Direktur Utama RSU dr Soetomo Surabaya Dr dr Joni Wahyuadi SpBS (K). ""Saya ingat betul saat saya sedang menempuh pendidikan, saat itu saat masih menjadi Dokter Muda, dibimbing oleh beliau. Saya yang dibimbing langsung oleh beliau, juga sejawat dokter yang lain pasti sepemahaman, bahwa beliau adalah sosok guru yang sangat baik di mata mahasiswanya,"" kata Dekan Unair Prof Budi, Selasa (24/8/2021). Prof Budi menyebut, meninggalnya Dokter Tommy menjadi duka mendalam bagi FK Unair. Sosoknya yang peduli terhadap kemajuan ilmu pengetahuan dan pendidikan di FK Unair, kini tak bisa dipetik ilmunya. Kepergiannya menambah daftar pahlawan dan guru FK Unair yang gugur di masa pandemi  . Selama masih hidup, banyak kiprah pendidikan dan pekerjaan yang ditempuh almarhum. Almarhum lulus dokter umum dari FK Unair pada tahun 1973. Dan mengambil studi Spesialis Anestesiologi dan Reanimasi di institusi yang sama tahun 1978. Di Tahun 1979, mengikuti Pendidikan Intensive Care di Prancis dan mendapat gelar Konsultan Intensive Care tahun 1997. Dokter kelahiran 30 Juni 1946 ini memulai karir di FK Unair tahun 1974 sebagai asisten di Departemen Anestesiologi dan Reanimasi FK Unair. Kemudian diangkat menjadi PNS tahun 1976 dan pensiun tahun 2011. Hingga tutup usianya, almarhum masih aktif menjadi Staf Pengajar di Departemen Anestesiologi dan Reanimasi FK Unair-RSU dr Soetomo. ""Selain mengabdikan diri pada pengetahuan, Dokter Tommy juga aktif di berbagai organisasi profesi. Antara lain sebagai Pengurus Ikatan Dokter Indonesia (IDI), Ikatan Dokter Spesialis Anestesiologi & Reanimasi Indonesia dan Perhimpunan Dokter Spesialis Bedah Indonesia. Selain itu juga aktif di Perhimpunan Kedokteran Gawat Darurat Indonesia, Perhimpunan Dokter Spesialis Anestesiologi dan Reanimasi Indonesia, serta Perhimpunan Dokter Intensive Care Indonesia,"" jelasnya. Sikap welas asih dokter Tommy ini dirasakan mahasiswa   yang saat ini tengah menempuh pendidikan. Di mata residen PPDS di Departemen Anastesiologi dan Reanimasi saat ini, sosoknya tak ubahnya seorang ayah yang perhatian namun juga disiplin dalam mendidik. ""Beliau selalu memastikan residen PPDS-nya mengerti saat konsultasi. Bahkan, setiap hari libur besar seperti Idul Fitri/Idul Adha, beliau selalu mengirimkan makanan untuk tim jaga. Sangat baik beliau di mata kami,"" kenang dr Pratama, Chief PPDS Anestesi & Reanimasi FK Unair.","Dokter Tommy, Spesialis Anestesi RSU Soetomo Meninggal Usai Long COVID-19",organisasi profesi,https://news.detik.com/berita-jawa-timur/d-5694736/dokter-tommy-spesialis-anestesi-rsu-soetomo-meninggal-usai-long-covid-19?single=1,"Selasa, 24 Agu 2021 18:01 WIB"
"Ketua Umum Perhimpunan Rumah Sakit Seluruh Indonesia (PERSI) Kuntjoro Purjanto angkat bicara soal kondisi . Menurut dia, saat ini Indonesia bak berada di kapal besar dengan gelombang Corona yang bisa menerjang kapan saja, tak jelas kapan selesainya. ""Saya berharap pemerintah juga mempertimbangkan, karena pada saat ini kita semua tuh sedang di dalam kapal besar, yang sedang mengalami gelombang yang tinggi, kemudian rendah nanti ada lagi dan sebagainya,"" ungkap dia dalam konferensi pers Seruan Kebangsaan bersama organisasi profesi, Rabu (18/8/2021). ""Yang belum jelas gelombang itu. Untuk mendorong kapal ini sampai ke tujuan yang secara afirmatif saya berkehendak bahwa COVID-19 itu hilang dari bumi pertiwi ini, Indonesia kuat, Indonesia tumbuh, dan Indonesia sehat,"" sambung dia. Kuntjoro mewanti-wanti jangan sampai rumah sakit kemudian menjadi sakit, tidak bisa menangani pasien secara optimal. Hal ini disebutnya bisa dicegah dengan pengawasan di hulu dan masifnya testing hingga tracing. Tidak sedikit tenaga kesehatan yang berguguran disoroti Kuntjoro menjadi perhatian bersama ke depan agar pemerintah bisa memfasilitasi seluruh kebutuhan termasuk alat pelindung diri para nakes, di garda terdepan. Pada akhirnya, jika hulu tak tertangani, bukan tidak mungkin setiap RS kesulitan menjaga pelayanan bermutu. ""Jangan sampai rumah sakitnya menjadi sakit, tenaga kesehatannya tidak terjaga yang mengakibatkan konsistensi terhadap pelayanan bermutu tidak akan tercapai,"" kata dia. Kendati demikian, Kuntjoro menjamin seluruh pihak RS selama pandemi COVID-19 bekerja keras menangani pasien-pasien Corona. ""Saya menjamin saat   ini komitmen sivitas hospitalia terhadap penanganan COVID-19 luar biasa, sekaligus itu merupakan kebanggaan,"" pungkasnya.",,organisasi profesi,https://health.detik.com/berita-detikhealth/d-5687265/persi-corona-ri-bak-kapal-besar-dihadang-gelombang-tinggi-tak-tahu-kapan-usai?single=1,"Rabu, 18 Agu 2021 20:01 WIB"
"sudah melanda Indonesia dan negara-negara lain di dunia selama dua tahun. Berbagai prediksi menyebut penyakit ini tidak akan benar-benar dan hanya akan berubah menjadi penyakit endemi. Kapan itu terjadi? Wakil ketua Asosiasi Dinas Kesehatan (ADINKES) Nurhandini Eka Dewi mengatakan belum bisa memastikan apakah pandemi COVID-19 akan menjadi endemik di 2022. Sebab, kasus Corona di dunia masih terus bergerak maju mundur. ""Kalau kita melihat dunia juga masih bergerak maju-mundur, misalnya ada yang sudah melandai tapi naik lagi, masih ada puncak-puncaknya, rasanya mungkin awal tahun masih belum ya (jadi endemik),"" ungkapnya dalam konferensi pers Seruan Kebangsaan bersama organisasi profesi, Rabu (18/8/2021). Kenyataannya, Nurhandini mengungkapkan sampai saat ini belum satupun negara yang benar-benar bebas dari kasus COVID-19. Salah satu patokan yang bisa membuktikan COVID-19 telah menjadi   adalah sudah tidak ada kasus Corona lagi di banyak negara. ""Tetapi, melihat sampai saat ini, belum satupun negara yang bisa betul-betul bebas dari angka-angka kesakitan COVID ini. Maka untuk COVID menjadi endemik di tahun 2022 masih menjadi tanda tanya,"" tegasnya. Menurut Nurhandini, salah satu yang menyebabkan   menjadi endemik adalah dengan penanganan virus Corona yang maksimal. Jika tidak ada lagi negara yang terancam COVID-19, kemungkinan Corona menjadi endemik akan terbuka. ""Kita berharap mungkin apabila penanganannya bisa maksimal, kemudian banyak negara yang sudah tidak terancam dengan kasus COVID-19, di situlah dia (COVID-19) berubah dari pandemi menjadi endemik,"" pungkasnya.",,organisasi profesi,https://health.detik.com/berita-detikhealth/d-5686989/kasus-masih-naik-turun-kapan-pandemi-covid-19-akan-jadi-endemik?single=1,"Rabu, 18 Agu 2021 17:31 WIB"
"Kasus penangkapan   di tengah perseteruan dengan Kartika Putri, menyita perhatian netizen. Polisi menyebut, dr Richard ditangkap karena terciduk memposting endorse di akun Instagram @dr.richard_lee, saat akun disita karena dugaan pencemaran nama baik Kartika Putri. ""Yang bersangkutan ada memposting endorse di akun Instagram-nya, di story maupun feed-nya, padahal akunnya itu sudah kami sita,"" ujar Kasubdit Siber Polda Metro Jaya Kompol Rovan Richard Mahenu kepada  , Kamis (12/8/2021). Terkait aturan bermedsos, Majelis Kehormatan Etik Kedokteran (MKEK) Pusat Ikatan Dokter Indonesia (IDI) sudah merilis fatwa etik dokter dalam aktivitas media sosial. Termasuk di dalamnya adalah tentang promosi. Hal tersebut tercantum dalam poin kelima Surat Keputusan Nomor 029/PB/K/MKEK/04/2021. ""Pada penggunaan media sosial, dokter harus menjaga diri dari promosi diri berlebihan dan prakteknya serta mengiklankan suatu produk dan jasa sesuai dengan SK MKEK Pusat IDI No 022/PB.K.MKEK/07/2020 tentang Fatwa Etika Dokter Beriklan dan Berjualan Multi Level Marketing yang diterbitkan MKEK Pusat IDI tanggal 28 Juli 2020,"" jelas surat keputusan tersebut, dikutip Kamis (12/8/2021). SK tersebut menyebutkan dokter dan organisasi profesi dokter dilarang tampil dalam iklan yang terang-terangan mempromosikan suatu produk dengan klaim apapun di seluruh media. Seperti promosi penyembuhan penyakit, kesehatan, kecantikan, atau kebugaran. Para dokter bisa tampil dalam iklan produk tanpa klaim penyembuhan penyakit hingga kecantikan dengan syarat melepas atribut profesi dokter, atau menegaskan pernyataannya tidak mewakili profesi dokter. ""Serta harus melepaskan atribut dan logo organisasi profesi kedokteran,"" lanjut SK terkait. Pada poin lainnya, para dokter diminta untuk memahami potensi kesalahpahaman di masyarakat. Sebab, keterlibatan dokter dalam iklan produk menimbulkan kepercayaan produk sudah teruji klinis hingga aman digunakan. Hal ini yang kemudian perlu menjadi perhatian.",,organisasi profesi,https://health.detik.com/berita-detikhealth/d-5679785/dikaitkan-dengan-penangkapan-dr-richard-ini-etika-dokter-endorse-di-ig?single=1,"Kamis, 12 Agu 2021 18:00 WIB"
"Kementerian Kesehatan memperbarui pedoman tatalaksana pasien COVID-19 berdasarkan sejumlah rekomendasi organisasi profesi. Jika sebelumnya terdapat azitromisin dan   dalam paket obat COVID-19 gejala ringan, kini keduanya dihapus, dan diganti Favipiravir. Menteri Kesehatan Budi Gunadi Sadikin menjelaskan perubahan pedoman obat dilakukan usai kasus COVID-19 varian Delta terus mendominasi. Pedoman yang kemudian dikeluarkan sembari meningkatkan percepatan perawatan pasien Corona di sejumlah RS demi menekan angka kematian COVID-19. ""Kita sudah minta tolong lima organisasi profesi kedokteran untuk mengkaji protokol tatalaksana COVID-10. Mereka mengajukan tatalaksana yang baru, yang memang lebih sesuai dengan mutasi Delta,"" ungkap Budi dalam konferensi pers Senin (2/8/2021). ""Di mana intervensinya di rumah sakit-rumah sakit akan lebih cepat, dan komposisi obat-obatan yang dibutuhkan juga agak diubah sedikit,"" beber Menkes Budi. Bagaimana dengan paket obat gratis yang dibagikan khusus isoman COVID-19? Apakah akan ikut berubah? ""Kita sudah melakukan adjustment perbaikan dari jadwal produksi dan paket-paket obat yang ada untuk bisa mencocokkan dengan tatalaksana protokol   yang baru,"" lanjut Menkes Budi.  - Vitamin C, D  - Obat-obatan suportif - Vitamin C, D  - Favipiravir  - Pengobatan simtomatis  - Obat-obat suportif - Vitamin C, D  - Favipiravir atau Remdesiviur  - Antikoagulan LMWH/UFH berdasarkan evaluasi DPJP  - Pengobatan simtomatis  - Pengobatan komorbid dan komplikasi yang ada - Vitamin C, B, E, D, Zinc  - Favipiravir atau Remdesivir  - Kortikosteroid  - Anti IL-6 (tocilizumab/sarilumab)  - Pengobatan komorbid dan komplikasi yang ada  - Antikoagulan LMWH/UFH berdasarkan evaluasi DPJP  - Terapi tatalaksana syok (bila terjadi)",,organisasi profesi,https://health.detik.com/berita-detikhealth/d-5666268/fix-tak-ada-lagi-oseltamivir-azitromisin-di-paket-obat-isoman-covid-19?single=1,"Senin, 02 Agu 2021 14:03 WIB"
"Menko Polhukam Mahfud Md menyoroti adanya 'kelompok tidak murni' yang selalu memprovokasi serang pemerintah terkait seruan aksi ' '. PPP menyarankan pemerintah menggandeng organisasi masyarakat untuk menanggulangi kelompok tersebut. ""Untuk menanggulangi kelompok-kelompok tidak murni yang ingin memanfaatkan belum optimalnya hasil kerja pemerintah dalam menanggulangi COVID tersebut, maka menurut hemat PPP langkah ke depan yang harus ditempuh oleh pemerintah adalah memperluas peran serta ormas-ormas dan elemen-elemen masyarakat sipil termasuk organisasi profesi, organisasi pekerja, perkumpulan pedagang pasar, dan lain-lain,"" kata Waketum PPP, Arsul Sani kepada wartawan, Sabtu (24/7/2021). Menurut Arsul, tidak bisa dipungkiri bahwa di kalangan ormas misalnya ada suara bahwa pemerintah seperti menjalankan langkah-langkah penanggulangan lebih dengan pendekatan 'one man show'. Sementara potensi ormas dan lain-lainnya tak diberdayakan lebih maksimal. ""Padahal ormas-ormas seperti Muhammadiyah, NU dan organisasi-organisasi keagamaan lainnya yang memiliki atau terafiliasi dengan rumah sakit dan fasilitas kesehatan juga telah berperan serta dalam mengatasi pandemi COVID ini,"" ujarnya. Oleh sebab itu, PPP meminta pemerintah melibatkan ormas dalam penanganan pandemi. PPP meyakini kelompok tak murni yang ingin memanfaatkan pandemi pun tak akan digubris oleh masyarakat. ""PPP berharap KPC-PEN ke depan berinisiatif lebih maksimal melibatkan peran serta ormas dan elemen masyarakat tersebut sejak dalam perencanaan kebijakan yang akan diambil. Paling tidak masukan-masukan mereka didengarkan,"" ucapnya. ""Jika peran serta masyarakat ini ditingkatkan, PPP yakin bahwa kelompok-kelompok tidak murni yang ingin memanfaatkan situasi untuk men  pemerintah itu juga tidak akan mendapat respons yang besar lagi dari warga masyarakat,"" imbuhnya. Seruan demonstrasi bertajuk 'Jokowi End Game' sebelumnya muncul di tengah masa pandemi COVID-19. Menko Polhukam Mahfud Md menyoroti adanya 'kelompok tidak murni' yang selalu memprovokasi menyerang pemerintah. ""Ada kelompok murni dan ada kelompok tidak murni yang masalahnya itu hanya ingin menentang saja, memanfaatkan situasi,"" kata Mahfud Md dalam konferensi pers terkait situasi politik dan keamanan, disiarkan kanal YouTube Kemenko Polhukam RI, Sabtu (24/7).",PPP Sarankan Gandeng Ormas Tanggulangi Kelompok Tak Murni 'Jokowi End Game',organisasi profesi,https://news.detik.com/berita/d-5655705/ppp-sarankan-gandeng-ormas-tanggulangi-kelompok-tak-murni-jokowi-end-game?single=1,"Minggu, 25 Jul 2021 05:03 WIB"
"Guru besar (Gubes) di Fakultas Kedokteran Universitas Airlangga (FK Unair) Surabaya memberi rekomendasi pemerintah dalam menangani pandemi COVID-19.  Budi Gunadi Sadikin mengatakan akan menindaklanjuti rekomendasi ini. Rekomendasi ini bertajuk Gebrak COVID-19 atau Gerakan Aksi Bersama Serentak Tanggulangi COVID-19. Rekomendasi ini diserahkan secara simbolis kepada Menko Koordinator Bidang Perekonomian Airlangga Hartarto, Menteri Kesehatan Budi Gunadi Sadikin, Ketua Satgas Nasional Penanganan COVID-19 Letjen Ganip Warsito hingga Gubernur Jawa Timur Khofifah Indar Parawansa secara virtual melalui zoom meeting. ""Kami melihat masukan dari FK Unair, terima kasih masukan ini akan kami bawa dan kami akan tindaklanjuti,"" kata Budi saat memberi sambutan secara virtual yang dilihat detikcom di Surabaya, Jumat (30/7/2021). Budi menambahkan pihaknya beberapa kali telah mengajak ahli dari Fakultas Kedokteran dan Fakultas Kesehatan Masyarakat Unair untuk berdiskusi dalam mengatasi pandemi. ""Beberapa kali kita ajak diskusi untuk membantu Kemenkes dalam mengatasi pandemi ini dalam empat kelompok. Kelompok pertama adalah protokol kesehatan, kelompok kedua adalah kelompok testing, tracing, dan isolasi. Ketiga adalah vaksinasi dan keempat adalah mengenai perawatan,"" imbuhnya. ""Semua pandemi ini kan nggak akan berakhir cepat, dia nanti akan berubah menjadi epidemi normal dan itu akan terjadi kalau pengobatannya baik,"" tambahnya. Di kesempatan yang sama, Budi juga terbuka menerima masukan dan kerja sama dari para ahli perawatan penyakit menular hingga penyakit paru  . "" karena memiliki banyak ahli perawatan, termasuk juga perawatan penyakit menular maupun paru. Saya mohon kalau bisa bekerja sama dengan kami dan memberi masukan kepada kami, terapi apa yang memang memiliki kans untuk bisa mengurangi fatalitas di RS,"" jelas Budi. Untuk memfasilitasi hal ini, Budi juga telah meminta ke Wakil Menteri untuk membuat working grup khusus terkait penanganan terbaik di RS. ""Saya sudah minta ke Wamen untuk bisa membuat working grup khusus yang membahas terapi di RS, yang bisa sebanyak mungkin menghasilkan terapi untuk mengurangi keparahan di rumah sakit. Kita sudah menyusun tata laksana dan saya berharap tata laksana ini ke depannya akan semakin tajam, saya mendapat masukan dari teman-teman termasuk dari organisasi profesi untuk mengobati orang. Bagaimana bisa memberikan masukan mengenai terapi yang paling baik, paling murah dan paling bisa menyembuhkan orang di RS,"" pungkas Budi.",Menkes Tindaklanjuti Rekomendasi Penanganan COVID-19 dari Unair,organisasi profesi,https://news.detik.com/berita-jawa-timur/d-5662778/menkes-tindaklanjuti-rekomendasi-penanganan-covid-19-dari-unair?single=1,"Jumat, 30 Jul 2021 11:59 WIB"
"Seiring lonjakan kasus COVID-19 di Indonesia, kebutuhan akan obat-obatan meningkat. Mulai dari obat antivirus, antibiotik, hingga obat-obatan tertentu yang berfungsi meringankan gejala COVID-19 seperti demam dan pilek. Walhasil, tak sedikit masyarakat mempertanyakan, adakah  ? Guru besar Fakultas Farmasi Universitas Gadjah Mada (UGM) Prof Dr Apt Zullies Ikawati menjelaskan, pada dasarnya, COVID-19 adalah penyakit yang bisa sembuh dengan sendirinya tanpa pasien mengonsumsi obat tertentu. Pasalnya, COVID-19 disebabkan oleh virus sehingga satu-satunya cara untuk menyembuhkan pasien adalah dengan meningkatkan daya tahan tubuh, bukan dengan minum obat tertentu. ""Penyakit ini kan penyakit karena virus yang sebetulnya sih bisa sembuh sendiri, seperti flu itu itu kan bisa sembuh sendiri sehingga yang harus dikuatkan adalah sistem imun,"" terang Prof Zullies pada  , Rabu (14/7/2021). ""Untuk menguatkan sistem imun itu kan banyak cara. Di samping menggunakan vitamin, itu juga dari makanan yang sehat istirahat yang cukup, kemudian berjemur untuk mendapat tambahan vitamin D. Kemudian jangan cemas karena cemas bisa memengaruhi sistem imun,"" lanjutnya. Berikut daftar obat yang sempat viral dan marak diborong. Dari daftar di bawah ini, adakah  ? Berdasarkan revisi Protokol Tatalaksana COVID-19 oleh 5 organisasi profesi, oseltamivir tidak lagi direkomendasikan sebagai obat untuk pasien COVID-19, khususnya yang menjalani isoman. Disebutkan, oseltamivir hanya diberikan jika terdapat kecurigaan ko-infeksi influenza pada pasien COVID-19. Menurut Prof Zullies, revisi rekomendasi obat wajar terjadi disebabkan perkembangan bukti klinis baru seiring penggunaan obat, khususnya pada COVID-19 di mana hingga kini, belum ada obat yang terbukti mempan menyembuhkan. ""Oseltamivir diberikan secara empiris pada masa awal pandemi COVID-19 karena sulitnya membedakan gejala pasien COVID-19 dan pasien yang terinfeksi virus influenza. Saat ini, oseltamivir dapat ditambahkan pada dimana pasien dengan COVID-19 dan diduga terinfeksi virus influenza dengan dosis 2 x 75Mgo,"" terang Prof Zullies. Sama seperti oseltamivir, Azithromycin juga mengalami revisi dalam Protokol Tatalaksana COVID-19 oleh 5 organisasi profesi. Azithromycin kini hanya perlu diberikan pada pasien COVID-19 suspek kasus berat dan kritis, dengan kecurigaan ko-infeksi dan mikroorganisme. Dalam kesempatan lainnya, Ketua Satgas Ikatan Dokter Indonesia (IDI), Prof Zubairi Djoerban menjelaskan, azithromycin adalah obat antibiotik untuk bakteri, sementara COVID-19 adalah penyakit akibat virus. ""Sehingga, tidak seharusnya pasien COVID-19 diberikan azithromycin kecuali ada infeksi bakteri sekunder. Akan tetapi, pemakaiannya tetap ditentukan oleh dokter,"" ujarnya, dikutip dari laman Twitternya, Senin (19/7/2021). ""Kalau pemakaiannya sembarangan, terlalu banyak, tanpa indikasi yang benar, maka akan timbul resistensi. Yang resisten tentunya bukan kita, tapi bakterinya,"" lanjut Prof Zubairi. Menteri Kesehatan Budi Gunadi Sadikin baru saja menyebutkan, anjuran obat oseltamivir untuk diberikan pada pasien COVID-19 telah diganti dengan favipiravir. Dengan pertimbangan, efektivitasnya terhadap varian Delta. ""Favipiravir ini akan mengganti sel sebagai obat antivirus. Kalau azithromycin antibiotik, favipiravir ini masuk kategori antivirus yang oleh dokter-dokter 5 profesi di Indonesia sudah mengkaji dampaknya terhadap mutasi virus Delta ini dan mereka menganjurkan agar antivirusnya digunakan favipiravir,"" ujar Menkes dalam konferensi pers virtual, Senin (26/7/2021). Lantas, sudah terjawabkah pertanyaan Anda soal  ? Mengacu pada penjelasan Prof Zullies, yang terpenting dilakukan oleh pasien COVID-19 adalah menjaga daya tahan tubuh. Misalnya, dengan menjaga asupan makanan, beristirahat, dan berjemur. Maka itu, masyarakat tak perlu panik jika tidak bisa mendapatkan obat-obatan sebagaimana yang sempat marak diborong.",,organisasi profesi,https://health.detik.com/berita-detikhealth/d-5658860/obat-covid-19-yang-ampuh-ada-nggak-sih-ini-kata-ahli-farmakologi?single=1,"Selasa, 27 Jul 2021 16:33 WIB"
