artikel,judul,keyword,link,tanggal
"Pengusaha membantah laporan   yang mengatakan terpaksa tetap masuk kerja meskipun positif COVID-19. Pengusaha menilai laporan para buruh tidak benar, pasalnya pengelola pabrik tidak akan mungkin mengizinkan adanya pekerja yang positif COVID-19 untuk tetap bekerja. Ketua Umum Asosiasi Pertekstilan Indonesia (API), Jemmy Kartiwa menegaskan tak pernah ada paksaan dari pengusaha kepada pekerja yang positif COVID-19 untuk tetap bekerja. Dia justru mengatakan bila ada pabrik yang memaksa pekerja yang positif COVID-19 bekerja seharusnya dilaporkan. ""Kalau orang sakit dipaksa bekerja kami nggak menemukan ya, kalau memang ada ya mending dilaporkan. Saya rasa nggak mungkin orang sakit disuruh kerja,  -nya yang malah stres kalau nanti ada kasus besar,"" ungkap Jemmy dalam konferensi pers Apindo-Kadin, Rabu (21/7/2021). Sebelumnya, fakta mengejutkan terungkap dari laporan serikat  . Mereka menyampaikan masih banyak anggotanya yang terkonfirmasi positif COVID-19 dan terpaksa tetap bekerja, utamanya di sektor industri tekstil, garmen, sepatu, dan kulit. Menurut Jemmy, perusahaan tak mungkin membiarkan adanya penyebaran COVID-19 di pabrik. Maka dari itu dia menegaskan tidak ada buruh yang positif COVID-19 dan tetap bekerja. ""Kalau   dan   meningkat kan merugikan perusahaan juga ya. Jadi, itu kondisi tidak benar. Secara nalar dan akal sehat tidak akan terjadi ya,"" kata Jemmy. Jemmy juga menegaskan perusahaan pasti menerapkan protokol kesehatan dengan ketat. Dia menilai hal itu sudah menjadi komitmen para pengusaha tekstil. Soal protokol kesehatan pun sebelumnya juga dikeluhkan buruh tidak dilakukan di pabrik-pabrik tempat mereka bekerja. ""Mengenai penggunaan APD, protokol kesehatan, dan lain-lain, itu sudah jadi standar kami. Kami sudah minta dijalankan, kami ingatkan anggota bekerja sama untuk tekan positif case menurun,"" ungkap Jemmy. Ketua Umum Gabungan Pengusaha Makanan dan Minuman (Gapmmi) Adhi Lukman menambahkan, selama ini semua industri masuk sektor kritikal dan beroperasi dengan protokol kesehatan ketat, termasuk juga industri makanan dan minuman. Dia memaparkan pengusaha pun harus melengkapi diri dengan surat izin dan laporan berkala ke Kementerian Perindustrian. ""Kami ini masuk industri kritikal, kami memang boleh operasi dan kami lakukan protokol kesehatan ketat. Kami harus ada izin IOMKI dan kami lapor berkala ke Kemenperin, selama ini laporan dari anggota makanan minuman ini tidak ada hambatan,"" ungkap Adhi. Saking ketatnya protokol kesehatan di kawasan industri, menurut Adhi saat ini sebetulnya sudah tidak ada penularan COVID-19 secara signifikan di pabrik-pabrik. Malah menurutnya, yang seharusnya diperketat adalah protokol kesehatan di lingkungan setingkat RT/RW. ""Penularan ini bukan dari industri, karena kami sudah ketat, tapi sekarang justru kebanyakan dari penularan rumah tangga. Harusnya RT/RW diperketat supaya tak ada penularan,"" kata Adhi. Sebelumnya, Ketua Federasi Serikat Buruh Persatuan Indonesia (FSBPI) Dian Septi Trisnanti mengatakan saat ini banyak perusahaan yang mengubah status buruhnya menjadi pekerja kontrak atau borongan. Dengan perubahan status itu membuat pemberian upah buruh sesuai dengan jam kerja harian. Maka bila tidak masuk kerja mereka khawatir tidak dapat upah. Dari situ lah para buruh memaksa diri untuk tetap bekerja meskipun positif COVID-19. ""Pekerja kontrak dan borongan akan terpaksa tetap bekerja, meski sakit, karena takut kehilangan upah. Klaster pabrik sangat agresif, buruh TGSL (tekstil, garmen, sepatu, dan kulit), dalam dua minggu saja di Cakung, Tangerang, Subang, dan Solo ribuan anggota kita terpapar,"" ungkap Dian dalam konferensi pers virtual, Senin (19/7/2021). Di mata para buruh, PPKM Darurat juga tidak berlaku. Mereka menilai di pabrik-pabrik tempatnya bekerja sama sekali tidak menerapkan aturan PPKM Darurat. Semua aturan dan protokol kesehatan tidak ada yang berlaku di pabrik industri tekstil, garmen, sepatu, dan kulit (TGSL). Dian mengatakan banyak pabrik di daerah sentra tekstil masih mempekerjakan pekerjanya 100%. Sebagai informasi, dalam aturan PPKM Darurat untuk sektor industri orientasi ekspor dapat beroperasi dengan kapasitas maksimal dengan 50% staf di fasilitas produksi/pabrik, serta 10% untuk pelayanan administrasi perkantoran. ""Pada sektor manufaktur TGSL, PPKM nyaris tidak berlaku bagi ratusan ribu atau bahkan jutaan pekerjanya. Di banyak sentra industri sektor ini misal, Cakung, Tangerang, Subang, Sukabumi, dan Solo, puluhan pabrik masih beroperasi 100%,"" ungkap Dian. Dian mengatakan para pekerja terpaksa untuk tetap bekerja, jika tidak mereka akan kehilangan pekerjaan. Para pekerja bahkan harus melakukan lembur. Buruknya lagi, protokol kesehatan sama sekali tidak dilakukan di pabrik. Untuk   dan fasilitas cuci tangan saja sama sekali tidak disediakan perusahaan. Belum lagi beberapa fasilitas seperti tes COVID-19 berkala ataupun vitamin untuk menjaga imunitas para buruh.",Bantahan Pengusaha soal Kabar Buruh Positif COVID-19 Tetap Kerja,serikat buruh,https://finance.detik.com/berita-ekonomi-bisnis/d-5651620/bantahan-pengusaha-soal-kabar-buruh-positif-covid-19-tetap-kerja?single=1,"Rabu, 21 Jul 2021 19:00 WIB"
"Serikat   menyampaikan masih banyak anggotanya yang terkonfirmasi positif COVID-19 dan terpaksa tetap bekerja. Hal ini terus terjadi apalagi di tengah lonjakan kasus COVID-19. Ketua Federasi Serikat Buruh Persatuan Indonesia (FSBPI) Dian Septi Trisnanti mengatakan saat ini banyak perusahaan yang mengubah status buruhnya menjadi pekerja kontrak atau borongan. Dengan perubahan status itu membuat pemberian upah buruh sesuai dengan absensi harian kerjanya. Maka bila tidak masuk kerja mereka khawatir tidak dapat upah. Dari situ lah para buruh memaksa diri untuk tetap bekerja meskipun positif COVID-19. ""Pekerja kontrak dan borongan akan terpaksa tetap bekerja, meski sakit, karena takut kehilangan upah. Klaster pabrik sangat agresif, buruh TGSL (tekstil, garmen, sepatu, dan kulit), dalam dua minggu saja di Cakung, Tangerang, Subang, dan Solo ribuan anggota kita terpapar,"" ungkap Dian dalam konferensi pers virtual, Senin (19/7/2021). Ketua Bidang Hubungan Luar Negeri Federasi Serikat Pekerja Tekstil, Sandang, dan Kulit Serikat Pekerja Seluruh Indonesia (FSP TSK-SPSI) Dion Wijaya mengatakan perubahan status pekerja banyak dilakukan perusahaan kepada buruh sejak Omnibus Law UU Cipta Kerja disahkan. ""Dengan status itu maka semakin tertekan para pekerja garmen khususnya pekerja perempuan. Dengan status begitu meski mereka terpapar mereka terpaksa kerja karena dengan status itu mereka khawatir nggak dapat upah,"" kata Dion dalam diskusi yang sama. Mirisnya lagi bila   ketahuan perusahaan terpapar, dia akan diminta pulang untuk isolasi mandiri. Namun, buruh tidak mendapatkan fasilitas apapun dari perusahaan. ""Mereka mungkin bisa bekerja kalau cuma gejala saja belum dicek, tapi yang terpapar itu kalau ada yang tes massal disuruh pulang dan isoman. Tapi tanpa ada fasilitas di perusahaan, ini muncul  ,"" ungkap Dion. Ketua Umum Federasi Serikat Pekerja Tekstil, Sandang, dan Kulit Konfederasi Serikat Pekerja Seluruh Indonesia (FSP TSK-KSPSI) menambahkan sudah banyak bukti dari laporan buruh di lapangan yang mengaku bila harus isolasi mandiri di rumah mereka tak mendapatkan upah.  akan mengambil risiko untuk tetap bekerja selama gejala COVID-19 belum parah dan memilih untuk tidak mendeteksinya. Apabila dinyatakan positif COVID-19 tidak akan melapor kantor. ""Mereka memilih masuk lah mengambil risiko masuk meski sakit, mereka pikir gejala nggak seberapa kecuali sudah parah banget baru mereka nggak akan masuk. Sudah banyak contoh di perusahaan, kalau isoman sama seperti dirumahkan tanpa upah,"" ungkap Helmy.",Kacau! Banyak Buruh Terpaksa Kerja Meski Positif COVID-19,serikat buruh,https://finance.detik.com/berita-ekonomi-bisnis/d-5648654/kacau-banyak-buruh-terpaksa-kerja-meski-positif-covid-19?single=1,"Senin, 19 Jul 2021 12:24 WIB"
"Fakta mengejutkan terungkap dari laporan serikat  . Mereka menyampaikan masih banyak anggotanya yang terkonfirmasi positif COVID-19 dan terpaksa tetap bekerja. Ketua Federasi Serikat Buruh Persatuan Indonesia (FSBPI) Dian Septi Trisnanti mengatakan saat ini banyak perusahaan yang mengubah status buruhnya menjadi pekerja kontrak atau borongan. Dengan perubahan status itu membuat pemberian upah buruh sesuai dengan jam kerja harian. Maka bila tidak masuk kerja mereka khawatir tidak dapat upah. Dari situ lah para buruh memaksa diri untuk tetap bekerja meskipun positif COVID-19. ""Pekerja kontrak dan borongan akan terpaksa tetap bekerja, meski sakit, karena takut kehilangan upah. Klaster pabrik sangat agresif, buruh TGSL (tekstil, garmen, sepatu, dan kulit), dalam dua minggu saja di Cakung, Tangerang, Subang, dan Solo ribuan anggota kita terpapar,"" ungkap Dian dalam konferensi pers virtual, Senin (19/7/2021). Ketua Bidang Hubungan Luar Negeri Federasi Serikat Pekerja Tekstil, Sandang, dan Kulit Serikat Pekerja Seluruh Indonesia (FSP TSK-SPSI) Dion Wijaya mengatakan perubahan status pekerja banyak dilakukan perusahaan kepada buruh sejak Omnibus Law UU Cipta Kerja disahkan. ""Dengan status itu maka semakin tertekan para pekerja garmen khususnya pekerja perempuan. Dengan status begitu meski mereka terpapar mereka terpaksa kerja karena dengan status itu mereka khawatir nggak dapat upah,"" kata Dion dalam diskusi yang sama. Mirisnya lagi bila   ketahuan perusahaan terpapar, dia akan diminta pulang untuk isolasi mandiri. Namun, buruh tidak mendapatkan fasilitas apapun dari perusahaan. ""Mereka mungkin bisa bekerja kalau cuma gejala saja belum dicek, tapi yang terpapar itu kalau ada yang tes massal disuruh pulang dan isoman. Tapi tanpa ada fasilitas di perusahaan, ini muncul problem,"" ungkap Dion. Ketua Umum Federasi Serikat Pekerja Tekstil, Sandang, dan Kulit Konfederasi Serikat Pekerja Seluruh Indonesia (FSP TSK-KSPSI) Helmy Salim menambahkan sudah banyak bukti dari laporan buruh di lapangan yang mengaku bila harus isolasi mandiri di rumah mereka tak mendapatkan upah. Buruh akan mengambil risiko untuk tetap bekerja selama gejala COVID-19 belum parah dan memilih untuk tidak mendeteksinya. Apabila dinyatakan positif COVID-19 tidak akan melapor kantor. ""Mereka memilih masuk lah mengambil risiko masuk meski sakit, mereka pikir gejala nggak seberapa kecuali sudah parah banget baru mereka nggak akan masuk. Sudah banyak contoh di perusahaan, kalau isoman sama seperti dirumahkan tanpa upah,"" ungkap Helmy.  juga mengungkapkan bahwa banyak pabrik tidak patuh aturan PPKM Darurat. Cek halaman berikutnya. Di mata para buruh PPKM Darurat tidak berlaku. Mereka menilai di pabrik-pabrik tempatnya bekerja sama sekali tidak menerapkan aturan PPKM Darurat. Semua aturan dan protokol kesehatan tidak ada yang berlaku di pabrik industri tekstil, garmen, sepatu, dan kulit (TGSL). Dian mengatakan banyak pabrik di daerah sentra tekstil masih mempekerjakan pekerjanya 100%. Sebagai informasi, dalam aturan PPKM Darurat untuk sektor industri orientasi ekspor dapat beroperasi dengan kapasitas maksimal dengan 50% staf di fasilitas produksi/pabrik, serta 10% untuk pelayanan administrasi perkantoran. ""Pada sektor manufaktur TGSL, PPKM nyaris tidak berlaku bagi ratusan ribu atau bahkan jutaan pekerjanya. Di banyak sentra industri sektor ini misal, Cakung, Tangerang, Subang, Sukabumi, dan Solo, puluhan pabrik masih beroperasi 100%,"" ungkap Dian. Dian mengatakan para pekerja terpaksa untuk tetap bekerja, jika tidak mereka akan kehilangan pekerjaan. Para pekerja bahkan harus melakukan lembur. Buruknya lagi, protokol kesehatan sama sekali tidak dilakukan di pabrik. Untuk hand sanitizer dan fasilitas cuci tangan saja sama sekali tidak disediakan perusahaan. Belum lagi beberapa fasilitas seperti tes COVID-19 berkala ataupun vitamin untuk menjaga imunitas para buruh. ""Jutaan pekerja bekerja penuh waktu, bahkan melakukan lembur. Mereka bekerja dalam ruang tertutup dan padat, tanpa alat pelindung diri baik APD, masker, hand sanitizer, fasilitas mencuci tangan. Tidak ada juga fasilitas kesehatan memadai seperti klinik, tes COVID-19, atau vitamin penunjang,"" papar Dian. Pengakuan sama diungkap oleh Ketua Bidang Perempuan dan Anak Serikat Pekerja Nasional (SPN) Sumiyati, menurutnya selama ini pabrik-pabrik sama sekali tidak punya sensitivitas terhadap COVID-19. Dia menilai operasional berjalan seperti biasa, menurutnya pengusaha tak mau mengalah dengan PPKM Darurat. ""Kami lihat juga beberapa pabrik operasional berjalan seperti biasa. Mereka nggak mau ngalah dengan PPKM ini, semua rutinitas seperti biasa. Tidak ada protokol berjalan dengan baik,"" ungkap Sumiyati. Pengadaan hand sanitizer, masker, hingga suplemen vitamin yang seharusnya didapatkan demi menjaga keamanan, keselamatan, kesehatan kepada para buruh juga tak pernah diberikan. Bahkan untuk masker saja, banyak buruh yang menggunakannya secara berulang. ""Banyak buruh menggunakan masker berulang dicuci dipakai, karena beban. Vitaminnya juga tidak diminum, karena tidak disiapkan,"" kata Sumiyati. Sumiyati juga menyatakan harusnya perlindungan pekerja dijamin oleh perusahaan. Hal itu merupakan amanat UU Ketenagakerjaan menurutnya. ""Saya ingatkan lagi UU Ketenagakerjaan. Dijelaskan pemberi kerja diwajibkan berikan perlindungan kesejahteraan, keselamatan, dan kesehatan kerja bagi tenaga kerja baik mental dan fisiknya,"" ungkap Sumiyati.",Pedih! Buruh Terpaksa Tetap Kerja Padahal Positif COVID-19,serikat buruh,https://finance.detik.com/berita-ekonomi-bisnis/d-5649523/pedih-buruh-terpaksa-tetap-kerja-padahal-positif-covid-19?single=1,"Selasa, 20 Jul 2021 07:00 WIB"
"Pengusaha menepis kabar   yang terpaksa tetap kerja meskipun positif COVID-19. Mereka menilai pengelola pabrik tidak akan mungkin mengizinkan adanya pekerja yang positif COVID-19 untuk tetap bekerja. Sebelumnya, fakta mengejutkan terungkap dari laporan serikat buruh. Mereka menyampaikan masih banyak anggotanya yang terkonfirmasi positif COVID-19 dan terpaksa tetap bekerja, utamanya di sektor industri tekstil, garmen, sepatu, dan kulit. Ketua Umum Asosiasi Pertekstilan Indonesia (API), Jemmy Kartiwa menegaskan tak pernah ada paksaan dari pengusaha kepada pekerja yang positif COVID-19 untuk tetap bekerja. Dia justru mengatakan bila ada pabrik yang memaksa pekerja yang positif COVID-19 bekerja seharusnya dilaporkan. ""Kalau orang sakit dipaksa bekerja kami nggak menemukan ya, kalau memang ada ya mending dilaporkan. Saya rasa nggak mungkin orang sakit disuruh kerja,  -nya yang malah stres kalau nanti ada kasus besar,"" ungkap Jemmy dalam konferensi pers Apindo-Kadin, Rabu (21/7/2021). Menurutnya, perusahaan tak mungkin membiarkan adanya penyebaran COVID-19 di pabrik. Maka dari itu dia menegaskan tidak ada  ˇ yang positif COVID-19 dan tetap bekerja. ""Kalau   dan   meningkat kan merugikan perusahaan juga ya. Jadi, itu kondisi tidak benar. Secara nalar dan akal sehat tidak akan terjadi ya,"" kata Jemmy. Jemmy juga menegaskan perusahaan pasti menerapkan protokol kesehatan dengan ketat. Dia menilai hal itu sudah menjadi komitmen para pengusaha tekstil. Soal protokol kesehatan pun sebelumnya juga dikeluhkan buruh tidak dilakukan di pabrik-pabrik tempat mereka bekerja. ""Mengenai penggunaan APD, protokol kesehatan, dan lain-lain, itu sudah jadi standar kami. Kami sudah minta dijalankan, kami ingatkan anggota bekerja sama untuk tekan positif   menurun,"" ungkap Jemmy. Ketua Umum Gabungan Pengusaha Makanan dan Minuman (Gapmmi) Adhi Lukman menambahkan, selama ini semua industri masuk sektor kritikal dan beroperasi dengan protokol kesehatan ketat, termasuk juga industri makanan dan minuman. Dia memaparkan pengusaha pun harus melengkapi diri dengan surat izin dan laporan berkala ke Kementerian Perindustrian. ""Kami ini masuk industri kritikal, kami memang boleh operasi dan kami lakukan protokol kesehatan ketat. Kami harus ada izin IOMKI dan kami lapor berkala ke Kemenperin, selama ini laporan dari anggota makanan minuman ini tidak ada hambatan,"" ungkap Adhi. Saking ketatnya protokol kesehatan di kawasan industri, menurut Adhi saat ini sebetulnya sudah tidak ada penularan COVID-19 secara signifikan di pabrik-pabrik. Malah menurutnya, yang seharusnya diperketat adalah protokol kesehatan di lingkungan setingkat RT/RW. ""Penularan ini bukan dari industri, karena kami sudah ketat, tapi sekarang justru kebanyakan dari penularan rumah tangga. Harusnya RT/RW diperketat supaya tak ada penularan,"" kata Adhi. Sebelumnya, Ketua Federasi Serikat Buruh Persatuan Indonesia (FSBPI) Dian Septi Trisnanti mengatakan saat ini banyak perusahaan yang mengubah status buruhnya menjadi pekerja kontrak atau borongan. Dengan perubahan status itu membuat pemberian upah buruh sesuai dengan jam kerja harian. Maka bila tidak masuk kerja mereka khawatir tidak dapat upah. Dari situ lah para buruh memaksa diri untuk tetap bekerja meskipun positif COVID-19. ""Pekerja kontrak dan borongan akan terpaksa tetap bekerja, meski sakit, karena takut kehilangan upah. Klaster pabrik sangat agresif, buruh TGSL (tekstil, garmen, sepatu, dan kulit), dalam dua minggu saja di Cakung, Tangerang, Subang, dan Solo ribuan anggota kita terpapar,"" ungkap Dian dalam konferensi pers virtual, Senin (19/7/2021). Di mata para buruh, PPKM Darurat juga tidak berlaku. Mereka menilai di pabrik-pabrik tempatnya bekerja sama sekali tidak menerapkan aturan PPKM Darurat. Semua aturan dan protokol kesehatan tidak ada yang berlaku di pabrik industri tekstil, garmen, sepatu, dan kulit (TGSL). Dian mengatakan banyak pabrik di daerah sentra tekstil masih mempekerjakan pekerjanya 100%. Sebagai informasi, dalam aturan PPKM Darurat untuk sektor industri orientasi ekspor dapat beroperasi dengan kapasitas maksimal dengan 50% staf di fasilitas produksi/pabrik, serta 10% untuk pelayanan administrasi perkantoran. ""Pada sektor manufaktur TGSL, PPKM nyaris tidak berlaku bagi ratusan ribu atau bahkan jutaan pekerjanya. Di banyak sentra industri sektor ini misal, Cakung, Tangerang, Subang, Sukabumi, dan Solo, puluhan pabrik masih beroperasi 100%,"" ungkap Dian. Dian mengatakan para pekerja terpaksa untuk tetap bekerja, jika tidak mereka akan kehilangan pekerjaan. Para pekerja bahkan harus melakukan lembur. Buruknya lagi, protokol kesehatan sama sekali tidak dilakukan di pabrik. Untuk   dan fasilitas cuci tangan saja sama sekali tidak disediakan perusahaan. Belum lagi beberapa fasilitas seperti tes COVID-19 berkala ataupun vitamin untuk menjaga imunitas para buruh.",Pengusaha Bantah Paksa Buruh Kerja Meski Positif COVID-19,serikat buruh,https://finance.detik.com/berita-ekonomi-bisnis/d-5650939/pengusaha-bantah-paksa-buruh-kerja-meski-positif-covid-19?single=1,"Rabu, 21 Jul 2021 12:19 WIB"
"telah berlalu lebih dari dua minggu, bahkan ada opsi perpanjangan dilakukan. Namun, di mata para buruh PPKM Darurat tidak berlaku. Mereka menilai di pabrik-pabrik tempatnya bekerja sama sekali tidak menerapkan aturan PPKM Darurat. Semua aturan dan protokol kesehatan tidak ada yang berlaku di pabrik industri tekstil, garmen, sepatu, dan kulit (TGSL). Ketua Federasi Serikat Buruh Persatuan Indonesia (FSBPI) Dian Septi Trisnanti mengatakan banyak pabrik di daerah sentra tekstil masih mempekerjakan pekerjanya 100%. Sebagai informasi, dalam aturan   untuk sektor industri orientasi ekspor dapat beroperasi dengan kapasitas maksimal dengan 50% staf di fasilitas produksi/pabrik, serta 10% untuk pelayanan administrasi perkantoran. ""Pada sektor manufaktur TGSL, PPKM nyaris tidak berlaku bagi ratusan ribu atau bahkan jutaan pekerjanya. Di banyak sentra industri sektor ini misal, Cakung, Tangerang, Subang, Sukabumi, dan Solo, puluhan pabrik masih beroperasi 100%,"" ungkap Dian dalam konferensi pers virtual, Senin (19/7/2021). Dian mengatakan para pekerja terpaksa untuk tetap bekerja, jika tidak mereka akan kehilangan pekerjaan. Para pekerja bahkan harus melakukan lembur. Buruknya lagi, protokol kesehatan sama sekali tidak dilakukan di pabrik. Untuk   dan fasilitas cuci tangan saja sama sekali tidak disediakan perusahaan. Belum lagi beberapa fasilitas seperti tes COVID-19 berkala ataupun vitamin untuk menjaga imunitas para buruh. ""Jutaan pekerja bekerja penuh waktu, bahkan melakukan lembur. Mereka bekerja dalam ruang tertutup dan padat, tanpa alat pelindung diri baik APD, masker,   fasilitas mencuci tangan. Tidak ada juga fasilitas kesehatan memadai seperti klinik, tes COVID-19, atau vitamin penunjang,"" papar Dian. Hal ini pun akhirnya membuat timbulnya klaster pabrik. Sudah ada ribuan buruh TGSL menurut Dian yang terpapar COVID-19. Pabrik-pabrik sentra industri tekstil sendiri tersebar di Cakung, Tangerang, Subang, Sukabumi, dan Solo. ""Klaster pabrik menyebabkan klaster hunian. Klaster pabrik terjadi akibat pelanggaran protokol kesehatan oleh pengusaha yang berlangsung terus tanpa sanksi,"" tegas Dian. Pengakuan sama diungkap oleh Ketua Bidang Perempuan dan Anak Serikat Pekerja Nasional (SPN) Sumiyati, menurutnya selama ini pabrik-pabrik sama sekali tidak punya sensitivitas terhadap COVID-19. Dia menilai operasional berjalan seperti biasa, menurutnya pengusaha tak mau mengalah dengan PPKM Darurat. ""Kami lihat juga beberapa pabrik operasional berjalan seperti biasa. Mereka nggak mau ngalah dengan PPKM ini, semua rutinitas seperti biasa. Tidak ada protokol berjalan dengan baik,"" ungkap Sumiyati. Pengadaan   masker, hingga suplemen vitamin yang seharusnya didapatkan demi menjaga keamanan, keselamatan, kesehatan kepada para buruh juga tak pernah diberikan. Bahkan untuk masker saja, banyak buruh yang menggunakannya secara berulang. ""Banyak buruh menggunakan masker berulang dicuci dipakai, karena beban. Vitaminnya juga tidak diminum, karena tidak disiapkan,"" kata Sumiyati. Sumiyati juga menyatakan harusnya perlindungan pekerja dijamin oleh perusahaan. Hal itu merupakan amanat UU Ketenagakerjaan menurutnya. ""Saya ingatkan lagi UU Ketenagakerjaan. Dijelaskan pemberi kerja diwajibkan berikan perlindungan kesejahteraan, keselamatan, dan kesehatan kerja bagi tenaga kerja baik mental dan fisiknya,"" ungkap Sumiyati.","Buruh Bongkar Pabrik Tekstil Tak Terapkan PPKM Darurat, Ini Lokasinya",serikat buruh,https://finance.detik.com/berita-ekonomi-bisnis/d-5648692/buruh-bongkar-pabrik-tekstil-tak-terapkan-ppkm-darurat-ini-lokasinya?single=1,"Senin, 19 Jul 2021 12:53 WIB"
