artikel,judul,keyword,link,tanggal
"M Riza Damanik terpilih sebagai sebagai Ketua Umum Ikatan Sarjana Kelautan Indonesia (Iskindo) periode 2021-2026. Pemilihan Ketua Umum Iskindo tersebut dilakukan dalam Kongres III Iskindo, Kamis (23/9). Kongres yang diselenggarakan organisasi beranggotakan sekitar 35 ribu orang ini digelar secara hybrid. Sebanyak 115 peserta dari berbagai provinsi mengikuti kongres secara luring, yakni di CK Tanjung Pinang Hotel & Convention Center, Kepulauan Riau. Sementara itu, peserta lainnya mengikuti secara daring lewat aplikasi zoom. Ada sembilan nama kandidat ketua umum yang muncul dalam kongres ini. Pada akhirnya Riza yang terpilih lewat musyawarah dan mufakat. Riza bukanlah nama baru di lingkungan pegiat kelautan di Tanah Air. Sebelumnya, pada periode pertama Presiden Jokowi, Riza aktif mengawal agenda poros maritim sebagai Ahli Utama Kantor Staf Presiden bidang Kemaritiman. ""Kalau bukan karena tinta, takkan tertulis sebait puisi. Kalau tidak karena cinta. Takkan berkumpul kita disini,"" kata Riza dalam pidatonya seperti dikutip dalam keterangan tertulis, Jumat (24/9/2021). ""Dari langkat sampai ke Lotim, bersama Hang Tuah dan Hang Jebat. Selamat Hari Maritim. Maritim Kuat, Indonesia Hebat,"" lanjut Riza dengan berpantun. Riza menyampaikan terima kasih kepada Ketua Umum Iskindo periode 2018-2021 Zulficar Mochtar, panitia dan semua pihak yang telah mengawal kesuksesan Kongres III Iskindo. Termasuk seluruh pengurus DPW Iskindo yang hadir, baik daring maupun luring. ""Wabil khusus DPW Kepri yang telah mempersiapkan dengan sebaik-baiknya,"" lanjutnya. Staf Khusus Menteri Koperasi dan UKM ini juga menyampaikan terima kasih atas amanah yang diberikan kepadanya sebagai Ketum Iskindo Periode 2021-2026. ""Sebuah pekerjaan besar menanti di depan,"" kata Riza. Ia meyakini, dengan solidaritas yang kuat dari seluruh pengurus DPP dan DPW di seluruh Indonesia nantinya mampu membuat pekerjaan besar tersebut menjadi terasa ringan sehingga bisa membawa manfaat untuk Indonesia. Alumni Ilmu Kelautan Universitas Diponegoro Semarang ini menguraikan ada 3 syarat untuk Indonesia menjadi negara maritim yang kuat. Pertama, adanya SDA berkelanjutan. Kedua, tersedianya SDM kelautan yang unggul. Ketiga, adanya kebijakan yang mendukung tumbuh kembangnya inovasi dan teknologi guna mengoptimalkan pengelolaan sumber daya kelautan dan perikanan. ""Insyaallah SDM yang ada di ISKINDO dapat berkontribusi memenuhi syarat-syarat tersebut,"" sebut Riza. Riza menyatakan akan memperkuat sinergi dengan berbagai pihak, baik itu dengan kementerian/lembaga, pemerintah daerah, perguruan tinggi, organisasi profesi lainnya, BUMN, swasta, lembaga-lembaga penelitian di dalam dan luar negeri dalam rangka memperkuat kapasitas SDM Kelautan Indonesia. ""Termasuk mendorong pembentukan lembaga sertifikasi profesi jasa kelautan, memperluas peran sarjana kelautan dalam melahirkan inovasi dan teknologi guna mendukung cita-cita besar menjadikan Indonesia sebagai negara maritim yang kuat,"" tutur Riza. Ia menambahkan kelengkapan organisasi Iskindo juga akan terus diperkuat melalui peningkatan kapasitas anggota, pendataan dan kemandirian organisasi. Hal tersebut akan menjadi prioritas hingga melengkapi 34 DPW di 34 provinsi seluruh Indonesia. ""Terakhir, insyaallah seluruh konsensus kelautan yang kita sepakati dari Kongres III ini akan kami jalankan sebaik-baiknya,"" sebut Riza. ""Pergi ke laut membawa pukat, berlayar hingga ke Tunisia. Semoga Iskindo membawa manfaat, memajukan kelautan Indonesia kita,"" tutur Riza kembali berpantun. Koordinator Steering Committee Kongres III Iskindo Dr. Hendra Yusran Siri mengatakan pelaksanaan kongres III dilaksanakan pada momen yang tepat. Sebab, bersamaan dengan peringatan Hari Maritim yang diperingati pada tanggal 23 September 2021. Menurut Hendra, Iskindo hadir untuk memberikan warna dan kontribusi dalam memberi arah baru pembangunan kelautan bangsa Indonesia. Dalam penyusunan Rencana Pembangunan Jangka Panjang (RPJP) nanti, corak maritim dan kelautan harus mendominasi konsep pembangunan nasional. ""Warna dan corak maritim dan kepulauan harus lebih terdeterminasi dalam blue print pembangunan nasional,"" ungkap Hendra.","Jadi Ketum Iskindo, Riza Damanik Ingin Majukan Industri Kelautan RI",organisasi profesi,https://news.detik.com/berita/d-5738856/jadi-ketum-iskindo-riza-damanik-ingin-majukan-industri-kelautan-ri?single=1,"Jumat, 24 Sep 2021 19:20 WIB"
"Di bawah kendali DN Aidit, PKI menjelma menjadi salah satu kekuatan politik besar. Pada Pemilu 1955, PKI menempati posisi keempat di bawah PNI, Masyumi, dan NU dengan meraih 16,4 persen suara. Kesuksesan PKI di Indonesia tersebut memang tidak dapat dipisahkan dari peran DN Aidit. Pada tahun 1960-an, PKI mengklaim punya anggota lebih dari 3 juta dan membuatnya menjadi partai komunis terbesar ketiga di dunia setelah RRC dan Uni Soviet. Hingga akhirnya meletus peristiwa berdarah dikenal dengan nama Gerakan 30 September (G30S) yang menyebabkan tewasnya sejumlah perwira tinggi Angkatan Darat. Kemudian rezim Orde Baru di bawah pimpinan Jenderal Soeharto menuding PKI sebagai satu-satunya dalang peristiwa naas itu. Pada masa Orba, PKI disematkan di belakang G30S dan menjadi G30S/PKI.  Soeharto kemudian menetapkan PKI sebagai organisasi terlarang.  Meski demikian sejumlah peneliti dan sejarawan menyebut berbagai versi lain terkait peristiwa itu. Ada yang mengungkapkan kejadian itu merupakan konflik internal Angkatan Darat, lalu operasi intelijen asing, keterlibatan Soeharto hingga Sukarno.   Fakta DN Aidit yang dikutip dari buku '100 Tokoh yang Mengubah Indonesia' karya Floriberta Aning S: Banyak yang tidak mengetahui latar belakang DN Aidit. Pria ini dulunya bernama Achmad Nama Dipa Nusantara Aidit dipilihnya karena mengikuti nama idolanya, yaitu Pangeran Diponegoro. Ia mengubah namanya pada tanggal 30 Juli 1932. Karier DN Aidit di PKI mulai tersorot pada akhir 1950-an. Hal itu dikarenakan ia sukses menyingkirkan tokoh-tokoh komunis tua dari partai. Aidit dan kelompoknya juga berhasil mengubah kiblat PKI dari Rusia ke RRC. Aidit membangun PKI dengan militan . Ia menggunakan pendekatan di akar rumput , yaitu dengan membentuk organisasi mantel dan menempatkan kader-kadernya dalam berbagai organisasi profesi, bahkan di tubuh militer.  merupakan sosok yang flamboyan. Hal itulah yang membuatnya sukses mendekati Presiden Sukarno. Aidit juga sempat menjabat sebagai Menteri Koordinator dan Wakil Ketua MPRS. Ia pun pandai melakukan negosiasi dan melobi orang-orang. Hal ini terbukti dari keberhasilannya melobi Sukarno agar mengangkat orang-orang PKI di jajaran pemerintahan. Kampanye Nasakom merupakan bukti keberhasilan DN Aidit dalam bermain di antara kekuatan politik Indonesia. Dengan kampanye Nasakom, Bung Karno memberikan pengakuan bahwa komunis, nasionalis, dan agama berada dalam posisi yang paralel. Sosok DN Aidit merupakan pemberi warna tersendiri bagi dinamika politik Indonesia. Aidit merupakan tokoh komunis militan yang pernah membawa negeri ini berada dalam hari-hari penuh agitasi dan konflik. DN Aidit keluar dari Jakarta menuju Jawa Tengah setelah peristiwa di akhir September 1965. Dalam sebuah operasi miiter pada pertengahan November 1965, ia tertangkap di Surakarta. Kemudian, seharusnya   dibawa ke markas Kodam Diponegoro di Semarang. Namun, baru sampai di Boyolali pemimpin PKI ini dieksekusi mati pada 22 November 1965. Hingga kini jasad atau kuburannya tak pernah ditemukan.","Sosok dan Fakta DN Aidit, Pemimpin PKI yang Jago Lobi",organisasi profesi,https://www.detik.com/edu/detikpedia/d-5745346/sosok-dan-fakta-dn-aidit-pemimpin-pki-yang-jago-lobi?single=1,"Rabu, 29 Sep 2021 17:00 WIB"
"Kementerian Ketenagakerjaan mendorong Ikatan Pengantar Kerja Seluruh Indonesia (IKAPERJASI) agar memperkuat peran dan fungsinya dalam meningkatkan profesionalisme pengantar kerja. Hal itu dikatakan Dirjen Pembinaan Penempatan Tenaga Kerja dan Perluasan Kesempatan Kerja (Binapenta dan PKK) Kemnaker, Suhartono saat membuka Raker IKAPERJASI di Solo, Jawa Tengah. ""Saya mempunyai harapan yang besar terhadap organisasi profesi IKAPERJASI untuk penguatan peran dan fungsinya terhadap peningkatan profesionalisme pengantar kerja dalam memberikan layanan antar kerja,"" ujar Dirjen Binapenta dan PKK, Suhartono dalam keterangan tertulis, Kamis (16/9/2021). Suhartono mengatakan saat ini jumlah Pejabat Fungsional Pengantar Kerja di seluruh Indonesia sebanyak 668 orang. Dengan jumlah tersebut, Pengantar Kerja diharapkan dapat menjadi agent of change yang mampu memberi warna baru dalam budaya organisasi di mana pun berkarya. ""Optimalkan potensi diri Anda agar dapat berkontribusi secara maksimal dalam pembangunan ketenagakerjaan,"" ucapnya. Lebih lanjut ia mengatakan berdasarkan arahan Menteri Ketenagakerjaan, Ida Fauziyah, IKAPERJASI juga diharapkan dapat berperan ganda, yakni sebagai pembela anggotanya serta menjadi mitra pemerintah dalam menyampaikan informasi bidang penempatan tenaga kerja dan perluasan kesempatan kerja kepada stake holder dan masyarakat pada umumnya. Direktur Bina Pengantar Kerja Kemnaker, Indyah Winasih mengatakan, Raker IKAPERJASI diselenggarakan dalam rangka Pembinaan Organisasi Profesi Pengantar Kerja Tahun 2021. ""Rapat kerja ini diharapan dapat memberikan hasil diskusi yang lebih mendalam mengenai bentuk program kerja dan kegiatan yang akan dilaksanakan disesuaikan dengan kebutuhan anggota IKAPERJASI, sehingga akan memberikan manfaat sebanyak-banyaknya bagi anggota nantinya,"" ucap Indyah. Sebagai informasi, Raker IKAPERJASI Tahun 2021 ini dihadiri oleh 50 orang peserta yang terdiri dari Pengurus IKAPERJASI dan Peninjau (Pejabat Fungsionl Pengantar Kerja di lingkungan Kemnaker serta BP2MI). Kegiatan yang diselenggarakan selama tiga hari, yakni Kamis-Sabtu (16-18/9/2021) ini juga mematuhi protokol kesehatan COVID-19 secara ketat.",Asosiasi Pengantar Kerja Diminta Perkuat Peran dan Fungsinya,organisasi profesi,https://news.detik.com/berita/d-5727492/asosiasi-pengantar-kerja-diminta-perkuat-peran-dan-fungsinya?single=1,"Kamis, 16 Sep 2021 23:39 WIB"
"Gubernur Jawa Barat Mochamad Ridwan Kamil menargetkan 4,2 juta warga Kabupaten Bogor divaksin akhir Desember 2021. Target ini merupakan bagian dari kampanye 37 juta warga Jawa Barat divaksin untuk mencapai kekebalan komunal (herd immunity). ""Target dari Kabupaten Bogor juga Jawa Barat adalah bulan Desember. Sebanyak 70% warga Jabar kalau ditotal adalah 37 juta jiwa, terbesar di Indonesia, itu harus selesai. Bogor juga sama 70% nya adalah 4,2 juta ditargetkan juga selesai di bulan Desember,"" ujarnya dikutip dari laman resmi Pemprov, Kamis (16/9/2021). Adapun kecepatan rata-rata harian vaksin di Kabupaten Bogor sekitar 50.000 per hari. Jika langkah ini konsisten dilakukan, maka target 4,2 juta masyarakat divaksin pada akhir tahun bisa tercapai. ""Kecepatan di Kabupaten Bogor sekitar 50.000 per hari. Kalau itu dilakukan per tiga puluh hari kan 1,5 juta, masih ada waktu di bulan Oktober November, Desember kali tiga bulan 4,2 juta itu bisa,"" imbuhnya saat meninjau pelaksanaan vaksinasi massal COVID-19 dengan 10.000 dosis di Jonggol, Kabupaten Bogor.   Dia menyatakan untuk menyukseskan target tersebut semua pihak harus ikut bergerak, karena jika hanya pemerintah saja tidak akan cukup untuk mengejar target tersebut. ""Syaratnya semua bergerak. Siapa itu semua, ada institusi dari pemerintah daerah, puskesmas, rumah sakit. Ada institusi TNI/Polri, dan juga ada pihak ketiga seperti kelompok usaha, partai politik silakan. Organisasi masyarakat kita motivasi, juga organisasi profesi,"" sebutnya. ""Contohan, Grup Ciputra yang berulang tahun ke-40 ternyata mau membantu Pemkab Bogor dan daerah lain di Indonesia untuk mempercepat vaksinasi. Untuk itu, saya ucapkan terimakasih,"" imbuhnya. Lebih lanjut, dia menyatakan setelah vaksinasi rampung masyarakat dapat hidup berdamai dengan COVID-19 dan beberapa aktivitas bisnis dan ruang publik sudah bisa kembali dibuka. Oleh karenanya, dia meminta masyarakat harus tetap disiplin menjalankan protokol kesehatan khususnya menggunakan masker. Penerapan protokol kesehatan ini harus tetap dilakukan sampai Presiden Joko Widodo mengumumkan Indonesia sudah bebas dari Covid-19. ""Mudah-mudahan dengan begitu, setelah vaksin beres kita tinggal hidup berdamai. Segala boleh tapi 5M dan terpenting memakai masker karena itu menjauhkan 80 persen dari kena COVID-19,"" pungkasnya.","RK Targetkan 4,2 Juta Warga Bogor Tuntas Divaksin COVID Desember 2021",organisasi profesi,https://news.detik.com/berita/d-5726569/rk-targetkan-42-juta-warga-bogor-tuntas-divaksin-covid-desember-2021?single=1,"Kamis, 16 Sep 2021 15:06 WIB"
"menerima penghargaan Manggala Karya Kencana (MKK) 2021 dari BKKBN RI. Penghargaan ini merupakan apresiasi atas kepedulian dan dukungan Khofifah pada kemajuan program Keluarga Berencana (KB) dan kesejahteraan keluarga di Jatim. Penghargaan berupa piagam dan lencana ini sesuai dengan Surat Keputusan (SK) Kepala BKKBN RI Nomor 71/KEP/G2/2021 tertanggal 25 Juni 2021. Kepala BKKBN RI Hasto Wardoyo memberikan langsung kepada Khofifah di Gedung BKKBN RI, Jakarta Timur. Penghargaan MKK merupakan penghargaan tertinggi yang diberikan Pemerintah Pusat melalui BKKBN RI, kepada sosok yang dinilai mempunyai dedikasi tinggi terhadap program pengendalian penduduk, Keluarga Berencana (KB) dan Pembangunan Keluarga. Khofifah menyebut penghargaan ini dipersembahkan untuk masyarakat Jatim. Penghargaan ini tak lepas dari peran serta masyarakat dan dukungan Forkopimda Jatim dalam melaksanakan berbagai kegiatan organisasi profesi dan gerakan organisasi wanita. Seperti PKK, Bhayangkari, Persit, Jalasenastri, Muslimat NU, Aisyiyah dan lain sebagainya. ""Alhamdulillah, berbagai langkah upaya konkret dan progresif telah kita lakukan terutama dalam peningkatan kualitas Sumber Daya Manusia (SDM) dan kualitas keluarga di Jawa Timur. Hal ini juga terbukti dengan capaian Indeks Pembangunan Manusia (IPM) di Jawa Timur pada tahun 2020 terus mengalami kemajuan,"" ujar Khofifah di Jakarta, Senin (6/9/2021). Khofifah menyampaikan, pada tahun 2019, IPM Jawa Timur telah mencapai 71,50. Lalu di tahun 2020 meningkat menjadi 71,71. Sedang untuk bayi yang baru lahir memiliki peluang hidup hingga 71,30 persen, meningkat 0,12 persen. ""Ini menunjukkan bahwa capaian pengendalian penduduk di Provinsi Jawa Timur selama ini juga membuah prestasi yang menggembirakan. Laju pertumbuhan penduduk periode tahun 2000 hingga 2010 hanya 0,70 persen, setengah dari laju pertumbuhan penduduk Indonesia sebesar 1,49 persen,"" jelas wanita yang pernah menjabat sebagai Kepala BKKBN dan Menteri Sosial RI. Sebelumnya,   pernah menerbitkan SE (Surat Edaran) Gubernur Jawa Timur Nomor 810 Tahun 2021, pada tanggal 18 Januari 2021 terkait Pencegahan Perkawinan Anak kepada Bupati/Wali Kota se Jawa Timur. Hal ini untuk meningkatkan perlindungan anak, pemenuhan hak anak, mengendalikan kuantitas dan meningkatkan kualitas penduduk. Termasuk juga untuk pendewasaan usia perkawinan, serta untuk meningkatkan kualitas kesehatan anak. Untuk menindaklanjuti SE tersebut, Khofifah mengajak pemangku kepentingan di antaranya DPRD Jatim, Kementerian Agama, Media, Pengadilan Tinggi Agama, PKK, MUI, Lembaga Masyarakat, dan beberapa organisasi lainnya, untuk menandatangani Pakta Integritas serta memberikan award kepada pemerintah daerah, instansi, dan Non-Governmental Organization (NGO) yang telah berkomitmen tinggi pada 7-8 April 2021 lalu. ""Saya ingin menyampaikan soal masih tingginya angka nikah dini di Jatim. Setelah kami mendapatkan mandat sebagai Gubernur Jatim. Di beberapa Kabupaten yang nikah usia dini masih harus didorong untuk diturunkan. Saya diskusi dengan Kepala Pengadilan Tinggi Agama dan Ketua Pengadilan Agama. Beberapa hal penyebab nikah usia dini dijelaskan, termasuk di dalamnya mekanisme dispensasi perkawinan. Di mana 80 persen dispensasi perkawinan dikarenakan kehamilan mendahului. Ini PR sejak dulu saya di BKKBN, dan komitmen saya tidak berkurang melakukan identifikasi dan solusi secara lebih komprehensif termasuk di dalamnya mekanisme dispensasi perkawinan,"" jelas Khofifah. Lalu, untuk meningkatkan keluarga berkualitas dan penduduk tumbuh seimbang, Khofifah juga langsung menerbitkan Surat Keputusan (SK) Gubernur Jawa Timur, Nomor 188/436/KPTS/013/2021 pasca BKKBN mendapatkan mandat untuk menjadi Ketua Penanganan Penurunan Stunting dari Presiden RI Joko Widodo. SK ini diterbitkan dengan membentuk tim Koordinasi Pembinaan dan Pengawasan Kinerja Kabupaten/Kota dalam rangka Percepatan Pencegahan Stunting Terintegrasi Provinsi Jawa Timur tahun 2021-2024. Termasuk di dalamnya juga mendukung upaya penurunan kasus Anemia Remaja Putri (Calon Pengantin) dan Penurunan Angka Kematian Ibu (AKI) dan Angka Kematian Bayi (AKB). ""Kami melakukan pemetaan di 5 kabupaten kota yang AKI/AKB dan stuntingnya masih tinggi di Jatim. Kita mendiskusikan, kami harap untuk stunting ada kesamaan metode menghitung. Jadi mohon nanti, Pak Kepala BKKBN, ada rakor khusus untuk stunting dan aplikasi yang disiapkan untuk Kabupaten/Kota bisa melakukan update secara mandiri untuk angka stuntingnya di masing-masing Kabupaten/Kota. Sehingga peta yang disiapkan selalu update,"" paparnya. Untuk meningkatkan kualitas SDM dan kualitas keluarga, dirinya juga mendorong terbentuknya Kampung KB di Kabupaten/Kota se-Jawa Timur dengan kualitas yang terus meningkat. ""Ini sebagai wahana pemberdayaan masyarakat dan meningkatkan kualitas hidup masyarakat di tingkat kampung, desa atau kelurahan. Selain itu juga sebagai upaya penurunan angka kemiskinan dan membangun kemandirian dan sebagainya,"" lanjut  . Di kesempatan yang sama Kepala BKKBN Hasto Wardoyo mengatakan, raihan penghargaan bagi Jatim berdasarkan pada penilaian juri sekaligus dalam rangka Hari Keluarga Nasional 2021. ""Ibu Gubernur sudah memimpin Jawa Timur dengan sangat baik, karena total fertility rate untuk seluruh Pulau Jawa relatif terjaga dengan baik, sekarang 1,9,"" ujar Hasto. Hasto menambahkan, prestasi Jatim untuk menjaga jumlah penduduk dengan fertility rate yang stabil sangatlah tidak mudah. Utamanya, ada wilayah-wilayah tertentu yang bisa terjaga. Salah satu contohnya ialah Kabupaten Pamekasan, Madura dengan angka fertility rate tidak lebih dari 2,1. ""Oleh karena itu terima kasih sebesarnya kepada Ibu Gubernur yang juga telah memberikan komitmen mengeluarkan Surat Edaran yang diterbitkan untuk pencegahan perkawinan dini, ini sangat penting bagi BKKBN. Karena dengan indikator tertentu bisa menurunkan angka usia perkawinan di kisaran 15-19 tahun,"" jelas Hasto.",Gubernur Khofifah Raih Penghargaan Manggala Karya Kencana 2021,organisasi profesi,https://news.detik.com/berita-jawa-timur/d-5712622/gubernur-khofifah-raih-penghargaan-manggala-karya-kencana-2021?single=1,"Senin, 06 Sep 2021 21:02 WIB"
"Gubernur Jawa Barat (Jabar) Ridwan Kamil menceritakan lika-liku vaksinasi di Jabar. Ia pun memaparkan tantangan yang harus dihadapi Jabar dalam mencapai target kekebalan komunal, mulai dari infrastruktur kesehatan hingga ketersediaan dosis vaksin. Dalam video berdurasi 9 menit, pria yang akrab disapa Kang Emil itu memaparkan dengan konsep mind mapping yang ia tulis sendiri. Awalnya, Kang Emil menceritakan tentang target yang harus dicapai Jabar untuk mendapatkan kekebalan komunal. Dengan penduduk hampir 50 juta orang, minimal 35 juta orang harus tervaksinasi. Sasaran vaksinasi itu diharapkan rampung pada akhir Desember 2021, sesuai dengan arahan Presiden Joko Widodo. ""Kita sudah dikasih 18,6 juta dosis. Sudah disuntikan 14,4 juta. Atau 77,4 persen dari yang dikasih. Dosis pertama 25 persen atau 9,4 juta penduduk. Dosis kedua ada 5 juta,"" ucap Kang Emil dalam video yang disiarkan Humas Jabar, dilihat Rabu (1/9/2021). Ia mengatakan ada percepatan laju vaksinasi di Jabar yang signifikan dalam dua bulan terakhir. Semula Jabar hanya bisa menyuntikan 50 ribu dosis vaksin per hari, kini meningkat menjadi rata-rata 235 ribu dosis pada akhir Agustus 2021. ""Nah Alhamdulillah dua bulan lalu kita masih 50 ribu dosis per hari. Kemarin akhir Agustus kemarin rata-rata 235 ribu per hari. Dan kita testing (coba) tanggal 28 Agustus kita bisa 420 ribu (dalam acara Gebyar Vaksinasi),"" katanya. Berdasarkan perhitungan dari Satgas Penanggulangan COVID-19 Jabar, untuk mencapai target kekebalan komunal dibutuhkan suplai vaksin sebanyak 15 juta dosis vaksin per bulannya. Ia pun telah meminta kepada pemerintah pusat agar proporsional dalam memberikan jatah vaksin. ""Suplai ke kami tidak proporsional. Ada provinsi yang penduduknya sedikit tapi vaksinnya banyak. Ada provinsi besar seperti Jabar vaksinnya sedikit yang ngasihnya. Maka kalau dipresentasekan masih jauh, padahal jumlah vaksinnya saja sedikit. Jadi, kalau Desember mau beres tolong suplai ke jabar tidak kurang 15 juta dosis per bulan,"" katanya. Wilayah Jabar yang luas dengan demografis alam yang beragam pun, ujar Kang Emil menjadi salah satu tantangan untuk menentukan kecepatan vaksinasi. Pasalnya, infrastruktur kesehatan di Jabar juga masih terbatas. ""Teritorial di Jabar itu beragam. Jadi tak bisa dibandingkan dengan yang homogen. Jabar itu ada kota dan kabupaten pedalaman pelosok yang jangkauannya susah secara mobilitas. Infrastruktur juga terbatas dan tidak merata. Jumlah Puskesmas kita hanya 1000-an padahal standar WHO 5000-an,"" katanya. Untuk mengatasi keterbatasan itu, ia pun mengajak semua pihak untuk melakukan bela negara dengan menggelar sentra vaksinasi. Menurut Kang Emil selain Pemda dan TNI-Polri, semua unsur telah menunjukkan bela negara mulai dari ormas, komunitas, organisasi profesi, institusi pendidikan hingga partai politik. ""Ada juga partai politik, saya juga hadir beberapa kali hatur nuhun. Ini agar partai tidak muncul tiap lima tahun sekali, dalam kondisi seperti ini interaksi dengan masyarakat juga dibutuhkan,"" ujar Kang Emil.",Ridwan Kamil Paparkan Lika-Liku Vaksinasi COVID-19 di Jabar,organisasi profesi,https://news.detik.com/berita-jawa-barat/d-5705886/ridwan-kamil-paparkan-lika-liku-vaksinasi-covid-19-di-jabar?single=1,"Rabu, 01 Sep 2021 19:23 WIB"
"Insinyur punya tanggungjawab untuk menyelesaikan masalah-masalah di dunia ini menurut Ketua Umum Persatuan Insinyur Indonesia (PII) Heru Dewanto. Ia menyebut, hal itu adalah kesepakatan dari World Federation of Engineering Organizations (WFEO), yang merupakan organisasi tingkat internasional yang mewadahi insinyur. ""World Federation of Engineering Organizations sepakat, insinyur harus menyelesaikan masalah-masalah dunia, karena untuk menyelamatkan bumi kita adalah teknologi, dan teknologi adalah produk dari insinyur,"" ujar heru Dewanto, Selasa (24/8/2021). Heru Dewanto dalam pemaparannya menjelaskan, bahwa dengan perkembangan teknologi saat ini dan untuk menyongsong Revolusi Industri 5.0, peranan insinyur juga sangat diperlukan. Ketua Umum PII mengatakan bahwa dalam revolusi tersebut, dibutuhkan praktis yang cakap di bidang engineering science, biomedical engineering, nano teknologi serta kecerdasaan buatan. Berdasarkan data dari Bank Dunia, talent gap Indonesia terbesar ada di bidang hospitality and tourism, infrastructure development,sustainable engineering, sustainable management of natural commodities, manufacturing, modern agriculture dan pendidikan. Empat dari delapan tema tersebut,nya berkaitan dengan ke-insinyur-an. Gap atau selisih tersebut menurut mengganggu pertumbuhan Indonesia. ""Jadi wajar kalau ada pertanyaan, apakah ada broken chain. Ada ketidakselarasan antara kompetensi yang diajarkan di kampus, dengan kebutuhan dunia kerja,"" katanya. Di acara yang juga dihadiri oleh Menko Perekonomian Airlangga Hartarto itu, Heru Dewanto mengatakan bahwa perlu ada penyelarasan antara kebutuhan duia kerja dengan kompetensi yang dimiliki seorang insinyur. Selain itu standarisasi juga harus terus dilakukan, agar lulusan fakultas teknik lebih bisa bersaing di dunia kerja. ""Hari ini kita sudah memiliki dua puluh ribu insinyur profesional yang bisa disetarakan dengan insinyur dunia. Setiap tahunnya ada dua ratus ribu lulusan fakultas teknik. Dari dua ratus ribu lulusan sarjana teknik di seluruh Indonesia, baru sekitar dua puluh ribu yang memiliki kompetensi,"" katanya. PII yang keberadaannya diamanatkan di undang-undang dan bukan lagi sekedar organisasi profesi, menurut Heru Dewanto terus berperan aktif dalam mendorong standarisasi lulusan fakultas teknik. Kata dia, saat ini standarisasi nasional dan standarisasi internasional politeknik yang ada di Indonesia, sudah dilakukan oleh badan tetap PII. Wakil Rektor Bidang Pendidikan, Pengajaran dan Kemahasiswaan UGM, Djagal Wiseso Marseno, dalam acara tersebut menyampaikan secara keseluruhan dunia kampus akan berubah. Semua pihak harus bisa mengantisipasi, termasuk UGM dan fakultas teknik UGM. ""Dunia engineering juga. Kita lihat China, sering kita dengar China membangun rumah sakit hanya dalam satu hari, membangun jembatan juga demikian, ini juga harus kita antisipasi,"" terangnya.","Indonesia Disebut Butuh Lebih Banyak Insinyur, Kenapa?",organisasi profesi,https://finance.detik.com/berita-ekonomi-bisnis/d-5695361/indonesia-disebut-butuh-lebih-banyak-insinyur-kenapa?single=1,"Rabu, 25 Agu 2021 07:36 WIB"
