artikel,judul,keyword,link,tanggal
"Sebagai garda terdepan yang menangani Covid-19, tenaga kesehatan (nakes) kerap sulit memperoleh  . Tapi tak sedikit yang menyumbangkan ribuan makanan khusus untuk nakes yang bertugas. Para nakes (tenaga kesehatan) mulai dari dokter hingga perawat kini tengah disibukkan melayani pasien Covid-19 yang membludak di rumah sakit. Saking sibuknya, bahkan untuk makan saja mereka kadang kesulitan mendapatkannya. Padahal para nakes dituntut tetap sehat dan berenergi dalam melayani pasien. Hal inilah yang mengetuk hati banyak orang untuk membantu meringankan beban para nakes dengan cara menyediakan makanan gratis. Tak tanggung-tanggung, ada perorangan atau lembaga yang berbesar hati menyediakan ribuan porsi makanan. Makanan ini kemudian dikirimkan ke rumah sakit tempat para nakes bertugas. Ada pasangan Anang Ashanty yang selama PPKM Darurat menyediakan ratusan porsi makanan, ada juga lembaga kemanusiaan yang menyumbangkan ribuan porsi makanan untuk santapan para nakes. Menu makanannya pun beragam dan dipastikan kelayakannya. Pasangan artis ternama Anang Ashanty memberi sumbangan makanan untuk nakes yang bertugas. Selama PPKM Darurat, pasangan ini menyumbangkan 100 porsi makanan setiap harinya. Hal ini dilakukan hingga tanggal 20 Juli mendatang. Sebelumnya, aksi serupa juga pernah dilakukan saat awal pandemi. Kini melihat lonjakan angka pasien positif Covid-19 yang terus meningkat, orangtua Aurel ini kembali membagikan makanan. Lewat instagramnya, Ashanty berharap aksi ini bisa membantu. Jenis makanan yang dikirimkan pun beragam dan akan dikirim ke rumah sakit dan puskesmas secara bergantian. Lembaga sosial Aksi Cepat Tanggap (ACT) turut membagikan  untuk nakes yang bertugas di rumah sakit. Melalui program Operasi Pangan Gratis, ACT bersama para relawan dan mitra memberikan makanan bergizi untuk nakes di Bandar Lampung. Aksi yang dilakukan pada 12 Juli 2021 ini membagikan 1.000 porsi paket makanan siap santap. Tak hanya untuk nakes, makanan juga dibagikan kepada orang kurang beruntung yang juga terdampak adanya PPKM Darurat yang diterapkan pemerintah. Targetnya adalah lansia di panti jompo, pekerja informal seperti ojek online, tukang becak, dan masyarakat pra sejahtera yang berada di sepanjang jalan protokol Bandar Lampung. Hotel The Alana Hotel and Convention Center Yogyakarta turut terdampak pandemi Covid-19 namun hal itu tak membuat pihak hotel ogah berbuat sosial. Pada 9 Juli 2021, hotel ini menyiapkan kurang lebih 1.200 porsi makanan untuk dibagikan kepada nakes yang bertugas di Yogyakarta. Donasi berupa makanan sehat untuk para nakes itu disalurkan di sejumlah Rumah Sakit (RS) seperti RS PKU Muhammadiyah Bantul, RS DKT Kotabaru, RS Condongcatur, RSUP Prof Dr Sardjito, RS UAD, RS PDHI dan masih banyak lainnya. Makanan dibagikan langsung oleh staf hotel. Pengusaha muda Gilang Widya Pramana membagikan 1.000 paket makanan siap santap dan masker untuk nakes dan satuan tugas (satgas) PPKM Darurat di kawasan Kota Batu, Kota Malang dan Kabupaten Malang. Pasangan Gilang dan Shandy yang dikenal sebagai Crazy Rich Malang ini menyiapkan 1.000 paket makanan dan masker yang kemudian dibagikan pada 9 Juli 2021 lalu. Beberapa titik yang mendapat bantuan ini antara lain Rumah Sakit UMM, Rumah Sakit UNISMA, Rumah Sakit UB Suhat, Rumah Sakit Lavalette dan juga pos jaga PPKM Darurat. Rano Karno juga tak mau ketinggalan berbagi  gratis untuk para nakes. Ia menyiapkan 500 porsi makanan siap santap yang akan dibagikan untuk nakes yang bertugas. ""Hallo gaes, selamat pagi hari ini hari Sabtu tanggal 3 Juli. Kita hari ini kirim lagi untuk para nakes sekitar 500 paket untuk para nakes yang bekerja di medan perang. Semangat, tapi harus tetap jaga kesehatan dan terus senyum supaya imun kita meningkat,"" kata Rano Karno dalam video yang diunggahnya lewat instagram pribadinya @si.rano. Tak hanya sekali, pemeran Si Doel ini sudah beberapa kali mengunggah aksi sosialnya. Rano Karno berharap aksinya ini bisa bermanfaat dan menginspirasi banyak orang agar lebih tergerak membantu sesama.",,bantuan panti,https://food.detik.com/info-kuliner/d-5643950/salut-artis-dan-crazy-rich-ini-sumbang-ribuan-porsi-makanan-untuk-nakes?single=1,"Kamis, 15 Jul 2021 12:30 WIB"
"Selama  , nenek Umi Tamamia, penjual peyek di Jalan Diponegoro Sidoarjo selalu merasa sedih. Nyaris tak ada yang membeli dagangannya. Padahal ia cukup lama seharian berjualan. Dengan segala keterbatasannya, nenek 87 tahun itu tetap berjualan dan percaya rezeki sudah ada yang mengatur. Kesedihan nenek Umi akhirnya terobati saat siang itu sejumlah polisi menghampirinya. Polisi itu mengajak nenek Umi kembali ke rumahnya. Lewat polisi itulah rezeki nenek Umi datang. Ia mendapat bantuan berupa sembako dan uang tunai. Kasat Lantas Polresta Sidoarjo Kompol Wikha Ardilestanto mengatakan pihaknya tergerak setelah mengetahui keluhan nenek Umi tersebut dari ungahan di media sosial. ""Kami menelusuri dan menemukan rumahnya. Kami berikan bantuan berupa sembako dan uang tunai yang berasal dari program Rabu Sedekah untuk membantu masyarakat tidak mampu yang terdampak PPKM darurat,"" ujar Wikha kepada detikcom, Kamis (22/7/2021). Sebelumnya, video  viral setelah diunggah di media sosial oleh salah satu warga. Dalam video tersebut nenek Umi menangis karena peyek daganganya tidak laku dalam beberapa hari terakhir, karena Jalan Diponegoro tempatnya berjualan ditutup. ""Kalau dagangan saya tidak laku, terus saya makan apa,"" kata nenek Umi saat ditemui di rumahnya. Nenek Umi merupakan warga RT 09, RW 02 Kelurahan Lemahputro, Kecamatan Sidoarjo Kota. Nenek Umi bercerita dirinya sempat berontak dan menangis keras saat seorang polwan memegang tangannya. ""Saya mengira saya dicakup (dirazia) dan dibawa ke panti sosial. Ternyata mbak polisi baik hati tersebut mengantarkan saya pulang ke rumah dan memberi batuan,"" terangnya. melanjutkan ceritanya, dirinya sudah tiga tahun terakhir berjualan peyek buatanya di Jalan Diponegoro. Dia berangkat sehabis subuh dan beranjak pulang sekitar pukul 09.00 WIB. Setiap hari, ia membawa 50 bungkus peyek yang dia jual Rp 2 ribu perbungkusnya. ""Meskipun untungnya sedikit tapi tidak apa-apa. Sewu-sewu pokok mambu (seribu-seribu yang penting bisa nabung),"" kata Nenek Umi. Sejatinya, oleh anak-anak-anaknya, nenek Umi disuruh berhenti berjualan. Namun semangatnya jauh melebihi tubuh ringkihnya. Ia tetap tak bisa dihentikan untuk berjualan. Padahal tangannya sudah terlihat bergetar. Untuk berjalan jauh saja, dia mengaku tidak mampu. ""Kalau berdiam diri di rumah, mungkin sudah lama saya mati. Badan ini harus tetap bergerak. Laku atau tidak laku, saya tetap berjualan,"" tandas Umi.",Cerita Nenek 87 Tahun Penjual Peyek yang Kekeh Jualan Saat PPKM Darurat,bantuan panti,https://news.detik.com/berita-jawa-timur/d-5652874/cerita-nenek-87-tahun-penjual-peyek-yang-kekeh-jualan-saat-ppkm-darurat?single=1,"Kamis, 22 Jul 2021 17:17 WIB"
"Tentu semua sepakat bahwa anak memegang peran penting dalam kehidupan hari esok. Oleh karenanya, menyiapkan mereka menjadi generasi hebat menjadi sebuah keniscayaan. Persoalan yang muncul kemudian adalah bagaimana nasib anak di tengah pandemi Covid-19? Sudah lebih dari setahun bangsa Indonesia bergulat dengan Covid-19. Kebijakan sering berganti menjadi penanda bahwa sebenarnya pemerintah masih terus mencari strategi. Kondisi tersebut karena pemerintah sampai saat ini belum berhasil menangani atau mencari cara jitu menyelesaikan Covid-19 dengan baik. Keterbatasan data tentang Covid-19 menambah pelik persoalan pemerintah ini. Di tengah penularan Covid yang masih tinggi, kita tetap perlu memikirkan masa depan anak Indonesia. Anak Indonesia perlu diselamatkan dari bahaya virus corona. Ini kata kunci yang perlu sama antara pemerintah pusat, daerah, sampai rumah tangga warga bangsa. Mengapa anak Indonesia perlu selamat dari bencana ini? Pasalnya, mereka adalah bagian dari kelompok rentan. Mereka sangat rentan terpapar Covid-19. Penanganan mereka pun perlu lebih khusus, di tengah masih banyaknya usia dewasa yang terpapar. Selain itu sebagaimana rekomendasi Komisi Perlindungan Anak Indonesia (KPAI) dalam momen Hari Anak Nasional 23 Juli adalah ""pemilahan data yang lebih rinci terkait jumlah anak-anak yang kehilangan salah satu orang tuanya dan atau jumlah anak-anak yang kehilangan kedua orang tuanya."" Persoalan pengasuhan anak di tengah pandemi Covid-19 dihadapkan pada permasalahan yang kompleks. Salah satunya masih cukup rendahnya pemahaman masyarakat terkait Covid-19. Rendahnya pemahaman masyarakat ini salah satunya digempur oleh informasi yang simpang-siur. Informasi hoaks seakan menjadi bagian kehidupan masyarakat Indonesia. Ironisnya, informasi hoaks itu dianggap benar oleh sebagian masyarakat. Saat orang dewasa minim pengetahuan tentang Covid-19, maka akan berimbas pada kehidupan anak. Anak-anak akan menjadi ""mangsa"" ketidaktahuan orang dewasa. Inilah yang mungkin menjadi salah satu faktor tingginya angka anak terpapar Covid-19 di Indonesia. Anak juga dapat terhambat mendapatkan vaksinasi karena ketidaktahuan dan salah informasi yang diterima orang tua. Ketidaktahuan, untuk tidak menyebut sebagai kebodohan, dapat menghancurkan semua. Literasi Covid-19 tampaknya perlu menjadi agenda kebangsaan. Literasi Covid-19 bisa dimulai dari lingkungan terkecil yaitu media sosial. Media sosial memiliki peran cukup signifikan dalam membentuk pemahaman seseorang tentang Covid-19. Oleh karena itu, media sosial perlu dibanjiri dengan informasi benar dengan meminimalisasi adanya hoaks. Ini tidak mudah, karena membuat konten positif membutuhkan   lebih dibandingkan dengan membuat konten hoaks. Konten hoaks mudah saja dibuat, karena tanpa harus mikir. Sedangkan konten benar/positif membutuhkan pemikiran matang, apakah ini layak atau tidak. Maka dari itu, kita perlu menjadi bagian masyarakat   yang mau memproduksi konten positif. Tanpa hal ini masa depan bangsa dapat tergadaikan. Lebih lanjut, tempat ibadah perlu menjadi ruang publik menciptakan masyarakat sadar Covid-19. Tempat ibadah merupakan sentral kehidupan umat yang perlu mewartakan kebenaran. Jika kini masjid, gereja, pura, wihara, klenteng nonaktif dari aktivitas ibadah, ini adalah wujud dari pendidikan sadar Covid-19. Menutup tempat ibadah untuk sementara waktu menjadi sarana komunikasi aktif rumah ibadah dalam menyelamatkan kehidupan. Peran tokoh agama, dai, mubaligh, ulama, dan pemuka agama lainnya perlu menjadi suluh di tengah jumudnya masyarakat. Mereka perlu terus bersuara, bahwa Covid-19 itu benar adanya. Dai di daerah perlu merujuk pada keputusan-keputusan ormas Islam besar dalam menangani hal ini. Keputusan Muhammadiyah dan NU misalnya, dapat menjadi pedoman dalam mendidik warga bangsa tentang bahaya Covid-19. Melalui berbagai kegiatan itu, anak dapat terselamatkan. Menyelamatkan anak dari hulu ini menjadi agenda kebangsaan saat ini. Ada beberapa kondisi anak terdampak situasi Covid secara langsung, yaitu anak yang salah satu orangtuanya meninggal karena Covid, anak yang kehilangan kedua orangtuanya karena Covid, anak yang harus menjalani isolasi mandiri bersama keluarga, dan anak yang menjalani isolasi sendiri, serta anak yang sementara di rumah sendiri karena salah satu orangtua mengurus orangtua lain yang terpapar Covid. Saat anak kehilangan kedua orangtuanya, maka persoalan perencanaan pengasuhan harus dituntaskan. Bagaimana mengasuh mereka, siapa yang akan mengasuh mereka? Pemerintah harus memastikan kesejahteraan anak tersebut. Pemerintah memastikan bahwa anak sebaiknya tetap diasuh oleh keluarga hingga derajat ketiga. Mengirim anak yatim ke lembaga kesejahteraan anak (panti asuhan) adalah alternatif terakhir. Anak merasakan situasi yang sangat berat kehilangan orangtua, jangan sampai kondisi psikologis anak memburuk karena harus dipisahkan dari lingkungannya. Pemerintah harus memberikan dukungan kepada anak melalui keluarga pengasuh dengan bantuan sosial Program Keluarga Harapan, kepastian pembiayaan sekolah anak, hingga pendampingan psikologis. Masyarakat juga harus membantu agar anak dapat menjalani tumbuh kembangnya dengan baik. Pemerintah juga harus mengalokasikan ruang isolasi mandiri anak tanpa orangtua yang disesuaikan dengan kebutuhan usia tumbuh kembang anak. Selain itu, bantuan dan pendampingan pemerintah untuk anak yang harus berada di rumah sendiri juga menjadi hal yang penting. Masyarakat pun dapat berperan lebih mengulurkan tangan kepada anak-anak tersebut sebagai pengejawantahan rasa kemanusiaan. Meskipun seringkali muncul dalam benak masyarakat bahwa anak dapat menularkan Covid, hal ini harus disikapi dengan protokol kesehatan. Pemerintah pun perlu memberikan amunisi yang memadai bagi tenaga kesehatan, pekerja sosial, serta lembaga yang mendampingi anak-anak tersebut agar mereka juga nyaman mendampingi anak-anak. Pada akhirnya, pandemi tidak boleh menambah luka dan kesedihan bagi anak Indonesia. Senyum anak Indonesia perlu terus tersungging dalam keceriaan wajah mereka. Nyanyian kegembiraan anak pun perlu terus didendangkan di tengah kondisi yang semakin tidak menentu.",Menyalamatkan Anak dari Dampak Pandemi,bantuan panti,https://news.detik.com/kolom/d-5653791/menyalamatkan-anak-dari-dampak-pandemi?single=1,"Jumat, 23 Jul 2021 13:02 WIB"
"Wakil Ketua MPR RI Hidayat Nur Wahid (HNW) membagikan daging kurban, pada Hari Raya Idul Adha 1442 H. Daging kurban dibagikannya kepada sejumlah warga, termasuk mereka yang tengah isolasi mandiri (isoman). Penyerahan daging kurban, itu dilakukan sebagai bagian dari program tebar 1 juta paket kurban yang dicanangkan oleh Ketua Majelis Syuro PKS Dr. Salim Segaf Al Jufri, untuk membantu dan meringankan beban warga yang terdampak pandemi COVID-19. ""Saya mendukung program yang diinisiasi oleh Dr. Salim dengan hadirkan kepedulian nyata terhadap warga terdampak COVID-19, khususnya di daerah pemilihan (dapil) Jakarta II meliputi Jakarta Selatan dan Jakarta Pusat,"" kata Hidayat, Rabu (21/7/2021). Hidayat menerangkan hewan kurban disalurkan bekerja sama dengan kader dan relawan PKS serta tokoh Masyarakat. Pembagian daging 22 ekor sapi dan 11 ekor kambing dilakukan di berbagai kecamatan, masjid dan musala di Jakarta Selatan dan Jakarta Pusat. ""Semoga spirit peduli dan daging kurban yang disalurkan, membantu warga terdampak COVID-19, dan bermanfaat bagi masyarakat untuk menyemangati mereka yang susah akibat pandemi. Serta agar semangat saling membantu dan gotong royong selalu bisa dihadirkan lagi,"" ulas Hidayat. Selain dibagikan kepada warga yang tengah isoman, Hidayat memberikan daging kurban ke fakir miskin, guru ngaji, panti asuhan hingga anak-anak yatim. Hidayat pun mendorong umat Islam agar menjadikan momentum Idul Adha ini sebagai momen menguatkan solidaritas, persatuan, dan toleransi. ""Semua warga, apalagi yang terdampak COVID-19, tanpa membedakan SARA dan afiliasi politik, harus merasakan manfaat dan berkah dari ibadah sosial kurban ini,"" tutur Hidayat. Warga menyambut positif program Tebar Sejuta Paket Kurban yang didukung oleh HNW. Iis, warga Jagakarsa Jakarta Selatan berterima kasih dengan gerakan tebar 1 juta paket kurban ini. Ia mendoakan agar tebar sejuta paket kurban itu membuat Indonesia memperoleh keberkahan di masa sulit pandemi COVID-19. ""Insya Allah berkah, apalagi di tahun ini (sedang pandemi COVID-19), terima kasih kepada Pak Hidayat dan terima kasih kepada PKS yang telah menyelenggarakan kegiatan yang bermanfaat ini,"" ungkap Iis. Selain pendistribusian hewan kurban, Hidayat juga menyalurkan bantuan kepada masyarakat terdampak pandemi COVID-19. Bantuan yang disalurkan terdiri dari makanan, sembako, masker, APD, obat-obatan dan vitamin. Ia juga memberikan uang tunai bagi warga yang sedang isoman. Bantuan lainnya berupa penyediaan ambulans, advokasi akses rumah sakit, hingga dukungan percepatan vaksinasi di sejumlah daerah di Jakarta Pusat dan Selatan. ""Itu semua wujud kecintaan kepada warga dan kepada Indonesia. Membantu Pemerintah dan sesama agar lekas sehat dan selamat dari virus Korona varian delta dengan segala kejahatannya,"" cetus Hidayat.",HNW Bagi Ribuan Paket Kurban ke Pasien Isoman hingga Anak Yatim,bantuan panti,https://news.detik.com/berita/d-5651094/hnw-bagi-ribuan-paket-kurban-ke-pasien-isoman-hingga-anak-yatim?single=1,"Rabu, 21 Jul 2021 14:15 WIB"
"Telkomsel melalui program Corporate Social Responsibility (CSR) yang mengusung semangat #BukaPintuKebaikan menyalurkan bantuan 906 ekor hewan kurban kepada sekitar 56.200 penerima manfaat di sekitar 800 lokasi hingga pelosok negeri. Penyerahan hewan kurban yang terdiri dari 129 ekor sapi dan 777 ekor kambing tersebut dilakukan secara simbolis oleh Telkomsel pada Senin (19/7). ""Idul Adha selalu menjadi momen yang tepat bagi Telkomsel untuk dapat kembali berkontribusi dalam memberikan manfaat bagi masyarakat Indonesia melalui penyaluran bantuan hewan kurban. Upaya ini merupakan wujud nyata dari komitmen Telkomsel yang ingin terus membuka pintu kebaikan dengan berbagi dan memberikan dukungan bagi setiap lapisan masyarakat di segala kondisi, termasuk di masa pandemi yang penuh tantangan saat ini,"" ujar Direktur Utama Telkomsel, Hendri Mulya Syam dalam keterangan tertulis, Rabu (21/7/2021). ""Pada momen Idul Adha tahun ini, Telkomsel juga mengusung semangat gotong royong dengan menjalin kolaborasi bersama mitra-mitra strategis dalam menyediakan sekaligus mendistribusikan hewan kurban agar dapat membantu menjangkau lebih banyak penerima manfaat secara menyeluruh,"" tambahnya. Dalam kegiatan ini, Telkomsel berkolaborasi dengan para mitra strategis yang berasal dari ekosistem bisnis perusahaan. Para mitra tersebut di antaranya komunitas kerohanian Islam Majelis Telkomsel Taqwa (MTT), lembaga sosial terpercaya, yayasan, serta platform crowdfunding seperti KitaBisa.com. Telkomsel juga menggandeng startup digital Ternaknesia yang merupakan salah satu peserta program NextDEV Telkomsel sebagai penghubung UMKM peternak lokal. Adapun aksi kolaboratif tersebut bertujuan untuk memperluas cakupan penyaluran hewan kurban secara konvensional maupun digital. Aksi ini juga dilakukan sebagai bagian dari upaya Telkomsel dalam membantu memperkuat ekonomi digital masyarakat secara inklusif melalui pemberdayaan UMKM peternak lokal. Lebih lanjut Hendri menambahkan sejumlah bantuan hewan kurban juga berasal dari sumbangan karyawan Telkomsel. Keseluruhan bantuan hewan kurban ditargetkan dapat didistribusikan ke sejumlah masjid, rumah sakit, pesantren, lembaga sosial, panti asuhan, yayasan, hingga pemukiman masyarakat di sekitar wilayah kantor dan infrastruktur operasional Telkomsel di berbagai pelosok negeri. Di tengah kondisi saat ini, Hendri menyebut sangat penting bagi masyarakat Indonesia dan para pemangku kepentingan agar dapat saling bahu-membahu dan berbagi dalam menebarkan manfaat. Untuk itu, melalui kegiatan ini, Telkomsel senantiasa mengaktualisasikan dan selalu berusaha membuka berbagai kesempatan untuk saling berbagi, serta menebarkan manfaat bagi setiap lapisan masyarakat di segala fase kehidupan. ""Kami berharap, bantuan yang diberikan ini dapat membawa keberkahan dan manfaat bagi masyarakat Indonesia yang memaknai Hari Raya Idul Adha dengan rasa syukur meski kita masih berada di tengah kondisi pandemi seperti sekarang ini. Melalui dukungan sosial ini, Telkomsel berharap dapat memberikan inspirasi dan memicu semangat bagi para penerima manfaat agar dapat bersama-sama bertahan dan berbagi untuk sesama. Bantuan ini pun diharapkan dapat meringankan tantangan ekonomi sosial yang dialami masyarakat di masa pandemi yang masih berlangsung saat ini,"" katanya. ""Ke depan, Telkomsel akan terus berkomitmen memperkuat upaya kolaboratif dengan para pemangku kepentingan untuk terus bergerak maju, menghadirkan semangat dalam memaksimalkan pemanfaatan teknologi sebagai salah satu upaya mendorong pertumbuhan ekonomi berbasis digital dengan semangat gotong royong,"" tutup Hendri.",Telkomsel Salurkan 906 Hewan Kurban ke 56.200 Orang di 800 Lokasi,bantuan panti,https://news.detik.com/berita/d-5650705/telkomsel-salurkan-906-hewan-kurban-ke-56200-orang-di-800-lokasi?single=1,"Rabu, 21 Jul 2021 09:19 WIB"
