artikel,judul,keyword,link,tanggal
"menerima aliran dana dari  yang mereka sebarkan di sejumlah daerah. Salah satu ciri-ciri kotak amal yang disebarkan jaringan tersebut tidak terdapat nomor registrasi di badan kotak amal. ""Kemudian untuk tanda-tanda daripada infak contohnya seperti ini, ini ada tulisannya. Misalnya kotak infak panti asuhan saja, nggak ada nomor registrasi, nggak ada nomor izin juga tidak ada,"" kata Kadiv Humas Polri Irjen Argo Yuwono dalam konferensi pers di Bareskrim Polri, Jakarta Selatan, Jumat (20/8/2021). Argo mengatakan kotak amal tersebut disebar ke sejumlah daerah, di antaranya di Bojonegoro, Parung, dan sekitarnya. Setelah melakukan penangkapan terhadap sejumlah teroris, kini polisi lebih bisa mengetahui ciri-ciri kotak amal yang digunakan teroris jaringan JI. ""Setelah kita lakukan penangkapan, kita baru tahu mereka pakai nama yayasan apa. Jadi kita baru tahu di situ setelah lakukan penangkapan. Jadi kalau kita belum lakukan penangkapan, nggak tahu ini siapa dan informasi lainnya,"" ujar Argo. ""Semuanya kita baru dapat informasi setelah dilakukan penangkapan, nanti kita tanya yang bersangkutan itu  kotak infak atas nama siapa, panti asuhan apa, itu baru kita ketahui. Termasuk lokasinya pun kita baru tahu,"" sambung Argo. Diketahui, Densus 88 telah menangkap 50 orang terduga teroris jaringan JI selama periode Agustus 2021. Kabag Bantuan Operasi Densus 88 Kombes Aswin Siregar mengatakan mereka menyebarkan ribuan kotak amal di lokasi yang berbeda-beda. ""Ada ribuan lokasi, jadi di satu kota atau provinsi bisa seribu atau 2.000 kotak. Jadi tempatnya tersebar di mana-mana di masyarakat,"" kata Kabag Bantuan Operasi Densus 88 Kombes Aswin Siregar dalam konferensi pers di Bareskrim Polri, Jakarta Selatan, Jumat (20/8/2021). Mereka menyasar ke lokasi-lokasi tempat masyarakat sering berkumpul. Seperti di warung, supermarket, bahkan tempat ibadah pun jadi sasaran mereka menaruh kotak amal.",Ini Penampakan Kotak Amal yang Disebar Teroris Jaringan JI,bantuan panti,https://news.detik.com/berita/d-5690156/ini-penampakan-kotak-amal-yang-disebar-teroris-jaringan-ji?single=1,"Jumat, 20 Agu 2021 19:57 WIB"
"Berbagai peristiwa terjadi di Jawa Barat dalam sepekan. Mulai dari kasus pemukulan Ryan Jombang oleh Habib Bahar bin Smith hingga pembunuhan sadis di Kabupaten Subang. Berikut rangkuman Jabar sepekan : Very Idham Henyansyah alias Ryan Jombang menjadi sorotan. Terpidana mati kasus mutilasi ini dibogem habib Bahar bin Smith gegara masalah uang. Kasman Sangaji, kuasa hukum Ryan Jombang menjelaskan dugaan penganiayaan yang menimpa kliennya itu dipicu masalah uang. Bahar disebut kerap meminjam uang kepada Ryan Jombang hingga totalnya mencapai Rp 10 juta. ""Kalau permasalahan awalnya itu sebenarnya masalah sepele, jadi habib Bahar ini beberapa bulan lalu sering meminjam uang ke Ryan,"" ujar Kasman. Selain dipukul, kata Kasman, lengan kliennya juga disayat Bahar. Sayatan itu mematri tulisan 'Pengkhianat'. Buntut dari aksi tersebut, Ryan berencana melaporkan Bahar ke polisi. Bahkan kuasa hukum Ryan sudah berkoordinasi ke Bareskrim Polri. Namun belakangan kuasa hukum menunda terlebih dahulu. Kasman mengatakan pihaknya akan berbicara terlebih dahulu dengan Ryan lantaran sudah adanya perdamaian secara internal di Lapas Gunung Sindur. Soal perdamaian ini pun dibenarkan oleh Kalapas Gunung Sindur Mujiarto. Dia mengatakan kasus tersebut sudah selesai dan sudah saling memaafkan. ""Yang jelas perselisihan sudah selesai dan mereka pun kembali mengikuti aturan-aturan dan program pembinaan yang diberikan pihak lapas,"" kata dia. Belakangan juga beredar surat yang diduga kuat ditandatangani Ryan yang membantah bahwa persoalan dirinya dengan Bahar karena piutang Rp 10 juta. Warga Kabupaten Subang digegerkan dengan temuan mayat penuh darah di bagasi mobil Alphard. Diketahui, dua mayat itu merupakan mayat ibu dan anak yang dibunuh secara sadis. Kedua korban yakni Tuti (55) dan Amelia Mustika Ratu (23). Keduanya ditemukan tewas bersimbah darah di mobil yang terparkir di halaman rumah di Dusun Ciasuti, Desa Jalancagak, Kecamatan Jalancagak, Kabupaten Subang pada Rabu (18/8). Kepala Desa Jalan Cagak Indra Jenal mengatakan mayat ibu-anak itu ditemukan suami korban, Yosep (55) pukul 07.30 WIB. ""Kondisinya banyak darah di dalam bagasi belakang mobil,"" kata Jenal. Menurut Jenal, suami sekaligus ayah korban yang memberi tahu kepadanya soal dua mayat dalam bagasi mobil itu. Polisi sudah datang ke tempat kejadian perkara (TKP) yang tak lain rumah korban. Mobil itu pun milik korban. ""Suaminya itu yang menemukan kedua korban di rumahnya (mobil parkir di halaman),"" ucap Jenal. Autopsi jenazah ibu dan anak yang mayatnya ditemukan dalam bagasi mobil sudah dilakukan. Hasil sementara, kedua korban mengalami patah tulang tengkorak kepala hingga luka robek. Hasil sementara, kedua korban mengalami patah tulang tengkorak kepala dan memar, itu diperkirakan akibat benda tumpul, ada luka robek di bagian bibir ibunya, sementara untuk hasil lab kita tunggu dua tiga hari ke depan,"" ujar Kapolsek, Kamis (19/08/2021). Hasil autopsi juga mengungkap perbedaan waktu pembunuhan. Ada perbedaan waktu hingga lima jam antara pembunuhan Tuti dan anaknya. ""Kemudian dari kaku mayat diperkirakan korban pertama ibu itu meninggalnya 5 jam sebelum ditemukan itu, ya dini hari lah ya, kemudian yang anak 23 tahun remaja itu dperkirakan kematiannya jam 4-5 subuh, karena kaku mayatnya beda,"" tuturnya. Sejauh ini pelaku masih misterius. Namun polisi menduga pelaku dan korban saling mengenal. ""Untuk motifnya belum ketahuan jelas, yang pasti korban kenal dengan pelaku,"" ujar Kasat Reskrim Polres Subang AKP M Zulkarnaen saat dikonfirmasi, Kamis (19/8/2021). Analisa korban dan pelaku saling kenal itu berdasarkan hasil olah TKP yang dilakukan oleh penyidik Polres Subang. Menurut Zulkarnaen, tak ada kerusakan di TKP. ""Penyerangannya tidak menimbulkan kerusakan. Posisinya sempat berantem juga kalau dilihat dari TKP,"" kata dia. Kantor LSM kemanusiaan Syam Organizer di Soreang, Kabupaten Bandung, Jawa Barat, digeledah Tim Detasemen 88 Antiteror terkait terorisme. Dalam penggeledahan itu, petugas menyita 1.540 celengan kotak amal yang diduga digunakan untuk pendanaan terorisme. ""Jadi, penggeledahannya itu kemarin. Hari Minggu di kantor Sekretariat Yayasan Syam Organizer Jawa Barat, alamatnya di Soreang, Bandung,"" ujar Kabag Penum Divisi Humas Polri Kombes Ahmad Ramadhan kepada wartawan, Senin (16/8/2021). ""Yang diamankan itu banyak, 1.540. Ada 1.540 celengan,"" sambungnya. Ramadhan menyebut celengan kotak amal yang disita dari kantor Syam Organizer itu diduga digunakan untuk mendanai aksi teror. Adapun Densus hanya mengamankan celengan kotak amal itu di kantor Syam Organizer, bukan di tempat umum ataupun masjid. ""Ini yang sekarang diamankan itu di kantor sekretariat itu. Jadi bukan kami ambil di tempat-tempat masjid, tapi di kantor,"" ucap Ramadhan. Ruko ditempati Syam Organizer Jabar ini berada di sisi Jalan Gading Tutuka, Desa Cincin, Kecamatan Soreang, Kabupaten Bandung. Pantauan detikcom, Senin (16/8/2021) siang, ruko dengan cat abu dan merah itu sudah ditutup menggunakan garis polisi. Dari luar tidak terlihat ada logo atau spanduk yang menjelaskan nama dari ruko tersebut. Namun, detikcom melihat ada tulisan 'Syam Organizer' pada sebuah tiang parkir di depan ruko. Pagar dari ruko tersebut tertutup rapat. Sebuah rantai melintang dengan gembok menutup jalan menuju ruko. Ruko tersebut pun menjadi perhatian sejumlah warga yang melintas. Salah satu warga menuturkan, ruko tersebut sudah lama tidak ada aktivitas. Pintu ruko selalu tertutup. ""Sudah lama nggak buka itu ruko pak. Jarang juga lihat keluar masuk orang,"" ujar Yulia (41), warga yang bekerja di samping ruko tersebut. Dari keterangan pengurus RW setempat, kantor tersebut milik seorang pria asal Ciamis. Tahun lalu atau 2020, ruko tersebut dikontrakkan kepada pengelola Yayasan Syam Organizer Jabar. Sekadar informasi, dalam profil yang ditampilkan Google Maps, kantor ini bernama Syam Organizer Jabar. ""Awalnya pemilik ruko baru membangun sekitar 70 persen. Terus lapor ke saya, kalau ruko itu mau dikontrakkan,"" ujar Ketua RW 19, Aan Tadjudin, kepadadetikcomdi lokasi penggeledahan, Senin (16/8/2021). Penelusuran detikcom dari laman syamorganizer.org, lembaga ini berdiri pada tahun 2013. Awalnya, lembaga yang telah memiliki 21 cabang di berbagai kota di Indonesia ini, merupakan penata acara untuk kegiatan road show tablig akbar yang mengabarkan bahwa Umat Islam sedang terzalimi di seluruh belahan dunia. ""Kemudian berkembang menjadi satu lembaga kemanusiaan internasional yang fokus membantu korban bencana kemanusiaan di Negeri Syam,"" tulisan dalam profil laman syamorganizer.org sebagaimana dilihat detikcom dari, Senin (16/8/2021). Di dalam profil Syam Organizer itu tertulis juga Akta Notaris Yayasan Amal Syam Abadi, berikut akta dari Menkumham dan Nomor Pokok Wajib Pajak (NPWP). Salah satu hal yang menyita perhatian dalam laman ini, adalah ditampilkannya wajah sejumlah ustaz kondang dalam video di halaman depan laman tersebut. Sementara itu, penggalangan dana dengan jangka waktu tertentu pun dilakukan oleh lembaga ini mulai dari gotong royong bedah rumah, wakaf renovasi musala, pembagian makanan siap saji untuk panti, santri dan duafa, proyek pabrik roti Syam Organizer, bantuan musim dingin untuk warga Palestina dan yang lainnya. Baik di dalam maupun di luar negeri. Bencana gempa bumi megathrust kembali menghantui. Kepala Laboratorium Geodesi Institut Teknologi Bandung (ITB) Heri Andreas mewanti-wanti terkait potensi bencana gempa bumi megathrust selatan Jawa. Menurut Heri, gempa tersebut memiliki kekuatan yang sangat besar dan saat ini tengah berada di ujung siklus perulangan (earthquake cycle). Menurut Heri, berdasarkan data Global Navigation Satellite System (GNSS) mengkonfirmasi adanya akumulasi energi di bagian megathrust Selat Sunda hingga Pelabuhan Ratu dan selatan Parangtritis hingga selatan Pantai Jawa Timur. Dari hasil pemodelan, jika gempa terjadi kekuatannya dapat mencapai magnitudo (M) 8,7 hingga 9,0, bisa jadi diikuti tsunami hingga 20 meter tingginya. Gelombang tsunami bisa sampai di pesisir Jakarta dengan ketinggian 1 meter hingga 1,5 meter. Dibandingkan dengan tsunami yang terjadi di bagian selatan ketinggian tersebut relatif lebih kecil. ""Namun demikian fakta saat ini pesisir Jakarta wilayahnya sudah ada di bawah laut hingga minus 1-2 meter, ini artinya potensi tsunami akan lebih besar. Berdasarkan hasil simulasi model, run-up tsunami dapat mencapai sebagian besar Pluit, Ancol, Gunung Sahari, Kota Tua hingga Gajah Mada. Kalau kita perhatikan modelnya ternyata nyaris menyentuh Istana,"" ujar Heri dalam keterangan yang diterima detikcom, Senin (16/8/2021). Karena itu, ujar Heri, dari pemodelan tersebut menyiratkan bahwa tanggul pantai atau laut di Jakarta akan berperang sangat penting, tidak hanya mencegah banjir rob, tetapi juta melindungi Jakarta dari tsunami. ""Untuk itu kita harus mendukung pemerintah dalam mempercepat upaya pembangunan tanggul sepanjang pesisir Jakarta. Fakta ini mau tidak mau harus diungkap, meskipun terkesan menakut-nakuti,"" ujar Heri yang juga Ketua Lembaga Riset Kebencanaan IA-ITB. ""Mari kita sikapi dengan bijak dan waspada. Gempa bumi dan tsunami merupakan bencana alam yang hampir tidak mungkin kita cegah, kecuali dengan doa. Apa yang bisa kita perbuat adalah bagaimana kita bersiap menghadapinya,"" tutur Heri menambahkan. Menurutnya, tanggul pantai atau laut adalah salah satu bentuk kesiapsiagaan dalam menghadapi bencana seperti di Jakarta. ""Untuk itu sekali lagi, kita harus mendukung pemerintah dalam mempercepat proses pembangunan tanggul di pesisir Jakarta. Takutnya tsunami-nya keburu datang, karena saat ini tengah di ujung perulangan,"" ucap Heri mengingatkan. Raden Rahardjo, pria keturunan Sultan Sepuh XI Radja Jamaludin Aluda Tajul Arifin yang sempat membetot perhatian publik dengan menggembok Keraton Kasepuhan Cirebon pada 2020 silam, kini dilantik sebagai Sultan Sepuh Aloeda II. Pelantikan atau jumenengan Rahardjo sebagai sultan digelar tertutup. Rahardjo dinobatkan sebagai Sultan Sepuh Aloeda II oleh keluarga besarnya. Penobatan Rahardjo sebagai Sultan Sepuh Aloeda II digelar sehari setelah peringatan Hari Kemerdekaan, 18 Agustus kemarin. Penobatan Rahardjo sebagai sultan ini menjadi bukti bahwa polemik yang terjadi atau perebutan takhta di Keraton Kasepuhan Cirebon masih terjadi. Sebab, saat ini Pangeran Raja Adipati (PRA) Luqman Zulkaedin pada tahun lalu telah dinobatkan sebagai Sultan Sepuh XV Keraton Kasepuhan Cirebon. Prosesi jumenangan Luqman itu digelar pada 30 Agustus 2020, sebulan setelah ayahnya yakni Sultan Sepuh XIV PRA Arief Natadiningrat mangkat. Penobatan Rahardjo sebagai Sultan Sepuh Aloeda II itu merupakan sikap dari klan atau keluarga besar Sultan Sepuh XI menolak kekuasaan PRA Luqman Zulkaedin, yang merupakan klan dari Sultan Sepuh XIII Maulana Pakuningrat. Rahardjo pun menjelaskan tentang proses jemunengan dirinya sebagai Sultan Sepuh Aloeda II yang dilakukan secara tertutup. ""Karena untuk menjaga kesakralan penobatan ini. Beliau (Sultan Sepuh XI) setelah menikahi nenek saya, Nyi Mas Rukjah mengganti gelar di belakangnya dari Natadiningrat menjadi Aluda,"" kata Rahardjo kepada awak media di kompleka Keraton Kasepuhan Cirebon, Kamis (19/8/2021). Rahardjo menjelaskan PRA Luqman Zulkaedin bukanlah keturunan Sultan Sepuh XI. Sehingga, penobatan Luqman sebagai sultan tidak sah. ""Kalau kita merunut kembali dari kakek moyangnya Luqman, yaitu Alexander Raja Rajaningrat, beliau tidak memiliki hubungan darah dengan Sultan Sepuh XI,"" kata Rahardjo. Rahardjo mengaku keputusannya untuk menobatkan diri sebagai sultan berpegang pada putusan Mahkamah Agung (MA) yang menolak forum previlegiatum Alexander, yang mengaku sebagai Sultan Sepuh XII. Putusan tersebut berawal saat enam keturunan Sultan Sepuh XI mengajukan gugatan ke pengadilan terkait penolakan Alexander. Dalam perjalanannya, pengadilan negeri memutuskan menolak forum previlegoatum atau jabatan sultan Alexander. Hal itu dibuktikan dengan putusan pengadilan bernomor 82/1958/Pn.Tjn juncto nomor 279/1963 PT.Pdt juncto nomor K/Sip/1964. Salah satu ahli waris dari enam nama yang mengajukan gugatan itu adalah Raden Rahardjo, yang kini menobatkan diri sebagai Sultan Aloeda II. ""Keputusan MA mengenyampingkan atau menolak forum previlegiatum Alexander. Artinya pada saat itu, NKRI tahun 1958 tidak pernah mengakui Alexander sebagai sultan,"" kata Rahardjo. Rahardjo mengaku telah menyiapkan langkah-langkahnya untuk memuluskan proses pelantikannya sebagai sultan. Ia pun mulai kasak-kusuk menjalin komunikasi dengan instansi lain. ""Kita akan kirim surat ke instansi-instansi. Kemudian kita juga akan membentuk perangkat baru untuk membantu melaksanakan tugas sultan,"" kata Rahardjo. Sementara itu, Sultan Sepuh XV Keraton Kasepuhan Cirebon PRA Luqman Zulkaedin belum memberikan keterangan resmi terkait penobatan Raden Rahardjo sebagai sebagai Sultan Aloeda II. Jurnalis detikcom berusaha menghubungi Luqman, namun belum mendapatkan jawaban. Sekadar diketahui, polemik perubatan takhta di Keraton Kasepuhan Cirebon ini bermula saat Rahardjo menggembok pintu Bangsal Dalem Arum dan menurunkan foto mendiang Sultan Sepuh XIV PRA Arief Natadiningrat pada akhir Juni 2020. Saat itu Arief tengah menjalani perawatan intensif di salah satu RS di Bandung. Sebulan setelah kejadian itu, Arief meninggal dunia. Anak dari Arief, PRA Luqman Zulkaedin melanjutkan tahta ayahnya. Luqman dinobatkan sebagai Sultan Sepuh XV pada akhir Agustus 2020. Sementara itu, Rahadjo Djali yang merupakan cucu dari istri kedua Sultan Sepuh XI Jamaludin Aluda Tajul Arifin dikukuhkan sebagai polmak atau pejabat sementara (Pjs) Sultan Keraton Kasepuhan Cirebon pada awal Agustus 2020. Pengukuhan Rahardjo sebagai polmak dilakukan di Masjid Agung Sang Cipta Rasa, Kota Cirebon, Jawa Barat.",Jabar Sepekan: Habib Bahar Bogem Ryan Jombang-Syam Organizer Digeledah,bantuan panti,https://news.detik.com/berita-jawa-barat/d-5691271/jabar-sepekan-habib-bahar-bogem-ryan-jombang-syam-organizer-digeledah?single=1,"Sabtu, 21 Agu 2021 22:23 WIB"
"PT Hutama Karya (Persero) (HK) menggelar beberapa program tanggung jawab sosial dan lingkungan (TJSL) dalam peringatan HUT RI Ke-7. Hutama Karya membagikan ribuan paket sembako dan memasang perpustakaan digital (Edubp) untuk beberapa sekolah di wilayah Sumatera. Paket sembako 'Merdeka' diberikan secara simbolis oleh perwakilan Tim TJSL Hutama Karya kepada Ketua DPC Legiun Veteran Republik Indonesia (LVRI) Jakarta Selatan Letkol. Purn. Suparyono pada Rabu (18/8/2021 di kantor LVRI Duren Sawit, Jakarta Timur. Adapun pembagian sembako sejatinya sudah dimulai sejak Minggu (15/8) lalu. Selain itu, cucu perusahaan Hutama Karya yakni PT Bhirawa Steel juga membagikan 2.500 paket kepada masyarakat terdampak Pandemi COVID-19 di Surabaya, Jawa Timur. Ribuan paket sembako tersebut diserahkan secara simbolis pada Senin (16/8) lalu. Executive Vice President (EVP) Sekretaris Perusahaan Hutama Karya Tjahjo Purnomo mengatakan pembagian 100 paket sembako merdeka ini merupakan dukungan perusahaan bagi para veteran beserta keluarga yang dahulu berjuang untuk meraih kemerdekaan RI, khususnya di tengah masa Pandemi COVID-19. ""Paket sembako yang kami bagikan terdiri dari beras, minyak, gula, teh, madu, susu, biskuit dan multivitamin untuk memenuhi kebutuhan pokok para veteran RI. Paket tersebut akan didistribusikan kepada para veteran yang tersebar di wilayah DKI Jakarta, Bogor dan Bekasi. Selain itu, lewat cucu perusahaan kami, Bhirawa Steel, ribuan paket sembako dibagikan ke 20 kelurahan dan panti sosial di wilayah Surabaya dan Sekitarnya. Semoga paket sembako ini dapat bermanfaat dalam memenuhi kebutuhan pokok yang dibutuhkan bagi para veteran maupun masyarakat,"" ujar Tjahjo dalam keterangan tertulis, Rabu (18/8/2021). Selain pembagian paket sembako untuk veteran, Hutama Karya juga berkolaborasi dengan perusahaan BUMN lainnya untuk memasang Perpustakaan Digital (EduBP) di beberapa wilayah Sumatera, antara lain Lampung, Bengkulu dan Riau. Serah terima bantuan pemasangan perpustakaan digital (edubp) secara simbolis dilakukan pada Senin (16/8) di SMAN 1 Terbanggi Besar, Lampung oleh Vice President CSR/PKBL Hutama Karya Agus Kosasih dan Branch Manager Jalan Tol Terbanggi Besar - Pematang Panggang - Kayu Agung Yoni Satyo kepada Kepala Sekolah SMAN 1 Terbanggi Besar, Haryono. ""Kegiatan pemasangan akses perpustakaan digital (Edubp) dilaksanakan pada tiga sekolah yang berdekatan dengan wilayah operasional perusahaan Sumatera yakni SDN 008 Purnama Kecamatan Dumai Barat Kota Dumai, Provinsi Riau, SMP Negeri 25 Kecamatan Kampung Melayu Kota Bengkulu dan SMA Negeri 1 Terbanggi Besar Kecamatan Terbanggi Besar Kabupaten Lampung Tengah. Pemasangan perpustakaan digital (Edubp) mulai dilakukan pada tanggal 16 Agustus dan akan berlanjut hingga 31 Agustus mendatang,"" papar Tjahjo. Tjahjo menambahkan pemasangan perpustakaan digital merupakan bagian upaya BUMN untuk mendorong pencapaian tujuan pembangunan berkelanjutan (TPB) yang berkaitan dengan pendidikan berkualitas lewat pendirian Taman Baca Masyarakat (TMB) dan pemasangan Perpustakaan Digital (EduBP) di lebih dari 1.000 titik. ""Perpustakaan digital ini berisi berbagai materi pembelajaran video visual, audio visual dan materi sekolah dasar pada umumnya, termasuk informasi mengenai Hutama Karya. Harapannya, dengan kehadiran fasilitas perpustakaan digital, beberapa sekolah yang sebelumnya mengalami kesulitan memperoleh akses informasi dan referensi dapat terbantu serta mendukung kegiatan belajar mengajar secara daring di tengah situasi Pandemi Covid-19,"" jelas Tjahjo. Ketua DPC LVRI Jakarta Selatan Letkol Purn Suparyono mengapresiasi Hutama Karya dan 35 BUMN donatur lainnya atas paket sembako yang dibagikan. ""Harapan kami sebagai veteran pejuang bangsa, agar perjuangan, semangat dan cita-cita kami dapat terus dilanjutkan oleh para generasi penerus bangsa. Tangguh dan tumbuh bersama-sama untuk Indonesia yang lebih baik ke depannya,"" ucap Suparyono. Sementara itu, Kepala Sekolah SMA Negeri 1 Terbanggi Besar Haryono juga menyampaikan terima kasih kepada perusahaan atas bantuan fasilitas pendidikan perpustakaan digital diberikan. ""Kehadiran fasilitas pendidikan perpustkaan digital (Edubp) ini dapat membantu para guru, siswa dan seluruh tenaga pendidik di SMAN 1 Terbanggi Besar untuk lebih cepat memperoleh dan mengakses berbagai informasi dan referensi tambahan guna menjadi bahan ajar di sekolah kami ke depannya,"" kata Haryono.","HUT RI, HK Beri Bansos ke Legiun Veteran & Pasang Perpustakaan Digital",bantuan panti,https://news.detik.com/berita/d-5686609/hut-ri-hk-beri-bansos-ke-legiun-veteran--pasang-perpustakaan-digital?single=1,"Rabu, 18 Agu 2021 14:19 WIB"
"Gubernur Khofifah Indar Parawansa melantik pimpinan Badan Amil Zakat Nasional  . Khofifah menitipkan 6.000-an anak yatim piatu yang ditinggal orang tuanya meninggal akibat COVID-19. ""Ada 6.000 lebih yang terkonfirmasi anak-anak menjadi yatim dan yatim piatu karena pandemi COVID-19. Tadi siang saya mengkoordinasikan ini, kalau untuk panti asuhan di sini regulasinya banyak. Kalau untuk remaja sudah tidak diperbolehkan, harus usia anak-anak,"" kata Khofifah di Gedung Negara Grahadi Surabaya, Senin (23/8/2021). Khofifah mengaku anak-anak ini tak hanya membutuhkan uluran tangan dana untuk pendidikan dan biaya kebutuhan sehari-hari. Namun, juga pengasuhan. Dia pun telah menyampaikan ke pengasuh ponpes agar bisa membantu memberikan pengasuhan pada anak yatim piatu. Khofifah juga meminta ke BAZNAS agar bisa membantu proses pemberian pengasuhan pada anak-anak ini. ""Tumbuh kembang anak-anak butuh lingkungan yang kondusif dalam proses pengasuhan yang bagus. Opsi pengasuhan ini bisa di exercise oleh BAZNAS titik mana yang bisa diajukan, terutama proses pengasuhannya,"" pesan Khofifah. ""Dari seluruh stakeholder sama-sama mengambil ruang empati dan simpati kita semua untuk memberikan pengasuhan pada anak-anak yang kehilangan salah satu atau kedua orang tuanya,"" imbuhnya. Di kesempatan yang sama, Khofifah juga berpesan agar BASNAZ bisa menyisir masyarakat yang tidak teregistrasi atau unregistered people agar bisa mendapat bantuan. ""Saat silaturahim tim dari BAZNAS untuk menyisir unregistered people. Saya beberapa kali ke titik-titik tertentu ketemu dengan unregistered people, karena mereka ini hanya menjadi penonton. Karena tidak bisa APBD dipakai untuk mengintervensi unregistered people, karena APBD dipakai untuk registered people,"" tambah Khofifah. Sementara Ketua BAZNAS Jatim, KH M Roziqi mengatakan pihaknya akan mengakomodir pesan Gubernur Khofifah soal  . Roziqi menyebut pihaknya akan merumuskan. ""Iya nanti akan ada koordinasi, ya antara lain seperti itu, kita akan bergerak menjadi orang tua asuh pada mereka yang yatim ditinggal orang tuanya kena COVID-19,"" ujar Roziqi. ""Amanah yang dibebankan kepada kami berlima merupakan tugas yang cukup berat, mengumpulkan dan mendistribusikan dana infaq, shodaqoh dan yang lain. Dalam mengumpulkan dana ini kita tidak bisa berjalan sendiri tanpa bimbingan, dorongan dari ibu gubernur, untuk mengurangi angka kemiskinan dan meningkatkan kesejahteraan masyarakat,"" pungkasnya. Sedangkan selain Roziqi yang dilantik, ada lima pimpinan BAZNAS. Yakni, Wakil Ketua I Prof Ali Maschan Moesa, Wakil Ketua II Ahsanul Haq, Wakil Ketua III H. Muhammad Zakki dan Wakil Ketua IV H. Husnul Khuluq.","Lantik BAZNAS, Khofifah Titip 6.000 Yatim Piatu karena Ortu Meninggal COVID-19",bantuan panti,https://news.detik.com/berita-jawa-timur/d-5693612/lantik-baznas-khofifah-titip-6000-yatim-piatu-karena-ortu-meninggal-covid-19?single=1,"Senin, 23 Agu 2021 20:35 WIB"
