artikel,judul,keyword,link,tanggal
"Forum Organisasi Usaha Rakyat Kecil UMKM-Informal Nusantara (FORUM URKANTARA) meminta Presiden Joko Widodo ( ) mengambil komando penanganan pandemi COVID-19. Permintaan tersebut disampaikan dalam surat terbuka kepada Jokowi. ""Mengambil Tongkat Komando dan Tongkat Kendali sebagai Panglima Tertinggi Penanganan pandemi Covid-19,"" demikian aspirasi dalam surat yang mereka layangkan dikutip Jumat (23/7/2021). Mereka juga berharap dengan segala daya dan sumber daya yang dimiliki Indonesia, Jokowi bisa memberikan jaminan perlindungan dan keselamatan bagi masyarakat, memastikan terpenuhinya kebutuhan pangan seluruh masyarakat, melindungi dan menjamin keberlangsungan roda usaha kecil, UMKM dan sektor informal bergerak efektif, memulihkan ekonomi nasional dari resesi, serta mempertahankan dan memperkokoh persatuan dan kesatuan bangsa Indonesia. Mereka juga meminta dilakukan perombakan total tim penanganan pandemi COVID-19, dan diganti dengan tim yang solid, kredibel, kapabel, profesional, dan memiliki integritas kuat, serta kokoh sehingga dapat dengan cepat menangani pandemi COVID-19 beserta dampak yang diakibatkan. Jokowi juga diharapkan memiliki itikad untuk memanggil dan duduk bersama para pimpinan organisasi pemangku usaha rakyat kecil UMKM dan sektor informal, serta usaha besar, para pimpinan organisasi profesi di bidang kesehatan, kedokteran, kesehatan masyarakat, kefarmasian, ekonomi. ""Dan para ahli lain terkait untuk merumuskan, serta mengambil langkah dan tindakan super cepat, efektif dan efisien sehingga dalam tempo secepat-cepatnya Pandemi COVID-19 dapat teratasi beserta dampak yang diakibatkan,"" demikian isi surat tersebut lebih lanjut. Mereka juga meminta Jokowi mengambil sikap tegas dan berani untuk mengalokasikan sebagian besar anggaran belanja negara untuk penanganan pandemi COVID-19 beserta dampak yang diakibatkan, mulai dari kesehatan dan keselamatan jiwa, termasuk untuk tenaga medis, para medis, sarana dan prasarana kesehatan, hingga berbagai subsidi untuk menjamin kebutuhan dasar rakyat terpenuhi secara layak. ""Serta stimulus dan insentif ekonomi bagi usaha rakyat kecil, UMKM dan sektor informal, stimulus dan insentif ekonomi lainnya, baik yang usaha, ekonomi, dan pekerjaannya yang terdampak pandemi COVID-19 secara langsung maupun yang tidak langsung diseluruh tanah air,"" lanjut surat tersebut. Jokowi pun diminta mengambil sikap tegas dan berani untuk mengeluarkan peraturan dan kebijakan-kebijakan khusus yang diperlukan, yakni untuk percepatan penanganan pandemi COVID-19 dengan pendekatan humanis dan persuasif, serta mencegah terjadinya tindakan represif dan kekerasan di lapangan.","Pedagang Kecil Minta Jokowi Ambil Komando, Rombak Tim Penanganan COVID-19",organisasi profesi,https://finance.detik.com/berita-ekonomi-bisnis/d-5654206/pedagang-kecil-minta-jokowi-ambil-komando-rombak-tim-penanganan-covid-19?single=1,"Jumat, 23 Jul 2021 15:59 WIB"
"Pakar penyakit menular Amerika Serikat yang belakangan hits di Twitter, dr Faheem Younus, baru-baru ini menyinggung penggunaan obat  . Antibiotik ini memang banyak diburu untuk isolasi mandiri (isoman), diyakini ampuh mengobati COVID-19. ""  tidak mencegah atau menyembuhkan varian COVID apa pun. Namun, dapat menyebabkan aritmia jantung yang fatal. Jangan diambil untuk COVID. Ini memiliki lebih banyak risiko daripada manfaat,"" terangnya, dikutip dari akun Twitter resminya @FaheemYounus, Minggu (18/7/2021). Azithromycin bagaimanapun merupakan antibiotik yang terdaftar sebagai obat keras. Penggunannya harus dalam pengawasan dokter, dan seharusnya tidak bisa dibeli sembarangan tanpa resep. Dalam rekomendasi terbarunya, 5 organisasi profesi dokter spesialis tidak lagi memasukkan Azithromycin sebagai obat wajib bagi pasien isoman COVID-19. Obat   hanya diberikan pada kasus berat dan kritis dengan kecurigaan koinfeksi mikroorganisme tipikal. Obat lain yang juga 'dikeluarkan' dari terapi wajib pasien isoman COVID-19 adalah Oseltamivir. Obat antivirus yang dipasarkan juga dengan nama dagang Tamiflu ini hanya diberikan bila ada kecurigaan koinfeksi influenza.",,organisasi profesi,https://health.detik.com/berita-detikhealth/d-5648322/sembarangan-minum-azythromycin-saat-isoman-covid-19-ini-bahayanya?single=1,"Senin, 19 Jul 2021 05:30 WIB"
"Ketua Ikatan Apoteker Indonesia (IAI) Kabupaten Tulungagung, Adi Wibisono turut mendukung program Jaminan Kesehatan Nasional - Kartu Indonesia Sehat (JKN-KIS). Menurutnya, program tersebut salah satu wujud eksistensi profesi khususnya apoteker dalam memberikan pelayanan kefarmasian kepada masyarakat. Selain itu, JKN-KIS juga merupakan program negara dan program pemerintah. Dengan demikian, apoteker sudah selayaknya ikut terlibat dalam program tersebut. ""Program JKN itu kan program negara, karena regulasi sudah ada, UU SJSN-BPJS dan Perpres JKN, dan pasti dikawal oleh negara. Tanggung jawab pemerintah dalam urusan kesehatan warganya dalam program JKN-KIS ini. Mau tidak mau saya yang kebetulan berada di organisasi profesi juga harus mendukung. Artinya dari sisi regulasi tidak bisa terbantahkan,"" ujarnya dalam keterangan tertulis, Minggu (18/7/2021). ""Yang kedua, kalau bicara dari sisi profesi, karena profesi itu kan esensinya harus berpraktek, mengaktualisasikan diri berdasarkan kompetensi, standar pelayanan, dan etika profesi. Salah satunya terwujudkan dalam bentuk pelayanan kefarmasian yang bertanggungjawab kepada masyarakat secara langsung di apotek, puskesmas, rumah sakit, dan sebagainya,"" imbuhnya. Sebagai organisasi profesi, Adi menyampaikan IAI juga mengambil peran dalam penyelenggaraan program JKN-KIS, mulai dari tingkat pusat hingga daerah. Adapun sinergi ini diwujudkan melalui kontribusi di dalam Tim Kendali Mutu Kendali Biaya (TKMKB). Menurutnya, untuk di tingkat pusat dan daerah keterlibatan IAI dalam TKMKB telah menunjukkan eksistensi dari profesi. ""Kita dukung bagaimana cara meningkatkan Program Rujuk Balik (PRB) berhasil, melalui peningkatan kepesertaan aktif. BPJS punya ide baik kita dukung, atau sebaliknya, kita punya ide yang inovatif BPJS dukung. Prinsipnya, kalau IAI melakukan itu (karena bagian dari negara), paling tidak kita ikut terlibat langsung dalam pelaksanaan program negara ini. Kami berkeyakinan (program ini) akan terus berkelanjutan. Sustainable program,"" ungkapnya. Terkait hal ini, Adi juga memberikan motivasi kepada apotek yang sudah bekerja sama dengan BPJS Kesehatan. Hal ini mengingat program BPJS Kesehatan memiliki berbagai tantangan ke depannya, khususnya di masa pandemi COVID-19. Adi menyebut ada 3 hal pendekatan yang dapat dilakukan apotek mitra BPJS Kesehatan, yakni dengan terus berkesinambungan dalam melaksanakan pelayanan kefarmasian kepada masyarakat atau pasien PRB secara langsung. Di samping itu, pelayanan kefarmasian juga perlu dilakukan dengan patient safety oriented program apotek, serta dengan pendekatan komunikatif, kreatif-inovatif dan konsisten. ""Dalam pelaksanaannya, misalnya yang pertama, harus tetap berkomunikasi, terdapat harmonisasi stakeholder, pasien, provider supaya baik. Ketika ada isu atau problem di lapangan, bisa dicarikan solusi penyelesaiannya. Contoh di Tulungagung terkait peningkatan mutu, edukasi kepada pasien PRB, dan kepesertaan aktif peserta PRB. Salah satu tools-nya yang disepakati bersama pakai Koper Sobat (koordinasi dokter, apoteker melalui senam dan pengambilan Obat PRB). Program itu harus dievaluasi, dianalisa akar permasalahannya, dimodifikasi yang tepat,"" ujarnya. Dalam program JKN-KIS, Adi menyampaikan proses pengembangan peran apotek dan apoteker juga harus ada perencanaan ulang. Pasalnya, ia melihat tingkat kehadiran peserta aktif PRB baru mencapai 50 persen. Untuk itu, Adi berharap pihak apotek tidak hanya datang ke FKTP untuk sekadar melaksanakan fungsinya. Apotek perlu melakukan terobosan program agar menarik bagi peserta JKN, terutama dari sisi apotek dan apoteker. ""Harus ada semacam program kreatif apotek untuk mendorong karyawan agar tetap semangat, berkinerja positif, dan dapat berdampak pada tujuan keselamatan pasien di apotek, khususnya pada pasien PRB. Selanjutnya, semua (perbaikan) itu dilaksanakan secara konsisten oleh pihak FKTP, apotek dan peserta PRB, serta pihak BPJS sesuai peran dan wewenangnya, dan tetap dilakukan monev dalam pelaksanaannya,"" ujarnya. Adi pun meminta agar apoteker dan apotek ikut berpartisipasi dan mendukung program JKN-KIS. Meskipun dalam perjalanannya terdapat kendala, Adi optimis akan selalu ada solusi untuk menyelesaikannya. Ia mengatakan pendekatan komunikasi yang efektif efisien dapat menjadi salah satu sarana penyelesaian yang terbaik. ""Ambil saja peran itu dalam program JKN, karena ini program pemerintah maka kita harus ikut, harus support dengan apoteker berpraktek profesi di apotek, kalau tidak support juga nanti ada penyesalan atau kerugian (kesempatan dan waktu). Hari gini (masa pandemi) kalau kita tidak memanfaatkan peluang sekecil apapun sebagai sumber potensi pendapatan apotek dari kita berpraktek profesi itu suatu kerugian menurut saya. Pasti ada kendala, dan pasti nanti ada solusinya,"" pungkasnya.",,organisasi profesi,https://health.detik.com/berita-detikhealth/d-5646869/apa-peran-apotek-dan-apoteker-dalam-program-jkn-kis?single=1,"Minggu, 18 Jul 2021 08:40 WIB"
"menegaskan kasus  yang diduga menyebar   COVID-19, terus berjalan walau tidak ditahan. Dirtipidsiber Bareskrim Brigjen Slamet Uliandi menyebut  juga dapat diproses etik di organisasi profesi kedokteran. Kepada polisi,  mengaku tidak akan melarikan diri sehingga tidak ditahan. ""Yang bersangkutan menyanggupi tidak akan melarikan diri. Oleh karena itu, saya memutuskan untuk tidak menahan yang bersangkutan. Hal ini juga sesuai dengan konsep Polri menuju Presisi yang berkeadilan,"" ujar Slamet melalui pesan singkat, Selasa (13/7/2021). Slamet yakin  tidak akan melarikan diri dan menghilangkan barang bukti meski tidak ditahan. Apalagi, kata Slamet, pihaknya telah memiliki seluruh barang bukti dr Lois dalam menyebarkan   COVID-19. ""Setelah dilakukan pemeriksaan oleh penyidik, kami dapatkan kesimpulan bahwa yang bersangkutan tidak akan mengulangi perbuatannya dan tidak akan menghilangkan barang bukti mengingat seluruh barang bukti sudah kami miliki,"" katanya. Lebih lanjut Slamet menyebut  dapat diproses lebih lanjut oleh otoritas profesi kedokteran. Slamet mengungkap pernyataan selaku orang yang memiliki gelar dan profesi dokter tidak memiliki pembenaran secara otoritas kedokteran. ""Polri memberikan catatan bahwa terduga dapat diproses lebih lanjut secara otoritas profesi kedokteran,"" kata Slamet. Slamet menyebut  juga turut mengakui opini yang dia publikasikan di media sosial tidak berlandaskan riset serta membangun asumsi. ""Dalam klarifikasi dr Lois, ia mengakui bahwa perbuatannya tidak dapat dibenarkan secara kode etik profesi kedokteran,"" terang Slamet. Sebelumnya, Polda Metro Jaya menangkap  , yang belakangan viral karena pernyataan kontroversial soal . Karena pernyataannya itu, dr Lois dianggap telah menyebarkan berita bohong kepada masyarakat luas. ""Dokter L telah menyebarkan berita bohong dan/atau menyiarkan berita atau pemberitaan bohong dengan sengaja yang dapat menimbulkan keonaran di kalangan rakyat,"" kata Kabag Penum Divisi Humas Polri Kombes Ahmad Ramadhan dalam jumpa pers di Mabes Polri yang disiarkan melalui YouTube, Senin (12/7). Ramadhan menjelaskan  menyebarkan berita bohong di tiga platform media sosial. Adapun dr Lois terancam hukuman maksimal 10 tahun penjara.",Polisi: dr Lois Bisa Diproses Etik di Organisasi Kedokteran,organisasi profesi,https://news.detik.com/berita/d-5642163/polisi-dr-lois-bisa-diproses-etik-di-organisasi-kedokteran?single=1,"Selasa, 13 Jul 2021 18:05 WIB"
"Nama   saat ini tengah hangat diperbincangkan di berbagai media sosial. Pasalnya, ia secara blak-blakan menyangkal keberadaan COVID-19 saat hadir di sebuah acara di televisi. Akibatnya, dr Lois akan dipanggil Majelis Kehormatan Etik Kedokteran Ikatan Dokter Indonesia (MKEK IDI) untuk mengklarifikasi dan dimintai pertanggungjawaban ilmiah atas pernyataannya. Tak hanya itu, sosok dr Lois ini juga disebut pernah berseteru dengan dokter sekaligus influencer kesehatan dr Tirta Mandira Hudhi. Melalui siaran Live di Instagram pribadinya, dr Tirta mengungkapkan bahwa dr Lois tidak terdaftar sebagai anggota IDI dan tidak menangani  . ""Ibu Lois ini mengaku sebagai dokter. Setelah dikonfirmasi ke ketua IDI Pusat dr Daeng dan saya konfirmasi ke ketua MKEK yaitu dr Pukovisa, beliau mengatakan bahwa dr Lois tidak terdaftar di anggota IDI. Semua dokter di Indonesia harus terikat dalam organisasi profesi IDI,"" ujar dr Tirta dikutip dari unggahan Instagramnya atas izin yang bersangkutan, Minggu (11/7/2021). ""Ingat, ibu Lois tidak terdaftar sebagai anggota  . Status dokternya dipertanyakan, STR (Surat Tanda Registrasi) beliau tidak aktif sejak 2017,"" lanjutnya. Dalam siaran live tersebut, dr Tirta mengatakan sempat mengira bahwa akun   itu adalah fake account karena domisilinya tidak jelas. Namun, setelah pernyataannya viral, dr Tirta meminta pertanggungjawaban dr Lois agar tidak menjadi pembohongan publik. ""Adapun berita yang disebarkan Ibu Lois terkait interaksi obat, terkait anti masker, terkait mengatakan COVID tidak ada, terkait mengatakan bahwa yang meninggal karena COVID tidak ada, terkait informasi vitamin C setiap jam secara ilmiah harus dibuktikan,"" tegasnya. ""Jika tidak bisa mempertanggungjawabkan, maka PB IDI pasti sekali lagi akan menimbang-nimbang, mengurus sesuai hukum yang berlaku. Kasus ini juga sudah diamati oleh pihak berwajib di antaranya Polda Metro jaya dan Polri,"" sambung dr Tirta.",,organisasi profesi,https://health.detik.com/berita-detikhealth/d-5639925/dr-lois-jadi-sorotan-gegara-sangkal-covid-19-dan-anti-masker-dia-siapa-sih?single=1,"Senin, 12 Jul 2021 08:16 WIB"
"Presiden Joko Widodo (Jokowi) direncanakan akan membagikan paket   bagi penderita COVID-19 yang kurang mampu. Ketersediaan  penderita COVID-19 diharapkan lebih baik pada pekan ini. Hal itu disampaikan Menko Bidang Kemaritiman dan Investasi Luhut Binsar Pandjaitan dalam rapat koordinasi virtual PPKM darurat Jawa-Bali pada Minggu (11/7/2021) kemarin. Sejumlah pejabat turut mengikuti rapat tersebut antara lain Menteri BUMN Erick Thohir, Menkes Budi Gunadi Sadikin, hingga beberapa gubernur. ""Minggu depan mudah-mudahan sudah lebih baik,"" kata Luhut soal ketersediaan obat-obatan bagi penderita COVID-19 seperti dikutip dari keterangan tertulis di situs Kemenko Maritim dan Investasi, Senin (12/7/2021). Luhut menjelaskan, syarat untuk mendapatkan bantuan  perawatan untuk pasien COVID-19 dari pemerintah ini adalah menunjukkan hasil tes PCR. ""Saran saya nanti 2.200 dokter yang direkrut dan dikoordinasi oleh Pak Tugas (Kapuskes TNI) dipimpin Panglima TNI, bisa atur semua flow (alur) ini,"" ujar Luhut. Perihal paket  tersebut, Menkes Budi Gunadi Sadikin mengusulkan kepada Luhut agar dilakukan finalisasi jenisnya. ""Kita perlu finalisasi lagi terkait paketnya karena belum sinkron dengan organisasi profesi dokter, jangan sampai terjadi resistensi terkait paket obat ini,"" kata Budi. Sementara itu, Panglima TNI Marsekal Hadi Tjahjanto menyatakan kesiapan pihaknya untuk menyusun mekanisme pencatatan, penyaluran, dan sosialisasi obat-obatan tersebut. Koordinasi dilakukan dengan berbagai pihak. ""Untuk kecamatan dan desa kami tentu akan terus berkoordinasi dengan dokter dan bidan desa untuk mengedukasi pasien, dan Babinsa juga nanti akan membantu,"" ujar Hadi.",Pemerintah Akan Bagikan Paket Obat COVID-19 bagi Warga Kurang Mampu,organisasi profesi,https://news.detik.com/berita/d-5640029/pemerintah-akan-bagikan-paket-obat-covid-19-bagi-warga-kurang-mampu?single=1,"Senin, 12 Jul 2021 10:02 WIB"
"Pandemi COVID-19 yang lebih dari setahun melanda dunia, bukan hanya berdampak pada kesehatan, akan tetapi juga mempengaruhi masyarakat dan perekonomian. Dampak pandemi juga berpengaruh terhadap program Badan Kependudukan dan Keluarga Berencana Nasional (BKKBN). ""Secara langsung ataupun tidak langsung. pandemi COVID-19 telah memberikan dampak terhadap berlangsungnya program yang menjadi mandat dari BKKBN yaitu pembangunan keluarga, kependudukan dan keluarga berencana atau Program Bangga Kencana,"" ujar Kepala BKKBN, Hasto Wardoyo dalam keterangan tertulis, Minggu (11/7/2021). Hasto pun merinci dampak pandemi terhadap program BKKBN, di antaranya menurunnya pelayanan KB pada fasilitas kesehatan, mengingat dari sisi supply pelayanan, fokus tenaga kesehatan pada penanganan COVID-19. Sementara sisi demand atau permintaan dari masyarakat adalah perhitungan urgensi untuk mendatangi fasilitas pelayanan kesehatan untuk mendapatkan pelayanan KB menurun. ""Selain itu, menurunnya kesertaan ber-KB pada masyarakat, terutama pada kelompok rentan (daerah kumuh, galcitas, masyarakat pra-sejahtera) yang menjadi penerima manfaat utama dari pelayanan yang diselenggarakan oleh BKKBN bersama dengan Kementerian Kesehatan,"" ujarnya Selanjutnya adalah rantai pasok alat dan obat kontrasepsi yang terganggu akibat kendala mobilitas petugas di lini lapangan. Terakhir adalah penurunan kegiatan KIE Kesehatan Reproduksi, Keluarga Berencana dan Pembangunan Keluarga (balita dan anak, remaja, serta lanjut usia), serta kegiatan lain yang berbasis kelompok kegiatan di masyarakat akibat keterbatasan mobilitas masyarakat dan penerapan pembatasan kegiatan. Oleh karena itu, kata dia, diperlukan evaluasi berbagai kebijakan yang selama ini telah dilaksanakan selama pandemi. Terutama kebijakan terkait pemenuhan hak kesehatan reproduksi, seperti akses layanan kesehatan bagi ibu hamil. BKKBN mengantisipasinya dengan gerakan sejuta akseptor untuk mengatasi dampak pandemi bagi program KB. Sedangkan untuk vaksinasi COVID-19 anak dan ibu hamil BKKBN bekerja sama dengan instansi terkait, pemerintah daerah serta organisasi profesi terkait seperti IDAI, POGI, dan IBI. ""Jika hak tersebut tidak dipenuhi maka akan dapat berdampak pada kehamilannya, dan kemudian dapat menyebabkan anak yang dilahirkannya kelak menjadi stunting,"" katanya. Ia menyatakan, stunting dapat dicegah mulai dari hulu dengan memberi konseling pra-nikah dan memberi pemahaman tentang kesehatan reproduksi. Selain itu, menjaga jarak kehamilan juga menentukan kualitas anak. ""Perencanaan pra-nikah perlu ada edukasi tentang kesehatan reproduksi yang baik dan mempersiapkan kehamilan yang sehat. Pendekatan tersebut perlu dilakukan sejak dini, termasuk persiapan psikologi dan ekonomi,"" ungkapnya. Oleh karena itu, lanjut Hasto, pada Hari Kependudukan Dunia yang jatuh pada hari ini, pihaknya terus berusaha meningkatkan kesadaran tentang kebutuhan dan kerentanan kesehatan seksual dan reproduksi perempuan dan anak perempuan. ""Untuk menyoroti bagaimana melindungi hak dan pilihan merupakan solusi terbaik atas perubahan demografi, dan memastikan bahwa pelayanan kesehatan seksual, kesehatan reproduksi dan otonomi tubuh tetap menjadi agenda lokal saat kita melihat ke arah 2030,"" lanjutnya. Selain itu, dalam rangka Hari Kependudukan Dunia, United Nation Population Fund (UNFPA) Indonesia dan BKKBN akan menyelenggarakan kampanye dan acara daring bertema 'Pemenuhan Hak Kesehatan Reproduksi untuk Percepatan Penurunan Stunting'. ""Semoga momentum ini menjadi sebuah upaya untuk mensosialisasikan kebijakan pemerintah dalam penyediaan akses kesehatan reproduksi bagi ibu di masa pandemi COVID-19 dan meningkatkan kesadaran masyarakat tentang dampak pandemi COVID-19 terhadap kehamilan dan stunting,"" ungkap Hasto. Sebelumnya, Wakil Presiden Ma'ruf Amin, dalam pidatonya pada Peringatan HARGANAS ke-28, 29 Juni lalu berharap, pelayanan gizi dan kesehatan, terutama untuk anak dan ibu hamil, tidak terhenti selama pandemi COVID-19 ini. Sehingga program percepatan penurunan prevalensi stunting dapat dicapai.",,organisasi profesi,https://health.detik.com/berita-detikhealth/d-5639537/hari-kependudukan-dunia-bkkbn-beberkan-dampak-pandemi-ke-program-kb?single=1,"Minggu, 11 Jul 2021 18:03 WIB"
"Nama   kini jadi perbincangan panas di media sosial. Setelah blak-blakan menyangkal COVID-19 di acara televisi, kini ia dipanggil oleh Majelis Kehormatan Etik Kedokteran Ikatan Dokter Indonesia (MKEK IDI) untuk dimintai klarifikasi dan pertanggungjawaban ilmiah. dr Tirta alias Tirta Mandira Hudhi angkat bicara. Pasalnya, sosok   disebut-sebut sudah pernah berseteru dengan dr Tirta terkait COVID-19. Lewat live Instagramnya, dr Tirta membongkar bahwa status dr Lois sebagai dokter kini dipertanyakan lantaran izinnya tidak aktif sejak 2017. dr Lois juga disebut tidak menangani pasien selama pandemi COVID-19, baik menjadi relawan atau praktek. ""Ibu Lois ini mengaku sebagai dokter. Setelah dikonfirmasi ke ketua IDI Pusat dr Daeng dan saya konfirmasi ke ketua MKEK yaitu dr Pukofisa, beliau mengatakan bahwa dr Lois tidak terdaftar di anggota IDI. Semua dokter di Indonesia harus terikat dalam organisasi profesi IDI,"" ujar dr Tirta dikutip dari unggahan Instagramnya atas izin yang bersangkutan, Minggu (11/7/2021). ""Ingat, ibu Lois tidak terdaftar sebagai anggota IDI. Status dokternya dipertanyakan, STR (Surat Tanda Registrasi) beliau tidak aktif sejak 2017,"" lanjutnya. Ia mengaku, sempat mengira akun media sosial   adalah   lantaran domisilinya tidak jelas. Namun kini lantaran pernyataan kontroversialnya di acara televisi viral, dr Tirta menegaskan, perlu ada pertanggungjawaban agar tak menjadi pembohongan publik. Tak lain, dengan cara memberikan klarifikasi dan pembuktian ilmiah di hadapan MKEK IDI. ""Ada pun berita yang disebarkan Ibu Lois terkait interaksi obat, terkait anti masker, terkait mengatakan COVID tidak ada, terkait mengatakan bahwa yang meninggal karena COVID tidak ada, terkait informasi vitamin C setiap jam secara ilmiah harus dibuktikan,"" tegasnya. ""Jika tidak bisa mempertanggungjawabkan, maka PB IDI pasti sekali lagi akan menimbang-nimbang, mengurus sesuai hukum yang berlaku. Kasus ini juga sudah diamati oleh pihak berwajib di antaranya Polda Metro jaya dan Polri,"" sambung dr Tirta.",,organisasi profesi,https://health.detik.com/berita-detikhealth/d-5639324/dipanggil-idi-gara-gara-sangkal-covid-19-siapa-sebenarnya-dr-lois?single=1,"Minggu, 11 Jul 2021 14:58 WIB"
"Lonjakan kasus   yang saat ini terjadi di Indonesia membuat layanan kesehatan terancam kolaps. Kapasitas rumah sakit yang hampir penuh, kesulitan mencari oksigen, hingga banyaknya tenaga kesehatan (nakes) yang gugur saat bertugas. Kondisi ini membuat banyak pihak berharap agar pemerintah menyediakan  atau vaksin dosis ketiga, dengan harapan para nakes bisa terlindungi dari COVID-19 lebih maksimal. Menanggapi ini, Direktur Utama Bio Farma Honesti Basyir mengakui adanya opsi vaksin booster tersebut. ""Terkait vaksin booster, yang ketiga, memang kita sudah mulai pembicaraan dengan pemerintah, Badan Pengawas Obat dan Makanan (BPOM), dan beberapa organisasi profesi,"" kata Honesti dalam rapat bersama di Komisi VI DPR RI Rabu (7/7/2021). Namun, hal ini belum diputuskan mengingat vaksinasi tahap 1 dan 2 yang masih belum mencapai target yang diinginkan. Untuk itu, Honesti mengatakan opsi vaksin booster belum bisa dipastikan kapan akan berjalan. ""Ya boro-boro kita ngomongin vaksinasi 3, vaksinasi 1 dan 2 juga masih belum cukup,"" lanjutnya. Honesti melanjutkan, kalaupun vaksinasi booster nantinya akan diberikan, para nakes akan menjadi prioritas. Sebab, tenaga kesehatan saat ini sangat berperan dalam upaya melawan pandemi  . ""Jadi bersamaan sudah mulai kita diskusikan, minimal untuk proteksi terhadap nakes dulu lah. Tapi, hasilnya nanti tentu akan bisa disampaikan oleh otoritas yang bersangkutan saat itu sudah diputuskan,"" pungkasnya.",,organisasi profesi,https://health.detik.com/berita-detikhealth/d-5634958/bio-farma-akui-ada-kemungkinan-opsi-vaksin-booster-minimal-untuk-nakes?single=1,"Rabu, 07 Jul 2021 19:01 WIB"
