artikel,judul,keyword,link,tanggal
"mengandung nilai-nilai luhur yang dapat diterapkan dalam perilaku sehari-hari. Nilai-nilai yang terkandung dalam sila Pancasila yaitu nilai ketuhanan, kemanusiaan, persatuan, kerakyatan, dan keadilan. Contoh perilaku yang mencerminkan perwujudan nilai dasar Pancasila seperti dikutip dari Pasti Bisa Pendidikan pancasila dan Kewarganegaraan untuk SD/MI kelas IV dan Arif Cerdas untuk Sekolah Dasar Kelas 5 oleh Christiana Umi yakni sebagai berikut. Nilai yang terkandung dalam sila pertama Pancasila adalah nilai ketuhanan. Contoh sikap perilaku manusia sebagai warga negara yang mencerminkan nilai dasar Pancasila yang pertama yaitu: 1. Mengembangkan sikap saling menghormati kebebasan menjalankan ibadah sesuai dengan agama dan kepercayaannya 2. Percaya dan takwa kepada Tuhan Yang Maha Esa sesuai dengan agama dan kepercayaan masing-masing menurut dasar kemanusiaan yang adil dan beradab. 3. Tidak melakukan penistaan terhadap suatu agama. Penistaan terhadap agama adalah perilaku menghina atau merendahkan agama, contohnya melakukan pembakaran rumah ibadah 4. Membina kerukunan hidup di antara sesama umat beragama dan kepercayaan terhadap Tuhan Yang Maha Esa 5. Mengembangkan sikap saling menghormati, bekerja sama, dan tolong-menolong antar pemeluk agama dan penganut kepercayaan terhadap Tuhan Yang Maha Esa 6. Tidak memaksakan suatu agama dan kepercayaan kepada orang lain 7. Menjalankan perintah agama sesuai ajaran agama yang dianut, misalnya dengan rajin beribadah 8. Melaksanakan sikap toleran 9. Menghormati orang yang merayakan hari besar keagamaannya 10. Mempersilahkan teman untuk melaksanakan ibadah dengan nyaman Nilai yang terkandung dalam sila ke-2 Pancasila adalah nilai kemanusiaan. Contoh perilaku yang mencerminkan nilai kemanusiaan dalam Pancasila yaitu: 1. Mengakui persamaan derajat, hak, dan kewajiban asasi setiap manusia tanpa membeda-bedakan suku, keturunan, agama, kepercayaan, jenis kelamin, warna kulit, kedudukan sosial, dan sebagainya 2. Mengakui dan memperlakukan manusia sesuai harkat dan martabatnya sebagai makhluk ciptaan Tuhan Yang Maha Esa 3. Mengembangkan sikap saling mencintai dan mengasihi antara sesama manusia 4. Tidak semena-mena terhadap orang lain 5. Gemar melakukan kegiatan kemanusiaan seperti bakti sosial, memberikan bantuan ke panti asuhan, dan membantu korban bencana alam 6. Senang membantu teman yang sedang mengalami kesusahan 7. Mengembangkan sikap tenggang rasa 8. Menjunjung tinggi hak asasi manusia 9. Mengembangkan sikap saling menghormati dan bekerjasama dengan bangsa lain 10. Membela kebenaran dan keadilan 11. Berteman tanpa membeda-bedakan latar belakang 12. Tidak memihak dalam menyelesaikan masalah 13. Menjenguk teman yang sakit 14. Membantu orang lain yang kesusahan tanpa pandang latar belakang 15. Mengakui persamaan derajat, persamaan hak, dan persamaan kewajiban antara sesama manusia 16. Mengembangkan sikap tenggang rasa Nilai yang terkandung dalam sila ketiga Pancasila  adalah nilai persatuan. Contoh perilaku yang mencerminkan perwujudan   dalam kehidupan sehari-hari yaitu: 1. Mengembangkan sikap bangga dan cinta tanah air 2. Mengutamakan persatuan, kesatuan, kepentingan, dan keselamatan bangsa dan negara di atas kepentingan pribadi atau golongan 3. Rela berkorban untuk kepentingan bangsa dan negara 4. Memajukan pergaulan demi persatuan dan kesatuan bangsa yang berlandaskan Bhineka Tunggal Ika 5. Melaksanakan kegiatan gotong-royong membersihkan sekolah, lingkungan rumah, dan lingkungan sekitar 6. Mempelajari dan menghormati kebudayaan daerah lain 7. Menghargai kebudayaan asli daerah sendiri 8. Menghargai karya dan produk-produk buatan dalam negeri Nilai yang terkandung dalam sila keempat Pancasila adalah nilai kerakyatan. Contoh perilaku yang mencerminkan perwujudan nilai dasar kerakyatan dalam kehidupan sehari-hari yaitu: 1. Mengutamakan kepentingan masyarakat dan negara di atas kepentingan pribadi saat bermufakat 2. Melaksanakan musyawarah saat ingin membuat keputusan yang berdampak bagi kelompok atau masyarakat 3. Menghormati dan menghargai pendapat orang lain 4. Tidak memaksakan kehendak dan pendapat diri sendiri kepada orang lain 5. Menggunakan hak pilih dengan mengikuti pemilu 7. Bermusyawarah dan menggunakan hak pilih dalam pemilihan ketua OSIS 8. Berjiwa besar dalam menerima keputusan hasil musyawarah 9. Melaksanakan keputusan bersama secara ikhlas dan bertanggung jawab Nilai yang terkandung dalam Pancasila sila ke-5 adalah nilai keadilan. Contoh perilaku yang mencerminkan perwujudan nilai dasar keadilan dalam kehidupan sehari-hari yaitu: 1. Menghargai hak dan kewajiban orang lain karena semua orang memiliki kedudukan yang sama di muka hukum 2. Membantu melaksanakan pembangunan nasional, baik dari sisi pendidikan, budaya, sosial, politik, ekonomi, kesehatan, dan lain-lain 3. Menikmati hasil pembangunan masyarakat Indonesia dengan bertanggung jawab 4. Menghukum dan mengadili sebuah tindakan sesuai undang-undang yang berlaku tanpa pandang jabatan dan latar belakang 5. Peduli terhadap penderitaan yang dialami orang lain 6. Menjaga keseimbangan hak dan kewajiban sehari-hari 7. Tidak bergaya hidup mewah 8. Menghargai hasil karya orang lain 9. Bekerja keras 10 .Memberi pertolongan kepada orang lain 11. Tidak menggunakan hak milik pribadi untuk hal-hal yang bersifat pemborosan 12. Melakukan kegiatan yang membantu mewujudkan kemajuan merata dan berkeadilan sosial Nah, itu dia contoh perilaku yang mencerminkan perwujudan nilai dasar   dari sila pertama sampai kelima. Yuk, terapkan di keseharian kita!",55 Contoh Perilaku yang Mencerminkan Perwujudan Nilai Dasar Pancasila,panti asuhan,https://www.detik.com/edu/detikpedia/d-5669058/55-contoh-perilaku-yang-mencerminkan-perwujudan-nilai-dasar-pancasila?single=1,"Rabu, 04 Agu 2021 13:30 WIB"
"Manajemen   secara resmi meluncurkan logo dan slogan yang menandai rangkaian peringatan 34 tahun tim Singo Edan yang jatuh, Rabu (11/8/2021). Logo dan slogan yang mengambil tema 'Solidarity' itu memiliki makna khusus. Semangat solidaritas sengaja dipilih karena saat ini Indonesia masih menghadapi masa pandemi   yang belum berlalu. Salah satu hal yang ditekankan adalah semangat solidaritas yang sudah ditunjukkan oleh Arema FC yang berusaha andil dalam penanggulangan COVID-19 dalam memberikan bantuan kepada masyarakat terdampak. Solidaritas disimbolkan di logo 34 tahun Arema FC dengan simbol syal bertuliskan 'Solidarity', syal yang melintang diantara singa yang mengaum. Harapannya, semangat solidaritas dan respect sosial Arema membantu Arema terus mengaum tak kenal lelah sampai kapanpun. ""Peringatan 34 tahun   ini kita peringati tahun ini tidak hanya sebagai tanda atas sebuah perjalanan. Tapi juga sebagai pengingat bagi kita semua untuk terus semangat untuk tetap semangat dalam menggalang solidaritas, lebih-lebih disaat ini, saat Indonesia masih belum bisa lepas dari pandemi COVID-19,"" ungkap Presiden Arema FC, Gilang Widya Pramana dalam keterangan resminya, Selasa (3/8/2021). Warna kebesaran biru juga mendominasi sosok singa yang mengaum. Hal itu disimbolkan bahwa solidaritas adalah sebuah sikap ksatria yang berani mewujudkan cinta kasih untuk sesama. ""Singa mengaum wujud dari keberanian dan menyampaikan pesan bahwa singa tetap tangguh dan kuat dalam menghadapi situasi sesulit apapun,"" tandas Gilang. Di usia ke-34 tahun ini, lanjut Gilang, Arema FC selain menonjolkan semangat solidaritas juga menekankan pentingnya sinergi dalam bahu membahu dengan merawat karakter Arek-arek Malang untuk meraih prestasi yang membanggakan. ""Angka 34 dengan bentuk perisai ini merupakan wujud sinergi dan solidaritas banyak elemen di Malang Raya dengan harapan bersatu untuk mewujudkan prestasi tim Singo Edan,"" tegasnya. Arema FC juga meluncurkan Champion Corner yang merupakan sebuah space khusus yang memajang trophy serta momen-momen Arema FC saat menjadi juara sejak pertama kali berdiri. Selain meluncurkan slogan dan logo, Arema FC juga menggelar donasi berupa paket sembako kepada 34 panti asuhan. ""Harapannya menuju hari yang sakral ini Arema FC bisa memberikan manfaat kepada banyak pihak, termasuk panti asuhan yang tersebar di Malang,"" papar Gilang. Dalam kesempatan itu,   juga melakukan perkenalan ruangan konferensi pers yang didesain cukup elegan yang menguatkan karakter klub kebanggaan arek-arek Malang ini.",2 Hal yang Baru dari Arema FC di Perayaan HUT ke-34,panti asuhan,https://sport.detik.com/sepakbola/liga-indonesia/d-5667465/2-hal-yang-baru-dari-arema-fc-di-perayaan-hut-ke-34?single=1,"Selasa, 03 Agu 2021 11:23 WIB"
"Pelajar di Kota Cirebon, Jawa Barat, ramai-ramai berburu tempat pelaksanaan vaksinasi massal. Pelajar dari berbagai sekolah itu berharap vaksinasi bisa mempercepat kebijakan kegiatan belajar mengajar (KBM) tatap muka kembali digelar. Pelajar di Cirebon mengaku merindukan KBM tatap muka. Kerinduan itu menggerakkan sejumlah pelajar berbondong-bondong menyerbu pelaksanaan vaksinasi di aula Badan Pendidikan Kristen (BPK) Penabur Cirebon, Jalan Cipto Mangunkusumo Kota Cirebon, Jawa Barat. Salah seorang pelajar SMA Kristen Penabur Cirebon Irma (17) mengaku senang adanya vaksinasi bagi pelajar atau kelompok usia 12 tahun ke atas. Setelah mendapat informasi tentang pelaksanaan vaksinasi COVID-19, Irma bersama saudaranya langsung bergegas mendaftar. ""Rasanya biasanya saja, tidak sakit,"" kata Irma saat berbincang dengan   usai divaksin, Kamis (12/8/2021). Pelajar kelas XII SMA itu mengaku rindu belajar tatap muka. Sebab, lanjut Irma, KBM tatap muka lebih efektif ketimbang dalam jaringan (daring) atau virtual. ""Biar cepat tatap muka. Dari pertama pandemi sampai sekarang daring. Bosan juga kalau daring terus. Kalau tatap muka itu lebih bebas bertanya, dan memahami pelajarannya lebih mudah,"" kata Irma. Senada disampaikan Qeysha (15), pelajar kelas X SMA Al Azhar Cirebon. Dia mengikuti vaksinasi massal di BPK Penabur Cirebon. Ia mengaku merindukan KBM tatap muka. ""Daring itu kurang enak. Tugas memang banyak, tapi pemahaman pembelajaran kurang. Bagi saya, lebih mudah belajar tatap muka,"" kata Qeysha. Selain tatap muka, Qeysh juga mengaku mengikuti vaksinasi karena ingin meningkatkan imun. Ia berharap dengan adanya vaksinasi massal bisa membantu tercapai target herd immunity atau kekebalan kelompok. ""Pribadi saya pengin vaksin. Kebetulan orang tua juga menyuruh. Semoga pandemi berakhir,"" kata Qeysha. Lain halnya dengan Irma dan Qeysha, Rika Amalia (18) mengaku mendapatkan informasi adanya vaksinasi massal dari grup sekolah. Lulusan SMK N 2 Kota Cirebon itu mengatakan vaksinasi merupakan bagian dari upaya untuk menjaga kesehatannya. ""Sekarang itu ke mana-mana harus vaksin. Biar tidak susah juga kalau ke mana-mana. Ini lagi cari-cari kerja, baru lulu sekolah,"" kata Rika. Sementara itu, Ketua Yayasan BPK Penabur Cirebon Eko Sudjatmanto mengatakan pelaksanaan vaksinasi COVID-19 tak hanya diperuntukkan pelajarnya. Ia mengajak pelajar dari sekolah lain untuk ikut vaksinasi. ""Ada dari SMK Veteran, Al Azhar, dan sekolah lainnya. Ada orang tua pelajar yang belum divaksin, kami izinkan untuk ikut vaksin. Masyarakat umum sekitar sekolah juga boleh ikut,"" kata Eko. Eko menjelaskan vaksinasi massal massal merupakan upaya untuk membantu mencapai target kekebalan kelompok. Pihaknya bekerja sama dengan Kodim 0614/Kota Cirebon. ""Vaksinasi digelar dua hari, hari ini dan besok. Yang terdaftar sudah 1.750 orang. Hari ini targetnya 750 orang yang divaksin,"" kata Eko. Di tempat yang sama, Kepala Staf Kodim 0614/Kota Cirebon Mayor Inf Tatang B mengatakan pihaknya menyediakan 39.300 vial vaksin sejak Maret. Pihaknya melaksanakan vaksinasi secara bertahap dengan berbagai lembaga. ""Bertahap dilaksanakan untuk dewasa, 18 tahun ke atas, dan sekarang untuk 12 tahun ke atas. Ini disebar di seluruh Kota Cirebon. Tersisa sekitar 5.000 vial vaksin,"" kata Tatang. Sementara itu, di Kota Cimahi vaksinasi COVID-19 mulai menyasar anak yatim. Ratusan anak yatim antusias menjalani vaksinasi di Puskesmas Cimahi Utara. Total ada sebanyak 108 anak yang bakal menjalani vaksinasi di Kota Cimahi berdasarkan data Dinas Sosial. Namun pelaksanaan vaksinasi tersebut bakal berjalan secara berkala. Sekretaris Dinas Sosial Pengendalian Penduduk dan Keluarga Berencana, Pemberdayaan Masyarakat dan Perlindungan Anak (DinsosP2KBP3A) Kota Cimahi, Fitriani Manan mengatakan, berdasarkan data Kementerian Sosial (Kemensos) di Kota Cimahi baru tiga panti yang ditunjuk untuk menjalani vaksinasi COVID-19 ""Kemensos menunjuk tiga panti dulu di Cimahi yang anak-anaknya akan menjalani vaksinasi. Ada 108 anak totalnya. Dan vaksinasinya mulai berjalan hari ini,"" ungkap Fitriani kepada wartawan. Fitriani menjelaskan anak yatim masuk dalam sasaran vaksinasi COVID-19 namun mereka masuk kategori masyarakat umum dan yang rentan terpapar COVID-19. ""Untuk saat ini belum semua bisa divaksinasi. Mudah-mudahan ke depannya semua anak yang usianya memenuhi syarat kan divaksinasi juga,"" jelas Fitriani. Dahlan Kurnia (15), seorang anak yatim yang berasal dari salah satu panti asuhan di Kota Cimahi akhirnya bisa menjalani vaksinasi COVID-19 setelah menunggu lama. ""Iya alhamdulillah akhirnya divaksin juga. Tadi lumayan gugup aja, tapi enggak masalah asal udah divaksin,"" ujar Dahlan. Dahlan berharap semakin banyak orang yang divaksin COVID-19 ini bisa terkendali. Sebab ia sangat berharap bisa kembali belajar tatap muka di sekolah. Dahlan sudah jenuh setahun lebih belajar secara daring. ""Iya harapannya sekolah bisa tatap muka lagi. Untuk yang belum divaksinasi, ayo divaksinasi biar pada sehat semua jadi bisa normal lagi sehari-harinya,"" pungkas Dahlan.","Rindu KBM Tatap Muka, Pelajar Cirebon Antusias Jalani Vaksinasi COVID-19",panti asuhan,https://news.detik.com/berita-jawa-barat/d-5679325/rindu-kbm-tatap-muka-pelajar-cirebon-antusias-jalani-vaksinasi-covid-19?single=1,"Kamis, 12 Agu 2021 14:01 WIB"
"Jajaran kader dan pengurus Partai Persatuan Pembangunan (PPP) di daerah menyambut imbauan Ketua Umum PPP Suharso Monoarfa untuk membantu masyarakat terdampak pandemi COVID-19. Untuk itu, para kader dan pengurus partai melakukan aksi sosial di sejumlah daerah seperti Rembang, Bogor, Padang, Jakarta, dan lainnya. Ketua DPC PPP Kabupaten Rembang, Zaimul Umam atau Gus Umam mengatakan pihaknya siap untuk terus melaksanakan aksi sosial. Adapun aksi sosial ini berupa pemberian bantuan sosial (bansos) kepada masyarakat yang terdampak COVID-19. ""Kami di daerah menyambut baik imbauan Ketum dalamcRakornas PPP. Bahkan, PPP di Rembang sudah dan akan terus turun memberikan bantuan sosial kepada masyarakat,"" ungkap Zaimul dalam keterangan tertulis, Senin (2/8/2021). Menurutnya, berbagai aksi sosial yang digalakkan oleh kader PPP di seluruh daerah diharapkan dapat menjadi solusi atas masalah yang saat ini sedang dihadapi masyarakat. Khususnya bagi warga yang terdampak langsung oleh pandemi COVID-19. ""Sekecil apapun bantuan yang diberikan kepada masyarakat diharapkan dapat membantu meringankan beban mereka,"" imbuhnya. Senada dengan hal tersebut, Ketua DPC PPP Kabupaten Bogor Elly Rachmat Yasin mengatakan pihaknya mendukung penuh imbauan Ketua Umum PPP agar seluruh kader ikut membantu warga terdampak pandemi COVID-19. Elly pun mengungkap PPP Kabupaten Bogor telah melakukan pembagian sembako di sejumlah kecamatan di Bogor, Jawa Barat. ""Saat ini kita melibatkan semua anggota fraksi, baik itu Fraksi PPP di DPR RI, DPRD Provinsi maupun anggota Fraksi PPP di DPRD kabupaten. Pada saat ini kita membagikan sebanyak 2.000 paket sembako di dua kecamatan,"" tutur Elly. Tak hanya di Rembang dan Bogor, aksi sosial ini juga dilakukan oleh kader dan pengurus DPW PPP Sumatera Barat. Kegiatan aksi sosial di wilayah ini dilakukan dengan memberikan santunan kepada anak-anak yatim yang tinggal di Panti Asuhan Aisyiah Muhammadiyah, Lubuk Begalung, Kota Padang, Sumatera Barat. Selain itu, kegiatan sosial juga dilakukan oleh organisasi sayap PPP, yaitu Angkatan Muda Ka'bah (AMK). Ketua Umum PN AMK Rendhika Harsono mengungkap organisasi yang dipimpinnya memberikan bantuan sosial berupa paket sembako kepada masyarakat di kawasan Manggarai, Jakarta Selatan. ""AMK merespons positif imbauan yang disampaikan Ketum PPP. Kami langsung turun memberikan bantuan sosial, salah satunya membagikan paket sembako dan mie instan kepada masyarakat yang tinggal di pinggir rel kereta di daerah Manggarai,"" terangnya. Sebelumnya, Ketum PPP Suharso Monoarfa mengimbau seluruh kader PPP agar menjadi bagian dari solusi atas berbagai persoalan yang dihadapi masyarakat akibat pandemi COVID-19. Imbauan itu disampaikan dalam Rapat Koordinasi Nasional PPP yang digelar secara virtual, Sabtu (31/7) lalu. ""Kader PPP harus mengambil peran aktif dalam melakukan bantuan sosial bagi warga yang terdampak, fasilitasi layanan sosial dan kesehatan bagi warga terpapar, perluasan dan percepatan vaksinasi warga, serta membantu peningkatan pendapatan dan penciptaan lapangan kerja,"" imbau Suharso",Kader-Pengurus PPP Daerah Bagikan Bansos untuk Warga Terdampak Pandemi,panti asuhan,https://news.detik.com/berita/d-5665957/kader-pengurus-ppp-daerah-bagikan-bansos-untuk-warga-terdampak-pandemi?single=1,"Senin, 02 Agu 2021 11:00 WIB"
",   dan  , memberikan 10 ribu Kinder Joy atau satu truk di perayaan ulang tahun sang buah hati, Amberly. Ternyata satu truk Kinder Joy yang dipesan Gilang Widya Pramana dan Shandy Purnamasari berjumlah 10 ribu. Dalam Instagram miliknya, Shandy Purnamasari memberikan tebak-tebakan. Berapa kira-kira mereka menghabiskan uang untuk membeli 10 ribu Kinder Joy tersebut? ""Pertama idenya pengennya kadoin @amberlykidss kinderjoy se truck, trus kedua ngide kinderjoy setrucknya di hamburin ke kolam! Jadilah kinderjoy pool party total ada +/- 4rb ( tenyata dpt report klo ada 10rb pcs ) @kinderjoyofmoving haha kyknya bnyk bgt yg dikasi ni,"" buka Shandy Puramasari dalam Instagram miliknya. ""Aku mau bagiin kinderjoynya kalian anak2 yg ga kesampean beli kinderjoy dan setengahnya dikasi ke panti asuhan juga,"" bebernya lagi. Tidak hanya menebak,   juga bakal memberikan uang kepada orang yang beruntung dan menjawab pertanyaan dengan tepat. ""Kira2 totalnya brp rupiah hayo Yg aku kasi aku lgs komenin ( dpt ) ya kyk biasanya,"" lanjutnya lagi. Postingan itu langsung mendapatkan banyak respons. Banyak dari netizen yang langsung mengakumulasikan berapa jumlah tersebut. Sampai Rp 50 juta nggak ya? ""Happy birthday amber cantik 1 dus isi 24 pcs kak shandy. Kalo 4000 pcs +/- 167 dus. Totalnya 1 dus sekitar 250.000 jadi kurang lebih jumlahnya sekitar Rp 41.750.000,"" ungkap akun ahs***. ""Bisa mau 50jutaan yahh kak ini jajanan cemilan termahal klo blg k anak akuu jadii klo k indomaret mening beli biskuit or chiki yg murah gede lagii,"" beber akun metta***. ""Waaahhh 13rbx4000=52 juta buat beli kinderjoy,"" ucap akun jeur***. ""Kmren bli d alfa 14.000 berarti 56 JT ka Shandy, mudah""an rejeki (dpt) buat bli kado anakku yg ultah juga aminn,"" papar akun ern***. Hingga saat ini belum ada jawaban yang tepat dan  juga belum memberikan pengumuman siapa pemenang dalam kesempatan ini.","Menebak Harga 1 Truk Kinder Joy Crazy Rich Malang di Ultah Anak, Rp 50 Juta?",panti asuhan,https://hot.detik.com/celeb/d-5738092/menebak-harga-1-truk-kinder-joy-crazy-rich-malang-di-ultah-anak-rp-50-juta?single=1,"Jumat, 24 Sep 2021 16:00 WIB"
"Dua pelajar di Kabupaten Madiun harus berurusan dengan polisi. Karena kecanduan  , mereka nekat mencuri uang sebuah panti asuhan dengan total Rp 102 juta. Salah satu pelaku merupakan anak asuh di panti asuhan tersebut. ""Betul kami baru mengungkapkan kemarin, kasus pencurian melibatkan dua pelajar dan satu di antaranya merupakan anak asuh salah satu panti asuhan di Caruban,"" ujar Kasat Reskrim Polres Madiun, AKP Ryan Wira Raja Pratama saat dikonfirmasi detikcom, Sabtu (7/8/2021). Kedua pelaku yang masih di bawah umur, kata Ryan, yakni berinisial MY dan DW. MY merupakan anak asuh dari panti asuhan tersebut. MY melakukan aksi   usai salat magrib di mana jemaah masih menggelar selawatan dan doa bersama. Uang hasil curian dititipkan ke DW. ""Pada saat selawatan dan doa-doa itulah MY memasuki ruang penyimpanan uang di panti asuhan tersebut, yang mana uang tersebut disimpan di dalam lemari panti asuhan. Setelah diambil uang tersebut diserahterimakan atau dititipkan kepada pelaku DW,"" kata Ryan. Ryan mengatakan, pelaku sudah 10 kali melakukan aksi pencurian sejak 2019. Total uang yang dicuri mencapai RP 102 juta. Selain untuk bermain game online, uang curian juga digunakan pelaku untuk membeli sepeda motor. ""Uang curian tersebut digunakan untuk  , membeli HP dan juga sepeda motor. Dari keterangannya sejak 2019 sampai dengan 2021 total 10 kali melakukan pencurian yang mana total semua sekitar Rp 102 juta,"" ungkapnya. Ryan menambahkan, saat ini Satreskrim Polres Madiun masih melakukan pengembangan. ""Kita masih lakukan pengembangan dengan harapan tidak ada merembet teman lainnya,"" pungkasnya.","Kecanduan Game Online, 2 Pelajar di Madiun Curi Uang hingga Rp 102 Juta",panti asuhan,https://news.detik.com/berita-jawa-timur/d-5674139/kecanduan-game-online-2-pelajar-di-madiun-curi-uang-hingga-rp-102-juta?single=1,"Minggu, 08 Agu 2021 08:24 WIB"
"Hari kemerdekaan RI sudah di depan mata akan kembali dirayakan di tengah pandemi Corona. Salah satu cara merayakan HUT ke-76 RI di masa pandemi ini adalah dengan membantu sesama. Finalis Puteri Indonesia 2020 Stephanie Cecillia Munthe termasuk wanita inspiratif yang tergerak membantu sesama di masa pandemi. Dokter gigi cantik ini membuat yayasan non profit untuk tenaga kesehatan. Stephanie Cecillia Munthe yang berprofesi sebagai dokter gigi memiliki latar belakang pendidikan di bidang komunikasi. Ia pun aktif di beberapa organisasi sosial sebagai Founder of Medication (Medical Talk and Communication), Head of Public Health Department Rumah Millenial dan Sie Marketing AWMI (Asosiasi Wisata Medis Indonesia). Berbagi kisah kepada Wolipop, Stephanie mengungkapkan bagaimana dia memutuskan mendirikan Medical Talk and Communication yang merupakan sebuah organisasi non profit untuk para pekerja kesehatan. Organisasi yang didirikannya itu menyumbangkan persediaan logistik seperti minuman kesehatan dan pembersih tangan kepada pekerja medis yang berjuang di garda depan penanganan pandemi Covid-19. Stephanie Cecillia mendirikan Medical Talk and Communication pada Februari 2019. Selain oleh Stephanie, organisasi tersebut didirikannya bersama beberapa rekan tenaga kesehatan lainnya yang diawali oleh rasa cemas akan dampak dari miskomunikasi dan kesenjangan antar tenaga kesehatan di masa pandemi. ""Jadi awalnya terbentuk dari komunitas saja, untuk menyuarakan isu-isu kesejahteraan dan mutual respect di berbagai macam profesi kesehatan,"" kata Stephanie kepada Wolipop, Minggu (16/8/2021). Stephanie mengungkapkan alasan mendirikan yayasan tersebut, karena adanya kesenjangan di antara tenaga kesehatan. Dia dan rekan-rekannya juga ingin meningkatkan awareness atau kesadaran akan semangat kolaborasi antar nakes. ""Banyak sekali masalah-masalah manajemen pelayanan kesehatan, seperti miskomunikasi antar tenaga kesehatan. Kurang adanya respect antar profesi kesehatan. Yang ujung-ujungnya yang mengakibatkan pelayanan kesehatan itu tidak optimal,"" tuturnya. Medical Talk and Communication menurut Stephanie resmi menjadi sebuah yayasan pada 2020. Yayasan tersebut terdiri dalam empat divisi, ada advokasi, research, empowerment dan kolaborasi. Berikut penjelasannya dari Stephanie : 1. Research Para tenaga kesehatan yang menjadi member bisa mendapatkan pelatihan untuk penulisan artikel ilmiah. Dan berkolaborasi dengan profesi kesehatan lainnya. ""Jadi mereka punya karya sendiri di website kami www.medicaltalkandcommunication.id,"" lanjut Stephanie. 2. Empowerment Pada divisi empowerment, para nakes diberdayakan untuk bisa aktif dalam mengedukasi tengang kesehatan di media sosial, menjadi moderator atau host sebuah acara. Selain itu para nakes juga mendapatkan pelatihan komunikasi, public speaking dan soft skill atau kemampuan non teknis lainnya. 3. Advokasi ""Divisi advokasi kita mendukung para nakes dengan mengadakan virtual health education di tengah pandemi. Dulu sebelum pandemi kita aktif melakukan bakti sosial. Kadang bekerja sama dengan Pemprov DKI Jakarta dan sektor lainnya,"" ungkap dokter gigi 26 tahun itu. Semenjak pandemi, seluruh kegiatan advokasi beralih secara daring untuk memberikan edukasi tentang kesehatan ke komunitas masyarakat, sekolah, anak, panti asuhan dan lainnya. 4. Kolaborasi Stephanie menjelaskan jika Medical Talk and Communication bekerja sama di berbagai sektor. Mulai dari pemerintahan sampai ke sektor masyarakat lainnya untuk mengadakan kampanye tentang kesehatan di masa pandemi COVID-19. Merayakan HUT ke-76 RI, Stephanie pun menyampaikan harapannya. Dia berharap pada masa pandemi Corona ini akan ada lebih banyak orang, khususnya wanita yang bisa berdaya dan bermanfaat untuk sesama. ""Di hari kemerdekaan ini semoga seluruh wanita Indonesia juga bisa dapat berdaya untuk melakukan kegiatan-kegiatan sesuai dengan passionnya dan bermanfaat untuk orang lain,"" terangnya. Stephanie juga mengajak para tenaga kesehatan untuk berkolaborasi agar bisa memberikan edukasi seputar kesehatan di masa pandemi. ""Khususnya untuk para tenaga kesehatan, tetap semangat apalagi nakes yang menjadi garda terdepan dalam pandemi ini,"" tutupnya dengan ramah.",,panti asuhan,https://wolipop.detik.com/worklife/d-5684635/kisah-stepahnie-cecillia-dokter-cantik-buat-gerakan-inspiratif-saat-pandemi?single=1,"Selasa, 17 Agu 2021 11:00 WIB"
