artikel,judul,keyword,link,tanggal
"Banyak orang yang setelah pensiun sibuk memutar otak untuk tetap berpenghasilan. Namun pria ini justru dedikasikan hidupnya untuk jadi  . Bekerja di sebuah perusahaan ada batas usia pensiun yang ditetapkan untuk para pekerja, bergantung dengan kebijakan masing-masing perusahaan. Masa pensiun tersebut diberikan agar para mantan pekerja bisa menikmati hari tuanya tanpa masih sibuk bekerja. Tetapi banyak mantan pekerja yang sesaat setelah pensiun justru berhasil menciptakan bisnis baru untuk tetap mendapatkan penghasilan. Tetapi seorang mantan manajer yang satu ini justru dedikasikan segala penghasilan yang didapatkan dari masa kerjanya. Keputusannya ini ternyata disambut baik oleh keluarganya. Bahkan istrinya membantu untuk menyukseskan keinginan mulia suaminya. Mengutip The Star (20/9), seorang mantan manajer di salah satu perusahaan elektronik memutuskan untuk pensiun di usianya yang ke 60 tahun pada tahun 2008 lalu. Namun sejak memutuskan untuk pensiun, Kirnan Palaniappan, memutuskan untuk mendedikasikan dirinya menjadi  . Pada akhir pekan, Kirnan dan istrinya, Manjula, akan pergi ke toko bahan-bahan makanan untuk membeli makanan seperti nasi, sarden, telur, tepung dan gula. Bukan untuk memenuhi kebutuhan keluarganya, bahan-bahan makanan ini ditujukan untuk keluarga-keluarga yang kurang mampu di kawasan Sungai Buloh, Selangor, Malaysia. ""Keluarga yang mendapatkan bantuan ini merupakan 14 keluarga yang yang bekerja sebagai buruh, tukang kebun maupun pemotong rumput. Banyak dari mereka yang juga kehilangan pekerjaannya selama masa pandemi,"" kata Kirnan mengungkapkan alasan donasi yang dilakukannya. Melihat kesulitan yang dialami oleh orang-orang di sekitarnya, Kirnan merasa sangat terpukul. Ia merasa saat itu adalah waktu yang tepat untuk dirinya bergerak dan membantu orang-orang sekitar di kawasan Sungai Buloh, Selangor, Malaysia. ""Aku punya lebih banyak waktyu setelah pensiun. Aku kemudian berinisasi bahwa kegiatan menjadi   ini akan sedikit mengisi waktu luangku,"" kata Kirnan. Sudah lebih dari 16 bulan belakangan ini Kirnan memang disibukkan dengan memberi makan bagi orang-orang yang membutuhkan. Satu bulan yang lalu bahkan Kirnan menyediakan makanan untuk panti asuhan di kawasan Shah Alam yang penghuninya sempat dinyatakan positif Covid-19. Tak hanya sendiri, Kirnan juga mendapat bantuan dari teman-teman dekatnya yang berada di berbagai negara. Mulai dari teman-teman di Australia, Amerika Serikat hingga Qatar semuanya ikut membantu Kirnan dalam memenuhi kebutuhan makanan yang akan didonasikan. Ternyata perilaku mulia ini memang sudah ditanamkan oleh orang tua Kirnan sejak dirinya masih kecil. Mengaku belajar banyak dari sang ayah, membuat Kirnan terinspirasi untuk mendedikasikan dirinya untuk membantu orang banyak.",,panti asuhan,https://food.detik.com/info-kuliner/d-5735544/pensiun-jadi-manajer-pria-ini-dedikasikan-hidupnya-jadi-donatur-makanan?single=1,"Kamis, 23 Sep 2021 15:30 WIB"
"Risland Indonesia, developer yang menaungi Apartemen Sky House BSD+ dan Sky House Alam Sutera+ bersama Bright Property Service Indonesia (BPSI) menyalurkan bantuan sembako ke salah satu panti asuhan di Kalideres. Sky House dan BPSI juga membagikan lebih dari 1.000 paket bantuan ke masyarakat terdampak COVID-19 yang berada di lingkungan sekitar perusahaan. Bantuan tersebut diberikan sebagai salah satu wujud nyata kepedulian Apartemen Sky House dan BPSI kepada sesama. Penyaluran bantuan ini diserahkan oleh perwakilan Sky House BSD+ dan Alam Sutera+, serta BPSI kepada pengurus Panti Tuna Grahita Belaian Kasih dengan menerapkan protokol kesehatan ketat. Seluruh tim Sky House dan BPSI yang hadir pada kegiatan tersebut juga dipastikan dalam kondisi sehat dan negatif COVID-19 melalui hasil test swab antigen yang dilakukan sebelum menuju lokasi. Penyaluran bantuan telah dilaksanakan sejak bulan Agustus 2021 dan puncaknya dilakukan pada hari Kamis (16/9). Penyaluran bantuan tersebut diharapkan dapat membantu mengurangi beban dari dampak wabah COVID-19 terhadap perubahan aktivitas dan penurunan pendapatan ekonomi masyarakat.",Sky House dan Bright Property Service Indonesia Gelar Aksi Sosial,panti asuhan,https://news.detik.com/berita/d-5732711/sky-house-dan-bright-property-service-indonesia-gelar-aksi-sosial?single=1,"Selasa, 21 Sep 2021 09:04 WIB"
"Menteri Badan Usaha Milik Negara (BUMN), Erick Thohir mengunjungi komunitas binaan IndiHome di Papua, baik yang bergerak di bidang seni, budaya, dan pendidikan. Ia didampingi Direktur Consumer Service PT Telkom Indonesia (Persero), Venusiana yang sempat berbincang dengan beberapa komunitas tersebut. ""Sebagai #InternetnyaIndonesia, IndiHome berkomitmen bukan hanya mewujudkan pemerataan konektivitas digital dari Aceh sampai Papua, tetapi kami juga bertekad menyambung kebahagiaan dan menghadirkan solusi nyata bagi masyarakat Papua melalui platform dan layanan digital terbaik,"" ungkap Venusiana dalam keterangan tertulis, Selasa (5/10/2021). Hal itu diungkapkanya saat menyambut kedatangan Erick di Jayapura, Papua belum lama ini. Erick dan Venusiana berbincang santai dengan Mama Ibo, pendiri Batik Papua 'Pondok Putri Dobonsolo' yang menceritakan proses seni ukir batik Papua yang terinspirasi dari batik di Pulau Jawa. Menurut Mama Ibo, keunikan dari Batik Papua ada pada ukiran yang khas dengan ikon Papua, seperti Burung Cenderawasih. Mama Ibo juga menjelaskan bahwa kehadiran IndiHome sangat berarti baginya. Komunitas binaan IndiHome lain yang dikunjungi adalah Bengkel Tifa yang berperan penting menjaga tradisi alat musik khas Papua 'Tifa'. Menurut Denis Koibur, pendiri Bengkel Tifa, selain alat musik Tifa, Bengkel Tifa juga membuat Wai Ron yaitu perahu tradisional suku Biak yang digunakan oleh nenek moyang suku Biak untuk berlayar menelusuri samudra. Wai Ron juga digunakan untuk mengikuti Festival Perahu Perang di Samarai Papua Nugini. Bagi Suku Biak, perahu Wai Ron adalah lambang sakral kebudayaan suku Biak, termasuk tato di wajah menjadi bagian dari ciri khas suku Biak Papua. Di sinilah peran Bengkel Tifa yang dinakhodai Denis.  Selanjutnya di bidang pendidikan, Erick juga menyaksikan dan mengapresiasi kontribusi IndiHome dalam mendukung kelanjutan pendidikan generasi muda Papua melalui bantuan ke Yayasan Panti Asuhan Sayap Kasih, Kampung Harapan, dan Distrik Sentani Jayapura Papua. ""Kalian adalah aset masa depan Papua, jangan takut bermimpi, saya yakin suatu hari nanti akan lahir pemimpin-pemimpin dari sini. Karena saya sendiri tidak pernah menyangka akan menjadi Menteri,"" ujarnya untuk menyemangati anak asuh binaan IndiHome di Yayasan Panti Asuhan Sayap Kasih, Jayapura Papua. Sebelumnya, dalam rangka memeriahkan pembukaan PON XX Papua 2021, IndiHome menggelar kegiatan seni musik di tujuh booth berbeda di berbagai venue PON XX. Hadir dalam kegiatan tersebut, talenta binaan IndiHome seperti Marcelina Murtya Umar, pemenang kompetisi Gita dan Nada Papua bersama IndiHome pada 30 April 2021. Acara semakin meriah, pengunjung ikut bernyanyi riang gembira menyaksikan penampilan dari Sanggar Tari Vans Palara yang berarti pencinta alam raya dengan mayoritas anggota komunitas berusia anak-anak hingga remaja. Dalam penyelenggaraan PON XX Papua 2021 ini, TelkomGroup hadir sebagai official platinum telco partner melalui penyediaan digital connecitivity, digital platform, dan digital services di berbagai venue. TelkomGroup menyediakan layanan internet dengan total bandwidth lebih dari 11,5 Gbps yang dilengkapi sistem pencadangan (backup), termasuk pengamanan pada network security. TelkomGroup menyediakan 142 IndiHome, 427 access point internet nirkabel (WiFi), 2 Satelite News Gathering dan 4 media center, yakni 1 main media center di Kota Jayapura serta 3 mini media center di Kabupaten Jayapura, Mimika, dan Merauke.",Erick Thohir Puji Komunitas Seni hingga Budaya Binaan IndiHome di Papua,panti asuhan,https://news.detik.com/berita/d-5754529/erick-thohir-puji-komunitas-seni-hingga-budaya-binaan-indihome-di-papua?single=1,"Rabu, 06 Okt 2021 08:30 WIB"
"Unggahan yang disertai narasi pembangunan musala di   dirusak kepala lingkungan (kepling) viral di media sosial (medsos). Wali Kota Medan   menyebut permasalahan itu terjadi dipicu selisih paham soal pembangunan gedung. ""Permasalahan yang saya tangkap ya, permasalahan antara rumah ibadah sama warga, jemaahnya-lah kita bilang. Ini masalah pembangunan antara teras yang mau dibangun sama mau dinaikkan ke lantai dua,"" kata Bobby setelah meninjau vaksinasi pelajar di SMPN 40 Medan, Rabu (6/10/2021). ""Apakah petugas kita di situ, kepling kita di situ mau menengahi atau seperti apa atau tersulut, tapi saya rasa kemarin sudah diselesaikan ya,"" tambah Bobby. Bobby mengatakan para pihak yang terlibat sudah berdamai. Peristiwa itu diselesaikan secara kekeluargaan. ""Sudah berdamai, mungkin kondisi di lapangan tahulah namanya seperti itu. Tapi saya rasa itu bisa diselesaikan dengan kekeluargaan,"" ucap Bobby. Meski begitu, dia meminta pihak yang terlibat cekcok harus juga bertanggung jawab bila ada yang dirugikan. ""Yang pasti, kalau misalnya ada yang merusak, tentunya harus meminta maaf. Itu saya rasa, kalau itu sudah dilakukan, tinggal berbicara sama yang berkonflik ataupun di rumah ibadahnya. Saya rasa kalau dipecahkannya, harus diganti,"" ucap Bobby. Bobby mengatakan akan mendalami persoalan ini. Namun dia mengingatkan bahwa kepling adalah pengayom masyarakat. ""Makanya tadi kita lihat, ini permasalahannya apa dulu. Kalau permasalahannya antara pribadi kepling sama masjidnya, kita berikan teguran. Karena kenapa pula masalah itu, bagaimanapun, dia pengayom masyarakat juga,"" sebut Bobby. Sebelumnya, unggahan yang disertai narasi pembangunan musala di Medan dirusak kepala lingkungan   di media sosial. Dalam video, terlihat keributan antara seorang pria yang menggunakan kopiah dengan pria yang menggunakan baju dinas ASN. Sejumlah warga di lokasi terlihat memisahkan dua pria yang ribut itu. Narasi dalam video itu menyebut keributan terjadi antara warga dan kepala lingkungan (kepling). Kepling itu disebut melakukan perusakan terhadap pembangunan musala. Keributan disebut terjadi di Musala Al Amanah yang berada di Medan Area, Kota Medan. Majelis Ulama Indonesia (MUI) Kota Medan mengungkap duduk perkara keributan itu. MUI mengatakan keributan berawal dari rencana pembangunan musala di atas tanah wakaf. ""Jadi peristiwa semalam itu bagian tak terpisah dari pembicaraan sebelumnya. Bahwa Musala Al Amanah itu berdiri di tanah wakaf,"" ucap Ketua MUI Kota Medan Hasan Matsum, Selasa (6/10). Hasan mengatakan ada panti asuhan dan tanah kosong yang biasanya dipakai warga untuk berkegiatan di atas tanah itu. Keributan disebut terjadi saat pengurus musala memulai pembangunan dengan menggunakan tanah kosong yang berada di dekat musala. ""Belakangan, BKM musala ingin mengembangkan musala, memperbesar dengan mengambil sebagian lahan yang terbuka tadi. Inilah masyarakat kurang setuju. Inilah persoalannya,"" tutur Hasan. Karena pengurus musala tetap ingin membangun di tanah kosong, warga kemudian menyampaikan penolakan. Warga mengklaim tanah wakaf itu diberikan untuk kepentingan masyarakat umum. ""Karena masyarakat kurang setuju, terjadi keributan. Menurut versi masyarakat, dari keterangan ahli waris yang memiliki wakaf, yang membuat wakaf ini kan sudah meninggal, kata ahli waris itu lahan ini untuk kepentingan umum. Makanya terjadi insiden semalam,"" kata Hasan. Dia mengatakan telah ada pertemuan antara camat, lurah, kepling, pengurus masjid, dan kepolisian. Pembangunan masjid itu diputuskan ditangguhkan.","Viral Proyek Musala di Medan Dirusak Kepling, Begini Kata Bobby",panti asuhan,https://news.detik.com/berita/d-5755513/viral-proyek-musala-di-medan-dirusak-kepling-begini-kata-bobby?single=1,"Rabu, 06 Okt 2021 16:07 WIB"
"PT Taspen (Persero) memberikan bantuan senilai Rp 50 juta kepada Yayasan Yatim Piatu Da'arul Rahman, Pejaten, Jakarta Selatan. Bantuan ini merupakan bagian dari program tanggung jawab sosial dan lingkungan (TJSL) Taspen Peduli. Bantuan tersebut diserahkan oleh Komisaris Utama Taspen Suhardi Alius dan Direktur Utama Taspen A.N.S Kosasih kepada Ketua Yayasan Yatim Piatu Da'arul Rahman KH. Ahmad Saiful Habib, SE di Aula Kantor Taspen Cabang Jakarta Selatan, Jumat (17/9). ""Taspen terus berkomitmen mengusung semangat Taspen Peduli dalam setiap program tanggung jawab sosialnya. Sebagai perusahaan asuransi dan bergerak di bidang sosial, kami tidak hanya memberikan kepedulian dan dukungan kepada pihak atau kelompok tertentu. Program TJSL kali ini merupakan wujud nyata partisipasi aktif kami dalam memberikan kepedulian dan dukungan kepada seluruh lapisan masyarakat dengan berbagai latar belakang,"" kata A.N.S Kosasih dalam keterangan tertulis, Minggu (19/9/2021). ""Kami berharap bantuan kali ini dapat dimanfaatkan sebaik mungkin untuk kebutuhan dan pemenuhan beberapa rencana yayasan ke depan. Taspen akan tetap berkomitmen menjalankan beragam program TJSL yang sejalan dengan core bisnis perusahaan dan memberikan dampak yang signifikan bagi seluruh masyarakat Indonesia,"" sambung Kosasih. Ketua Yayasan Yatim Piatu Da'arul Rahman KH. Ahmad Saiful Habib menyampaikan apresiasi atas bantuan yang diberikan Taspen. Ia mengatakan bantuan kali ini akan dimanfaatkan untuk kebutuhan yayasan, terutama proyek perluasan asrama yang saat ini sedang dilakukan. ""Kami berharap, bantuan yang diberikan ini dapat memberikan kebaikan bagi seluruh pihak dan menjadi amal ibadah,"" ungkap Ahmad. Kosasih menambahkan sebelumnya Taspen memberikan bantuan serupa kepada beberapa yayasan panti asuhan dan panti sosial. Pada momen HUT ke-58, Taspen memberikan bantuan sebesar Rp 400 juta kepada Pesantren An Nawawi Tanara (PENATA) di Serang, Banten. Taspen juga memberikan Rp 100 juta kepada Yayasan Beri Perubahan Yogyakarta, dan Rp 55,8 juta kepada Panti Sosial Asuhan Anak Balita Tunas Bangsa Jakarta. Selain itu, Taspen memberikan bantuan kepada Yayasan Cinta Qur'an Jakarta, Rumah Piatu Muslimin Jakarta, Panti Asuhan Aisyiyah Jakarta, Panti Asuhan Bersinar Jakarta, Yayasan TPA Al-Istiqomah Bekasi dan bantuan senilai Rp 25 juta kepada Panti Sosial Tresna Werdha Budi Mulia Jakarta berupa perlengkapan kebersihan. Kosasih menyampaikan bantuan-bantuan tersebut merupakan program TJSL yang rutin dijalankan Taspen dalam rangka meningkatkan kesejahteraan sosial dan kualitas pendidikan di berbagai yayasan yatim piatu dan panti sosial. Kosasih menyatakan komitmen perusahaan dalam menjalankan program TJSL membuat Taspen meraih empat penghargaan di ajang Nusantara CSR Awards 2021 untuk kategori pilar sosial, ekonomi, dan lingkungan pada beberapa waktu lalu.",Taspen Beri Bantuan Rp 50 Juta ke Ponpes Yatim Piatu Da'arul Rahman,panti asuhan,https://news.detik.com/berita/d-5730669/taspen-beri-bantuan-rp-50-juta-ke-ponpes-yatim-piatu-daarul-rahman?single=1,"Minggu, 19 Sep 2021 17:02 WIB"
"Panel hakim Pengadilan   (Turkey Tribunal) di Swiss mendengarkan kesaksian dua korban penyiksaan dan aktivis HAM. Salah satu korbannya mengaku dipaksa mengklaim diri sebagai anggota partai terlarang. Seperti dikutip dari laman lembaga HAM, Stockholm Center for Freedom, Rabu (22/9/2021) Turkey Tribunal merupakan sebuah pengadilan internasional simbolis yang dipimpin masyarakat sipil. Pengadilan ini didirikan untuk mengadili pelanggaran HAM di  . Menurut laporan oleh Bünyamin Tekin, para hakim pertama kali mendengar kesaksian Mehmet Alp, seorang guru yang bekerja di sebuah sekolah pemerintah. Dia mengaku diculik oleh badan intelijen Turki MİT di Cizre pada 18 April 2015. Alp dipaksa menandatangani pernyataan yang menuduhnya mendorong murid-muridnya untuk bergabung dengan Partai Pekerja Kurdistan (PKK) yang dilarang. Dia mengatakan dia diancam di bawah todongan senjata untuk menandatangani sebuah dokumen. Setelah insiden ini, Alp mengatakan dia tidak memberi tahu siapa pun karena takut. Dia dipenjara pada tahun 2016. Saat dia di penjara, kudeta terjadi di Turki pada 15 Juli 2016, yang secara dramatis mengubah iklim politik di negara itu. Pemerintah yang berkuasa melancarkan tindakan keras terhadap lawan politik dengan dalih perjuangan anti-kudeta. Meskipun Alp berada di penjara pada saat kudeta berlangsung, dia didakwa terlibat dalam kudeta. Dia mengatakan dia mengalami penyiksaan yang menyebabkan pendarahan internal dan ditolak perawatan medisnya. ""Kami tidak hanya menyiksa Anda, kami juga menyiksa istri Anda dan anak-anak Anda akan berakhir di panti asuhan. Jadi jika Anda mencintai keluarga Anda, maka jangan beri tahu pengadilan bahwa Anda disiksa,"" kata Alp mengutip kata-kata para penyiksanya. Alp dibebaskan oleh pengadilan sambil menunggu persidangan pada 2018, setelah itu ia melarikan diri ke Eropa untuk mencari suaka. Selain Alp, ada Erhan Dogan. Dogan adalah seorang guru sejarah yang bekerja di sekolah yang berafiliasi dengan gerakan Gulen. Dia menyatakan, pemerintahan di Ankara menuduh gerakan Gulen, sebuah kelompok berbasis agama yang diilhami oleh ulama Turki, Fethullah Gulen, berada di balik kudeta Turki yang gagal. Namun, gerakan tersebut menyangkal keterlibatan apapun dengan kudeta atau aktivitas lainnya. Dogan mengatakan dia ditahan 10 hari setelah kudeta gagal itu dan dibawa ke gym yang digunakan sebagai pusat penahanan setelah upaya kudeta oleh unit kontraterorisme (TEM) Departemen Kepolisian Ankara. ""Saya dipukuli, ditelanjangi dan dipukul dengan tongkat,"" kata Dogan. Hakim Ketua Dr. Françoise Barones Tulkens bertanya apakah dia bisa menceritakan metode kekerasan lain yang dia alami selain pemukulan. Dogan mengatakan polisi juga melecehkannya. Dogan mengatakan polisi meminta dia memberi mereka nama setidaknya 10 orang, dan menjanjikan akan dibebaskan jika dia melakukannya. Dogan mengatakan ia juga melihat polisi membawa tiga wanita ditahan dengan tahanan lain. Setelah Dogan, Eren Keskin, seorang pengacara dan aktivis HAM di Turki, bersaksi secara daring melalui panggilan video. Keskin mengatakan masalah yang paling mendesak dalam hal penyiksaan adalah sulitnya mendokumentasikan penyiksaan. Untuk diketahui, peradilan independen ini mengklaim telah memberikan kesempatan pada pemerintah Turki untuk melakukan pembelaan. Namun, pemerintah Turki tidak memakai haknya ini. Pengadilan ini akan mengumumkan putusannya juga akan dipublikasikan lewat situsnya.",Korban Pelanggaran HAM di Turki Bersuara di Turkey Tribunal,panti asuhan,https://news.detik.com/internasional/d-5735187/korban-pelanggaran-ham-di-turki-bersuara-di-turkey-tribunal?single=1,"Rabu, 22 Sep 2021 14:44 WIB"
"Hal itu diungkapkannya saat menjadi pembicara utama secara virtual 'Festival Beasiswa Nusantara, Dari Daerah untuk Indonesia'. Beasiswa, kata dia, memiliki tujuan utama meringankan biaya pendidikan. ""DPD RI ingin mengingatkan agar para pengelola beasiswa memperhatikan asas keadilan dan ketepatan sasaran penerima beasiswa,"" kata LaNyalla dikutip dalam keterangan tertulis, Senin (4/10/2021). Ia menuturkan dalam situasi pandemi Covid-19 cukup banyak pelajar dan mahasiswa yang terpaksa putus sekolah atau kuliah, karena ketidakmampuan membayar biaya pendidikan. ""Tidak jarang di antara mereka karena menunggak SPP selama berbulan-bulan, akhirnya memutuskan berhenti sekolah dan terpaksa harus bekerja membantu orang tua dan bahkan memutuskan menikah di usia dini,"" cetus LaNyalla. Ia menganggap sudah seharusnya pengelola beasiswa berani mengambil diskresi, agar asas manfaat dari program-program tersebut lebih tepat sasaran di tengah dampak pandemi COVID-19. Selain itu, lanjut LaNyalla, penyelenggara beasiswa sebaiknya memprioritaskan para korban bencana alam juga penting. Ia mengemukakan dalam beberapa kunjungannya ke daerah, masih banyak didapati anak-anak korban bencana alam yang menjadi yatim atau bahkan yatim piatu, belum mendapatkan akses pelayanan pendidikan yang memadai di tempat penampungan atau panti asuhan. ""Jadi, sekali lagi, selain harus mempertimbangkan asas keadilan, program beasiswa ini juga harus memperhatikan asas ketepatan sasaran. Sehingga, benar-benar memberi manfaat dan sesuai dengan amanat konstitusi yang tertulis dengan sangat jelas di dalam pasal 31 Undang-Undang Dasar Negara Republik Indonesia, di mana negara bertanggung jawab atas pendidikan warga negaranya,"" urai LaNyalla. Ia menambahkan pemerintah sesungguhnya memiliki cukup banyak program beasiswa, baik yang berasal dari program kementerian dan lembaga, maupun program khusus yang telah dicanangkan oleh Presiden. Salah satunya program Kartu Indonesia Pintar (KIP untuk pelajar maupun mahasiswa. Ada pula beasiswa Lembaga Pengelola Dana Pendidikan (LPDP) yang memberikan beasiswa hingga jenjang S-3 di luar negeri. Selain itu, ada beasiswa Dikti yang diperuntukkan bagi tenaga pendidik dan dosen, juga sampai jenjang S-3. ""Tercatat pula program beasiswa yang dikelola langsung Kemendikbud, juga sampai jenjang S-3 di luar negeri. Kementerian Agama juga membuka Program Beasiswa Santri Berprestasi atau PBSB. Begitu pula Kementerian Perindustrian melalui beasiswa pendidikan vokasi khusus garmen dan tekstil. Juga Kementerian Perdagangan untuk program Akademi Metrologi dan Instrumentasi,"" ulas LaNyalla. Di sektor telekomunikasi dan cyber, Kementerian Kominfo membuka peluang beasiswa untuk mereka yang ingin mendalami bidang-bidang tersebut. LaNyalla menjabarkan pemerintah juga memberikan prioritas penerima KIP mahasiswa kepada para calon mahasiswa yang berasal dari daerah 3 T, serta mereka yang berasal dari daerah yang terimbas konflik sosial dan terkena bencana alam. Termasuk juga para calon mahasiswa yang berasal dari Papua atau Papua Barat. Sementara itu, terkait Festival Beasiswa Nusantara, Dari Daerah untuk Indonesia, Senator asal Jawa Timur itu mengatakan kegiatan tersebut penting dalam rangka peningkatan kualitas Sumber Daya Manusia (SDM), khususnya pelajar dan mahasiswa Indonesia. Apalagi, sambungnya, informasi tentang program beasiswa masih belum secara luas dapat diakses, khususnya di daerah-daerah pelosok Tanah Air. ""Sudah seharusnya DPD RI sebagai wakil daerah memiliki tanggung jawab untuk ikut melakukan penyebaran informasi, sekaligus melakukan fungsi pengawasan atas pelaksanaan program-program tersebut,"" cetus LaNyalla.","Ketua DPD Minta Kriteria Penerima Beasiswa Diperluas, Ini Alasannya",panti asuhan,https://www.detik.com/edu/beasiswa/d-5752612/ketua-dpd-minta-kriteria-penerima-beasiswa-diperluas-ini-alasannya?single=1,"Senin, 04 Okt 2021 17:58 WIB"
"Kejadian   fiktif pesan makanan online kembali terjadi. Kini dialami oleh seorang driver ojol yang mendapat orderan martabak senilai Rp 208 ribu. Melalui video YouTubenya (22/09), seorang pembina yayasan menceritakan tentang seorang driver yang mengalami orderan fiktif. Driver tersebut bernama Mustofa. Dalam videonya memperlihatkan suasana di yayasan di mana Mustofa tengah menyerahkan makanan dari orderan fiktif. Kepada detikcom (24/09) Mawaddah menceritakan kronologinya. Mustofa merupakan driver dari jasa pesan antar makanan Shopee Food. Saat itu, Mustofa mendapat   martabak sebanyak 9 porsi. Total biaya dari orderan tersebut adalah Rp 208 ribu. Orderan itu kemudian ditujukan ke daerah Cengkareng, Jakarta Barat sesuai dengan alamat kustomer. ""Sekitar jam 23.30 malam itu memang kita habis pengajian. Tiba-tiba ada driver Shopee Food ke yayasan,"" ujar Mawaddah. Lebih lanjut, Mawaddah juga menjelaskan bahwa biaya kerugian yang dialami oleh Mustofa akan diganti oleh pihak Shopee Food. Karenanya ia harus menyerahkan makanan ke yayasan. ""Biar uangnya bisa diganti oleh Shopee Food, makanannya harus diberikan ke panti atau yayasan dengan bukti foto dan kwitansi gitu,"" tuturnya. Karena saat kejadian sudah larut malam, awalnya Mustofa kesulitan untuk mencari panti asuhan. Mustofa kemudian ditemani oleh keponakannya malam-malam untuk mencari panti yang masih buka. Kemudian mereka diarahkan oleh masyarakat sekitar untuk ke yayasan Al Karimiyah yang berlokasi di Jalan H. Taha, Kelapa Dua, Kebon Jeruk, Jakarta Barat. Mawaddah menceritakan bahwa anak-anak di yayasan senang dan bersyukur dengan kedatangan Mustofa. Selai itu, Mawaddah juga memuji kebijakan dari perusahaan layanan pesan antar makanan. Mawaddah menjelaskan bahwa sebelumnya yayasannya juga beberapa kali menerima makanan dari driver yang mengalami orderan fiktif. ""Kebijakan Shopee Food sangat luar biasa. Sudah 5 kali kami mendapat keberkahan dari adanya kebijakan Shopee Food ini, yaitu  , nasi goreng, martabak, pizza, kopi,"" tutup Mawaddah. Belakangan ini memang marak kejadian orderan fiktif yang dialami oleh driver ojol atau driver pengantar makanan. Sebelumnya juga ada driver yang mengalami hal serupa.",,panti asuhan,https://food.detik.com/info-kuliner/d-5737854/terulang-lagi-driver-ojol-dapat-orderan-fiktif-martabak-rp-208-ribu?single=1,"Jumat, 24 Sep 2021 14:00 WIB"
