artikel,judul,keyword,link,tanggal
"Sebanyak 47 dokter di Jatim meninggal terpapar COVID-19 selama Bulan Juli. Ketua  , Dr dr Sutrisno SpOG (K) memberikan 6 pesan kepada dokter yang tengah berjibaku menangani pasien COVID-19. ""Pesannya kepada para dokter, pertama, harus menghemat tenaga dengan cara mengatur jadwal, mengurangi praktik pribadi kepada pasien-pasien yang elektif. Kemudian mengutamakan pasien-pasien yang emergency dan berfokus pada pelayanan COVID-19,"" kata Sutrisno saat dihubungi detikcom, Selasa (27/7/2021). Kedua, Sutrisno berpesan agar para   yang bertugas menjaga hidup sehat, istirahat yang cukup dan olahraga. Lalu menurunkan berat badan bagi yang kelebihan berat badan. ""Banyak makanan sayuran dan buah, banyak kena sinar matahari, dan selalu bersemangat,"" ujarnya. Ketiga, rajin dan disiplin pada protokol kesehatan yang ketat untuk para tenaga kesehatan (nakes). Baik di RS atau tempat pelayanan di luar RS atau di masyarakat. Serta lebih banyak tinggal di rumah. ""Keempat, mengutamakan memberikan pelayanan lewat telemedicine atau medsos sehingga mengurangi kontak dengan pasien,"" tambahnya. Pesan kelima, Sutrisno meminta   agar selalu meng-update ilmu. Kemudian mengikuti perkembangan ilmu terbaru. ""Kompak dengan teman-teman profesi dan organisasi profesi, dan mengikuti regulasi profesi yang berlaku dan berubah setiap waktu,"" terangnya. ""Terakhir yang keenam, kontak dengan tim medikasi bila ada masalah dengan diri sendiri, dan keluarga yang terpapar COVID-19,"" pungkasnya.",6 Pesan IDI Jatim ke Dokter yang Berjibaku Tangani Pasien COVID-19,organisasi profesi,https://news.detik.com/berita-jawa-timur/d-5658130/6-pesan-idi-jatim-ke-dokter-yang-berjibaku-tangani-pasien-covid-19?single=1,"Selasa, 27 Jul 2021 10:01 WIB"
"Oleh karena itu, menjaga daya tahan tubuh adalah hal wajib yang akan terus menjadi ritual umat manusia, baik saat pandemi seperti sekarang hingga seterusnya. Tak lupa, protokol kesehatan 3M (memakai masker, menjaga jarak, mencuci tangan) harus tetap dijaga di samping menjaga daya tahan tubuh agar tak mudah terinfeksi virus Corona. Pada 14 Juli 2021 lalu, Kementerian Kesehatan RI menandatangani Revisi Protokol Tatalaksana COVID-19 yang disusun oleh lima organisasi profesi, yaitu Perhimpunan Dokter Paru Indonesia (PDPI), Perhimpunan Dokter Spesialis Kardiovaskular Indonesia (PERKI), Perhimpunan Dokter Spesialis Penyakit Dalam Indonesia (PAPDI), Perhimpunan Dokter Anestesiologi dan Terapi Intensif Indonesia (PERDATIN), dan Ikatan Dokter Anak Indonesia (IDAI). Dalam pedoman tersebut terdapat suplemen standar untuk pencegahan dan pengobatan gejala COVID-19, yaitu multivitamin yang mengandung     serta Vitamin D.   dapat merangsang pembentukan antibodi dalam tubuh dan merupakan komponen antioksidan yang baik untuk menangkal radikal bebas.  merupakan mineral yang berperan penting bagi regenerasi sel-sel tubuh yang rusak serta bermanfaat dalam memaksimalkan fungsi sistem imun tubuh. Sementara   berperan penting bagi keberlangsungan berbagai sistem pada metabolisme tubuh dan persyarafan sehingga energi tubuh terjaga. Suplemen yang dapat menjadi pilihan adalah C2FIT. Sebab C2FIT memiliki kandungan ZINC, Vitamin C, Vitamin B Kompleks dengan dosis tinggi dan telah memenuhi standar yang telah ditetapkan Kementerian Kesehatan bersama lima organisasi profesi tersebut. Selain itu, C2FIT dilengkapi dengan teknologi   untuk memastikan vitamin yang dikandungnya dapat terserap optimal dan bekerja melindungi tubuh hingga 24 jam. Vitamin C yang ada pada C2FIT merupakan Vitamin C generasi ke-3 yang aman bagi lambung. Dengan begitu, C2FIT aman untuk dikonsumsi orang yang memiliki masalah asam lambung. Mari tingkatkan daya tahan tubuh untuk Indonesia kembali sehat!",,organisasi profesi,https://health.detik.com/advertorial-news-block/d-5654286/simak-ini-revisi-suplemen-standar-pengobatan-covid-19-dari-kemenkes?single=1,"Sabtu, 24 Jul 2021 00:00 WIB"
"Berdasarkan  -19 dalam Protokol Tatalaksana COVID-19 oleh lima organisasi profesi, Azithromycin dan Oseltamivir tidak lagi direkomendasikan sebagai terapi utama COVID-19, khususnya untuk pasien isoman. Apa alasannya? Lantas, berbahayakah jika obat-obatan tersebut tetap dikonsumsi pasien COVID-19? Guru besar Fakultas Farmasi Universitas Gadjah Mada (UGM) Prof Dr apt Zullies Ikawati menyebut revisi rekomendasi obat adalah hal wajar yang disebabkan oleh perkembangan bukti-bukti klinis baru seiring penggunaan obat, khususnya pada COVID-19, yang hingga kini belum ada obat yang terbukti ampuh menyembuhkan pasien. Dalam protokol tata laksana COVID-19 disebutkan, Oseltamivir bukan obat COVID-19. Obat ini hanya diberikan jika terdapat kecurigaan ko-infeksi influenza pada pasien COVID-19. ""Oseltamivir diberikan secara empiris pada masa awal pandemi COVID-19 karena sulitnya membedakan gejala pasien COVID-19 dan pasien yang terinfeksi virus influenza. Saat ini Oseltamivir dapat ditambahkan pada pasien dengan COVID-19 dan diduga terinfeksi virus influenza dengan dosis 2 x 75 Mgo,"" terang Prof Zullies kepada  , Kamis (15/7/2021). Dalam  -19 disebutkan, Azithromycin kini hanya perlu diberikan kepada pasien COVID-19 suspek kasus berat dan kritis, dengan kecurigaan ko-infeksi dan mikroorganisme. Dalam kesempatan lainnya, dokter penyakit menular asal AS, dr Faheem Younus menjelaskan, antibiotik seperti Azithromycin adalah obat untuk bakteri, bukan virus sebagaimana penyebab COVID-19 (virus Corona). Menurutnya, 93 persen pasien COVID-19 tidak membutuhkan obat ini. Jika digunakan secara sembarangan, justru bisa menyebabkan resistensi. ""Masalah penggunaan antibiotik adalah, ketika ini menimbulkan semacam efek samping. Jadi Anda akan mengalami masalah B di atas masalah A (yaitu) ketika Anda berhenti mengkonsumsi antibiotik, Anda tidak bisa mengenali mana efek samping antibiotik dan mana gejala COVID-19,"" terangnya dalam diskusi daring, Sabtu (17/7/2021). ""Ketika Anda mengkonsumsi terlalu banyak (obat antibiotik), itu bisa menimbulkan resistensi. Artinya, ketika Anda membutuhkan antibiotik untuk membunuh bakteri 2 tahun ke depan, obat itu tidak akan bekerja,"" lanjut dr Faheem. Prof Zullies menambahkan, pada dasarnya, COVID-19 adalah penyakit yang bisa sembuh dengan sendirinya tanpa obat, selama pasien tidak memiliki riwayat penyakit berat tertentu. Yang penting, pasien mengupayakan penguatan daya tahan tubuh dan rutin memantau kondisi fisik. Misalnya, dengan mengecek saturasi oksigen menggunakan  . ""Penyakit ini kan penyakit karena virus, yang sebetulnya sih bisa sembuh sendiri kayak flu. Itu kan bisa sembuh sendiri, sehingga yang harus dikuatkan adalah sistem imun,"" terang Prof Zullies. ""Untuk menguatkan sistem itu kan banyak cara. Di samping menggunakan vitamin, itu juga dari makanan yang sehat, istirahat yang cukup, kemudian berjemur untuk mendapatkan tambahan vitamin D. Kemudian jangan cemas karena cemas bisa mempengaruhi sistem imun,"" pungkasnya terkait  -19 seperti Oseltamivir yang sempat marak diborong.",,organisasi profesi,https://health.detik.com/berita-detikhealth/d-5651286/obat-covid-19-untuk-pasien-isoman-direvisi-obat-obat-ini-tidak-wajib-lagi?single=1,"Rabu, 21 Jul 2021 15:58 WIB"
"Beberapa waktu lalu, komunitas psikolog klinis dalam Ikatan Psikolog Klinis (IPK) Indonesia dihebohkan dengan foto-foto yang dipublikasikan oleh organisasi psikologi lain yang cukup terkenal. Foto itu menampilkan banyak orang di Wisma Atlet dengan pakaian alat pelindung diri (APD) COVID-19 yang dibuka setengah untuk menunjukkan kaos identitas dari organisasi psikologi tersebut. Tagar yang disematkan di  -an Instagram memperingati ulang tahun organisasi tersebut. Seketika para psikolog klinis sebagai tenaga kesehatan dan tergabung dalam organisasi profesi resmi psikolog klinis mengkritik publikasi foto tersebut. Selain melanggar protokol kesehatan, foto-foto pencitraan untuk meraih simpati kala situasi genting saat ini di Wisma Atlet adalah tidak etis dan tidak berempati. Foto-foto itu pun kemudian dihapus, tanpa klarifikasi atau permintaan maaf sampai saat tulisan ini dibuat. Pencitraan dengan memanfaatkan pandemi merupakan indikator matinya empati. Sangat disayangkan, ketidakpedulian ini justru ditunjukkan oleh organisasi psikologi yang beranggotakan orang-orang yang mengerti tentang ilmu psikologi dan bahkan dilatih untuk berempati. Apa itu empati? Empati berasal dari kata   yaitu bahasa Yunani Kuno yang artinya afeksi fisik. Dua filsuf Herman Lotze dan Robert Vischer menyerap makna   untuk menciptakan istilah dalam bahasa Jerman yaitu e  yang berarti memasuki perasaan orang lain. Istilah empati sendiri dipopulerkan oleh psikolog Inggris yaitu Edward B. Titchener pada tahun 1909 yang merupakan terjemahan dari kata  . Empati adalah kemampuan seseorang untuk mengerti atau memahami apa yang orang lain rasakan secara emosional. Seseorang yang memiliki empati akan mudah membayangkan dirinya berada dalam posisi orang lain atau melihat sesuatu dari kacamata orang lain. Kemampuan ini sangat penting bagi psikolog untuk membantu klien atau pasien dalam memecahkan masalah psikologis maupun dalam menyembuhkan trauma psikologis yang dialami oleh klien atau pasiennya. Daniel Goleman dalam bukunya berjudul   memasukkan empati sebagai bagian dari kecerdasan emosi yang selayaknya dimiliki oleh setiap orang agar dapat berinteraksi dan menjalin relasi dengan baik satu sama lain. Lima elemen kunci dari empati menurut Goleman adalah memahami perasaan orang lain, bereaksi terhadap kebutuhan orang lain, mendahulukan kepentingan orang lain, menerima perbedaan dan memahami kepentingan dalam suatu kelompok tertentu. Empati adalah kunci utama manusia untuk menjaga keharmonisan dalam interaksi sosialnya sebagai makhluk sosial yang tidak dapat hidup sendiri. Berbagai masalah dalam hubungan manusia saat ini terjadi karena tidak adanya rasa empati. Setiap orang atau pihak yang terjebak dalam ego akan merasa dirinya paling benar dibandingkan orang lain. Pada akhirnya mereka bertindak tanpa mempedulikan apa yang dirasakan atau dipikirkan oleh orang lain. Saat ini, negara kita sedang dilanda gelombang kedua pandemi COVID-19. Situasinya sangat kritis karena COVID-19 varian Delta memiliki daya penularan tinggi di segala usia sehingga lonjakan penderita COVID-19 tak terelakkan. Pemerintah dan tenaga kesehatan bekerja lebih keras untuk menangani lonjakan ini. Fasilitas kesehatan dan tenaga kesehatan tidak sebanding dengan jumlah penderita COVID-19 berat yang terus berdatangan. Fasilitas kesehatan pun penuh, banyak orang mengantre dan berburu oksigen untuk anggota keluarganya karena terpaksa harus merawatnya sendiri di rumah. Banyak orang berduka kehilangan orang-orang tercinta dalam perpisahan yang sangat cepat tanpa ada seremoni perpisahan. Saatnya kita bersama menyalakan empati dalam diri kita. Empati berbeda dengan simpati. Empati akan menggerakkan kita pada perilaku moral yang baik dan perilaku tolong-menolong, sementara simpati hanya sebatas rasa senang atas perilaku baik yang dilakukan oleh orang lain. Cara menyalakan empati dalam diri kita sangat sederhana. Mari kita lihat tenaga kesehatan yang berjibaku melayani penderita COVID-19. Bagaimana rasanya jika diri kita menjadi tenaga kesehatan yang harus melayani pasien COVID-19 bergejala berat yang terus berdatangan? Bagaimana rasanya jika diri kita menjadi tenaga kesehatan di IGD yang rentan terpapar virus COVID-19? Bagaimana rasanya jika diri kita menjadi tenaga kesehatan yang akhirnya terkulai dalam lelah, bahkan dinyatakan tertular COVID-19? Jika empati kita mulai menyala, kita akan tergerak untuk melakukan sesuatu. Kita akan tergerak untuk membantu dan menolong para tenaga kesehatan saat ini. Mulai dari hal sederhana saja, yaitu agar diri kita tidak tertular atau menularkan COVID-19 dengan cara menjaga protokol kesehatan yang ada, misalnya memakai masker, mencuci tangan, menjaga jarak, menjauhi kerumunan, dan mengurangi mobilitas. Mari kita contoh orang-orang di sekitar kita yang sudah menyalakan empati di kala puncak pandemi ini. Beberapa penjual obat, vitamin, atau agen-agen oksigen tidak menaikkan harga selama pandemi. Pengrajin peti mati susah payah mencari kayu untuk menyediakan peti mati meski harga tetap. Para relawan pemulasaraan jenazah terus bertambah dan tak kenal lelah. Beberapa pemuda lulusan tenaga kesehatan merelakan diri tidak ikut seleksi ASN untuk menjadi relawan tenaga kesehatan. Banyak orang meminjamkan tabung oksigen tanpa minta bayaran atau sekadar mendahulukan antrean oksigen untuk orang lain yang lebih membutuhkan.  Banyak lagi perilaku tolong-menolong dan moral yang baik yang didasari karena adanya rasa empati. Jika empati terus menyala dan menyebar, maka perusahaan-perusahaan tidak akan memborong obat-obatan dan oksigen hanya untuk stok karyawannya, orang-orang tidak akan menimbun oksigen hanya untuk memenuhi rasa aman, dan tentunya partai atau organisasi tidak memanfaatkan puncak pandemi ini hanya untuk sekadar pencitraan, apalagi pencitraan dalam rangka ulang tahun organisasinya.",Menyalakan Empati Kala Puncak Pandemi,organisasi profesi,https://news.detik.com/kolom/d-5652607/menyalakan-empati-kala-puncak-pandemi?single=1,"Kamis, 22 Jul 2021 14:27 WIB"
"Ketua MPR RI Bambang Soesatyo (Bamsoet) mendukung usulan Pengurus Besar Ikatan Dokter Indonesia (PB IDI) dan Majelis Kehormatan Etik Kedokteran (MKEK) agar pemerintah segera menerbitkan peraturan turunan dari UU No. 29/2004 tentang Praktik Kedokteran. Dengan begitu diharapkan memberikan ketenangan bagi para dokter dan tenaga kesehatan (Nakes) yang sedang menjalankan tugas. Sehingga mereka tak perlu was-was dituntut secara pidana sebelum ada hasil dari sidang kode etik. ""Dokter dan Nakes harus mendapatkan kepastian dan ketenangan dalam menjalankan pelayanan medis. Apabila ada pelanggaran yang dilakukan dokter dalam pelayanan medis, maka yang berhak memeriksa pertama adalah mahkamah etik. Jika hasil sidang kode etik ditemukan pelanggaran, maka baru diputuskan apakah pelanggaran oleh dokter tersebut cukup selesai di peradilan etik atau bisa dituntut secara pidana,"" ujar Bamsoet dalam keterangannya, Senin (19/7/2021). Usai menghadiri rapat virtual dengan PB IDI, Ketua DPR RI ke-20 ini menambahkan aturan serupa sebelumnya pernah diterapkan dalam Undang-Undang Republik Indonesia No 40 Tahun 1999 Tentang Pers. Aturan tersebut menyebut insan pers yang melakukan pelanggaran saat menjalankan tugas jurnalistik, tidak bisa langsung dipidanakan, melainkan ditangani terlebih dahulu oleh Dewan Pers. ""Sama seperti insan pers, penegakkan hukum berjenjang bagi profesi kedokteran sangatlah penting. Semua kasus kedokteran harus melewati aturan kode etik dan kedisiplinan profesi kedokteran. Jika tidak ditemukan unsur pidana oleh mahkamah etik, maka kasus pelanggaran tersebut tidak perlu dilanjutkan ke pengadilan umum,"" kata Bamsoet. Ketua Umum Pengurus Besar Keluarga Olahraga Tarung Derajat ini menyebut, PB IDI dan MKEK mendukung rencana MPR RI mendorong pemerintah dalam membentuk Mahkamah Etik (Peradilan Etik). Sehingga setiap putusan etika yang diputuskan berbagai penegak kode etik yang terdapat di berbagai lembaga negara maupun organisasi profesi, tidak lagi dihadapkan dengan peradilan umum. ""Landasan pembentukan Mahkamah Etik mengacu kepada TAP MPR Nomor VI/MPR/2001 tentang Etika Kehidupan Berbangsa dan Bernegara. Perserikatan Bangsa-Bangsa (PBB) dalam Sidang Umum tahun 1996 telah merekomendasikan agar seluruh negara anggotanya, termasuk Indonesia, membangun ethic infrastructure in public offices, yang mencakup kode etik dan lembaga penegak kode etik,"" pungkas Bamsoet.",Pemerintah Diminta Segera Terbitkan Turunan UU Praktik Kedokteran,organisasi profesi,https://news.detik.com/berita/d-5649506/pemerintah-diminta-segera-terbitkan-turunan-uu-praktik-kedokteran?single=1,"Senin, 19 Jul 2021 21:55 WIB"
"Sejumlah organisasi profesi merevisi rekomendasi tatalaksana COVID-19, termasuk penggunaan obat   dan Azithromycin. Oseltamivir tak lagi dirutinkan untuk pasien COVID-19 isolasi mandiri, sementara Azithromycin disebut memiliki efek antiinflamasi yang kecil sehingga tidak lagi direkomendasikan. Direktur Pencegahan dan Pengendalian Penyakit Menular Langsung (P2PML) Kementerian Kesehatan dr Siti Nadia Tarmizi menegaskan hingga kini belum ada perubahan pedoman terkait Oseltamivir dan   untuk pasien COVID-19 bergejala ringan. Artinya, kedua obat tersebut masih digunakan untuk pasien isoman COVID-19 termasuk dalam paket obat gratis kerja sama Kemenkes dan 11 layanan telemedicine gratis. ""Belum, sampai saat ini masih digunakan. Pedoman belum direvisi,"" jelas dr Nadia saat dihubungi   Senin (19/7/2021). Menurutnya, Oseltamivir dan Azithromycin masih efektif sebagai 'obat' terapi COVID-19. Maka dari itu, bagi warga yang sudah menerima paket obat keduanya, tak perlu khawatir terkait keamanannya. Terlebih, mereka yang sudah menerima obat Oseltamivir dan Azithromycin sudah melakukan konsultasi dokter terlebih dahulu melalui layanan telemedicine gratis. ""Kan masih diperbolehkan ya di masa transisi, dan obat ini masih cukup efektif,"" beber dr Nadia. ""Iya aman (bagi yang sudah menerima obat   dan Azithromycin),"" pungkasnya.",,organisasi profesi,https://health.detik.com/berita-detikhealth/d-5648528/kemenkes-tegaskan-masih-pakai-oseltamivir-azithromycin-untuk-isoman-covid-19?single=1,"Senin, 19 Jul 2021 10:45 WIB"
"Presiden Joko Widodo (Jokowi) mendatangi sebuah apotek di Bogor, Jawa Barat. Ia menanyakan sejumlah obat yang belakangan banyak dikaitkan dengan terapi COVID-19, termasuk   dan Azithromycin. Dua obat ini, Oseltamivir dan Azithromycin, termasuk dalam paket obat isolasi mandiri (isoman) gratis dari Kementerian Kesehatan RI. Keduanya diresepkan dalam paket B, yakni untuk pasien isoman COVID-19 bergejala ringan. Paket B untuk pasien bergejala ringan berisi sebagai berikut: Meski demikian, rekomendasi terbaru 5 organisasi profesi dokter spesialis tidak lagi menyarankan kedua obat ini sebagai obat wajib. Oseltamivir misalnya, hanya diberikan bila ada kecurigaan koinfeksi influenza. Demikian juga Azithromycin yang kini tidak lagi perlu diberikan pada pasien isoman COVID-19. Awalnya, antibiotik ini diyakini memberikan efek antiinflamasi, namun belakangan tidak ditemukan bukti yang kuat.  sendiri merupakan obat antivirus yang digunakan untuk influenza tipe A dan B. Merek dagang yang cukup populer antara lain Fluvir dan Tamiflu.",,organisasi profesi,https://health.detik.com/berita-detikhealth/d-5654693/dicari-jokowi-di-apotek-oseltamivir-azithromycin-termasuk-obat-covid-19?single=1,"Jumat, 23 Jul 2021 21:53 WIB"
"Dalam revisi protokol tatalaksana COVID-19 yang dirilis sejumlah organisasi profesi, ada perubahan 'obat' COVID-19 yang diberikan pada pasien Corona bergejala ringan. Seperti obat   dan azithromycin yang tidak lagi masuk dalam anjuran rutin 'obat' terapi COVID-19 saat isolasi mandiri. Menurut Ketua Umum Perhimpunan Dokter Spesialis Penyakit Dalam Indonesia (PAPDI) Dr dr Sally Aman Nasution, SpPD K-KV FINASIM, FACP, penggunaan oseltamivir hanya akan diberikan jika pasien juga mengalami infeksi influenza. Sementara, data penggunaan azithromycin tak terbukti memiliki efek antiinflamasi yang cukup kuat. ""Untuk   dan azithromycin sebenarnya masih ada tapi dimasukkan pada terapi tambahan. Jadi tidak rutin diberikan,"" jelas Dr Sally kepada detikcom lewat pesan singkat, Kamis (15/7/2021). ""Oseltamivir diberikan kalau bersamaan dengan infeksi Influenza. Sedangkan Azitromisin, ada beberapa data yang menunjukkan bahwa hanya kecil persentasenya yang membutuhkan antibiotika, dan efek antiinflamasinya ternyata tidak terlalu kuat buktinya,"" sambungnya. Seperti diketahui, kedua obat tersebut juga berada di dalam paket obat gratis yang didapat dari layanan telemedicine kerja sama Kementerian Kesehatan RI dan 11 platform antara lain YesDok, GetWell, ProSehat, Halodoc, KlikDokter, KlinikGo, Link Sehat, Milvik Dokter, Good Doctor, SehatQ, dan Alodokter. Adalah Paket B, yang diberikan untuk pasien dengan gejala ringan. Daftar isi paket seperti berikut: dr Sally menilai revisi tersebut nanti akan menyesuaikan karena baru dirilis. Sementara bagi mereka yang sudah terlanjur mendapatkan oseltamivir maupun azithromycin aman-aman saja menggunakan kedua obat tersebut. ""Menurut saya karena revisi ini baru keluar, nanti disesuaikan saja,"" pungkasnya.",,organisasi profesi,https://health.detik.com/berita-detikhealth/d-5644673/terbaru-oseltamivir-azithromycin-kini-tak-wajib-untuk-isoman-covid-19?single=1,"Kamis, 15 Jul 2021 16:43 WIB"
"Stok   tahun 2021 di Jatim sebanyak 4.202.060. Stok ini diklaim aman dan layak untuk disembelih sebagai hewan kurban. Plt Kepala Dinas Peternakan Jatim Gunawan mengatakan, 4,2 juta ekor hewan kurban tersebut yakni sapi sebanyak 1.077.068 ekor, kemudian kambing sebanyak 2.210.226 ekor, serta domba sebanyak 914.766 ekor. ""Stok hewan kurban di Jatim aman. 4,2 juta hewan kurban itu telah layak, di antaranya sudah berumur satu tahun, sudah berganti gigi, tidak cacat, tidak sakit, termasuk tidak pincang, dan tentunya badanya tidak kurus,"" ujar Gunawan saat dikonfirmasi detikcom, Jumat (16/7/2021). Gunawan menjelaskan teknis pelaksanaan hewan kurban di Jatim tahun ini sudah diatur dalam SE Gubernur Jatim nomor 451/14901/012.1/2021 yang ditindaklanjuti dengan SE Kepala Dinas Peternakan Jatim nomor 524.3/5380/122.4.2021. Aturan itu telah diinstruksikan untuk dinas peternakan di 38 kabupaten/kota Jatim. Aturan itu di antaranya, memanfaatkan serta mengoptimalkan rumah potong hewan-ruminansia (RPH-R), agar pemotongan hewan tidak menimbulkan keramaian, serta sesuai SOP protokol kesehatan. Di dalam RPH-R juga diwajibkan menyediakan hand sanitizer, dan dilakukan disinfeksi pada titik masuk tempat produksi. Kemudian mengimbau petugas pemotong hewan untuk menerapkan prokes ketat, juga diterapkannya hygiene personal (menyediakan APD, prokes lengkap). Sedangkan bila pemotongan hewan kurban dilakukan di luar RPH-R, diwajibkan panitia/petugas berasal dari lingkungan tempat tinggal yang sama. Petugas/panitia yang berasal dari lingkungan lain (luar kota/kabupaten) harus memiliki surat keterangan sehat dari rumah sakit/puskesmas. ""Untuk petugas pemotongan harus dibedakan dengan panitia yang menangani pembagian  . Dan distribusi daging kurban dilakukan panitia ke rumah mustahik,"" terang Gunawan. Lalu, pemeriksaan penjual ternak kurban, pemotong  , serta tenaga yang membagikan hewan kurban. Selanjutnya, pedagang hewan kurban, dan tempat yang menjadi pemotongan, harus mendapat izin dari pemkot/pemkab setempat. Kemudian, sebelum hewan kurban disembelih, harus dilakukan pemeriksaan antermortem. Setelah dipotong, daging hewan kurban diharuskan untuk diperiksa postmortem. ""Dinas Peternakan juga mengimbau di kabupaten/kota berkoordinasi dengan fakultas kedokteran hewan/organisasi profesi dokter hewan untuk membantu pelaksanaan kegiatan pemotongan hewan,"" terang Gunawan. Gunawan menambahkan, Pemprov Jatim telah menyiapkan 1.000 tenaga dokter hewan dan paramedik veteriner yang tersebar di 38 kabupaten/kota.","Stok Hewan Kurban di Jatim 4,2 Juta Ekor, Diklaim Aman dan Layak Disembelih",organisasi profesi,https://news.detik.com/berita-jawa-timur/d-5645900/stok-hewan-kurban-di-jatim-42-juta-ekor-diklaim-aman-dan-layak-disembelih?single=1,"Jumat, 16 Jul 2021 15:57 WIB"
"Baru-baru ini, berdasarkan revisi Protokol Tatalaksana COVID-19 oleh 5 organisasi profesi,   tidak lagi direkomendasikan sebagai obat terapi utama   khususnya untuk pasien isoman. Disebutkan, azithromycin hanya diberikan jika ada kecurigaan koinfeksi mikroorganisme atipikal. Pendapat serupa disampaikan oleh Ketua Satgas Ikatan Dokter Indonesia (IDI), Prof Zubairi Djoerban. Menurutnya, azithromycin adalah   antibiotik yang mengatasi bakteri dan jamur, sedangkan COVID-19 disebabkan virus. ""Sehingga, tidak seharusnya pasien COVID-19 diberikan azithromycin kecuali ada infeksi bakteri sekunder. Akan tetapi, pemakaiannya tetap ditentukan oleh dokter,"" ujarnya, dikutip dari laman Twitter, Senin (19/7/2021). Ia menyebut, revisi serupa juga dikeluarkan oleh Organisasi Kesehatan Dunia (WHO). Revisi tersebut dikeluarkan lantaran sejumlah penelitian menyebut, tidak ada dampak efektif azithromycin terhadap penyembuhan COVID-19. Bahkan, penggunaan azithromycin secara tidak perlu justru bisa menimbulkan efek samping seperti resistensi. ""Kalau pemakaiannya sembarangan, terlalu banyak, tanpa indikasi yang benar, maka akan timbul resistensi. Yang resisten tentunya bukan kita, tapi bakterinya,"" ujar Prof Zubairi. ""Jadi, bakteri yang terlalu sering dapat Azitromisin, malah membuat bakteri itu resisten. Kalau mereka resisten, maka sulit diatasi.Saran saya, jangan pakai Azitromisin, kecuali memang terbukti ada infeksi bakteri, selain COVID-19,"" lanjutnya. Jika pasien COVID-19 yang menjalani isolasi mandiri sudah terlanjur mengonsumsi azithromycin, Prof Zubairi menganjurkan agar penggunaan segera dihentikan. Meski tujuannya benar yakni mengobati COVID-19, perlu diingat bahwa azithromycin bukanlah obat COVID-19. Jika pasien memerlukan pengobatan dengan antibiotik, penentuan harus berdasarkan dokter. ""Lalu, pada kondisi apa pasien Covid-19 harus memakai obat antibiotik? Penentuannya ada pada dokter. Kalau memang terbukti ada infeksi bakteri di tubuh pasien, ya memang harus memakai antibiotik,"" pungkas Prof Zubairi.",,organisasi profesi,https://health.detik.com/berita-detikhealth/d-5648354/azithromycin-ditegaskan-bukan-obat-covid-19-bagaimana-jika-terlanjur-minum?single=1,"Senin, 19 Jul 2021 07:43 WIB"
