artikel,judul,keyword,link,tanggal
"disebut harus menyelesaikan beberapa masalah agar kembali eksis di kancah perpolitikan Indonesia. Hal yang paling kuat adalah soal kekuatan sosok di partai tersebut. ""Kalau untuk sebagai peserta pemilu mungkin bisa (terjadi). KSPI atau pendukungnya bisa mencapai itu, tapi untuk menang, dapat PT (parliamentary threshold), menurut saya nggak mudah. Karena yang dihadapi pemilu besok kan partai yang relatif sudah punya pengalaman panjang. Kedua harus kuat di figur,"" kata peneliti politik UI Aditya Perdana, saat dihubungi, Senin (10/4/2021). ""Buruh punya figur kuat tanpa modal uang? Relatif nggak ada. Pemilu kita kan begitu modelnya,  ,   dukungan itu karena kepercayaan dan persoalan kita, kepercayaan terhadap kepercayaan orang di politik juga nggak bagus-bagus amat,"" katanya. Menurut Aditya, dulu KSPI menggunakan ketokohan Prabowo Subianto untuk menggerakkan massa di Pemilu 2019. Namun Prabowo adalah tokoh yang merupakan Ketua Umum Partai Gerindra. ""Dulu KSPI dukung Prabowo karena mudah mobilisasi, ada faktor figur kuat. Kini figur yang kuat siapa? Di daerah, basis kompetisi juga kuat, ada  , bupati, dinasti,"" katanya. Bagi Aditya, untuk kondisi saat ini, gerakan buruh sudah berhasil mengatasi masalah di internal mereka. Seperti memiliki daya tawar di perusahaan-perusahaan. Namun belum memiliki kekuatan pada ranah politik formal seperti partai politik. ""Kalau mobilisasi terkait dirinya, misal soal upah, nego dengan perusahaan dengan menaikkan  , mereka sudah lumayan berhasil. Kalau masuk urusan formal politik, ini di DPR, atau jadi eksekutif, perlu usaha lebih keras. Ini bukan hal mudah,"" katanya. Sebelumnya, KSPI beserta 50 federasi serikat pekerja tingkat nasional akan membangkitkan kembali Partai Buruh untuk ikut serta dalam kontestasi pemilu pada 2024 mendatang. Presiden KSPI Said Iqbal menyebut dirinya sementara sebagai calon tunggal yang akan mengisi kursi Presiden Partai Buruh. ""Calon Presiden Partai Buruh sampai hari ini menurut kawan-kawan hanya baru satu orang yang diusulkan bulat oleh 11 organisasi pendiri Partai Buruh yang baru saudara Said Iqbal. Memang mungkin bisa saja nanti sampai dengan nanti kongres ada yang bertambah, tapi bulat sampai hari ini baru satu nama yang disepakati untuk disetujui kongres, yaitu saudara Said Iqbal dari KSPI, presiden KSPI,"" kata Presiden KSPI, Said Iqbal, dalam konferensi pers di kanal YouTube 'Bicaralah Buruh', Minggu (3/10). Said Iqbal menerangkan kongres Partai Buruh akan digelar dua hari terhitung mulai besok. Sementara deklarasinya akan dilakukan pada hari terakhir kongres partai, yakni pada 5 Oktober di salah satu hotel di Jakarta. ""Kami mengundang pada tanggal 5 Oktober 2021 kepada kawan-kawan media untuk meliput penutupan kongres Partai Buruh akan diumumkan susunan pengurusnya yang baru dan juga keputusan keputusan kongres lainnya jam 10.45 WIB di Hotel Grand Cempaka Putih. Bagi yang tidak bisa hadir kami berharap bisa bergabung nanti di konferensi pers partai melalui Zoom,"" tuturnya.","Partai Buruh Dinilai Sulit Eksis, Butuh Figur Kuat",serikat buruh,https://news.detik.com/berita/d-5753297/partai-buruh-dinilai-sulit-eksis-butuh-figur-kuat?single=1,"Selasa, 05 Okt 2021 09:59 WIB"
"Partai Buruh kembali bangun usai dideklarasikan kembali di Jakarta pada Selasa, 5 Oktober 2021 kemarin. Disahkannya Omnibus Law UU Cipta Kerja menjadi alasan partai yang didirikan pada tahun 2003 oleh Muchtar Pakpahan ini bangkit kembali. Ketua Konfederasi Serikat Pekerja Seluruh Indonesia (KSPSI) Jawa Barat Roy Jinto mengatakan partai buruh muncul karena selama ini mayoritas partai yang ada tak dapat mengakomodir aspirasi dari buruh di Indonesia. ""UU Cipta Kerja telah disahkan, kalau kita tidak mempunyai kendaraan sendiri untuk memperjuangkan nasib buruh di parlemen atau eksekutif melalui jalur parpol, ternyata kita hanya menitipkan aspirasi suara partai-partai sudah ada,"" ucap Roy saat dihubungi, Rabu (6/10/2021). Melalui Partai Buruh, diharapkan semua aspirasi buruh bisa betul-betul dikawal dan diperjuangkan di jalur parlemen. ""Kami sadar betul, bahwa setiap pileg-pilpres kita hanya sebagai penyumbang suara dan tidak diperjuangkan aspirasinya,"" ujar Roy. Meski Partai Buruh kembali berdiri, ujar Roy, setiap individu buruh tetap memiliki independensi untuk menentukan arah dan suara politiknya. Walau demikian, ia mengharapkan adanya kekompakan untuk mengawal aspirasi dari buruh. ""Mendirikan partai memang orang-orang yang pengusaha dan punya duit lah, tapi kita ingin berusaha dengan modal sendiri,"" ujarnya. KSPI beserta 50 federasi serikat pekerja tingkat nasional mendeklarasikan kebangkitan kembali Partai Buruh. Presiden KSPI Said Iqbal resmi mengisi kursi Presiden Partai Buruh. Said Iqbal dipilih secara aklamasi pada partai besutan almarhum Muchtar Pakpahan itu. Tak ada nama lain yang mengajukan diri sebagai calon ketua umum selain Said Iqbal. Said Iqbal menyebut Partai Buruh didirikan oleh 11 organisasi yang disebut Majelis Rakyat Partai Buruh. Said Iqbal mengatakan Partai Buruh bukan partai dinasti. Berikut ini susunan pengurus Partai Buruh periode 2021-2026: Presiden: Said Iqbal Wakil Presiden: Agus Suproyadi Sekretaris Jenderal: Ferri Nuzarli Bendahara Umum: Luthano Budyanto Ketua Badan Pendiri (Majelis Rakyat): Sonny Pudjisasono Ketua Majelis Nasional: Agus Ruli Ardiansyah Ketua Mahkamah Partai: Riden Hatam Aziz","Partai Buruh Bangkit Lagi, KSPSI Jabar: Kita Berusaha Modal Sendiri",serikat buruh,https://news.detik.com/berita-jawa-barat/d-5755756/partai-buruh-bangkit-lagi-kspsi-jabar-kita-berusaha-modal-sendiri?single=1,"Rabu, 06 Okt 2021 17:59 WIB"
"menyambut baik kehadiran  . Ketua DPP PKS Mardani Ali Sera berharap Partai Buruh dapat berkontribusi bagi demokrasi di Indonesia. ""Bravo buat Mas Said Iqbal. Mendoakan Partai Buruh dapat memberi kontribusi positif bagi kemajuan bangsa,"" kata Mardani, kepada wartawan, Selasa (5/10/2021). Mardani mengatakan semua warga negara bebas berkontribusi dalam politik. Dia siap bekerja sama atau berkompetisi secara sehat. ""PKS senang jika semua orang baik masuk ke politik, hingga akan terwujud kompetisi antar kebaikan,"" ujarnya. ""Dan dengan basis sebagai partai kader, PKS siap bekerja sama dan berkompetisi secara sehat,"" lanjut Mardani. Sebelumnya, Konfederasi Serikat Pekerja Indonesia ( ) beserta 50 federasi serikat pekerja tingkat nasional mendeklarasikan kebangkitan kembali Partai Buruh. Presiden KSPI Said Iqbal kini resmi mengisi kursi Presiden Partai Buruh. Said Iqbal dipilih secara aklamasi pada partai besutan almarhum Muchtar Pakpahan itu. Tak ada nama lain yang mengajukan diri sebagai calon ketua umum selain Said Iqbal. Said Iqbal menyebut Partai Buruh didirikan oleh 11 organisasi yang disebut Majelis Rakyat Partai Buruh. Said Iqbal mengatakan Partai Buruh bukan partai dinasti. ""Partai buruh yang lama, Konfederasi Serikat Buruh Sejahtera Indonesia (KSBSI); Federasi Serikat Pekerja Metal Indonesia (FSPMI); Serikat Petani Indonesia (SPI); Organisasi Rakyat Indonesia; Konfederasi Perjuangan Buruh Indonesia; Konfederasi Serikat Pekerja Indonesia (KSPI); Federasi Serikat Pekerja Kimia Energi Pertambangan, Minyak, Gas Bumi, dan Umum (FSP-KEP); Federasi Serikat Pekerja Farmasi dan Kesehatan Reformasi (FSP-Farkes R),"" kata Said Iqbal setelah dilantik. Namun, ada penilaian peluang Partai Buruh sah secara legalitas kecil. Jika pun legalitas itu didapat, tantangan yang dihadapi juga sudah menunggu. ""Berat untuk mendirikan partai, UU-nya membuat berat,"" kata Direktur Saiful Mujani Research and Consulting (SMRC) Saiful Mujani kepada wartawan, Selasa (5/10).","PKS Sambut Kelahiran Partai Buruh: Siap Kerja Sama, Bahkan Adu Kuat",serikat buruh,https://news.detik.com/berita/d-5754691/pks-sambut-kelahiran-partai-buruh-siap-kerja-sama-bahkan-adu-kuat?single=1,"Rabu, 06 Okt 2021 07:10 WIB"
"mendeklarasikan rencananya turut berpartisipasi dalam kontestasi pemilu 2024 imbas . Rencananya, Partai Buruh akan mendaftarkan struktur kepengurusan yang baru ke Kementerian Hukum dan HAM (Kemenkumham) dalam satu hingga dua pekan ke depan setelah kongres digelar. ""Kira-kira dalam waktu seminggu, dua minggu ini kami akan lapor ke Kemenkumham, dan mudah-mudahan Kemenkumham bisa mengeluarkan (SK) untuk kepengurusan yang baru,"" kata Presiden Partai Buruh Said Iqbal usai Kongres IV Partai Buruh di Hotel Grand Cempaka, Cempaka Putih, Jakarta Pusat, Selasa (5/10/2021). Ia mengatakan pihaknya saat ini masih menyusun berbagai persyaratan administrasi yang dibutuhkan, termasuk akta notaris. ""Syaratnya harus ada akta notaris,"" kata dia. Dalam kongres itu, Said Iqbal menunjukkan asanya menuju pemilu 2024. Sebab, kata dia, saat ini Partai Buruh telah memiliki kantor perwakilan di 34 provinsi, 409 kabupaten/kota, dan 1.500 kecamatan. ""Dengan kata lain (untuk di tingkat kecamatan), sudah 40 persen dari persyaratan yang dibutuhkan,"" ujarnya. Sebelumnya, Presiden Konfederasi Serikat Pekerja Indonesia (KSPI) Said Iqbal resmi dilantik menjadi Presiden Partai Buruh. Pada sidang paripurna itu, Partai Buruh juga menetapkan susunan kepengurusan komite eksekutif periode 2021-2026. Said Iqbal menyebut Partai Buruh didirikan oleh 11 organisasi yang disebut Majelis Rakyat Partai Buruh. ""Partai buruh yang lama, Konfederasi Serikat Buruh Sejahtera Indonesia (KSBSI), Federasi Serikat Pekerja Metal Indonesia (FSPMI), Serikat Petani Indonesia (SPI), Organisasi Rakyat Indonesia, Konfederasi Perjuangan Buruh Indonesia, Konfederasi Serikat Pekerja Indonesia (KSPI), Federasi Serikat Pekerja Kimia Energi Pertambangan, Minyak, Gas Bumi, dan Umum (FSP-KEP), Federasi Serikat Pekerja Farmasi dan Kesehatan Reformasi (FSP-Farkes R),"" kata Said. ""Partai Buruh bukan partai dinasti. Pemiliknya bukan Pak Sony atau Pak Iqbal,"" sambungnya. Ia menjelaskan Partai Buruh menggunakan warna bendera oranye dengan lambang nama partainya di bagian kanan serta logo padi dengan 33 bulir dan 3 rumpun. Di bawah logo tersebut terdapat slogan 'Negara Sejahtera'.",Partai Buruh Bakal Daftarkan Pengurus Baru ke Kemenkumham Pekan Depan,serikat buruh,https://news.detik.com/berita/d-5753987/partai-buruh-bakal-daftarkan-pengurus-baru-ke-kemenkumham-pekan-depan?single=1,"Selasa, 05 Okt 2021 16:22 WIB"
"Ketua Umum Konfederasi Serikat Pekerja Seluruh Indonesia (KSPSI), Yorrys Raweyai, memberikan keterangan sebagai saksi dalam Uji Materi UU Cipta Kerja yang digelar di Mahkamah Konstitusi (MK) secara virtual, Rabu (6/10). Yorrys adalah salah satu saksi yang diajukan oleh pemerintah. Ketua Komite II DPD RI ini mengatakan bahwa sejak awal, dirinya terlibat secara intens, baik sebagai unsur serikat pekerja maupun sebagai bagian dari kelembagaan legislatif di DPD RI. Yorrys menegaskan bahwa keterlibatan KSPSI merupakan bentuk keterlibatan publik dalam mengawal kebijakan dan rancangan perundang-undangan yang terkait secara langsung dengan dunia ketenagakerjaan, khusus bagi masa depan pekerja. ""Sejak awal 2020, tepatnya 11 Februari 2020, Pemerintah telah melibatkan seluruh unsur serikat pekerja dalam melakukan sosialisasi tentang perubahan UU 13 Tahun 2003 tentang Ketenagakerjaan serta UU Omnibus Law Cluster Ketenagakerjaan. Meski diakui bahwa di tengah proses keterlibatan tersebut, beberapa unsur serikat pekerja menarik diri, namun hal itu merupakan bagian dari dinamika berdemokrasi,"" ujar Yorrys dalam keterangan tertulis, Rabu (6/10/2021). Lebih lanjut, beberapa pembahasan terkait Perjanjian Kerja Waktu Tertentu (PKWT), Alih Daya (Outsourcing) waktu kerja dan waktu Istirahat, pengupahan, pemutusan hubungan kerja dan pesangon, penghargaan lainnya, serta jaminan kehilangan pekerjaan dan sanksi ketenagakerjaan dilakukan penuh dinamika, hingga pada akhir proses pembahasan yang melibatkan unsur pemerintah, serikat pekerja dan pemerintah (tripartit) selesai dan diakhiri dengan penyelenggaraan roadshow ke berbagai lembaga negara, seperti DPR, MPR dan DPD, serta ke Menkopolhukan dan Menkoperekonomian. Di akhir penyampaiannya, Anggota DPD RI Dapil Papua ini menegaskan bahwa Konfederasi Serikat Pekerja Seluruh Indonesia yang ia pimpin memandang pentingnya kehadiran pekerja/buruh untuk bersama-sama dengan pengusaha dan pemerintah memberikan warna dan nuansa sosial dialog yang kuat dan berkualitas dalam mengawal proses pembahasan RUU Cipta Kerja terutama pada Klaster Ketenagakerjaan. Selain itu, menurutnya pro dan kontra dalam RUU Cipta Kerja tidak hanya terjadi pada kluster ketenagakerjaan, untuk itu pengajuan uji materi UU Cipta Kerja merupakan sarana yang tepat bagi segenap elemen masyarakat yang merasa hak konstitusionalnya dirugikan atas berlakunya UU tersebut, tentunya yang diharapkan setelah putusan nanti adalah semua pihak dapat menerima dengan lapang dada apapun hasilnya dan bersama-sama menatap ke depan untuk membangun hubungan industrial yang lebih berkeadilan. Adapun pihak pemohon dalam Perkara Nomor: 103/PUU-XVIII/2020 ini adalah Elly Rositas Silaban dan Dedi Hardianto. Sidang ini dipimpin langsung oleh Ketua Mahkamah Konstitusi Republik Indonesia, Dr. Anwar Usman, S.H., M.H.","Jadi Saksi Uji Materi UU Ciptaker di MK, Yorrys Raweyai Sampaikan Hal Ini",serikat buruh,https://news.detik.com/berita/d-5755944/jadi-saksi-uji-materi-uu-ciptakerdi-mkyorrys-raweyaisampaikan-hal-ini?single=1,"Rabu, 06 Okt 2021 19:50 WIB"
"Presiden  periode 2021-2026 Said Iqbal membeberkan sumber pendanaan Partai Buruh, yang kini resmi dideklarasikan kembali. Ia menuturkan Partai Buruh bergerak dari uang iuran tiap kader. ""Pendanaan Partai Buruh dari iuran,"" kata Said kepada wartawan usai Kongres IV Partai Buruh digelar di Hotel Grand Cempaka, Cempaka Putih, Jakarta Pusat, Selasa (5/10/2021). Said Iqbal mengatakan basis konstituen   terdiri dari 4 konfederasi serikat buruh, 50 federasi serikat pekerja, kelompok tani dan nelayan, guru honorer, dan guru swasta dengan total sekitar 10 juta orang. Dari jumlah tersebut, Partai Buruh akan mencari kader militan sebanyak 100 ribu orang. Said mengatakan 100 ribu kader itu akan melakukan pendidikan partai. Mereka akan dikenai iuran, sehingga pendanaan partai diambil dari iuran 100 ribu kader itu. ""(Sebanyak) 100 ribu kader militan kami akan minta iuran untuk bayar secara sukarela dan itu sudah pernyataan siap 100 ribu anggota kader buruh, tani, nelayan, termasuk guru honor,"" kata dia. Besaran iuran yang dibayarkan oleh kader, kata dia, telah disepakati sebesar Rp 50 ribu per orang. Menurutnya, nilai itu dianggap cukup menjadi sumber dana operasional partai. ""Berarti setiap kader nanti kita minta disepakati 50 ribu rupiah. Kalau dikali 100 ribu kan sudah hampir 5 miliar. Sudah mencukupi,"" kata dia. Sebelumnya, Said Iqbal resmi dilantik menjadi Presiden   periode 2021-2026 pada kongres tersebut. Said Iqbal dipilih secara aklamasi. ""Kami serahkan seluruh tugas ini kepada Presiden Partai Buruh yang baru, Bung Said Iqbal,"" ujar Sony Pudjisasono selaku Ketua Umum Partai Buruh lama dalam serah jabatan Partai Buruh di Hotel Grand Cempaka, Cempaka Putih, Jakarta Pusat, Selasa (5/10/2021).",Said Iqbal Beberkan Sumber Pendanaan Partai Buruh,serikat buruh,https://news.detik.com/berita/d-5753840/said-iqbal-beberkan-sumber-pendanaan-partai-buruh?single=1,"Selasa, 05 Okt 2021 15:02 WIB"
"Konfederasi Serikat Pekerja Indonesia ( ) beserta puluhan federasi serikat pekerja tingkat nasional mendeklarasikan kebangkitan kembali  . Bagaimana peluang Partai Buruh dalam  ? Guru Besar Ilmu Politik UIN Jakarta, Saiful Mujani berpendapat peluang Partai Buruh berlaga di Pemilu 2024 kecil. Sebab, menurutnya, syarat mendirikan partai berat. ""Berat untuk mendirikan partai, UU-nya membuat berat,"" kata Saiful kepada wartawan, Selasa (5/10/2021). Tidak itu saja tantangan yang akan dihadapi KSPI dan kawan-kawan (dkk). Jika berhasil berdiri, Partai Buruh juga harus memiliki tokoh 'berkelas' nasional. Saiful menyebut serikat buruh dkk harus punya yang dapat memobilisasi massa. Namun, menurutnya, saat ini belum ada tokoh di gerakan buruh Indonesia yang memiliki kriteria demikian, termasuk Said Iqbal. ""Maaf, saya belum melihat potensinya (Said Iqbal). Tes nyata dari kekuatan buruh dapat dilihat misalnya dari kegagalan organisasi buruh menghadang UU Ciptaker yang mereka tidak inginkan. Bikin partai itu bukan perkara mudah,"" sebut Saiful. Lebih lanjut, Saiful menuturkan saat ini sudah ada partai besar yang mengklaim membawa aspirasi buruh, yang sudah memiliki 'amunisi'. ""Selama ini sejumlah partai besar sudah mengklaim mewakili buruh. Mereka sudah lebih siap dari pada sekelompok aktivis buruh yang baru ingin bikin partai,"" ujarnya. Sebelumnya, KSPI beserta 50 federasi serikat pekerja tingkat nasional mendeklarasikan kebangkitan kembali Partai Buruh. Presiden KSPI Said Iqbal resmi mengisi kursi Presiden Partai Buruh. Said Iqbal dipilih secara aklamasi pada partai besutan almarhum Muchtar Pakpahan itu. Tak ada nama lain yang mengajukan diri sebagai calon ketua umum selain Said Iqbal. Said Iqbal menyebut Partai Buruh didirikan oleh 11 organisasi yang disebut Majelis Rakyat Partai Buruh. Said Iqbal mengatakan Partai Buruh bukan partai dinasti. ""Partai buruh yang lama, Konfederasi Serikat Buruh Sejahtera Indonesia (KSBSI); Federasi Serikat Pekerja Metal Indonesia (FSPMI); Serikat Petani Indonesia (SPI); Organisasi Rakyat Indonesia; Konfederasi Perjuangan Buruh Indonesia; Konfederasi Serikat Pekerja Indonesia (KSPI); Federasi Serikat Pekerja Kimia Energi Pertambangan, Minyak, Gas Bumi, dan Umum (FSP-KEP); Federasi Serikat Pekerja Farmasi dan Kesehatan Reformasi (FSP-Farkes R),"" kata Said Iqbal setelah dilantik. Pada sidang paripurna itu, Partai Buruh juga menetapkan susunan kepengurusan komite eksekutif periode 2021-2026. Berikut ini susunan pengurus Partai Buruh periode 2021-2026: Presiden: Said Iqbal Wakil Presiden: Agus Suproyadi Sekretaris Jenderal: Ferri Nuzarli Bendahara Umum: Luthano Budyanto Ketua Badan Pendiri (Majelis Rakyat): Sonny Pudjisasono Ketua Majelis Nasional: Agus Ruli Ardiansyah Ketua Mahkamah Partai: Riden Hatam Aziz",Menerka Peluang Partai Buruh Berlaga di Pemilu 2024,serikat buruh,https://news.detik.com/berita/d-5754639/menerka-peluang-partai-buruh-berlaga-di-pemilu-2024?single=1,"Rabu, 06 Okt 2021 04:56 WIB"
"mendeklarasikan rencananya yang turut serta dalam Pemilu 2024. Latar belakang partai oranye itu kembali dihidupkan adalah   atau Undang-Undang Nomor 11 Tahun 2020 tentang Cipta Kerja disahkan oleh DPR RI pada tahun lalu. "" -lah, UU Cipta Kerja men-  Partai Buruh dihidupkan kembali,"" kata Presiden Partai Buruh 2021-2026 Said Iqbal dalam Kongres IV partainya di Hotel Grand Cempaka, Cempaka Putih, Jakarta Pusat, Selasa (5/10/2021). Menurutnya, pengesahan   menjadi kekalahan telak bagi kaum buruh memperjuangkan hak-haknya. Baginya, kelompok buruh akan memperluas garis perjuangannya di bangku parlemen. ""Kami ingin berjuang secara parlemen, bukan lagi sekadar di jalan. Di jalan tetap ada sesuai konstitusi, tapi kami ingin berjuang di parlemen,"" katanya. Ia mengkritik sistem upah tenaga kerja yang tertuang dalam UU Cipta Kerja. Menurutnya, muatan dalam UU tersebut belum mengakomodasi hak-hak buruh selama ini. ""Bagaimana mungkin   seumur hidup? Negara Amerika saja membatasi. Indonesia melebihi Amerika yang super kapitalis. Karyawan kontrak diulang-ulang, upah UMSK dihilangkan, UMK bisa iya bisa tidak, nilai kenaikannya kecil,"" ujar Said. ""Karyawan perempuan yang mengambil cuti haid dan melahirkan tidak jelas dibayar atau tidak diupah. Jam kerja yang eksploitatif, perlindungan terhadap buruh perempuan makin menurun,"" sambungnya. Dalam pidatonya, Said Iqbal memaparkan tawaran Partai Buruh dalam hubungan industrial yang dinilai menjawab persoalan hak buruh. ""Menolak   tenaga kerja, menolak sistem karyawan kontrak berkepanjangan tanpa batas, uang pesangon yang layak, jam kerja yang manusiawi, perlindungan upah, menolak PHK yang dipermudah,"" papar Said. Ketua Majelis Rakyat   sekaligus Sekretaris Jenderal (Sekjen) Serikat Petani Indonesia (SPI) Agus Rully menyampaikan bahwa Partai Buruh juga akan memperjuangkan hak-hak buruh tani, yaitu mendorong reforma agraria dan kedaulatan pangan. ""Bahwa unsur petani menjadi sangat penting di dalam  . Di mana Partai Buruh bisa mendorong pelaksanaan reforma agraria, redistribusi dan koreksi terhadap ketimpangan sumber-sumber agraria yang selama ini ada,"" kata Agus. ""Kemudian juga kedaulatan pangan, bagaimana pangan kita bisa berdaulat, dari mulai produksi sampai distribusi dan teknologi pangan,"" ujarnya.",Alasan Partai Buruh Bangkit Kembali: Pengesahan Omnibus Law,serikat buruh,https://news.detik.com/berita/d-5753780/alasan-partai-buruh-bangkit-kembali-pengesahan-omnibus-law?single=1,"Selasa, 05 Okt 2021 14:22 WIB"
"Konfederasi Serikat Pekerja Indonesia (KSPI) akan membangkitkan kembali   untuk ikut serta dalam kontestasi pemilu pada 2024 mendatang. Wakil Ketua DPR yang juga Ketua Harian DPP Gerindra, Sufmi Dasco Ahmad, menyambut baik hal itu. ""Pertama kami apresiasi dan menyambut baik KSPI yang akan menghidupkan kembali Partai Buruh yang kita sudah sama-sama tahu bahwa Partai Buruh pernah beberapa kali mengikuti pemilu di RI. Nah di demokrasi ini sebaiknya salurkan aspirasi itu di parlemen untuk memperjuangkan aspirasi yang ada melalui mekanisme yang sudah dibentuk oleh demokrasi kita,"" kata Dasco kepada wartawan, Senin (4/10/2021). Dasco menilai Partai Buruh akan menjadi wadah bagi tuntutan para buruh jika digerakkan secara optimal. Tinggal bagaimana mereka menarik hari masyarakat. ""Oleh karena itu, adanya partai buruh ini sangat bagus, supaya aspirasi para buruh itu kemudian bisa diperjuangkan semaksimal mungkin dari mulai menyampaikan aspirasi sampai membentuk atau merevisi UU,"" ujarnya. ""Sekali lagi kami sampaikan apresiasi kepada teman-teman pekerja buruh dan saya ucapkan selamat berjuang untuk menempuh jalan demokrasi. Kalau mereka harus mengikuti demokrasi tentunya rakyat yang menentukan apakah memang kemudian partai ini bisa ada tempat di parlemen atau tidak, tergantung dari teman-teman Partai Buruh mengambil hati rakyat Indonesia,"" lanjut Dasco. Ketua Harian Gerindra ini menilai   memiliki peluang yang besar. Sebab, jumlah buruh di Indonesia yang angkanya cukup besar. ""Kalau lihat peluang seharusnya besar ya, karena dengan persyaratan 4 persen untuk   bisa dicapai oleh Partai Buruh yang basisnya adalah pekerja yang kita lihat bahwa pekerja kita di Indonesia ini jumlahnya banyak sekali, sehingga peluangnya cukup besar,"" katanya. Sebelumnya, KSPI beserta 50 federasi serikat pekerja tingkat nasional akan membangkitkan kembali Partai Buruh untuk ikut serta dalam kontestasi pemilu pada 2024 mendatang. Presiden KSPI Said Iqbal menyebut dirinya sementara sebagai calon tunggal yang akan mengisi kursi Presiden Partai Buruh. ""Calon Presiden Partai Buruh sampai hari ini menurut kawan-kawan hanya baru satu orang yang diusulkan bulat oleh 11 organisasi pendiri Partai Buruh yang baru saudara Said Iqbal. Memang mungkin bisa saja nanti sampai dengan nanti kongres ada yang bertambah, tapi bulat sampai hari ini baru satu nama yang disepakati untuk disetujui kongres, yaitu saudara Said Iqbal dari KSPI, presiden KSPI,"" kata Presiden KSPI, Said Iqbal, dalam konferensi pers di kanal YouTube 'Bicaralah Buruh', Minggu (3/10). Said Iqbal menerangkan kongres Partai Buruh akan digelar dua hari terhitung mulai besok. Sementara deklarasinya akan dilakukan pada hari terakhir kongres partai, yakni pada 5 Oktober di salah satu hotel di Jakarta. ""Kami mengundang pada tanggal 5 Oktober 2021 kepada kawan-kawan media untuk meliput penutupan kongres Partai Buruh akan diumumkan susunan pengurusnya yang baru dan juga keputusan keputusan kongres lainnya jam 10.45 WIB di Hotel Grand Cempaka Putih. Bagi yang tidak bisa hadir kami berharap bisa bergabung nanti di konferensi pers partai melalui Zoom,"" tuturnya. Said Iqbal berharap   lolos verifikasi KPU, termasuk ambang batas parlemen. Dua hal itu, kata Said Iqbal, sebagai wujud awal kebangkitan Partai Buruh. ""Kami harapkan kalau sudah lolos verifikasi KPU, lolos  , kami tidak muluk-muluk sebagai partai yang mudah-mudahan bisa lolos verifikasi ikut mengikuti pemilu oleh KPU lolos verifikasinya, lolos   sudah lebih dari cukup untuk tahap awal pembangkitan kembali Partai Buruh,"" ungkapnya.",Gerindra Sambut Partai Buruh: Selamat Berjuang Menempuh Demokrasi!,serikat buruh,https://news.detik.com/berita/d-5752045/gerindra-sambut-partai-buruh-selamat-berjuang-menempuh-demokrasi?single=1,"Senin, 04 Okt 2021 13:12 WIB"
