artikel,judul,keyword,link,tanggal
"Dit Polairud Polda Jabar membagikan seribu paket sembako bagi nelayan dan warga pesisir yang menjalani isolasi mandiri. Bantuan paket sembako ini disebar ke delapan desa di Kabupaten Cirebon, Jabar. Direktur Polairud Polda Jabar Kombes Widi Handoko mengatakan pembagian paket sembako dilaksanakan di delapan desa yang tersebar di tiga kecamatan, yakni Kecamatan Pangenan, Astanajapura, dan Mundu. ""Sasarannya adalah warga yang sedang menjalani isolasi mandiri dan nelayan. Selain delapan desa, kita salurkan juga ke empat panti asuhan,"" kata Widi Handoko kepada  usai melepas iring-iringan kendaraan pengangkut paket bantuan di Dit Polairud Polda Jabar, Kota Cirebon, Senin (30/8/2021). Widi Handoko tak menampik bantuan paket sembako itu tak menyelesaikan masalah dalam penanganan pandemi. Namun, lanjut Widi Handoko, bantuan tersebut bisa meringankan beban masyarakat terdampak, khususnya yang tengah menjalani isolasi mandiri. ""Ini saat yang tepat untuk berbagai kepada saudara. Tanpa melihat suku, ras, golongan dan agama. Total ada seribu paket bantuan,"" kata Widi Handoko. Widi Handoko mengatakan penyaluran bantuan paket sembako itu merupakan kerja sama antara Dit Polairud Polda Jabar, Cirebon Power dan Komipo. ""Ini adalah kegiatan yang sudah pernah kita lakukan juga sebelumnya. Termasuk pemberian asuransi kecelakaan diri bagi nelayan,"" kata Widi Handoko. Sementara itu, salah seorang nelayan asal Desa Citemu, Kecamatan Mundu, Cirebon, Karmin (30) mengaku bersyukur mendapat bantuan. Sebab, lanjut Karmin, selama pandemi ia kesulitan menjual hasil melaut. ""Ya kalau melaut tergantung cuaca, kalau buruk tidak melaut. Pandemi ini kesulitannya itu menjual hasil tangkapan, karena masyarakat juga lagi susah buat beli-belian,"" kata Karmin. Karmin rutin melaut setiap harinya. Nelayan asal Citemu ini bisa melaut hingga lima kali dalam sepakan. ""Ya alhamdulillah bisa sedikit membantu,"" kata Karmin.",Polda Jabar Salurkan Bantuan Sembako ke Warga Pesisir Cirebon yang Isoman,panti asuhan,https://news.detik.com/berita-jawa-barat/d-5701673/polda-jabar-salurkan-bantuan-sembako-ke-warga-pesisir-cirebon-yang-isoman?single=1,"Senin, 30 Agu 2021 10:49 WIB"
"Seorang   di Balikpapan, Kalimantan Timur rugi hampir Rp 1 juta setelah memesankan pizza untuk kustomer fiktif. Ini kronologinya. Orderan fiktif kembali memakan korban. Melalui unggahan Instagram @lintas_balikpapan (05/09) diceritakan bahwa driver ojol bernama Syamsuddin tersebut awalnya mendapat pesanan dari kustomer untuk membeli pizza. Varian pizza yang dipesan tersebut adalah pizza ukuran 1 meter yang dibanderol dengan harga sekitar Rp 229.000 per kotaknya. Saat itu, kustomer yang tertulis dengan nama Amanda memesan sebanyak 5 kotak pizza. Karena metode pembayaran yang dipilih kustomer adalah tunai, maka driverojol itu menggunakanuangnya terlebih dahulu untuk membeli pizza. Awalnya tidak ada kejanggalan. Hingga akhirnya driver ojol tersebut mendatangi rumah kustomer sesuai dengan aplikasi. Namun, kustomer itu tidak kunjung menemuinya. Saat dikirimi pesan lewat fitur chat, kustomer membalasnya dan membuat geram. Bagaimana tidak, kustomer itu secara terang-terangan mengatakan bahwa dirinya hanya ingin menipu. ""Hahahahahahah saya cuma nipu haaahahaha,"" bunyi pesan yang dikirimkan oleh kustomer. Padahal driverojol tersebut sudah menghabiskanuangnya sebanyak Rp 957.003 untuk membeli pizza. Kepadadetikcom (07/09)Syamsuddin menceritakan bahwa itu terjadi pada siang hari. Unggahan tentang   tersebut ramai ditanggapi oleh netizen yang ikut kesal dengan kustomer fiktif tersebut. Selain itu, tak sedikit juga netizen yang ingin membantu dengan membeli pizza tersebut. ""Kurang ajar deh orang yang nipu gitu, terus kalau udah berhasil nipu apa yang didapat sih?,"" tulis netizen. ""Semoga abang ojolnya diberi kesabaran dan rezeki yang berlipat-lipat,"" tulis netizen lainnya. Namun, driverojol tersebut memilih untuk menyumbangkanpizzanya ke panti asuhan. Seperti yangdiunggah diInstagram @dramaojol.id, driverojol tersebut menyertakan lima kotak pizza ke panti asuhan di Gunung Guntur. Sementara itu, kerugian yang dialami driver ojol telah diganti oleh pihak operator ojek online pusat. Meski awalnya, Syamsuddin mengatakan bahwa sulit untuk menghubungi pusat. ""Alhamdulillah kerugian tersebut sudah teratasi setelah berkali-kali menghubungi pihak Gojek Pusat, sebelumnya Gojek pusat tidak mau kembalikan saldonya karna menurut pusat Nominal Biaya sangatlah terlalu besar,"" ujar Syamsuddin. Saat ba'da Isya, uang kerugian akhirnya dibayarkan oleh pihak pusat. Setelah itulah, baru ia memberikan pizza tersebut ke panti asuhan. Lebih lanjut, Syamsuddin mengatakan bahwa dirinya sudah melaporkan ke kepolisian. ""Saya sudah melaporkan pihak customer ke Polresta Balikpapan, tapi menurut saya pihak Polresta Balikpapan menurut kurang tanggap/biasa saja, menurut saya juga Pihak Polresta Balikpapan tidak memproses kayaknya, nah yg saya takutkan hal tersebut akan terjadi lagi ke driver,"" ujar Syamsuddin. Sebelumnya ada juga seorang driver ojol di Bali sampai disuspend karena laporan kustomer. Kustomer tersebut menilai bahwa driver ojolnya tidak sopan karena tidak menuruti perintahnya untuk membuang makanan yang telah dipesan.",,panti asuhan,https://food.detik.com/info-kuliner/d-5713000/driver-ojol-kena-orderan-fiktif-beli-pizza-hampir-rp-1-juta?single=1,"Selasa, 07 Sep 2021 14:00 WIB"
"Kementerian Koperasi dan UKM (Kemenkop UKM) bersama Badan Amil Zakat Nasional (BAZNAS) dan Pemerintah Provinsi (Pemprov) Daerah Istimewa Yogyakarta (DIY) memberikan bantuan modal usaha serta sembako kepada lebih dari 10 ribu mustahik (penerima zakat) dengan nilai total mencapai sekitar Rp 10 miliar. Pemberian bantuan modal usaha ini dalam rangka mendorong UMKM yang terkena dampak akibat pandemi COVID-19 selama dua tahun terakhir. Berdasarkan data Bank Indonesia (BI) 2021, sebanyak 87,5% UMKM di Indonesia terdampak pandemi COVID-19. Sementara itu, sebanyak 93,2% UMKM terdampak pada sisi penjualan yang menurun. ""Tentunya dalam mengatasi kondisi ini, pemerintah tak bisa tinggal diam. Untuk mencegah penurunan kegiatan ekonomi yang lebih buruk, maka dibutuhkan suatu tindakan konkret,"" ujar Menteri Koperasi dan UKM Teten Masduki dalam keterangan tertulis, Jumat (27/8/2021). Hal ini dia ungkapkan saat penyaluran Kita Jaga Usaha UMKM Bangkit secara simbolis di kantor Gubernur DIY. Teten menegaskan UMKM merasakan dampak yang sangat dalam karena pandemi. Mulai dari turunnya omzet sampai penutupan usaha. Ditambah, saat yang bersamaan daya beli masyarakat ikut turun. Untuk itu, pemerintah dan lembaga maupun pemerintah daerah (Pemda) memastikan pelaku usaha kecil, mampu beradaptasi untuk bertahan, pulih, dan melanjutkan usaha di masa pandemi. ""Saya mengapresiasi Pemprov Yogyakarta yang pertumbuhan ekonominya tumbuh 11% di atas pertumbuhan ekonomi nasional di kuartal II-2021. Di mana mayoritas didorong oleh gerakan stimulus yang diberikan ke UMKM,"" kata Teten. Teten juga mengapresiasi kepada Baznas yang telah cepat tanggap dengan inisiatif bersama Kemenkop UKM untuk membantu UMKM terdampak pandemi. Jika bulan puasa yang lalu telah diberikan santunan untuk kaum Dhuafa dan Yatim Piatu, maka sekarang diberikan bantuan untuk Pengusaha Kuliner seperti Warung Tegal, Warung Padang, Bakso, Soto, Pecel Lele, dan Warung makan lainnya yang terdampak pandemi COVID-19. ""Zakat dan dana umat yang dikelola Baznas sebelumnya dioptimalkan pemanfaatannya untuk hal-hal produktif dan kemaslahatan. Tapi sekarang lebih produktif untuk modal usaha. Jadi ibadah dan pahalanya lebih besar lagi,"" sebut Teten. Diketahui, Peluncuran program bantuan tunai untuk usaha mikro ini tersebar di wilayah PPKM Jawa dan Bali yang dikemas dalam program Kita Jaga Usaha, dan dipusatkan di Kota Yogyakarta. Yogyakarta sendiri dipilih menurut Teten, lantaran kementerian melihat sudah banyaknya inisiatif yang dilakukan Pemprov Yogyakarta kepada UMKM untuk bertahan saat pandemi. Pemerintah, lanjut Teten, menargetkan pada 2024, sebanyak 30 juta UMKM dapat terhubung ke ekosistem digital. Hingga Agustus 2021, sudah ada 15,3 juta UMKM atau 23,9% total UMKM yang telah tergabung dalam e-commerce. Sementara itu, Ketua Baznas KH Noor Achmad mengatakan Baznas sebagai lembaga yang diamanatkan oleh Undang-Undang untuk mengelola dana zakat, infak, dan sedekah memiliki peran yang sangat penting dalam membantu kegiatan ekonomi khususnya pelaku UMKM. Baznas membentuk program sebagai respon darurat ekonomi COVID-19 yang terdiri dari UMKM Bangkit dan Dapoer Kuliner Nusantara. Adapun target penyaluran pada Kita Jaga Usaha ini sebesar Rp 13.857.261.770 dengan 10.290 mustahik penerima manfaat. ""UMKM Bangkit ini program pemberian bantuan langsung kepada 10 ribu pelaku UMKM di wilayah PPKM level 3 dan level 4 dengan jumlah bantuan sebesar Rp1 juta per orang. Total bantuan UMKM Bangkit sebesar Rp 10 miliar,"" ujar Noor Achmad. Sementara Program Dapoer Kuliner Nusantara merupakan program pemberdayaan warteg, warung nasi, warung padang, dan usaha kuliner skala kecil lainnya untuk menyediakan 123.888 paket makanan, yang akan didistribusikan kepada pelaku isoman, panti asuhan, panti jompo, lembaga pemasyarakatan, pesantren, rumah singgah, nakes, dan warga terdampak PPKM. Program Dapoer Kuliner Nusantara juga akan melakukan skema cash for work (CFW) bagi pekerja marginal yang akan membantu dalam pelaksanaan program. Total dana Program Dapoer Kuliner Nusantara sebesar Rp 3.857.261.770. ""Kedua program tersebut di atas akan Baznas luncurkan dengan tajuk Kita Jaga Usaha,"" jelas Noor. Gubernur DIY Sri Sultan Hamengkubuwono X menyambut baik program Kita Jaga Usaha yang diinisiasi oleh Baznas. Di mana bantuan itu akan bisa mendorong kemajuan bagi UMKM di Yogyakarta yang potensinya besar. ""Ini akan menjadi stimulus perekonomian nasional secara khusus Yogyakarta sendiri. Tujuan utama bagaimana melindungi dan meningkatkan ekonomi UMKM. Saya punya harapan, ke depan akan ada kemudahan persyaratan bantuan semacam ini serta tepat sasaran untuk pemulihan nasional,"" ujarnya. Ia juga bersyukur, di tengah pandemi pertumbuhan ekonomi Yogyakarta masih bisa tumbuh 11% di kuartal II-2021. Sri Sultan berharap, pertumbuhan selanjutnya di kuartal II dan IV tak jatuh terlalu dalam. ""UMKM memang menjadi salah satu pendukungnya. Semoga bisa terus bangkit,"" pungkasnya.",Kemenkop hingga BAZNAS Keroyokan Bantu Modal Pelaku Usaha Mikro,panti asuhan,https://finance.detik.com/berita-ekonomi-bisnis/d-5698878/kemenkop-hingga-baznas-keroyokan-bantu-modal-pelaku-usaha-mikro?single=1,"Jumat, 27 Agu 2021 15:15 WIB"
"Wali Kota Medan,   mengecek lahan yang bakal dibangun panti sosial di Kecamatan Medan Tuntungan, Kota Medan. Bobby pun bernegosiasi dengan warga yang meminta agar gedung itu tidak dibangun di lokasi yang saat ini dijadikan lapangan bola. Pantauan  , Minggu (5/9/2021), Bobby tiba bersama rombongan di lokasi tepatnya di Kelurahan Sidomulyo, Kecamatan Medan Tuntungan. Bobby lalu mengecek lahan tersebut. Bobby berbicara dengan tokoh masyarakat setempat. Bobby menjelaskan soal program yang sedang dikerjakannya. Salah satu warga setempat pun meminta agar program pembangunan panti asuhan dibangun di lokasi lain lantaran lokasi itu telah dijadikan lapangan sepak bola. Bobby bernegosiasi dan memberikan solusi bahwa lapangan akan dipindahkan tak jauh dari lokasi. Nantinya, fasilitas lapangan akan dibikin cantik oleh pihaknya. Setelah itu, Bobby bersama masyarakat pun mengecek lokasi lapangan yang bakal dibangun. ""Ya ini rencana sudah lama saya dapat info, saya cek juga ini, dari tahun 2015 perencanaannya akan dibangun panti sosial untuk kepentingan di Dinas Sosial demi kita memberdayakan masyarakat kita yang kurang beruntung yang selama ini kita temui di lampu-lampu merah, serta masyarakat yang mungkin gangguan kesehatan kejiwaannya kurang,"" kata Bobby di lokasi. Bobby menyebut di lokasi tersebut saat ini dipergunakan untuk kegiatan olahraga. Bobby pun berdiskusi langsung dengan tokoh masyarakat dan memindahkan lapangan itu ke tempat lain. ""Di sini memang ada sedikit fasilitas yang akan kita bangun, aset kita ini digunakan untuk kegiatan olahraga, ini kegiatannya sangat positif, sangat baik. Kita nggak mau program kita satu jalan tapi mengorbankan kegiatan yang lain. Lapangannya akan kita perbaiki, fasilitasnya kita lengkapi lagi, mungkin di lahan yang berbeda, tapi sangat dekat nggak lebih dari 100 meter. Lahannya punya Pemko Medan,"" sebut Bobby. Bobby menargetkan pembangunan panti sosial itu bakal selesai akhir tahun 2021. Dari perencanaan mungkin satu bagian dulu yaitu 24 meter dulu dari 90x 21 meter. Kapasitasnya untuk tahap awal 300 orang, namun total kapasitasnya mencapai 3.000 orang dengan berbagai fasilitas Sementara lapangan bola bakal dikerjakan saat pembangunan gedung panti sosial mulai dikerjakan. Dia memberikan waktu dua minggu fasilitas olahraga selesai. ""Selama ini dibangun saya minta dinas olahraga, ketika ini sudah dikerjakan ini dibangun fasilitas olahraganya waktunya 2 minggu saya kasih waktu untuk membangun fasiltas olahraganya,"" ucap Bobby.",Gaya Bobby Negosiasi Warga Penolak Pembangunan Panti Sosial di Medan,panti asuhan,https://news.detik.com/berita/d-5711111/gaya-bobby-negosiasi-warga-penolak-pembangunan-panti-sosial-di-medan?single=1,"Minggu, 05 Sep 2021 21:40 WIB"
"Seorang  Shopeefood mengalami orderan fiktif. Ia mengalami kerugian setelah memesankan steak sirloin seharga Rp 490 ribu, tetapi alamat kustomer palsu. Orderan fiktif kembali memakan korban. Kali ini dialami oleh Rocky, driver dari Shoopefood di Bandung. Pada Rabu (01/09) kemarin, ia menceritakan hal apesnya tersebut lewat sebuah video. ""Astagfirullah dari awal emang udah ragu, ternyata bener. Ini dapat orderan steak sirloin Rp 490 ini udah motong saldo kita. Ini makanannya tapi lihat, kustomernyanya ditelfon gak diangangkat,"" ujarnya. Di video itu juga terlihat paket  sirloin yang sudah dikemas menggunakan plastik berjejer memenuh bagian depan motor. Video tersebut menjadi viral setelah diunggah oleh akun Instagram @infobandungraya. Rocky mengatakan bahwa pesanan steak sirloin tersebut dikirim ke Jalan Kayu Lawang, Cibiru Hilir, Bandung sesuai dengan aplikasi. Namun, setelah diantar ke alamat tersebut, kustomernya tidak dapat dihubungi. Padahal Rocky sudah mencoba dengan menelpon dan mengirim pesan lewat fitur chat. Yang mengharukan dari Rocky adalah, ia memutuskan untuk menyumbangkan paket steak sirloin tersebut ke panti asuhan terdekat di Cibiru Hilir. Rocky juga sudah mengajukan pembatalan pesanan dan menjelaskan kronologis. Lebih lanjut, driver Shoopefood itu juga memberikan bukti-bukti kepada manajemen perusahaan. Dari pihak perusahaan pun langsung mengatasi hal tersebut dengan maksimal 2-5 hari kerja. Dikonfirmasi detikfood (10/09) kini Rocky sudah mendapatkan ganti saldo dari pihak perusahaan penyedia jasa (03/09). Unggahan itu langsung ramai ditanggapi netizen. Tak sedikit netizen yang ikut tersulut emosi dan ada pula yang merasa terharu dengan keputusan Rocky untuk menyambungkan steak ke panti asuhan. ""Astagfirullah tega banget ih, semoga digantikan yang lebih pak,"" tulis netizen. ""Keren tetep sedekah walau terkena masalah, semangat pak,"" tulis netizen lainnya. Kejadian serupa juga pernah dialami oleh Syamsuddin, seorang  di Balikpapan, Kalimantan Timur. Ia mengalami orderan fiktif saat memesan pizza dengan total biaya Rp Rp 957.003. Kustomer fiktifnya bahkan secara terang-terangan mengaku bahwa dirinya hanya ingin menipu. Syamsuddin sudah melaporkan dan telah mendapatkan uang ganti. Ia juga menyumbangkan pizzanya untuk panti asuhan.",,panti asuhan,https://food.detik.com/info-kuliner/d-5717618/kejadian-lagi-driver-dapat-orderan-fiktif-beli-steak-rp-490-ribu?single=1,"Jumat, 10 Sep 2021 12:30 WIB"
"Pemprov DKI Jakarta mencatat sekitar 4.000 anak menjadi  . Pemprov DKI pun menyiapkan bantuan untuk menjamin kesejahteraan anak yatim-piatu yang ditinggal orang tuanya karena terpapar virus Corona. ""Hingga saat ini telah terkumpul sekitar 4.000-an data target sasaran,"" kata Plt Asisten Kesejahteraan Rakyat Sekda DKI Jakarta Uus Kuswanto dalam keterangan tertulis, Minggu (29/8/2021). Uus mengatakan bantuan yang diberikan berupa bantuan pendidikan dan bantuan sosial (bansos) yang bersumber dari Pemprov maupun donatur. Penerima bantuan ialah anak usia 0-21 tahun. ""Jika ada anak yang tidak memiliki wali yang mampu mengurus, kami akan siapkan panti asuhan baik negeri atau swasta dengan dukungan penuh dari Pemprov DKI Jakarta,"" ujarnya. Uus menyampaikan saat ini pihaknya masih mendata jumlah anak  . Jadi, jumlahnya akan terus bertambah. ""Kami ingin memastikan bahwa bantuan perlindungan sosial ini tepat sasaran. Sehingga, kelengkapan dan verifikasi data harus dilakukan secara cermat, namun tetap sigap dan cepat implementasinya,"" jelasnya. Sebelumnya, Dinas Pendidikan DKI Jakarta menyiapkan skema bantuan pendidikan yang bisa diberikan bagi anak yang menjadi yatim-piatu akibat COVID-19. Ini rinciannya. Kasubag Dinas Pendidikan DKI Jakarta Taga Radja Gah menjelaskan anak-anak yang sudah bersekolah di swasta akan diurus pembuatan Kartu Jakarta Pintar (KPJ). Skema lainnya adalah memindahkan anak tersebut di semester berikutnya. ""Kalau kasusnya sudah sekolah di swasta maka mungkin kita akan bantu mendapatkan KJP. Kalau belum bersekolah diarahkan ke sekolah negeri atau dipindahkan pada semester berikutnya di sekolah negeri,"" kata Taga saat dikonfirmasi, Rabu (25/8/2021). Adapun untuk anak yang belum mendapatkan sekolah akan diarahkan mendaftar di sekolah negeri. Skema ini, sebutnya, sama dengan bantuan pendidikan yang diberikan kepada anak yang ditinggal orang tuanya yang berprofesi sebagai tenaga kesehatan (nakes). ""Sama ketika ayah-ibu tenaga kesehatan meninggal, maka dia lolos mendaftar PPDB,"" ujarnya.","4 Ribu Anak DKI Yatim Piatu Akibat COVID-19, Pemprov Siapkan Bantuan",panti asuhan,https://news.detik.com/berita/d-5700844/4-ribu-anak-dki-yatim-piatu-akibat-covid-19-pemprov-siapkan-bantuan?single=1,"Minggu, 29 Agu 2021 11:22 WIB"
"Kondisi puluhan orang tua jompo di Panti Asuhan Welas Asih, Tasikmalaya hidup prihatin selama Pandemi COVID-19 melanda. Mayoritas sudah tidak lagi diperhatikan keluarganya. Jangankan dibiayai kebutuhanya, kunjungan keluarga saja tidak ada lagi. Bahkan, beberapa orang tua jompo ini akhirnya wafat dan tidak diambil pihak keluarga. ""Di kami ada 100 orang tua jompo sebenarnya tapi kami sekarang batasi hanya 50 saja karena pandemi rentan terkena beliau beliau itu,"" kata Eka Sukmawati, pengelola Panti Welas Asih, Jumat 27/08/21). Eka menambahkan asal para lansia bukan hanya dari kota/kabupaten Tasikmalaya saja, melainkan luar Jawa Barat. ""Bahkan sampai meninggal dunia tinggal di panti jompo ini. Jadi jarang ada yang dibawa lagi keluarga nya,"" jelasnya. Selama pandemi COVID-19, terang dia, kebutuhan para lansia lebih kepada vitamin dan sekarang diberikan kepada para lansia. ""Jadi bagi pengelola sebagai cermin, bahwa ternyata bukan hanya dari dongeng saja. Banyak orang yang harus diperhatikan,"" ujarnya. Seorang jompo mengaku sudah tiga tahun menetap di Panti. Dia tidak lagi dikunjungi anaknya yang ikut suami di Jambi. ""Saya mah asal Bandung kalau anak dah gak ada komunikasi. Tinggal di Jambi tapi tau saya di sini menetap"" kata Mulyadi. Prihatin dengan kondisi orang tua jompo, Polwa Polres Tasikmalaya yang dipimpin langsung Kapolres Tasikmalaya, AKBP Rimsyahtono berikan bantuan sembako. ""Bertepatan dengan peringatan Hut Polwan ke-73 yang diperingati setiap 1 September, di tahun 2021, Polwan Polres Tasikmalaya menggelar bakti sosial memberikan bantuan kepada para jompo di Panti Jompo Welas Asih, Singaparna.""Kata Rimsyah. Selain memberikan bantuan berupa vitamin dan makanan lainnya juga pihak pengelola dan para jompo diberikan himbauan untuk menjaga dan menerapkan protokol kesehatan di tengah pandemi COVID-19 ini. ""ParaPolwan, memberikan bantuan berupa sembako, kemudian berinteraksi dan komunikasi. Kita mengetahui bahwa ada banyak panti jompo, ke depannya kita akan rutin berkunjung, menyampaikanprokes dan himbauan, termasuk bantuan,"" kataRimsyah. Ratusan Tenaga Kesehatan (Nakes) RSUD Singaparna Medika Citrautama (SMC) Kabupaten Tasikmalaya divaksinasi booster, Jumat (27/8/2021). Hal ini dilakukan sebagai upaya menjaga tenaga kesehatan dari paparan COVID-19. ""Benar Nakes kita Vaksin sekarang. Vaksin ketiga atau booster pakai moderna,"" Kata Iman Firmansyah, Dirut RSUD SMC Tasikmalaya di kantornya. Iman menambahkan target sasaran nakes yang akan divaksin mencapai 851 Nakes. Hingga saat ini, setidaknya tercatat 389 Nakes sudah mendapatkan vaksin tambahan. ""Kalau berbicara total itu ada 851 nakes di kita yang akan diberi vaksin tambahan. Itu targetnya, sekarang baru 300 lebih."" ucap Iman. Salah satu Nakes yang mendapatkan vaksin tambahan, Ridwan mengatakan, ia sangat menyambut baik adanya vaksin tambahan. Karena selama ini, ia berhadapan langsung dengan sejumlah pasien yang terpapar Covid-19. Meski beberapa orang nakes alami gejala usai vaksin. Demam, pusing, lemas hingga tidak nafsu makan. ""Ini upaya saja, apalagi saya bekerja berhadapan langsung dengan pasien yang positif. Meski katanya ada efek samping, tapi sejauh ini belum terasa apa-apa,"" ucap Ridwan.",Puluhan Orang Jompo di Panti Asuhan Tasikmalaya Ditelantarkan Keluarga,panti asuhan,https://news.detik.com/berita-jawa-barat/d-5699139/puluhan-orang-jompo-di-panti-asuhan-tasikmalaya-ditelantarkan-keluarga?single=1,"Jumat, 27 Agu 2021 17:11 WIB"
"Rasa senang tampak dari ratusan anak yang berkumpul di Aula Yayasan Yatim Piatu Khadijah Banyuwangi. Sebab, mereka mendapat  . Bingkisan diberikan dalam acara Bakti Sosial Berbagi Senyum Untuk Negeri Alumni Akpol 2000 Sanika Satyawada. Kapolresta Banyuwangi AKBP Nasrun Pasaribu ajak anak yatim piatu bisa jadi polisi. Anak yatim piatu ini diajak berdialog dengan Kapolresta Nasrun pada Rabu (25/8/2021). Dengan sigap mereka menjawab pertanyaan Kapolresta. ""Siapa yang ingin jadi polisi?"" tanya Nasrun yang dijawab anak-anak dengan mengacungkan tangan. ""Wah ternyata banyak ya. Mulai sekarang harus makan yang sehat dan olahraga. Harus pintar dan sekolah yang rajin,"" pesan Nasrun. Pada kesempatan tersebut, 200 paket bingkisan dibagikan kepada anak yatim. ""Hal ini kita lakukan lebih karena kepedulian, dan tanggung jawab moral kita dalam situasi pandemi sekarang anak-anak ini secara psikologis sangat terdampak,"" ujar Nasrun. AKBP Nasrun berharap kegiatan semacam ini bisa menumbuhkan semangat hidup anak yatim piatu, dan memotivasi belajar guna meraih masa depan yang lebih baik. Senyum semringah anak-anak tersebut memberikan kekuatan ke polisi untuk terus menyelenggarakan kegiatan semacam ini. Ada kepuasan sekaligus keharuan yang dirasakan kapolresta beserta pejabat Polresta Banyuwangi, saat bingkisan dibagikan kepada anak-anak tersebut. ""Saya ingin kegiatan semacam ini dilaksanakan secara rutin dan berkala, agar semakin banyak anak yatim piatu yang bisa kita bahagiakan,"" lanjut Nasrun. Acara Bakti Sosial Berbagi Senyum Untuk Negeri Alumni Akpol 2000, menurut Nasrun, diselenggarakan oleh pihaknya dengan tanpa ada kepanitiaan khusus dalam pelaksanaannya. Semua hanya spontanitas atas kepedulian, simpati dan empati. ""Kami imbau kepada seluruh masyarakat agar selalu mematuhi protokol kesehatan dalam menjalankan kehidupan sehari-hari,"" ucap Nasrun. Panti Asuhan Khadijah menyampaikan ucapan terima kasih atas kepedulian dari kepolisian bagi anak-anak panti asuhan. Menurutnya bantuan yang diberikan sangat membantu keperluan anak asuh. ""Kami sampaikan terima kasih berkat bantuan yang diberikan. Kami doakan keluarga besar Polresta Banyuwangi selalu diberikan keselamatan dan kelancaran dalam bertugas,"" ucapnya. Di samping Baksos ke panti asuhan, Kapolresta juga melaksanakan kegiatan vaksinasi di kampus Untag dan Unair Banyuwangi, yang merupakan rangkaian kegiatan   Berbagi Senyum Untuk Negeri Alumni Akpol 2000 Sanika Satyawada.",Senangnya Anak Yatim di Banyuwangi Dapat Bingkisan dari Polisi,panti asuhan,https://news.detik.com/berita-jawa-timur/d-5695647/senangnya-anak-yatim-di-banyuwangi-dapat-bingkisan-dari-polisi?single=1,"Rabu, 25 Agu 2021 12:34 WIB"
