artikel,judul,keyword,link,tanggal
"Setidaknya ada tiga dampak nyata pandemi Covid-19 terhadap anak-anak di Indonesia. Seiring banyaknya orang tua yang terkena pemutusan hubungan kerja (PHK) atau pengurangan jam kerja, otomatis pemenuhan gizi bagi anak-anak mereka berkurang. ""Survei nasional KPAI menunjukkan, pemenuhan gizi anak-anak di Indonesia selama pandemi sangat buruk yakni berada di angka 26, 6 persen,"" kata Ketua Komisi Perlindungan Anak Indonesia (KPAI) Dr Susanto kepada  , Minggu (15/8/2021). Sebelum pandemi, ia melanjutkan, data yang dihimpun Satgas Covid-19 menyebutkan ada 11.045 anak menjadi yatim, piatu, atau yatim-piatu akibat orang tua mereka berpulang karena sakit atau karena bencana alam. Tapi khusus yang meninggal karena covid, sejauh ini data akurat masih dihimpun instansi terkait.  Hal itu mutlak diperlukan agar bisa memberikan mitigasi yang tepat sasaran. ""Jangan sampai satu titik sasaran mendapat bantuan dari berbagai lembaga sementara yang lainnya zero,"" ujarnya. Merujuk Peraturan Pemerintah (PP) Nomor 44 Tahun 2017 dan Peraturan Menteri Sosial (Permensos) Nomor 1 Tahun 2020, pengasuh utama bagi anak yang orangtuanya meninggal dunia prioritasnya adalah keluarga sampai derajat ketiga, seperti kakek - nenek, atau paman-bibi mereka. Kalau tidak memungkinkan, penempatan anak bisa melalui orang tua asuh atau di Lembaga Kesejahteraan Sosial Anak (LKSA) atau panti asuhan. ""Jadi sebetulnya tidak boleh si anak langsung dibawa ke LKSA. Begitu pun para dermawan yang punya niat baik untuk menjadi orang tua asuh harus melalui prosedur yang benar agar tidak bermasalah di kemudian hari,"" terang Susanto. KPAI pun menggarisbawahi, bahwa dalam penanganan anak-anak ini perlu dijaga suasana batinnya. Ciptakan lingkungan yang nyaman dan aman agar mereka merasa gembira. Dampak lain selama pandemi adalah kualitas pendidikan yang harus berlangsung secara  . Selain karena keterbatasan infrastruktur bagi anak untuk dapat mengikutinya, interaksi sosial yang sangat penting bagi tumbuh kembang kejiwaan anak pun ikut terhambat.",KPAI: Gizi Menurun - Belasan Ribu Jadi Yatim/Piatu Selama Pandemi,bantuan panti,https://news.detik.com/berita/d-5683442/kpai-gizi-menurun---belasan-ribu-jadi-yatimpiatu-selama-pandemi?single=1,"Senin, 16 Agu 2021 06:22 WIB"
"Menteri Komunikasi dan Informatika Johnny G Plate memastikan negara hadir memberikan perlindungan dan bantuan kepada anak yang kehilangan orang tua akibat COVID-19. Bantuan tersebut mencakup obat-obatan, vitamin, test swab/PCR, vaksinasi dan kebutuhan dasar. ""Perlindungan dan kesejahteraan anak merupakan prioritas utama pemerintah. Negara akan hadir untuk melindungi semua anak yang merupakan bagian penting dari masa depan bangsa ini,"" tegasnya dalam keterangan tertulis, Minggu (15/8/2021). Bagi anak-anak yang kehilangan orang tua karena COVID-19, lanjutnya, pemerintah memberikan perlindungan dan bantuan agar mereka mampu melanjutkan hidup. ""Pemerintah melalui Kementerian Sosial memberikan berbagai bantuan kepada anak-anak yang kehilangan orang tua akibat COVID-19. Pemerintah berupaya memastikan anak-anak bangsa bisa terus melanjutkan hidup sebagai harapan dan masa depan Indonesia,"" ujarnya. Menurutnya, pemerintah juga memberikan konseling untuk anak-anak dan keluarga mereka. Di samping itu, Pemerintah juga berupaya menyatukan kembali anak dengan keluarga besar mereka demi mencegah anak kehilangan hak pengasuhan. Di sisi lain , kata dia, pemerintah turut memfasilitasi pengasuhan alternatif melalui pengasuhan oleh orang tua asuh atau panti asuhan, serta membantu keluarga besar anak untuk mengatasi kesulitan dalam mengasuh anak. Upaya lain dengan memberikan terapi fisik, psikososial, dan mental spiritual untuk mengatasi rasa sedih serta trauma karena kehilangan orang tua akibat COVID-19. ""Pemerintah mendukung anak-anak agar mendapatkan akses pendidikan dan fasilitas kesehatan yang layak,"" kata Johnny. Lebih lanjut, ia menyatakan, pemerintah terus menghimpun data anak-anak yang kehilangan orang tua karena COVID-19 berdasarkan nama dan alamat tempat tinggal. Hal ini, kata dia, dilakukan untuk memastikan semua anak yang membutuhkan dapat segera mendapatkan penanganan dan bantuan. ""Anak-anak adalah aset bangsa dan generasi penerus yang menentukan masa depan bangsa. Perlindungan dan kesejahteraan anak menjadi prioritas pemerintah,"" tutupnya.",Pemerintah Pastikan Lindungi & Bantu Anak Yatim-Piatu Gegara COVID-19,bantuan panti,https://news.detik.com/berita/d-5683349/pemerintah-pastikan-lindungi--bantu-anak-yatim-piatu-gegara-covid-19?single=1,"Minggu, 15 Agu 2021 23:10 WIB"
"Pancasila juga memiliki arti sebagai ideologi nasional. Menurut Edi Rohani dalam buku Pendidikan Pancasila dan Kewarganegaraan, hal ini berarti Pancasila merupakan seperangkat nilai oleh bangsa Indonesia untuk menata warga negaranya. Maka, Pancasila tak hanya bersifat kefilsafatan, namun juga aplikatif karena berkenaan dengan bagaimana manusia harus bertindak. Membantu teman saat jatuh dari sepeda merupakan pengamalan   Sila kedua berbunyi Kemanusiaan yang Adil dan beradab. Pancasila sila ke-2 mempunyai makna keadilan. Maksudnya, tiap masyarakat Indonesia berhak mendapat keadilan dalam hal apapun. 1. Pengakuan adanya harkat serta martabat manusia dengan segala hak dan kewajiban asasinya. 2. Perlakuan adil pada sesama manusia, terhadap diri sendiri, alam sekitar, dan Tuhan. 3. Manusia sebagai makhluk yang beradab dan berbudaya mempunyai daya cipta, rasa, karsa, dan keyakinan. 1. Mengakui persamaan derajat, hak, dan kewajiban asasi tiap manusia. Tanpa membedakan suku, keturunan, agama, kepercayaan, jenis kelamin, warna kulit, kedudukan sosial, dan faktor lainnya 2. Mengakui dan memperlakukan manusia berdasarkan harkat dan martabatnya sebagai makhluk ciptaan Tuhan 3. Mengembangkan sikap saling mencintai dan kasih sayang antara sesama manusia 4. Tidak semena-mena pada orang lain 5. Gemar melakukan kegiatan kemanusiaan, contohnya bakti sosial, memberi bantuan pada panti asuhan, atau membantu korban bencana alam 6. Senang membantu teman yang sedang kesusahan 7. Mengembangkan sikap tenggang rasa dan tepa salira 8. Menjunjung tinggi hak asasi manusia 9. Mengembangkan sikap saling menghormati dan bekerja sama dengan bangsa lain 10. Menyadari bahwa kita semua memiliki hak dan kewajiban yang sama 11. Berani membela kebenaran Sebagaimana disebutkan di atas, membantu teman yang sedang kesusahan merupakan salah satu contoh sikap yang mencerminkan sila ke-2. Jadi, membantu teman saat jatuh dari sepeda juga merupakan pengamalan  Kini detikers sudah paham, bukan?",Bantu Teman Jatuh dari Sepeda Termasuk Pancasila Sila ke Berapa? Ini Penjelasannya,bantuan panti,https://www.detik.com/edu/detikpedia/d-5672448/bantu-teman-jatuh-dari-sepeda-termasuk-pancasila-sila-ke-berapa-ini-penjelasannya?single=1,"Jumat, 06 Agu 2021 17:00 WIB"
"Puluhan anak di Kediri menjalani program pendampingan psikososial. Mereka mendapat program itu setelah menjadi yatim dan piatu karena orang tuanya meninggal  . Program pendampingan itu dilakukan Dinas Sosial Kabupaten Kediri. 50 Anak di Kabupaten Kediri itu trauma dan bersedih hati setelah orangtuanya meninggal terkena ganasnya COVID-19. Dan 25 anak dalam tahap awal ini untuk diikutkan pada program tersebut. Melalui tenaga dari Panti Rehabilitasi Sosial Bina Laras (RSBL) Kediri, anak-anak diajak bernyanyi dan bermain bersama. Metode ini disebut Rehab Mental dan Sosial. Tujuannya  mengembalikan rasa trauma anak dari peristiwa menyedihkan serta menumbuhkan rasa optimisme dalam hidup. ""Layanan untuk memberikan motivasi dan semangat kepada anak agar lebih siap dalam menatap masa depan. Anak-anak tidak terus bersedih hati karena ditinggalkan oleh orang tua atau salah satu di antaranya,"" jelas Kepala Dinas Sosial Kabupaten Kediri Suharsono, Selasa (10/8/2021). Melalui program tersebut, anak tidak hanya sekadar diberi pendampingan semata. Namun mereka juga mendapat bantuan uang saku dan permakanan. Diharapkan program untuk anak-anak tersebut berkesinambungan. Mengingat banyaknya di Kabupaten Kediri.",Pendampingan Psikologi Puluhan Anak di Kediri yang Ortunya Meninggal COVID-19,bantuan panti,https://news.detik.com/berita-jawa-timur/d-5676549/pendampingan-psikologi-puluhan-anak-di-kediri-yang-ortunya-meninggal-covid-19?single=1,"Selasa, 10 Agu 2021 09:13 WIB"
"Serangan Covid-19 tak pandang bulu. Virus jahat ini tidak hanya merenggut nyawa para orangtua dan lansia, tetapi juga menyebabkan anak-anak tiba-tiba harus kehilangan keluarganya. Di berbagai daerah, tidak sedikit anak-anak menjadi yatim piatu karena kedua orangtuanya meninggal dunia usai terpapar Covid-19. Di tengah ancaman Covid-19 di Indonesia yang masih memburuk dan angka kematian pasien yang masih meningkat, kita bias melihat kemungkinan jumlah anak yang kehilangan ayah atau ibunya, atau bahkan keduanya semakin bertambah dan meresahkan.  Menurut laporan Satgas Penanganan Covid-19, angka harian pasien Covid-19 pada 20 Juli mencatatkan korban meninggal dunia 1.280 orang, dengan tiga provinsi penyumbang angka kematian terbesar yakni DKI Jakarta, Jawa Barat, dan Jawa Tengah. Total korban meninggal menurut data tersebut hingga 20 Juli mencapai 76.200 orang. Di Kerawang, Jawa Barat seorang anak berusia 6 tahun mendadak harus menjadi yatim piatu karena kedua orangtuanya mendadak meninggal dunia akibat Covid-19 pada 11 dan 14 Juli 2021 lalu. Sementara itu, di Bantul, 4 anak dilaporkan mendadak menjadi yatim piatu karena kedua orangtuanya meninggal akibat Covid-19. Di Sukoharjo, Al Ghifari Putra Setiawan bocah berusia 8 tahun kini menjadi yatim piatu setelah kedua orangtuanya meninggal terpapar Covid-19. Tak hanya dua orangtuanya, Ghifari juga kehilangan sang kakek. Selain itu, Alviano Dava Raharjo atau Vino, bocah berusia 10 tahun asal Kutai, Kalimantan dilaporkan juga menjadi yatim piatu usai ayah-ibunya meninggal dunia akibat positif virus Covid-19. Dia dijemput ke Sragen, Jawa Tengah agar bisa dirawat kakeknya, Yatin (56 tahun). Daftar anak-anak yang mendadak menjadi yatim piatu gara-gara kedua orangtuanya menjadi korban keganasan Covid-19 dapat terus diperpanjang. Selain anak-anak yang dikemukakan di atas, di berbagai daerah masih banyak anak yang kehidupannya kini terancam terlantar karena kedua oran tuanya meninggal mendadak. Meski anak yatim piatu korban Covid-19 sebagian telah mendapatkan bantuan dan memiliki orangtua asuh, bukan berarti persoalan telah selesai. Dengan dibantu sejumlah dana dan jaminan dari orangtua asuhnya, kemungkinan anak yatim piatu kelaparan atau terlantar pendidikannya akan dapat diatasi. Tetapi, lebih dari sekadar bantuan ekonomi, anak-anak yatim piatu sesungguhnya membutuhkan pihak yang bisa menjadi substitusi kebutuhan sosial-psikologisnya yang menderita gara-gara kehliangan orangtuanya.   Anak yatim piatu sesungguhnya adalah anak-anak yang termasuk kategori anak rawan atau anak-anak membutuhkan perlindungan khusus (   ). Anak-anak yatim piatu dikatakan terlantar apabila karena suatu sebab tidak dapat terpenuhi kebutuhan dasarnya dengan wajar, baik secara rohani, jasmani, maupun sosial.   Seorang anak dikatakan terlantar bukan sekadar karena ia sudah tidak lagi memiliki salah satu orangtua atau kedua orangtuanya. Tetapi, terlantar di sini juga dalam pengertian ketika hak-hak anak untuk tumbuh-kembang secara wajar, hak anak untuk memperoleh pendidikan yang layak, dan hak untuk memperoleh pelayanan kesehatan yang memadai tidak terpenuhi karena kelalaian, ketidakmengertian orangtua, karena ketidakmampuan atau karena kesengajaan.  Seorang anak yang tidak lagi memiliki orangtua, mereka umumnya rawan untuk diterlantarkan dan bahkan diperlakukan salah ( ). Pada tingkat yang ekstrem, anak yaitu piatu bukan tidak mungkin kehilangan kesempatan untuk menyongsong masa depannya karena tiadanya perlindungan dan jaminan haknya terpenuhi.  Di berbagai komunitas, anak-anak yatim piatu seringkali menjadi korban pertama dan menderita, serta terpaksa terhambat proses tumbuh-kembang mereka secara wajar karena ketidakmampuan kerabat, masyarakat, dan pemerintah untuk memberikan pelayanan sosial yang terbaik bagi anak-anak yatim piatu.    Di Indonesia, diperkirakan jumlah anak terlantar mencapai jutaan jiwa. Ini pun terbatas pada kelompok anak-anak yang yatim piatu?di mana dari jumlah itu hanya sedikit di antara mereka yang terjangkau pelayanan sosial. Di tahun 2021 ini, bisa dipastikan jumlah anak terlantar yang ada akan jauh lebih banyak lagi, karena sejak pandemi Covid-19 mulai merambah ke berbagai wilayah, maka sejak itu pula kasus anak-anak yatim piatu terus bertambah. Sebagian anak yatim atau anak yatim piatu umumnya mereka tinggal di panti-panti dan hidup di bawah asuhan pengelola panti. Bagi anak-anak yatim piatu, apa yang menjadi kebutuhan mereka sebetulnya memang bukan sekadar memperoleh perlindungan dan terpenuhi kebutuhan dasarnya, tetapi yang tak kalah penting adalah bagaimana mereka dapat memperoleh jaminan dan kesempatan untuk dapat tumbuh-kembang secara wajar.  Sekali pun banyak warga masyarakat akan bersimpati dan peduli kepada nasib anak-anak yatim piatu yang terlantar, tetapi dalam kenyataan mereka tetap saja rawan diperlakukan salah, menjadi korban eksploitasi oleh pihak-pihak tertentu yang ingin memanfaatkan situasi, dan diterlantarkan, atau bahkan dilanggar haknya.   Dari segi penampakan fisik, perlakuan dan ancaman yang dihadapi anak-anak yatim piatu barangkali memang tidak sedramatis ketika kita mendengar atau menyaksikan anak-anak yang menjadi korban tindak kekerasan, seperti anak perempuan korban perkosaan atau anak-anak yang menjadi korban tindak kekerasan: terluka secara fisik, atau bahkan dianiaya hingga tewas. Tetapi, dari segi sosial dan psikologis, ancaman yang dihadapi anak-anak yatim piatu sesungguhnya tidaklah kalah berbahaya.  Di tingkat individu, anak-anak yang sejak dini terbiasa diterlantarkan, maka jangan heran jika mereka kemudian tumbuh inferior, rendah diri atau sebaliknya menjadi agresif dan nakal untuk menarik perhatian orang-orang di sekitarnya. Bahkan, tidak mustahil anak-anak yang diterlantarkan, kemudian terlibat dalam tindak kriminal karena salah asuhan dan salah pergaulan.   Bagi anak-anak yatim piatu yang tinggal di panti-panti asuhan, untuk sebagian persoalan mereka kini mungkin telah diatasi dengan pendekatan pengasuhan, pemberian bantuan dan pemberian perlindungan. Tetapi, bagi anak-anak yatim piatu yang tinggal di luar panti, boleh dikata sampai saat ini masih belum terumuskan pola pendekatan macam apa yang tepat dan efektif untuk dikembangkan.    Penanganan terhadap ancaman Covid-19 dari segi medis memang bisa dilakukan melalui program vaksinasi dan pemberlakuan protokol kesehatan yang ketat. Namun lebih dari sekadar pendekatan yang sifatnya regulatif dan mengancamkan sanksi, yang tak kalah penting adalah bagaimana memastikan nasib anak-anak yatim korban Covid-19 masa depannya tidak makin kelam.","Anak-Anak Yatim Piatu Korban Covid-19, Siapa Peduli?",bantuan panti,https://news.detik.com/kolom/d-5675607/anak-anak-yatim-piatu-korban-covid-19-siapa-peduli?single=1,"Senin, 09 Agu 2021 14:35 WIB"
"Manajemen   secara resmi meluncurkan logo dan slogan yang menandai rangkaian peringatan 34 tahun tim Singo Edan yang jatuh, Rabu (11/8/2021). Logo dan slogan yang mengambil tema 'Solidarity' itu memiliki makna khusus. Semangat solidaritas sengaja dipilih karena saat ini Indonesia masih menghadapi masa pandemi   yang belum berlalu. Salah satu hal yang ditekankan adalah semangat solidaritas yang sudah ditunjukkan oleh Arema FC yang berusaha andil dalam penanggulangan COVID-19 dalam memberikan bantuan kepada masyarakat terdampak. Solidaritas disimbolkan di logo 34 tahun Arema FC dengan simbol syal bertuliskan 'Solidarity', syal yang melintang diantara singa yang mengaum. Harapannya, semangat solidaritas dan respect sosial Arema membantu Arema terus mengaum tak kenal lelah sampai kapanpun. ""Peringatan 34 tahun   ini kita peringati tahun ini tidak hanya sebagai tanda atas sebuah perjalanan. Tapi juga sebagai pengingat bagi kita semua untuk terus semangat untuk tetap semangat dalam menggalang solidaritas, lebih-lebih disaat ini, saat Indonesia masih belum bisa lepas dari pandemi COVID-19,"" ungkap Presiden Arema FC, Gilang Widya Pramana dalam keterangan resminya, Selasa (3/8/2021). Warna kebesaran biru juga mendominasi sosok singa yang mengaum. Hal itu disimbolkan bahwa solidaritas adalah sebuah sikap ksatria yang berani mewujudkan cinta kasih untuk sesama. ""Singa mengaum wujud dari keberanian dan menyampaikan pesan bahwa singa tetap tangguh dan kuat dalam menghadapi situasi sesulit apapun,"" tandas Gilang. Di usia ke-34 tahun ini, lanjut Gilang, Arema FC selain menonjolkan semangat solidaritas juga menekankan pentingnya sinergi dalam bahu membahu dengan merawat karakter Arek-arek Malang untuk meraih prestasi yang membanggakan. ""Angka 34 dengan bentuk perisai ini merupakan wujud sinergi dan solidaritas banyak elemen di Malang Raya dengan harapan bersatu untuk mewujudkan prestasi tim Singo Edan,"" tegasnya. Arema FC juga meluncurkan Champion Corner yang merupakan sebuah space khusus yang memajang trophy serta momen-momen Arema FC saat menjadi juara sejak pertama kali berdiri. Selain meluncurkan slogan dan logo, Arema FC juga menggelar donasi berupa paket sembako kepada 34 panti asuhan. ""Harapannya menuju hari yang sakral ini Arema FC bisa memberikan manfaat kepada banyak pihak, termasuk panti asuhan yang tersebar di Malang,"" papar Gilang. Dalam kesempatan itu,   juga melakukan perkenalan ruangan konferensi pers yang didesain cukup elegan yang menguatkan karakter klub kebanggaan arek-arek Malang ini.",2 Hal yang Baru dari Arema FC di Perayaan HUT ke-34,bantuan panti,https://sport.detik.com/sepakbola/liga-indonesia/d-5667465/2-hal-yang-baru-dari-arema-fc-di-perayaan-hut-ke-34?single=1,"Selasa, 03 Agu 2021 11:23 WIB"
"(Kemensos) mencatat sebanyak 11.045 anak yang ditinggal meninggal orang tua (ortu) karena terpapar  . Anak-anak tersebut kini berstatus yatim, piatu, dan yatim piatu.  mengatakan pandemi Covid-19 telah mengakibatkan banyak perubahan di berbagai aspek kehidupan saat ini, termasuk bagi anak-anak. Selain adanya ketakutan akan terpapar Covid-19, anak-anak juga kerap berpotensi kehilangan orang-orang terdekat mereka yang meninggal akibat Covid-19. ""Hal ini membuat banyak anak akhirnya harus menjadi anak yatim, piatu dan yatim piatu,"" kata Risma kepada wartawan, Sabtu (8/8/2021). Risma menjelaskan berdasarkan data dari Satgas Penanganan Covid-19 per 20 Juli 2021, diketahui ada 11.045 anak menjadi yatim piatu, yatim atau piatu. Pada sisi lain jumlah anak yang positif dan meninggal menunjukkan lebih dari 350.000 anak positif dan 777 anak meninggal dunia. Menurut Risma, tingkat risiko anak terpapar Covid-19 tinggi. Karena itu, kata dia, pemerintah telah menetapkan kebijakan percepatan vaksinasi bagi anak-anak minimal usia 12 tahun. Risma menjelaskan bahwa Kemensos melalui Balai/Loka Rehabilitasi Sosial dan Pendamping Rehabilitasi Sosial telah mendapatkan laporan mengenai anak-anak yang ditinggal meninggal orang tua akibat terpapar Covid-19. Data tersebut di input berdasarkan by name by adress. ""Sejauh ini data akurat by name by adress terkait anak yatim, piatu dan yatim piatu yang orang tuanya meninggal karena terpapar Covid-19 masih dalam proses pengumpulan oleh tim kami di lapangan. Namun demikian, para pendamping juga telah melaksanakan respon kasus untuk anak-anak tersebut,"" ucap Risma. Dia menyebut data by name by adress terbaru dari Satuan Bakti Pekerja Sosial (Sakti Peksos) Jawa Timur menunjukkan bahwa terdapat 166 anak yang saat ini kehilangan orang tua karena Covid-19. Dari jumlah tersebut 12 anak menjadi yatim piatu, 58 anak menjadi piatu dan 89 anak menjadi yatim serta 8 anak sedang dalam konfirmasi. Anak-anak ini tersebar di 7 kabupaten/kota yang ada di Jawa Timur. Sementara di Yogyakarta, terdapat 142 anak yang ditinggal oleh orang tuanya. Sebanyak 19 anak kehilangan kedua orang tuanya, 92 anak kehilangan ayah dan 31 anak kehilangan Ibu. Terlaporkan juga sebanyak 10 orang dari 105 ibu hamil yang meninggal akibat Covid-19. ""Respon terhadap anak-anak tersebut dilakukan secepat mungkin dan dalam kesempatan pertama,"" ujarnya. Risma mengatakan selain upaya pendataan dan respon kasus bagi anak-anak yang kehilangan orang tua karena Covid-19, Kemensos juga telah memberikan dukungan secara langsung melalui Program Asistensi Rehabilitasi Sosial (ATENSI) yang mencakup pemenuhan kebutuhan dasar anak. Di antaranya seperti bantuan obat-obatan, vitamin, tes swab/PCR, vaksinasi dan kebutuhan dasar anak lainnya, termasuk memberikan konseling kepada anak-anak dan keluarganya. Lebih jauh, Risma menjelaskan untuk mencegah anak kehilangan hak pengasuhannya, Kemensos juga telah mereunifikasi anak dengan keluarga besarnya. Tak hanya itu, Kemensos juga memfasilitasi pengasuhan alternatif melalui pengasuhan oleh orang tua asuh (foster care)/wali/pengangkatan anak dan pengasuhan anak melalui panti-panti. ""Kemarin kita sudah mereunifikasi salah seorang anak bernama Vino (10) yang tinggal di Kutai Barat, Kalimantan Timur. Ia menjadi yatim piatu karena orang tuanya meninggal terpapar Covid-19. Didampingi oleh Satuan Bakti Pekerja Sosial (Sakti Peksos) dan Tim Respon Darurat Balai Budi Luhur Banjarbaru beserta pihak Dinas Sosial setempat, Vino berhasil dijemput oleh kakeknya yang berasal dari Sragen untuk selanjutnya diasuh oleh keluarga besar,"" katanya. ""Tidak hanya di Kutai Barat saja, hingga saat ini kami sudah melakukan respon cepat terhadap anak-anak yang orang tuanya meninggal akibat Covid-19 di antaranya di Kutai Kartanegara, Samarinda, Sukoharjo, Purwakarta, Bekasi dan Muna. Selanjutnya, tidak menutup kemungkinan kami juga akan merespon anak-anak di wilayah lainnya sesuai dengan laporan yang diterima,"" tambahnya. Dukungan lainnya yang juga diberikan oleh Kemensos adalah membantu keluarga besar anak untuk mengatasi kesulitan dalam mengasuh anak. Menurut Risma, layanan terapi melalui ATENSI berupa terapi fisik, psikososial dan mental spiritual juga diberikan kepada anak untuk mengatasi perasaan sedih karena kehilangan orang tua akibat Covid-19 dan membangkitkan kembali semangat mereka untuk melanjutkan hidupnya. Terakhir, Kemensos RI juga berupaya memberikan dukungan aksesibilitas untuk membantu anak agar dapat mengakses kebutuhan lainnya. ""Ke depan kami berencana melaksanakan kegiatan penanganan dampak Covid-19 pada anak yang kehilangan orang tuanya akibat Covid-19. Tentunya kegiatan ini akan melibatkan kerjasama lembaga/instansi terkait seperti NGO dan sektor pemerintahan yang bertanggungjawab dalam menangani hal tersebut,"" pungkas Risma.","11.045 Anak Ditinggal Ortu Meninggal Gegara COVID, Begini Langkah Kemensos",bantuan panti,https://news.detik.com/berita/d-5674141/11045-anak-ditinggal-ortu-meninggal-gegara-covid-begini-langkah-kemensos?single=1,"Minggu, 08 Agu 2021 08:29 WIB"
